"Next morning he received an oral message from the young woman, asking him to fetch her home from a meeting that evening.","第二天一早，他收到乔安娜的口信，说当天晚上有个聚会，让他去接她回家。"
"This he did, and while walking from the Town Hall to her door, with her hand in his arm, she said:","他去了，乔安娜挽着他的胳膊，两人从镇公所走到她家门口时，她说道："
"‘It is all the same as before between us, isn’t it, Shadrach?","“谢德拉克，我们俩还一如从前，是不是？"
"Your letter was sent in mistake?’","你那封信是寄错了吧？”"
"‘It is all the same as before,’ he answered, ‘if you say it must be.’","“是一如从前，”他答道，“如果你认为必须这样的话。”"
"‘I wish it to be,’ she murmured, with hard lineaments, as she thought of Emily.","“我希望这样。”她低声说道。想到埃米莉，她的脸色顿时凝重起来。"
"Shadrach was a religious and scrupulous man, who respected his word as his life.","谢德拉克信奉宗教，又小心谨慎，他信守诺言，如同敬重生命一样。"
"Shortly afterwards the wedding took place, Jolliffe having conveyed to Emily as gently as possible the error he had fallen into when estimating Joanna’s mood as one of indifference.","不久，二人举行了婚礼。在那之前，乔利夫尽可能温和地向埃米莉解释了他犯的错误，他以为乔安娜对他并不在乎。"

"Chapter II","第二章"
"A month after the marriage Joanna’s mother died, and the couple were obliged to turn their attention to very practical matters.","婚后一个月，乔安娜的母亲去世了。于是夫妻俩不得不转而关注非常实际的问题。"
"Now that she was left without a parent, Joanna could not bear the notion of her husband going to sea again, but the question was, What could he do at home?","乔安娜现在已失去双亲，她不能接受丈夫再次出海的想法。可问题是，他在家能干什么呢？"
"They finally decided to take on a grocer’s shop in High Street, the goodwill and stock of which were waiting to be disposed of at that time.","他们最终决定盘下主街上的一家杂货店。那家店当时正好准备转让店面和存货。"
"Shadrach knew nothing of shopkeeping, and Joanna very little, but they hoped to learn.","谢德拉克对开店一窍不通，乔安娜也知之甚少，不过两人希望能慢慢学习。"
"To the management of this grocery business they now devoted all their energies, and continued to conduct it for many succeeding years, without great success.","他们现在把全部精力都放在杂货店的生意上，之后的许多年里也是如此，不过生意始终没有红火起来。"
"Two sons were born to them, whom their mother loved to idolatry, although she had never passionately loved her husband; and she lavished upon them all her forethought and care.","他们的两个儿子相继出世，乔安娜尽管从未热烈地爱过丈夫，却将儿子为视为珍宝，她把所有的希望和关爱都寄托在孩子身上。"
"But the shop did not thrive, and the large dreams she had entertained of her sons’ education and career became attenuated in the face of realities.","可是店铺生意平平，乔安娜原本想为儿子们提供良好教育和工作的远大梦想，也在现实面前逐渐缩水了。"
"Their schooling was of the plainest, but, being by the sea, they grew alert in all such nautical arts and enterprises as were attractive to their age.","两个儿子在最为普通的学校里接受教育，不过，由于生活在海边，他们熟谙所有航海技巧和海上贸易，这一切对他们那个年龄的人来说很有诱惑力。"
"The great interest of the Jolliffes’ married life, outside their own immediate household, had lain in the marriage of Emily.","乔利夫和乔安娜结婚后，除了自己的小家庭外，最关心的就是埃米莉的婚姻问题。"
"By one of those odd chances which lead those that lurk in unexpected corners to be discovered, while the obvious are passed by, the gentle girl had been seen and loved by a thriving merchant of the town, a widower, some years older than herself, though still in the prime of life.","有一些显而易见的机会从身旁溜过，还有一些机会蛰伏在意想不到的角落，等着被人发现。由于这样一个偶然的机会，这个温柔的姑娘被镇上一个家业兴盛的商人看中了，这个商人曾经丧妻，比埃米莉长了几岁，不过依然正当壮年。"
"At first Emily had declared that she never, never could marry any one; but Mr. Lester had quietly persevered, and had at last won her reluctant assent.","起初埃米莉宣布，她绝不会嫁给任何人。可是莱斯特先生仍默默地坚持着，最终埃米莉不情愿地同意了。"
"Two children also were the fruits of this union, and, as they grew and prospered, Emily declared that she had never supposed that she could live to be so happy.","这二人的结合也带来了两个孩子。随着孩子健康地成长，埃米莉称她从没想到自己会生活得如此幸福。"
"The worthy merchant’s home, one of those large, substantial brick mansions frequently jammed up in old-fashioned towns, faced directly on the High Street, nearly opposite to the grocery shop of the Jolliffes, and it now became the pain of Joanna to behold the woman whose place she had usurped out of pure covetousness, looking down from her position of comparative wealth upon the humble shop-window with its dusty sugar-loaves, heaps of raisins, and canisters of tea, over which it was her own lot to preside.","这位可敬的商人拥有一栋结实的砖砌大宅子。在这个古老的小镇上，这种宅子鳞次栉比。商人家的房子正对着主街，几乎和乔利夫家的杂货店隔街相望。现在，乔安娜一看到埃米莉从她那相对优越的位置俯视自己家寒酸的商店，望着商店橱窗里沾满灰尘的棒棒糖、成堆的葡萄干，还有茶叶筒，她就暗自难过。是她自己纯粹出于贪婪，强夺了埃米莉本来的归属。"
"The business having so dwindled, Joanna was obliged to serve in the shop herself; and it galled and mortified her that Emily Lester, sitting in her large drawing-room over the way, could witness her own dancings up and down behind the counter at the beck and call of wretched twopenny customers, whose patronage she was driven to welcome gladly: persons to whom she was compelled to be civil in the street, while Emily was bounding along with her children and her governess, and conversing with the genteelest people of the town and neighbourhood.","杂货店的生意每况愈下，乔安娜不得不亲自去店里帮忙。令她感到羞辱和窘迫的是，埃米莉·莱斯特坐在街对面的大会客室里，便能看到那些既穷酸又讨人烦的顾客向她招手或者大声叫喊，而她不得不强颜欢笑迎接这些人的光顾，并在柜台后来回忙碌。她在街上遇到这些人时不得不以礼相待，而埃米莉则和孩子、家庭女教师呆在一起，只和镇上、街坊里最有教养的人聊天。"
"This was what she had gained by not letting Shadrach Jolliffe, whom she had so faintly loved, carry his affection elsewhere.","这正是乔安娜不肯让谢德拉克·乔利夫移情别恋而造成的结果，而她自己对乔利夫的爱不过是淡如白水。"
"Shadrach was a good and honest man, and he had been faithful to her in heart and in deed.","谢德拉克是个诚实的好人，无论是在内心还是在行为上，都对乔安娜非常忠实。"
"Time had clipped the wings of his love for Emily in his devotion to the mother of his boys: he had quite lived down that impulsive earlier fancy, and Emily had become in his regard nothing more than a friend.","时间抹平了他对埃米莉的爱，他现在全心爱着孩子们的母亲，他已经忘记了早先那情不自禁的爱恋，对他而言，埃米莉不过是个朋友。"
"It was the same with Emily’s feelings for him.","埃米莉对他的感情亦是如此。"
"Possibly, had she found the least cause for jealousy, Joanna would almost have been better satisfied.","或许，哪怕能找到一丁点儿值得嫉妒的原因，乔安娜也会好受些。"
"It was in the absolute acquiescence of Emily and Shadrach in the results she herself had contrived that her discontent found nourishment.","而正是由于埃米莉和谢德拉克完全默认她自己谋划的结果，她才愈发感到不满。"
"Shadrach was not endowed with the narrow shrewdness necessary for developing a retail business in the face of many competitors.","谢德拉克天生缺乏在众多竞争者当中经营零售业所必需的细致精明劲。"
"Did a customer inquire if the grocer could really recommend the wondrous substitute for eggs which a persevering bagman had forced into his stock, he would answer that ‘when you did not put eggs into a pudding it was difficult to taste them there’; and when he was asked if his ‘real Mocha coffee’ was real Mocha, he would say grimly, ‘as understood in small shops.’","如果有顾客问他，是否会真的推荐某些锲而不舍的推销员强行卖给他的“神奇的”鸡蛋替代品，他会说：“布丁里要是不放鸡蛋，就很难尝出鸡蛋味儿。”若有人问他，店里的“纯正摩卡咖啡”是否是真的摩卡，他会冷淡地说：“小商店里的东西，你懂的”。"
"One summer day, when the big brick house opposite was reflecting the oppressive sun’s heat into the shop, and nobody was present but husband and wife, Joanna looked across at Emily’s door, where a wealthy visitor’s carriage had drawn up.","一个夏日，街对面砖砌大房子反射到杂货店里的暑热令人难以忍受。除了夫妻二人外，杂货店里空无一人，乔安娜看着埃米莉家的门，一个阔气的访客正把马车停在门口。"
"Traces of patronage had been visible in Emily’s manner of late.","埃米莉近来的言行举止流露出恩主的派头。"
"‘Shadrach, the truth is, you are not a business-man,’ his wife sadly murmured.","“谢德拉克，你实在不适合经商，”他妻子难过地低声说道，"
"‘You were not brought up to shopkeeping, and it is impossible for a man to make a fortune at an occupation he has jumped into, as you did into this.’","“你不是自小开店的，一个半路出家的人不可能赚大钱，你就是这样。”"
"Jolliffe agreed with her, in this as in everything else.","乔利夫表示同意。他一向对乔安娜言听计从。"
"‘Not that I care a rope’s end about making a fortune,’ he said cheerfully.","“我对赚大钱没什么热情，”他乐呵呵地说，"
"‘I am happy enough, and we can rub on somehow.’","“我现在非常开心。不管怎样，我们总能填饱肚子。”"
"She looked again at the great house through the screen of bottled pickles.","乔安娜透过成排的瓶装泡菜，又看了一眼对面的大房子。"
"‘Rub on—yes,’ she said bitterly.","“填饱肚子——是的，”她苦涩地说，"
"‘But see how well off Emmy Lester is, who used to be so poor!","“可你看看埃米莉·莱斯特，她以前那么穷，现在多富裕！"
"Her boys will go to College, no doubt; and think of yours—obliged to go to the Parish School!’","她的儿子，毫无疑问会上大学，再想想你儿子，他们只能去教区学校！”"
"Shadrach’s thoughts had flown to Emily.","谢德拉克的思绪飘到了埃米莉身上。"
"‘Nobody,’ he said good-humouredly, ‘ever did Emily a better turn than you did, Joanna, when you warned her off me and put an end to that little simpering nonsense between us, so as to leave it in her power to say “Aye” to Lester when he came along.’","“没有人像你那样，”他好脾气地说道，“给埃米莉帮过那么大的忙，乔安娜，你劝诫她，让她离开我，结束了我们俩之间傻傻的小暧昧，这样莱斯特出现时，她才能答应他。”"
"This almost maddened her.","这话差点儿激怒了乔安娜。"
"‘Don’t speak of bygones!’ she implored, in stern sadness.","“别再提以前的事了！”她严厉而悲伤地恳求他，"
"‘But think, for the boys’ and my sake, if not for your own, what are we to do to get richer?’","“即使不为了你自己，也为了孩子们，还有我，想一想我们怎样才能赚到钱？”"
"‘Well,’ he said, becoming serious, ‘to tell the truth, I have always felt myself unfit for this business, though I’ve never liked to say so.","“好吧，”他语气也严肃起来，说道，“老实说，我一直觉得自己不适合做生意，尽管我总是不愿意承认。"
"I seem to want more room for sprawling; a more open space to strike out in than here among friends and neighbours.","我感觉自己需要更多的空间来施展身手，需要一个更开阔的地方大展拳脚，而不是在这里被朋友邻居包围。"
"I could get rich as well as any man, if I tried my own way.’","我可以像任何男人一样赚到钱，只要我按照自己的方式去做。”"
"‘I wish you would!","“我希望你能！"
"What is your way?’","你要怎么做？”"
"‘To go to sea again.’","“继续出海。”"
"She had been the very one to keep him at home, hating the semi-widowed existence of sailors’ wives.","而那个把他留在家里的人正是她，因为她讨厌水手妻子那种守活寡的生活。"
"But her ambition checked her instincts now, and she said: ‘Do you think success really lies that way?’","但是现在，她的野心抑制住了本能。她说：“你真的觉得那样能成功吗？”"
"‘I am sure it lies in no other.’","“我相信除此之外，别无他法。”"
"‘Do you want to go, Shadrach?’","“你想去吗，谢德拉克？”"
"‘Not for the pleasure of it, I can tell ’ee.","“老实说，我并不是因为好玩才要去的。"
"There’s no such pleasure at sea, Joanna, as I can find in my back parlour here.","乔安娜，出海一点儿都不好玩，远远不及我在家里的后客厅这么好玩。"
"To speak honest, I have no love for the brine.","说实话，我完全不喜欢大海。"
"I never had much.","从来都不怎么爱。"
"But if it comes to a question of a fortune for you and the lads, it is another thing.","可如果是为了给你和儿子们赚钱，那就是另外一回事了。"
"That’s the only way to it for one born and bred a seafarer as I.’","对我这样生来就当水手的人来说，出海是赚钱的唯一途径。”"
"‘Would it take long to earn?’","“赚钱会需要很长时间吗？”"
"‘Well, that depends; perhaps not.’","“嗯，说不准。或许不用。”"
"The next morning Shadrach pulled from a chest of drawers the nautical jacket he had worn during the first months of his return, brushed out the moths, donned it, and walked down to the quay.","第二天早上，谢德拉克从五斗橱里取出一件水手穿的夹克，他刚回来的头几个月里，一直穿着这件衣服。他清理了衣服上的蛾子，穿上衣服，然后去了码头。"
"The port still did a fair business in the Newfoundland trade, though not so much as formerly.","港口依然有人去纽芬兰做生意，不过规模已不如从前。"
"It was not long after this that he invested all he possessed in purchasing a part-ownership in a brig, of which he was appointed captain.","此后不久，谢德拉克倾其所有，与人合买了一艘双桅横帆船，他被指定为船长。"
"A few months were passed in coast-trading, during which interval Shadrach wore off the land-rust that had accumulated upon him in his grocery phase; and in the spring the brig sailed for Newfoundland.","随后数月里，谢德拉克一边进行海岸贸易，一边趁间歇温习他在开杂货店期间丢掉的航海技术。春季，他驾驶着那艘横帆船，向纽芬兰出发了。"
"Joanna lived on at home with her sons, who were now growing up into strong lads, and occupying themselves in various ways about the harbour and quay.","乔安娜和儿子们留在家里。两个儿子现在都长成了壮实的小伙子，忙活着海港和码头的各种事情。"
"‘Never mind, let them work a little,’ their fond mother said to herself.","“不要紧，让他们先干点儿活吧，”他们慈爱的母亲自言自语道，"
"‘Our necessities compel it now, but when Shadrach comes home they will be only seventeen and eighteen, and they shall be removed from the port, and their education thoroughly taken in hand by a tutor; and with the money they’ll have they will perhaps be as near to gentlemen as Emmy Lester’s precious two, with their algebra and their Latin!’","“我们现在为生计所迫，不过等谢德拉克回家后，他们也才十七八岁。到时他们就离开港口，会有家庭教师全面负责他们的学习。只要有钱，他们就可以学习代数和拉丁语，或许还会和埃米·莱斯特的两个宝贝儿子一样，像绅士一样！”"
"The date for Shadrach’s return drew near and arrived, and he did not appear.","谢德拉克回来的日期越来越近，终于到了，他却没有出现。"
"Joanna was assured that there was no cause for anxiety, sailing-ships being so uncertain in their coming; which assurance proved to be well grounded, for late one wet evening, about a month after the calculated time, the ship was announced as at hand, and presently the slip-slop step of Shadrach as the sailor sounded in the passage, and he entered.","乔安娜觉得无须担心，因为帆船的归期总是难以确定。她是对的，因为据预计回来的时间过了大约一个月后，在一个潮湿的深夜，帆船据说马上要靠岸了。很快，走廊上响起水手谢德拉克啪嗒啪嗒的脚步声，他进了门。"
"The boys had gone out and had missed him, and Joanna was sitting alone.","孩子们出去了，所以没有见到他，乔安娜一个人独自坐着。"
"As soon as the first emotion of reunion between the couple had passed, Jolliffe explained the delay as owing to a small speculative contract, which had produced good results.","夫妻俩团圆的激动刚过，乔利夫就解释了推迟回家的原因。原来是因为一小桩投机买卖，不过却带来了一些甜头。"
"‘I was determined not to disappoint ’ee,’ he said; ‘and I think you’ll own that I haven’t!’","“我决心不让你失望，”他说，“我想你会承认，我确实没有！”"
"With this he pulled out an enormous canvas bag, full and rotund as the money-bag of the giant whom Jack slew, untied it, and shook the contents out into her lap as she sat in her low chair by the fire.","他一边说着，一边抽出一只硕大的帆布包，鼓鼓的，仿佛杰克杀死的那个巨人的钱袋子。谢德拉克解开袋子，将里面的东西倒在乔安娜膝上，那时她正坐在炉火边的矮椅子上。"
"A mass of sovereigns and guineas (there were guineas on the earth in those days) fell into her lap with a sudden thud, weighing down her gown to the floor.","随着哗啦一声巨响，一大堆金镑和几尼（那时候几尼还在流通）落到乔安娜的膝头，把她的裙子压得都垂到了地上。"
"‘There!’ said Shadrach complacently.","“瞧！”谢德拉克得意地说，"
"‘I told ’ee, dear, I’d do it; and have I done it or no?’","“我说过，老婆，我会成功的。我是不是成功了？”"
"Somehow her face, after the first excitement of possession, did not retain its glory.","不知怎的，乔安娜的脸上闪过一阵发财的喜悦后，很快就失去了光彩。"
"‘It is a lot of gold, indeed,’ she said.","“确实是好多金币，”她说，"
"‘And—is this all?’","“不过，就这些了吗？”"
"‘All?","“就这些？"
"Why, dear Joanna, do you know you can count to three hundred in that heap?","嘿，亲爱的乔安娜，你知道那堆金币足足有300个吗？"
"It is a fortune!’","那可不是小数目！”"
"‘Yes—yes.","“唔——是的。"
"A fortune—judged by sea; but judged by land—’","就海上来说，不是小数目。不过在陆地上……”"
"However, she banished considerations of the money for the nonce.","不过，她暂时打消了对钱的念想。"
"Soon the boys came in, and next Sunday Shadrach returned thanks to God—this time by the more ordinary channel of the italics in the General Thanksgiving.","很快，孩子们就进来了，之后的周日到来时，谢德拉克去向上帝谢恩。这一次用了更平常的方式，诵读总感恩祷文中的斜体字部分。"
"But a few days after, when the question of investing the money arose, he remarked that she did not seem so satisfied as he had hoped.","不过，几天后，当夫妻俩谈到如何投资那笔钱的问题时，他说乔安娜似乎不像他期望的那么满意。"
"‘Well you see, Shadrach,’ she answered, ‘we count by hundreds; they count by thousands’ (nodding towards the other side of the Street).","“你看，谢德拉克，”她回答说，“我们拥有几百金币，他们却有数千金币”（她冲着街道对面扭扭头），"
"‘They have set up a carriage and pair since you left.’","“你走后，他们家添置了一辆双驾马车。”"
"‘O, have they?’","“哦，有这回事？”"
"‘My dear Shadrach, you don’t know how the world moves.","“亲爱的谢德拉克，你根本不知道如今的世道。"
"However, we’ll do the best we can with it.","不过，我们也会尽力而为。"
"But they are rich, and we are poor still!’","可他们富得流油，而我们还是一贫如洗！”"
"The greater part of a year was desultorily spent.","大半年时间在不经意间就过去了。"
"She moved sadly about the house and shop, and the boys were still occupying themselves in and around the harbour.","乔安娜在家里和店里难过地转来转去。孩子们依然在海港做着各种工作。"
"‘Joanna,’ he said, one day, ‘I see by your movements that it is not enough.’","“乔安娜，”有一天谢德拉克说道，“你的一举一动告诉我，那些钱还不够。”"
"‘It is not enough,’ said she.","“是不够，”她说，"
"‘My boys will have to live by steering the ships that the Lesters own; and I was once above her!’","“我儿子要靠给莱斯特家开船谋生，而我曾经过着比她优越的生活！”"
"Jolliffe was not an argumentative man, and he only murmured that he thought he would make another voyage.","乔利夫不善争论，他只是低声说，他想再出一次海。"
"He meditated for several days, and coming home from the quay one afternoon said suddenly:","谢德拉克思索了好几天，一天下午，他从码头回来，突然说："
"‘I could do it for ’ee, dear, in one more trip, for certain, if—if—’","“亲爱的，我再为你出一次海，就肯定能干成，只要——只要——”"
"‘Do what, Shadrach?’","“干成什么，谢德拉克？”"
"‘Enable ’ee to count by thousands instead of hundreds.’","“让你数到几千个金币，而不是几百个。”"
"‘If what?’","“只要怎样？”"
"‘If I might take the boys.’","“只要我能带上孩子们。”"
"She turned pale.","乔安娜的脸色变得煞白。"
"‘Don’t say that, Shadrach,’ she answered hastily.","“别说了，谢德拉克。”她慌忙回答道。"
"‘Why?’","“怎么了？”"
"‘I don’t like to hear it!","“我不想听！"
"There’s danger at sea.","出海太危险了。"
"I want them to be something genteel, and no danger to them.","我希望他们成为绅士，不想他们有危险。"
"I couldn’t let them risk their lives at sea.","我不能让他们冒着生命危险出海。"
"O, I couldn’t ever, ever!’","唉，我怎么能呢，怎么能呢！”"
"‘Very well, dear, it shan’t be done.’","“那好，亲爱的，不带他们就是了。”"
"Next day, after a silence, she asked a question:","次日，乔安娜沉默了一阵，终于问道："
"‘If they were to go with you it would make a great deal of difference, I suppose, to the profit?’","“我想，如果孩子们跟你一起去，赚到的钱会大不一样，是吗？”"
"‘’Twould treble what I should get from the venture single-handed.","“那会是我一个人去所赚钱的三倍。"
"Under my eye they would be as good as two more of myself.’","有我照看，他们会像我自己一样毫发无损的。”"
"Later on she said: ‘Tell me more about this.’","过了一阵，她又说：“再给我说说出海的事吧。”"
"‘Well, the boys are almost as clever as master-mariners in handling a craft, upon my life!","“唔，我敢担保，孩子们几乎和熟练的水手一样善于驾驶船！"
"There isn’t a more cranky place in the Northern Seas than about the sandbanks of this harbour, and they’ve practised here from their infancy.","北海那边没有比咱们这个海港的沙洲更蜿蜒曲折的地方了，而孩子们从小就在这里练手。"
"And they are so steady.","而且他们很沉稳。"
"I couldn’t get their steadiness and their trustworthiness in half a dozen men twice their age.’","比他们年长一倍的人里，半打人中也挑不出一个像他们这样沉稳可靠的。”"
"‘And is it very dangerous at sea; now, too, there are rumours of war?’ she asked uneasily.","“出海不是很危险吗？再说，不是还有传言说要打仗了？”她不安地问道。"
"‘O, well, there be risks.","“唔，这个嘛，会有风险的。"
"Still...’","不过……”"
