"The idea grew and magnified, and the mother’s heart was crushed and stifled by it.","这个不断膨胀的想法充斥了乔安娜的心，压得她喘不过气。"
"Emmy was growing too patronizing; it could not be borne.","埃米莉越来越显得高人一等，实在让人无法忍受。"
"Shadrach’s wife could not help nagging him about their comparative poverty.","谢德拉克的妻子总是不停地向他抱怨自家比埃米莉家穷。"
"The young men, amiable as their father, when spoken to on the subject of a voyage of enterprise, were quite willing to embark; and though they, like their father, had no great love for the sea, they became quite enthusiastic when the proposal was detailed.","年轻的孩子们像他们父亲一样随和。当父母跟他们提起出海做生意的事时，他们非常乐意参与，尽管他们也和父亲一样，并不是很热爱航海，但随着这个计划的细节确定下来，他们的兴致也高了很多。"
"Everything now hung upon their mother’s assent.","现在，一切都等乔安娜点头了。"
"She withheld it long, but at last gave the word: the young men might accompany their father.","她克制了很久，最后还是开口了：孩子们可以陪着他们父亲一起去。"
"Shadrach was unusually cheerful about it: Heaven had preserved him hitherto, and he had uttered his thanks.","谢德拉克对此显得格外开心，迄今为止，上帝一直在保佑他，他也表达了对上帝的感恩。"
"God would not forsake those who were faithful to him.","上帝不会遗弃那些忠于他的子民的。"
"All that the Jolliffes possessed in the world was put into the enterprise.","乔利夫变卖了所有家产，都投进了这次生意。"
"The grocery stock was pared down to the least that possibly could afford a bare sustenance to Joanna during the absence, which was to last through the usual ‘New-f’nland spell.’","杂货店的存货尽量削减，只留下出海期间够乔安娜维持基本生计的部分。而出海通常持续整整一个“纽芬兰季”。"
"How she would endure the weary time she hardly knew, for the boys had been with her formerly; but she nerved herself for the trial.","乔安娜不知道要怎样消磨漫漫长日。之前还有孩子们陪着她，不过她还是鼓起勇气，准备接受考验。"
"The ship was laden with boots and shoes, ready-made clothing, fishing-tackle, butter, cheese, cordage, sailcloth, and many other commodities; and was to bring back oil, furs, skins, fish, cranberries, and what else came to hand.","船上装满靴子、鞋子、成衣、捕鱼用具、黄油、奶酪、绳索、帆布以及其他各种货物；回来时，船上会载着石油、毛皮、兽皮、鱼、蔓越橘，以及其他任何能弄到手的东西。"
"But much trading to other ports was to be undertaken between the voyages out and homeward, and thereby much money made.","出海和回来的路上，他们还要在其他港口进行许多交易，因此会赚到大钱。"

"Chapter III","第三章"
"The brig sailed on a Monday morning in spring; but Joanna did not witness its departure.","春季的一个星期一早上，横帆船起航了，不过乔安娜没有去送行。"
"She could not bear the sight that she had been the means of bringing about.","她不忍面对自己一手促成的分离场景。"
"Knowing this, her husband told her overnight that they were to sail some time before noon next day hence when, awakening at five the next morning, she heard them bustling about downstairs, she did not hasten to descend, but lay trying to nerve herself for the parting, imagining they would leave about nine, as her husband had done on his previous voyage.","谢德拉克知道这些，因此离开的前一夜告诉她，他们大约在第二天中午之前出发。因此，第二天早上5点钟乔安娜醒来时，她听到他们在楼下来回忙碌，却没有急着下楼，而是躺着，试图鼓起勇气面对离别，她想着他们大约会在9点钟离开，就像她丈夫上一次出海时那样。"
"When she did descend she beheld words chalked upon the sloping face of the bureau; but no husband or sons.","后来，她终于下了楼，看到写字台的斜面上有粉笔写的字，可她丈夫和儿子们都不在了。"
"In the hastily-scrawled lines Shadrach said they had gone off thus not to pain her by a leave-taking; and the sons had chalked under his words: ‘Good-bye, mother!’","谢德拉克匆匆地写了几句，说他们为了不让她因为告别难过，已经出发了，孩子们在谢德拉克的字下面写着：“再见，妈妈！”"
"She rushed to the quay, and looked down the harbour towards the blue rim of the sea, but she could only see the masts and bulging sails of the Joanna; no human figures.","乔安娜匆匆赶到码头，站在港口俯视着蔚蓝的海面，可是除了“乔安娜号”的桅杆和鼓起的船帆，她什么也看不到，一个人影也没有。"
"‘’Tis I have sent them!’ she said wildly, and burst into tears.","“我就这样送走他们了！”她发狂般地说着，眼泪哗哗地流了出来。"
"In the house the chalked ‘Good-bye’ nearly broke her heart.","房间里用粉笔写的“再见”几乎让她的心都碎了。"
"But when she had re-entered the front room, and looked across at Emily’s, a gleam of triumph lit her thin face at her anticipated release from the thraldom of subservience.","可是再次进入前屋后，她看着对面埃米莉家，想到要从低人一等的境况中解脱出来了，瘦削的脸庞上也流露出了一丝胜利的表情。"
"To do Emily Lester justice, her assumption of superiority was mainly a figment of Joanna’s brain.","为了对埃米莉·莱斯特公平起见，我们必须指出，乔安娜认为埃米莉高高在上的想法，基本上都是她自己的臆想。"
"That the circumstances of the merchant’s wife were more luxurious than Joanna’s, the former could not conceal; though whenever the two met, which was not very often now, Emily endeavoured to subdue the difference by every means in her power.","埃米莉身为商人的妻子，生活条件比乔安娜优越，这是她无法隐藏的事实。然而，二人无论什么时候碰面（事实上现在她们也不常碰面了），埃米莉都尽力缩小两人之间的差距。"
"The first summer lapsed away; and Joanna meagrely maintained herself by the shop, which now consisted of little more than a window and a counter.","第一个夏季无声无息地过去了，乔安娜靠着杂货店勉强维持生计，店里现在除了窗户和柜台外，几乎没有其他东西了。"
"Emily was, in truth, her only large customer; and Mrs. Lester’s kindly readiness to buy anything and everything without questioning the quality had a sting of bitterness in it, for it was the uncritical attitude of a patron, and almost of a donor.","事实上，埃米莉是她唯一的大主顾。莱斯特太太不问质量，欣然购买任何东西，这种善意本身却带着一种令人心酸的刺痛，因为这种毫不挑剔的态度显示出她是个恩主，甚至可以说是个施舍者。"
"The long dreary winter moved on; the face of the bureau had been turned to the wall to protect the chalked words of farewell, for Joanna could never bring herself to rub them out; and she often glanced at them with wet eyes.","漫长而凄凉的冬季姗姗来临，写字台的正面现在朝着墙，以保护粉笔写的告别语，因为乔安娜怎么也不忍心把那些字擦掉。她常常看着那些字，眼里便蓄满了泪水。"
"Emily’s handsome boys came home for the Christmas holidays; the University was talked of for them; and still Joanna subsisted as it were with held breath, like a person submerged.","埃米莉家一表人才的男孩子们回来过圣诞节了，他们常常聊起上大学的事，而乔安娜依然小心翼翼地生活着，连呼吸都谨慎得仿佛一个溺水的人。"
"Only one summer more, and the ‘spell’ would end.","再过一个夏天，“纽芬兰季”就要结束了。"
"Towards the close of the time Emily called on her quondam friend.","归期快到时，埃米莉去拜访了她旧时的朋友。"
"She had heard that Joanna began to feel anxious; she had received no letter from husband or sons for some months.","埃米莉听说乔安娜开始感到焦虑了，她有几个月都没有收到丈夫和儿子们的信了。"
"Emily’s silks rustled arrogantly when, in response to Joanna’s almost dumb invitation, she squeezed through the opening of the counter and into the parlour behind the shop.","埃米莉一边回应乔安娜几近麻木的邀请，一边挤过柜台的开口，进入商店后面的客厅。她的丝绸衣服沙沙响着，显得颇为傲慢。"
"‘You are all success, and I am all the other way!’ said Joanna.","“你什么都顺顺当当，而我却什么都不如意！”乔安娜说。"
"‘But why do you think so?’ said Emily.","“你怎么会这样想呢？”埃米莉说，"
"‘They are to bring back a fortune, I hear.’","“我听说他们会赚大钱回来的。”"
"‘Ah! will they come?","“呵，他们会回来吗？"
"The doubt is more than a woman can bear.","这种担惊受怕可不是一个女人能承受的。"
"All three in one ship—think of that!","三个人在一条船上——想想吧！"
"And I have not heard of them for months!’","更别提我好几个月没有收到他们的消息了！”"
"‘But the time is not up.","“可是还不到他们回来的时间。"
"You should not meet misfortune half-way.’","你不会中途遭到厄运的。”"
"‘Nothing will repay me for the grief of their absence!’","“如果他们回不来了，那什么也不能弥补我的难过！”"
"‘Then why did you let them go?","“那你为什么还放他们去呢？"
"You were doing fairly well.’","你们家日子本来也不错。”"
"‘I made them go!’ she said, turning vehemently upon Emily.","“是我让他们去的！”她说着，猛地向埃米莉发作了，"
"‘And I’ll tell you why!","“让我告诉你为什么！"
"I could not bear that we should be only muddling on, and you so rich and thriving!","我受不了我们只是勉强度日，而你们家却过得红红火火！"
"Now I have told you, and you may hate me if you will!’","我现在都告诉你了，你想讨厌我，随你便吧！”"
"‘I shall never hate you, Joanna.’","“我永远都不会讨厌你的，乔安娜。”"
"And she proved the truth of her words afterwards.","埃米莉后来证明了自己的话。"
"The end of autumn came, and the brig should have been in port; but nothing like the Joanna appeared in the channel between the sands.","秋季过去，帆船应该回港口了，可是沙洲间的水道里却看不到“乔安娜号”的影子。"
"It was now really time to be uneasy.","现在，乔安娜真的坐立不安了。"
"Joanna Jolliffe sat by the fire, and every gust of wind caused her a cold thrill.","她坐在炉火边，每一阵寒风吹过，都会打个寒战。"
"She had always feared and detested the sea; to her it was a treacherous, restless, slimy creature, glorying in the griefs of women.","乔安娜素来畏惧大海，厌恶大海，她觉得大海是个凶险、虚伪而永不满足的怪物，以给女人带来悲伤为荣。"
"‘Still,’ she said, ‘they must come!’","“不过，”她说，“他们肯定会回来！”"
"She recalled to her mind that Shadrach had said before starting that if they returned safe and sound, with success crowning their enterprise, he would go as he had gone after his shipwreck, and kneel with his sons in the church, and offer sincere thanks for their deliverance.","她记得谢德拉克出发前说过，如果他们平安归来，并且是满载而归，他要像那次船只失事后那样去教堂，和孩子们跪在那里，为得救而虔诚地感谢上帝。"
"She went to church regularly morning and afternoon, and sat in the most forward pew, nearest the chancel-step.","乔安娜每天上下午都按时去教堂，她总是坐在第一排靠背长凳上，那里离高坛的台阶最近。"
"Her eyes were mostly fixed on that step, where Shadrach had knelt in the bloom of his young manhood: she knew to an inch the spot which his knees had pressed twenty winters before; his outline as he had knelt, his hat on the step beside him.","她总是盯着那级台阶，那是当年风华正茂的谢德拉克跪过的台阶，乔安娜非常清楚地记得20年前谢德拉克双膝跪下的地方，记得他跪着时的轮廓，他的帽子就放在身旁的台阶上。"
"God was good.","上帝是仁慈的。"
"Surely her husband must kneel there again: a son on each side as he had said; George just here, Jim just there.","她丈夫肯定还会再次跪在那里，像他说过的那样，两个儿子跪在他身边，一边是乔治，另一边是吉姆。"
"By long watching the spot as she worshipped it became as if she saw the three returned ones there kneeling; the two slim outlines of her boys, the more bulky form between them; their hands clasped, their heads shaped against the eastern wall.","乔安娜做礼拜时长时间盯着那级台阶，她仿佛看到父子三人已经回来，正跪在那里：两个修长的身躯是她的儿子，还有中间那更为粗壮的身影，三人的手紧紧握着，头部的轮廓映在东边的墙上。"
"The fancy grew almost to an hallucination: she could never turn her worn eyes to the step without seeing them there.","这个想法简直成了幻觉，她疲倦的眼神一落到那级台阶，就总会看到父子三人跪在那里。"
"Nevertheless they did not come.","然而，他们并没有回来。"
"Heaven was merciful, but it was not yet pleased to relieve her soul.","上天是仁慈的，可它却不愿让乔安娜的灵魂得到解脱。"
"This was her purgation for the sin of making them the slaves of her ambition.","她把父子三人变成她自己野心的奴隶，这是她应得的报应。"
"But it became more than purgation soon, and her mood approached despair.","可这很快就不只是报应了，乔安娜的情绪接近崩溃了。"
"Months had passed since the brig had been due, but it had not returned.","帆船的归期过了好几个月，船却依然没有回来。"
"Joanna was always hearing or seeing evidences of their arrival.","乔安娜总觉得自己听到或者看到了什么，证明他们回来了。"
"When on the hill behind the port, whence a view of the open Channel could be obtained, she felt sure that a little speck on the horizon, breaking the eternally level waste of waters southward, was the truck of the Joana’s mainmast.","有时她在港口后面的小山上，从那里看着开阔的海峡，她确信地平线上有个小点打破了永远平静的南流之水，她觉得那是“乔安娜号”主桅的桅杆帽。"
"Or when indoors, a shout or excitement of any kind at the corner of the Town Cellar, where the High Street joined the Quay, caused her to spring to her feet and cry: ‘’Tis they!’","有时候她在家，只要听到主街与码头相接之处的镇酒窖拐角传来大叫声或者喧闹声，就会匆匆站起，高喊道：“是他们！”"
"But it was not.","然而却不是。"
"The visionary forms knelt every Sunday afternoon on the chancel-step, but not the real.","每周日下午，她都幻想着他们跪在高坛的台阶上，事实上他们却是无迹可寻。"
"Her shop had, as it were, eaten itself hollow.","她的杂货店可以说是已经坐吃山空了。"
"In the apathy which had resulted from her loneliness and grief she had ceased to take in the smallest supplies, and thus had sent away her last customer.","由于寂寞与悲伤，她对开店已经漠不关心，一点儿货也不再进，于是最后一个客人也不来了。"
"In this strait Emily Lester tried by every means in her power to aid the afflicted woman; but she met with constant repulses.","在这种情况下，埃米莉·莱斯特竭尽全力接济这个孤苦的女人，可每次都被断然拒绝。"
"‘I don’t like you!","“我讨厌你！"
"I can’t bear to see you!’","我不能忍受看到你！”"
"Joanna would whisper hoarsely when Emily came to her and made advances.","埃米莉来看望乔安娜的时候，乔安娜总是这么嘶哑着嗓子，低声朝她怒吼。"
"‘But I want to help and soothe you, Joanna,’ Emily would say.","“可我想帮助你，安慰你，乔安娜。”埃米莉总是这样回答。"
"‘You are a lady, with a rich husband and fine sons!","“你是个阔太太，你丈夫有钱，你儿子有出息！"
"What can you want with a bereaved crone like me!’","你想从我这个失去亲人的老女人这里得到什么！”"
"‘Joanna, I want this: I want you to come and live in my house, and not stay alone in this dismal place any longer.’","“乔安娜，我想这样：我想让你住到我家去，不要再一个人住在这个凄凉的地方了。”"
"‘And suppose they come and don’t find me at home?","“万一他们回来了找不到我怎么办？"
"You wish to separate me and mine!","你想把我和我的家人分开！"
"No, I’ll stay here.","不，我要留在这里。"
"I don’t like you, and I can’t thank you, whatever kindness you do me!’","我讨厌你，不管你怎么帮我，我都不会感谢你的！”"
"However, as time went on Joanna could not afford to pay the rent of the shop and house without an income.","然而，随着时间的流逝，乔安娜因为没有收入，付不起商店和房子的租金了。"
"She was assured that all hope of the return of Shadrach and his sons was vain, and she reluctantly consented to accept the asylum of the Lesters’ house.","她已经认命了，知道谢德拉克和孩子们回来的希望很渺茫，最终不情愿地接受帮助，同意住到莱斯特家去。"
"Here she was allotted a room of her own on the second floor, and went and came as she chose, without contact with the family.","她在三楼得到一间属于她自己的房间，来去自如，也不和莱斯特家的人来往。"
"Her hair greyed and whitened, deep lines channeled her forehead, and her form grew gaunt and stooping.","她的头发渐渐变成花白，最终全白了，额头上皱纹横生，身体也变得骨瘦如柴，驼背得厉害。"
"But she still expected the lost ones, and when she met Emily on the staircase she would say morosely: ‘I know why you’ve got me here!","可她依然期盼着父子三人回来，有时在楼梯上遇到埃米莉，她就会愠怒地说：“我知道你为什么让我住在这儿！"
"They’ll come, and be disappointed at not finding me at home, and perhaps go away again; and then you’ll be revenged for my taking Shadrach away from ’ee!’","他们回到家里找不到我，会很失望，或许会再次离开，那样你就报了我把谢德拉克从你手中抢走的仇了！”"
"Emily Lester bore these reproaches from the grief-stricken soul.","埃米莉·莱斯特总是默默承受着这个悲痛欲绝的人发出的指责。"
"She was sure—all the people of Havenpool were sure—that Shadrach and his sons could not return.","她确信——实际上黑文普尔镇的所有人都确信——谢德拉克和他的儿子们不可能回来了。"
"For years the vessel had been given up as lost.","好几年过去了，人们已经对那艘失踪的船不抱希望了。"
"Nevertheless, when awakened at night by any noise, Joanna would rise from bed and glance at the shop opposite by the light from the flickering lamp, to make sure it was not they.","然而，每当夜里被一丁点儿响动吵醒，乔安娜总会从床上跳起来，借着忽明忽暗的灯光看一眼对面的杂货店，以确定是不是那父子三人。"
"It was a damp and dark December night, six years after the departure of the brig Joanna.","那是一个12月的夜里，潮湿漆黑，距“乔安娜号”帆船出海已经有六年了。"
"The wind was from the sea, and brought up a fishy mist which mopped the face like moist flannel.","风从海上吹来，带来一阵薄雾，散发着鱼腥味，拂到脸上就像湿润的法兰绒。"
"Joanna had prayed her usual prayer for the absent ones with more fervour and confidence than she had felt for months, and had fallen asleep about eleven.","乔安娜像往常一样为久别未归的三人做了祈祷，不过这次带着数月来都没有过的虔诚和信心，11点左右，她就睡着了。"
"It must have been between one and two when she suddenly started up.","不到2点钟的时候，乔安娜突然惊醒了。"
"She had certainly heard steps in the street, and the voices of Shadrach and her sons calling at the door of the grocery shop.","她确信自己听到了街上的脚步声，还有谢德拉克和孩子们在杂货店门口叫门的声音。"
"She sprang out of bed, and, hardly knowing what clothing she dragged on herself; hastened down Emily’s large and carpeted staircase, put the candle on the hall-table, unfastened the bolts and chain, and stepped into the street.","她从床上一跃而起，来不及披好衣服，就匆匆下了埃米莉家宽敞的、铺着地毯的楼梯。她把蜡烛放在大厅的桌子上，打开门闩和门链，走到街上。"
"The mist, blowing up the street from the Quay, hindered her seeing the shop, although it was so near; but she had crossed to it in a moment.","从码头方向蔓延而来的薄雾笼罩在街道上，虽然杂货店近在眼前，乔安娜却看不清楚。不过她很快就穿过街道，向杂货店走过去。"
"How was it?","怎么样呢？"
"Nobody stood there.","空无一人。"
"The wretched woman walked wildly up and down with her bare feet—there was not a soul.","这个可怜的女人光着脚，发疯般地走来走去，却一个人影也没有。"
"She returned and knocked with all her might at the door which had once been her own—they might have been admitted for the night, unwilling to disturb her till the morning.","她回到曾经属于她的杂货店门口，用尽力气敲着门——或许他们不愿意夜里打扰她，获准在店里过夜，要到第二天早上才告诉她。"
"It was not till several minutes had elapsed that the young man who now kept the shop looked out of an upper window, and saw the skeleton of something human standing below half-dressed.","不一会儿，如今拥有杂货店的年轻人从楼上的窗户里探出头来。他看到一个衣衫不整的瘦削人影站在下面。"
"‘Has anybody come?’ asked the form.","“有人来吗？”那身影问道。"
"‘O, Mrs. Jolliffe, I didn’t know it was you,’ said the young man kindly, for he was aware how her baseless expectations moved her.","“哦，乔利夫太太，我不知道是你，”年轻人和蔼地说道，因为他知道乔安娜是被虚幻的期待驱使着，"
"‘No; nobody has come.’","“没有，没有人来。”"
"June 1891.","1891年6月"

