"To Please His Wife","博妻欢心"
"by Thomas Hardy","作者：托马斯·哈代"
"Content","目录"
"Chapter I","第一章"
"Chapter II","第二章"
"Chapter III","第三章"

"Chapter I","第一章"
"The interior of St. James’s Church, in Havenpool Town, was slowly darkening under the close clouds of a winter afternoon.","一个冬日的下午，阴云密布，黑文普尔镇上圣詹姆斯教堂的室内慢慢暗了下来。"
"It was Sunday: service had just ended, the face of the parson in the pulpit was buried in his hands, and the congregation, with a cheerful sigh of release, were rising from their knees to depart.","那是个星期天。祷告仪式刚刚结束，布道坛上的牧师双手捂着脸，会众们发出一声解脱后的愉悦叹息，站起身准备离开。"
"For the moment the stillness was so complete that the surging of the sea could be heard outside the harbour-bar.","此时，教堂内一片寂静，甚至海港沙洲外汹涌的浪涛声都能听到。"
"Then it was broken by the footsteps of the clerk going towards the west door to open it in the usual manner for the exit of the assembly.","接着，教堂执事的脚步声打破了沉寂。他像往常一样走向西门，准备打开门让众人离开。"
"Before, however, he had reached the doorway, the latch was lifted from without, and the dark figure of a man in a sailor’s garb appeared against the light.","然而，他还没走到门口，门闩就被人从外面打开了。一个水手装束的黑色人影出现在光亮下。"
"The clerk stepped aside, the sailor closed the door gently behind him, and advanced up the nave till he stood at the chancel-step.","教堂执事让开路，水手轻轻关上门，穿过教堂中殿，一直走到高坛的台阶上站定。"
"The parson looked up from the private little prayer which, after so many for the parish, he quite fairly took for himself; rose to his feet, and stared at the intruder.","牧师本来正默默为自己作简短的祷告。他为教区的人们作了那么多祷告，为自己作一次也是合情合理。此时，他抬起头，站起身，盯着这位不速之客。"
"‘I beg your pardon, sir,’ said the sailor, addressing the minister in a voice distinctly audible to all the congregation.","“打扰了，先生，”水手说道。他虽是和牧师说话，声音却很响亮，所有的会众都听得见，"
"‘I have come here to offer thanks for my narrow escape from shipwreck.","“我来这里，是为了表达我的感恩之情，因为我侥幸从海难中生还。"
"I am given to understand that it is a proper thing to do, if you have no objection?’","我一向认为我应该这样做，如果您不反对的话。”"
"The parson, after a moment’s pause, said hesitatingly, ‘I have no objection; certainly.","牧师沉默了片刻，迟疑地说道：“我当然不反对。"
"It is usual to mention any such wish before service, so that the proper words may be used in the General Thanksgiving.","这种感恩的意愿通常要在祷告仪式之前提出，这样我为大家统一感恩祈祷时便能选择合适的话语。"
"But, if you wish, we can read from the form for use after a storm at sea.’","不过，如果你愿意，我们也可以诵读海上风暴过后常用的现成祷文。”"
"‘Ay, sure; I ain’t particular,’ said the sailor.","“嗯，没问题，我不介意。”水手说道。"
"The clerk thereupon directed the sailor to the page in the prayer-book where the collect of thanksgiving would be found, and the rector began reading it, the sailor kneeling where he stood, and repeating it after him word by word in a distinct voice.","于是，教堂执事让水手翻到祷告书上收录了这种感恩祷文的那一页，牧师开始诵读祷文。水手跪在他原先站着的地方，跟着牧师一字一句地大声念。"
"The people, who had remained agape and motionless at the proceeding, mechanically knelt down likewise; but they continued to regard the isolated form of the sailor who, in the precise middle of the chancel-step, remained fixed on his knees, facing the east, his hat beside him, his hands joined, and he quite unconscious of his appearance in their regard.","整个过程中，教堂的会众一直目瞪口呆，一动不动。现在，他们也机械地跟着跪了下来，但眼睛仍注视着水手孤零零的轮廓。他面朝东跪在高坛台阶的正中央，帽子放在身旁，双手紧握，完全没有意识到自己在众人眼中的形象。"
"When his thanksgiving had come to an end he rose; the people rose also, and all went out of church together.","水手作完感恩祈祷后，站了起来。其他人也站起身，一同走出教堂。"
"As soon as the sailor emerged, so that the remaining daylight fell upon his face, old inhabitants began to recognize him as no other than Shadrach Jolliffe, a young man who had not been seen at Havenpool for several years.","水手一走出去，夕阳的余晖照到他脸上，常年居住在这里的人们便渐渐认出，他就是谢德拉克·乔利夫。这个年轻人已经好些年没在黑文普尔露面了。"
"A son of the town, his parents had died when he was quite young, on which account he had early gone to sea, in the Newfoundland trade.","乔利夫出生在黑文普尔镇，很小的时候便失去了双亲。因此，他很早就成了水手，到纽芬兰做生意。"
"He talked with this and that townsman as he walked, informing them that, since leaving his native place years before, he had become captain and owner of a small coasting-ketch, which had providentially been saved from the gale as well as himself.","他一边走，一边和镇上的人左一句右一句地交谈。他告诉他们，几年前离开家乡后，他成了船长，拥有了一艘沿岸航行的小双桅纵帆船。多亏上帝保佑，他自己还有他的船才从大风暴中获救。"
"Presently he drew near to two girls who were going out of the churchyard in front of him; they had been sitting in the nave at his entry, and had watched his doings with deep interest, afterwards discussing him as they moved out of church together.","不一会儿，他靠近两个姑娘。这两个姑娘在他前面，正要走出教堂的院子。他进入教堂时，她们正坐在中殿里，饶有兴味地观察了他的一举一动。之后她们一起走出教堂，便聊起了他。"
"One was a slight and gentle creature, the other a tall, large-framed, deliberative girl.","其中一个姑娘身材纤细，温和文雅，另外一个则身材高大，体格健壮，做事很慎重。"
"Captain Jolliffe regarded the loose curls of their hair, their backs and shoulders, down to their heels, for some time.","乔利夫船长注视了她们好一会儿，从松松的发卷、后背、肩膀，一直打量到脚后跟。"
"‘Who may them two maids be?’ he whispered to his neighbour.","“这两位姑娘是？”他轻声问周围的乡邻。"
"‘The little one is Emily Hanning; the tall one Joanna Phippard.’","“小个子的是埃米莉·汉宁，高个子的是乔安娜·菲帕德。”"
"‘Ah!","“噢！"
"I recollect ’em now, to be sure.’","我现在想起来了，是她俩。”"
"He advanced to their elbow, and genially stole a gaze at them.","他赶上她们，快活地偷偷瞅了她们一眼。"
"‘Emily, you don’t know me?’ said the sailor, turning his beaming brown eyes on her.","“埃米莉，你不认识我了吗？”水手用含着笑意的棕色眼睛看着她，说道。"
"‘I think I do, Mr. Jolliffe,’ said Emily shyly.","“我想我还记得你，乔利夫先生。”埃米莉羞怯地回答。"
"The other girl looked straight at him with her dark eyes.","另外一个姑娘则用她那黑亮的眼睛直直地看着他。"
"‘The face of Miss Joanna I don’t call to mind so well,’ he continued.","“我对乔安娜小姐的长相记不太清了，”他继续说，"
"‘But I know her beginnings and kindred.’","“不过我见过她小的时候，也认识她的亲戚。”"
"They walked and talked together, Jolliffe narrating particulars of his late narrow escape, till they reached the corner of Sloop Lane, in which Emily Hanning dwelt, when, with a nod and smile, she left them.","他们边走边聊。乔利夫细细讲述着他不久前那次九死一生的经历，直到他们走到单桅船巷的拐角。埃米莉·汉宁就住在那里。她点了点头，微微一笑，先回了家。"
"Soon the sailor parted also from Joanna, and, having no especial errand or appointment, turned back towards Emily’s house.","很快，水手和乔安娜也告了别。由于没有什么事要做，也没有约，他便回转身，朝埃米莉家走去。"
"She lived with her father, who called himself an accountant, the daughter, however, keeping a little stationery-shop as a supplemental provision for the gaps of his somewhat uncertain business.","埃米莉和父亲一起住。她父亲自称是个会计师，但埃米莉却开了一个小小的文具店，以贴补父亲那那时好时坏的生意。"
"On entering Jolliffe found father and daughter about to begin tea.","一进门，乔利夫就看到父女俩正准备开始喝茶。"
"‘O, I didn’t know it was tea-time,’ he said.","“哦，没想到是下午茶时间了，”他说，"
"‘Ay, I’ll have a cup with much pleasure.’","“嗯，我很乐意喝一杯。”"
"He remained to tea and long afterwards, telling more tales of his seafaring life.","他喝了茶，又呆了很久，讲述了更多他航海生活中的故事。"
"Several neighbours called to listen, and were asked to come in.","几个邻居过来串门，应邀加入聊天。"
"Somehow Emily Hanning lost her heart to the sailor that Sunday night, and in the course of a week or two there was a tender understanding between them.","那个周日的晚上，埃米莉·汉宁不知怎的对水手动了心。不出一两周，两人之间便暗生情愫。"
"One moonlight evening in the next month Shadrach was ascending out of the town by the long straight road eastward, to an elevated suburb where the more fashionable houses stood—if anything near this ancient port could be called fashionable—when he saw a figure before him whom, from her manner of glancing back, he took to be Emily.","次月，一个月光皎洁的晚上，谢德拉克顺着一条长长的笔直大路朝东走出黑文普尔镇，一直走到郊区。那里地势较高，聚集了比较气派的房子——如果这个古老港口附近有称得上气派的东西的话——这时，他看到前方有一个身影，从那人回头张望的姿势来看，他觉得是埃米莉。"
"But, on coming up, he found she was Joanna Phippard.","不过，走近后他才发现，那是乔安娜·菲帕德。"
"He gave a gallant greeting, and walked beside her.","他殷勤地打了个招呼，和她并肩行走。"
"‘Go along,’ she said, ‘or Emily will be jealous!’","“你快走吧，”她说，“不然埃米莉会吃醋的！”"
"He seemed not to like the suggestion, and remained.","他似乎不喜欢这个提议，依然走在她旁边。"
"What was said and what was done on that walk never could be clearly recollected by Shadrach; but in some way or other Joanna contrived to wean him away from her gentler and younger rival.","那次散步途中说的话、做的事，谢德拉克怎么也记不清了；而乔安娜则想尽办法，试图让谢德拉克疏远那位比她更年轻、更温柔的情敌。"
"From that week onwards, Jolliffe was seen more and more in the wake of Joanna Phippard and less in the company of Emily; and it was soon rumoured about the quay that old Jolliffe’s son, who had come home from sea, was going to be married to the former young woman, to the great disappointment of the latter.","从那一周起，人们越来越频繁地看到乔利夫和乔安娜·菲帕德在一起，而他和埃米莉相处的时间则越来越少。不久，整个港口都风传老乔利夫的儿子，也就是那个刚刚出海回来的水手，要和前者结婚，让后者大失所望。"
"Just after this report had gone about, Joanna dressed herself for a walk one morning, and started for Emily’s house in the little cross-street.","就在谣言传开之后的一个早上，乔安娜收拾妥当，准备去小街上的埃米莉家走一遭。"
"Intelligence of the deep sorrow of her friend on account of the loss of Shadrach had reached her ears also, and her conscience reproached her for winning him away.","她也听说了她的朋友由于失去谢德拉克而伤心欲绝的消息。她为自己的横刀夺爱，受到良心上的谴责。"
"Joanna was not altogether satisfied with the sailor.","乔安娜对水手并非十分满意。"
"She liked his attentions, and she coveted the dignity of matrimony; but she had never been deeply in love with Jolliffe.","她喜欢他的殷勤照顾，也向往体面的婚姻生活，但她从未深深爱上乔利夫。"
"For one thing, she was ambitious, and socially his position was hardly so good as her own, and there was always the chance of an attractive woman mating considerably above her.","首先，她有更高的追求，而他的社会地位却还不及她自己。漂亮的女人总是有机会嫁给地位比自己高得多的男士。"
"It had long been in her mind that she would not strongly object to give him back again to Emily if her friend felt so very badly about him.","她反复思考，觉得如果埃米莉确实对乔利夫爱得死心塌地，那她倒也不怎么介意将他拱手还给她的朋友。"
"To this end she had written a letter of renunciation to Shadrach, which letter she carried in her hand, intending to send it if personal observation of Emily convinced her that her friend was suffering.","为此，她写了一封给谢德拉克的绝交信。她把信攥在手里，打算如果经过亲自观察，确定埃米莉饱受煎熬，那她就把信寄出去。"
"Joanna entered Sloop Lane and stepped down into the stationery-shop, which was below the pavement level.","乔安娜走进单桅船巷，向下迈进低于人行道的文具店。"
"Emily’s father was never at home at this hour of the day, and it seemed as though Emily were not at home either, for the visitor could make nobody hear.","这个时间，埃米莉的父亲向来不在家，埃米莉这天似乎也不在，因为没人回应登门拜访的乔安娜。"
"Customers came so seldom hither that a five minutes’ absence of the proprietor counted for little.","小店门可罗雀，不常有顾客光临，因此店主出去五分钟，也不打紧。"
"Joanna waited in the little shop, where Emily had tastefully set out—as women can—articles in themselves of slight value, so as to obscure the meagreness of the stock-in-trade; till she saw a figure pausing without the window apparently absorbed in the contemplation of the sixpenny books, packets of paper, and prints hung on a string.","埃米莉充分发挥女性的天赋，精心摆放了店里那些本身不甚值钱的商品，尽量掩盖东西本身的寒酸。乔安娜在小店里等着，突然看到一个人停在窗外，看上去正全神贯注地打量着六便士一本的廉价书籍、小捆纸和悬挂在细绳上的画片。"
"It was Captain Shadrach Jolliffe, peering in to ascertain if Emily were there alone.","来人正是谢德拉克·乔利夫船长。他正透过窗子观察店里，以确定是否只有埃米莉一个人在。"
"Moved by an impulse of reluctance to meet him in a spot which breathed of Emily, Joanna slipped through the door that communicated with the parlour at the back.","乔安娜突然觉得她不愿在一个散发着埃米莉气息的地方见到乔利夫，于是她悄悄溜进通往后面会客室的门。"
"She had frequently done so before, for in her friendship with Emily she had the freedom of the house without ceremony.","她以前经常这么干，因为凭着她和埃米莉的交情，她在这个家里可以自由自在，不需客气。"
"Jolliffe entered the shop.","乔利夫走进小店。"
"Through the thin blind which screened the glass partition she could see that he was disappointed at not finding Emily there.","透过遮住玻璃隔墙的薄百叶窗，乔安娜能看出，乔利夫发现埃米莉不在家后，很是失望。"
"He was about to go out again, when Emily’s form darkened the doorway, hastening home from some errand.","他刚要离开时，埃米莉的身影出现在门口。她因为一些事匆匆赶回来。"
"At sight of Jolliffe she started back as if she would have gone out again.","一看到乔利夫，她吃惊地倒退一步，仿佛要再次离开。"
"‘Don’t run away, Emily; don’t!’ said he.","“不要走，埃米莉。别走！”他说，"
"‘What can make ye afraid?’","“你怕什么呢？”"
"‘I’m not afraid, Captain Jolliffe.","“我不怕，乔利夫船长。"
"Only—only I saw you all of a sudden, and—it made me jump!’","只是——只是我突然看到你，吓了一跳！”"
"Her voice showed that her heart had jumped even more than the rest of her.","从她的声音可以听出，她内心的反应比她表现出来的还要强烈。"
"‘I just called as I was passing,’ he said.","“我路过，正好进来看看。”他说。"
"‘For some paper?’","“要买纸吗？”"
"She hastened behind the counter.","她匆匆走到柜台后面。"
"‘No, no, Emily; why do ye get behind there?","“不，不用，埃米莉。你为什么站到柜台后面？"
"Why not stay by me?","干吗不和我站在一起？"
"You seem to hate me.’","你似乎讨厌我。”"
"‘I don’t hate you.","“我不讨厌你。"
"How can I?’","我怎么会讨厌你呢？”"
"‘Then come out, so that we can talk like Christians.’","“那你出来，这样我们就能正经聊聊天。”"
"Emily obeyed with a fitful laugh, till she stood again beside him in the open part of the shop.","埃米莉呵呵地笑了一声，顺从地走了出去，走到店里的空处，再次站在乔利夫身边。"
"‘There’s a dear,’ he said.","“真是个可人儿。”他说。"
"‘You mustn’t say that, Captain Jolliffe; because the words belong to somebody else.’","“别这么说，乔利夫船长。这些话属于另外一个人。”"
"‘Ah!","“唉！"
"I know what you mean.","我明白你的意思。"
"But, Emily, upon my life I didn’t know till this morning that you cared one bit about me, or I should not have done as I have done.","可是，埃米莉，我以生命担保，直到今天早上，我才意识到你心里是有我的，否则我绝不会那样做。"
"I have the best of feelings for Joanna, but I know that from the beginning she hasn’t cared for me more than in a friendly way; and I see now the one I ought to have asked to be my wife.","我对乔安娜非常中意，可我知道，从一开始她对我就只能算是朋友关系。我现在想清楚了到底该向哪一位求婚。"
"You know, Emily, when a man comes home from sea after a long voyage he’s as blind as a bat—he can’t see who’s who in women.","埃米莉，你知道，经过长途航行出海归来的男人就像只蝙蝠，是个睁眼瞎，分辨不清女人。"
"They are all alike to him, beautiful creatures, and he takes the first that comes easy, without thinking if she loves him, or if he might not soon love another better than her.","女人对他而言都是一样的，是一种美丽的生物。他会追求容易接近的女人，不管她是否爱自己，也不管他自己是否不久会爱上更胜于她的另一个。"
"From the first I inclined to you most, but you were so backward and shy that I thought you didn’t want me to bother ’ee, and so I went to Joanna.’","最开始我更中意你，可你总是忸怩害羞，我以为你不希望我打扰你，于是就开始追求乔安娜。”"
"‘Don’t say any more, Mr. Jolliffe, don’t!’ said she, choking.","“别说了，乔利夫先生，别说了！”她哽咽着说道，"
"‘You are going to marry Joanna next month, and it is wrong to—to—’","“你下个月就要和乔安娜结婚了，不——不应该——”"
"‘O, Emily, my darling!’ he cried, and clasped her little figure in his arms before she was aware.","“唉，我亲爱的埃米莉！”他喊了一声。她还没有反应过来，他就紧紧拥住了她那弱小的身子。"
"Joanna, behind the curtain, turned pale, tried to withdraw her eyes, but could not.","乔安娜躲在帘子后，脸色变得苍白，她努力想移开视线，却做不到。"
"‘It is only you I love as a man ought to love the woman he is going to marry; and I know this from what Joanna has said, that she will willingly let me off!","“只有你，让我像男人爱自己要娶的女人那样去爱。我从乔安娜的话中明白了这一点，并且明白了她很愿意放开我！"
"She wants to marry higher I know, and only said “Yes” to me out of kindness.","我知道她希望嫁给更体面的人。她答应我的求婚，不过是出于善意。"
"A fine, tall girl like her isn’t the sort for a plain sailor’s wife: you be the best suited for that.’","像她那样漂亮高挑的女孩子，本不适合做平凡水手的妻子，你才是最适合的。”"
"He kissed her and kissed her again, her flexible form quivering in the agitation of his embrace.","他一遍遍吻着她，她柔软的身子在他的拥抱中激动得发抖。"
"‘I wonder—are you sure—Joanna is going to break off with you?","“我不知道——你确定——乔安娜会和你分手吗？"
"O, are you sure?","唉，你真的确定吗？"
"Because—’","因为——”"
"‘I know she would not wish to make us miserable.","“我相信她不希望让我们俩痛苦。"
"She will release me.’","她会让我解脱的。”"
"‘O, I hope—I hope she will!","“唉，我希望——我希望如此！"
"Don’t stay any longer, Captain Jolliffe!’","你现在走吧，乔利夫船长！”"
"He lingered, however, till a customer came for a penny stick of sealing-wax, and then he withdrew.","然而他一直呆着，直到一个顾客来买一便士的封口蜡时，他才恋恋不舍地离去。"
"Green envy had overspread Joanna at the scene.","看到此情此景，乔安娜妒火中烧。"
"She looked about for a way of escape.","她环顾四周，寻找逃脱的路。"
"To get out without Emily’s knowledge of her visit was indispensable.","她必须在不惊动埃米莉的情况下，离开她家。"
"She crept from the parlour into the passage, and thence to the front door of the house, where she let herself noiselessly into the street.","她从会客室慢慢挪到走廊，又潜行到房子前门，然后悄无声息地离开埃米莉家，走上街道。"
"The sight of that caress had reversed all her resolutions.","看到那两人拥抱后，她的决定完全改变了。"
"She could not let Shadrach go.","她不会放手谢德拉克。"
"Reaching home she burnt the letter, and told her mother that if Captain Jolliffe called she was too unwell to see him.","她一到家就烧了信，并且告诉母亲，如果乔利夫船长来访，就说她身体很不舒服，不能见他。"
"Shadrach, however, did not call.","然而，谢德拉克并没有来访。"
"He sent her a note expressing in simple language the state of his feelings; and asked to be allowed to take advantage of the hints she had given him that her affection, too, was little more than friendly, by cancelling the engagement.","他寄给她一封短信，简单地表明了他现在的情感状态。他还希望她允许自己根据她给的暗示（即她对他的感情仅限于友情），解除婚约。"
"Looking out upon the harbour and the island beyond he waited and waited in his lodgings for an answer that did not come.","他在房间里一边看着外面的海港及远方的岛屿，一边等啊等，然而始终没有等到回信。"
"The suspense grew to be so intolerable that after dark he went up the High Street.","他越来越焦虑，最终忍不住在天黑后去了镇子的主街。"
"He could not resist calling at Joanna’s to learn his fate.","他忍不住要去拜访乔安娜，看看自己命运如何。"
"Her mother said her daughter was too unwell to see him, and to his questioning admitted that it was in consequence of a letter received from himself; which had distressed her deeply.","乔安娜的母亲说她女儿身体很不舒服，无法见他。在他的追问之下，她承认这都是因为收到了他的一封信，那封信让她女儿伤心欲绝。"
"‘You know what it was about, perhaps, Mrs. Phippard?’ he said.","“您大概知道信的内容吧，菲帕德太太？”他问。"
"Mrs. Phippard owned that she did, adding that it put them in a very painful position.","菲帕德太太承认她知道，还说那封信让她们非常难过。"
"Thereupon Shadrach, fearing that he had been guilty of an enormity, explained that if his letter had pained Joanna it must be owing to a misunderstanding, since he had thought it would be a relief to her.","这样一来，谢德拉克很惶恐，觉得自己犯下了滔天罪行。于是他解释说，如果那封信让乔安娜这么伤心，那肯定是产生了误会，因为他本以为那封信会让她感到解脱。"
"If otherwise, he would hold himself bound by his word, and she was to think of the letter as never having been written.","如果并非如此，那他会让自己遵守诺言，而她可以当从来没有看到过那封信。"
