"How should an old man live his days if not in dreaming of his well-spent past?","除了梦回美好的过去，一个老人还能怎样继续他的生活？"
"In that, at all events, there is no agitating warmth, only pale winter sunshine.","无论如何，回忆中没有令人不安的燥热，只有冬日里苍白的阳光。"
"The shell can withstand the gentle beating of the dynamos of memory.","这副躯壳尚可承受住记忆那温柔的敲打。"
"The present he should distrust; the future shun.","他应该怀疑现在，逃避未来。"
"From beneath thick shade he should watch the sunlight creeping at his toes.","他应该在浓郁的树阴下面看阳光慢慢爬过脚背。"
"If there be sun of summer, let him not go out into it, mistaking it for the Indian-summer sun!","如果夏意浓浓，就不要让他跑去阳光下，别误把那当作“印第安之夏”的太阳！"
"Thus peradventure he shall decline softly, slowly, imperceptibly, until impatient Nature clutches his wind-pipe and he gasps away to death some early morning before the world is aired, and they put on his tombstone: ‘In the fulness of years!’ yea!","这样的话，他的身体或许会退化得轻一些、慢一些、不那么明显，直到大自然不耐烦了，掐住他的气管，使他在这个世界苏醒前的某个凌晨吐出最后一口气，离开人世。然后人们会在他的墓碑上写下“寿终正寝”。这多好啊！"
"If he preserve his principles in perfect order, a Forsyte may live on long after he is dead.","是的，一个福赛特如果一丝不苟地遵行他的原则，他在死后还可能长久地活下去。"
"Old Jolyon was conscious of all this, and yet there was in him that which transcended Forsyteism.","老乔利恩自然清楚这些，但他骨子里还有一种超越福赛特主义的东西。"
"For it is written that a Forsyte shall not love beauty more than reason; nor his own way more than his own health.","因为福赛特家有成文的家规：不能因爱美而失掉理性，不能因随心所欲而毁掉健康。"
"And something beat within him in these days that with each throb fretted at the thinning shell.","这些日子他总觉得有什么东西在他体内搏动，每一次悸动都啮蚀着他这副愈加瘦弱的躯壳。"
"His sagacity knew this, but it knew too that he could not stop that beating, nor would if he could.","他的理智觉察到了这一点，但同时也知道他无法停止这种悸动，而且就算能他也不会。"
"And yet, if you had told him he was living on his capital, he would have stared you down.","但是，如果你对他说他是吃老本，他一定会瞪着你，让你不敢与他对视。"
"No, no; a man did not live on his capital; it was not done!","不，不，人不能吃老本，那是不行的！"
"The shibboleths of the past are ever more real than the actualities of the present.","过去的陈规比当前的现实更加真实。"
"And he, to whom living on one’s capital had always been anathema, could not have borne to have applied so gross a phrase to his own case.","他一直对吃老本深恶痛绝，当然无法忍受用这一肮脏的说法来描述他自己的境况。"
"Pleasure is healthful; beauty good to see; to live again in the youth of the young—and what else on earth was he doing!","快乐益于健康；美赏心悦目；在年轻人的青春中重新活过——他所做的不就是这个么！"
"Methodically, as had been the way of his whole life, he now arranged his time.","他一生都有条不紊地生活，如今也井井有条地安排自己的时间。"
"On Tuesdays he journeyed up to town by train; Irene came and dined with him.","每个星期二，他坐火车进城，艾琳过来和他一起吃饭。"
"And they went to the opera.","然后他们一起去听歌剧。"
"On Thursdays he drove to town, and, putting that fat chap and his horses up, met her in Kensington Gardens, picking up the carriage after he had left her, and driving home again in time for dinner.","每个星期四，他坐马车进城，把那个胖家伙和他的马安顿好，到肯辛顿花园和她见面，两人分开后他再乘马车回家，刚好赶上吃晚饭。"
"He threw out the casual formula that he had business in London on those two days.","他随便找了个借口，说那两天在伦敦有事要办。 "
"On Wednesdays and Saturdays she came down to give Holly music lessons.","每个星期三和星期六，她来给霍利上音乐课。"
"The greater the pleasure he took in her society, the more scrupulously fastidious he became, just a matter-of-fact and friendly uncle.","在她的陪伴中获得的乐趣越多，他就越变得小心翼翼、谨小慎微，只作一个本分的、友善的伯父。"
"Not even in feeling, really, was he more—for, after all, there was his age.","即便在感情上，他也没有其他奢求——毕竟他年事已高。"
"And yet, if she were late he fidgeted himself to death.","但是如果她来迟了，他就会坐立不安，心急如焚。"
"If she missed coming, which happened twice, his eyes grew sad as an old dog’s, and he failed to sleep.","如果她没有来——这发生过两次——他的眼神就会变得如垂暮的老狗般悲伤，晚上也睡不着。"
"And so a month went by—a month of summer in the fields, and in his heart, with summer’s heat and the fatigue thereof.","这样过去了一个月——一个月的田野中的夏天，也是他心里的夏天，当然还有夏天的燥热和疲惫。"
"Who could have believed a few weeks back that he would have looked forward to his son’s and his grand-daughter’s return with something like dread!","谁能相信，就在几周前，他还正近乎忧虑地热切期盼着他的儿子和孙女回家！"
"There was such a delicious freedom, such recovery of that independence a man enjoys before he founds a family, about these weeks of lovely weather, and this new companionship with one who demanded nothing, and remained always a little unknown, retaining the fascination of mystery.","他几周来享受着宜人的天气，身边还多了一个毫无所求的人陪伴，她身上总有让人捉摸不到的东西，也越发保持着神秘的魅力。这一切都让他体会到自由的喜悦，重享成家立业前那种自在的感觉。"
"It was like a draught of wine to him who has been drinking water for so long that he has almost forgotten the stir wine brings to his blood, the narcotic to his brain.","这就像一个长期喝白开水的人在几乎忘掉美酒带来的血脉贲张、大脑迷醉的感觉后，又能畅饮美酒时的感受。"
"The flowers were coloured brighter, scents and music and the sunlight had a living value—were no longer mere reminders of past enjoyment.","花朵的颜色更鲜艳了，花香、音乐和阳光都有了活生生的价值——而不再只是让人想起过去的美好时光。"
"There was something now to live for which stirred him continually to anticipation.","现在他活着有了新的目标，这个目标也不断让他有新的期待。"
"He lived in that, not in retrospection; the difference is considerable to any so old as he.","他生活在这种期待里，而不是在回忆中；对于像他这个年纪的人来说，这两者间的差别很大。"
"The pleasures of the table, never of much consequence to one naturally abstemious, had lost all value.","他原本就饮食有度，美酒佳肴对他无关紧要，如今更是对他一点儿吸引力也没有了。"
"He ate little, without knowing what he ate; and every day grew thinner and more worn to look at.","他吃得很少，且食不甘味，因而一天天消瘦下去，看起来也越发憔悴不堪。"
"He was again a ‘threadpaper’; and to this thinned form his massive forehead, with hollows at the temples, gave more dignity than ever.","他又成了“瘦竹竿”，由于身体消瘦，他的额头更显宽大，加上凹陷的太阳穴，较之以往更显出他的威严来。"
"He was very well aware that he ought to see the doctor, but liberty was too sweet.","他非常清楚自己应该看医生，但自由实在是太过美好。"
"He could not afford to pet his frequent shortness of breath and the pain in his side at the expense of liberty.","不过是常常气短、肋下疼痛，他无法忍受为了减轻这些而丧失自由。"
"Return to the vegetable existence he had led among the agricultural journals with the life-size mangold wurzels, before this new attraction came into his life—no!","回到这个新乐趣闯进他生活之前的状态，再去过那种植物般乏味的生活，翻看农业杂志里跟实物一样大小的甜菜相片——不！"
"He exceeded his allowance of cigars.","他抽的雪茄已经超出了限额。"
"Two a day had always been his rule.","他一直都每天只抽两支。"
"Now he smoked three and sometimes four—a man will when he is filled with the creative spirit.","而现在他每天抽三支，有时甚至四支——当一个人创造力旺盛的时候往往如此。"
"But very often he thought: ‘I must give up smoking, and coffee; I must give up rattling up to town.’","但他也经常想：“我必须戒烟，戒咖啡，也不能老往城里去了。”"
"But he did not; there was no one in any sort of authority to notice him, and this was a priceless boon.","但是他没有；没人有权力来监督他，这真是个无价的恩赐。"
"The servants perhaps wondered, but they were, naturally, dumb.","仆人们也许很好奇，但他们天生就会保持缄默。"
"Mam’zelle Beauce was too concerned with her own digestion, and too ‘wellbrrred’ to make personal allusions.","博塞小姐一心想着自己的消化问题，而且太“有教养”，绝不会触及他人的私事。"
"Holly had not as yet an eye for the relative appearance of him who was her plaything and her god.","霍利还小，看不出他外表的变化，只把他当作她的玩偶、她的神。"
"It was left for Irene herself to beg him to eat more, to rest in the hot part of the day, to take a tonic, and so forth.","这样就只有艾琳自己来劝他多吃东西，天热的时候多休息，吃些补药什么的了。"
"But she did not tell him that she was the cause of his thinness—for one cannot see the havoc oneself is working.","但她没有说他这么消瘦就是因为她——人总是看不到自己造成的破坏。"
"A man of eighty-five has no passions, but the Beauty which produces passion works on in the old way, till death closes the eyes which crave the sight of Her.","八十五岁的人本说不上热情，但是美能唤起热情，一向如此，且始终如此，直到死亡将那双渴望见到她的眼睛闭上。"
"On the first day of the second week in July he received a letter from his son in Paris to say that they would all be back on Friday.","七月第二个星期的第一天，他收到了儿子从巴黎寄来的信，说他们星期五就全都回来。"
"This had always been more sure than Fate; but, with the pathetic improvidence given to the old, that they may endure to the end, he had never quite admitted it.","这一直是比命运还要确定的事；但是，由于老年人往往不顾将来，只是可怜地以为他们可以撑到最后，他始终不肯明确承认这件事。"
"Now he did, and something would have to be done.","现在他承认了，他必须做些什么了。"
"He had ceased to be able to imagine life without this new interest, but that which is not imagined sometimes exists, as Forsytes are perpetually finding to their cost.","他已经不能想象失去这种新乐趣的生活，但是想象不到的事情有时是存在的，福赛特家族的人就一直不断为此付出代价。"
"He sat in his old leather chair, doubling up the letter, and mumbling with his lips the end of an unlighted cigar.","他坐在他的旧皮椅上，折起信纸，唇间嚅弄着一根没有点燃的雪茄。"
"After to-morrow his Tuesday expeditions to town would have to be abandoned.","明天之后，他就没法每星期二进城一次了。"
"He could still drive up, perhaps, once a week, on the pretext of seeing his man of business.","他也许还能每星期坐马车进城一次，借口去见他的代理人。"
"But even that would be dependent on his health, for now they would begin to fuss about him.","可即便这样也得看他的健康状况，因为现在他们要开始担忧他的身体了。"
"The lessons!","钢琴课！"
"The lessons must go on!","钢琴课必须得上下去！"
"She must swallow down her scruples, and June must put her feelings in her pocket.","艾琳必须放下她的顾虑，琼也必须收起她的感情。"
"She had done so once, on the day after the news of Bosinney’s death; what she had done then, she could surely do again now.","她以前收起过她的感情，就是知道波辛尼出事的那天；她那次能做到的，这次当然也能做到。"
"Four years since that injury was inflicted on her—not Christian to keep the memory of old sores alive.","那一次伤害的打击已经过去四年了——还对过去的痛苦念念不忘就太不人道了。"
"June’s will was strong, but his was stronger, for his sands were running out.","琼的意志很强，但他的意志更强，因为他剩下的日子不多了。"
"Irene was soft, surely she would do this for him, subdue her natural shrinking, sooner than give him pain!","艾琳很温和，当然会为他这么做，她会克制她天性中的怯懦，而不愿让他痛苦！"
"The lessons must continue; for if they did, he was secure.","钢琴课必须继续下去，因为只有这样，他才安妥。"
"And lighting his cigar at last, he began trying to shape out how to put it to them all, and explain this strange intimacy; how to veil and wrap it away from the naked truth—that he could not bear to be deprived of the sight of beauty.","最后，他点燃了雪茄，开始考虑该怎么跟他们说，怎么解释这奇怪的亲密之情；怎样给它包装，以掩盖赤裸裸的实情——他受不了无法欣赏到美。"
"Ah! Holly! Holly was fond of her, Holly liked her lessons.","啊！霍利！霍利喜欢她，霍利喜欢她的钢琴课。"
"She would save him—his little sweet!","她会救他的——他的小甜心！"
"And with that happy thought he became serene, and wondered what he had been worrying about so fearfully.","这个念头使他愉悦了，也平静了下来，并且奇怪自己刚才为何那样忧心。"
"He must not worry, it left him always curiously weak, and as if but half present in his own body.","他不应该担心，担心总是让他感到莫名的虚弱，好像躯壳中只剩下了半个灵魂似的。"
"That evening after dinner he had a return of the dizziness, though he did not faint.","那天晚饭后，他头晕的毛病又犯了，但他没有晕倒。"
"He would not ring the bell, because he knew it would mean a fuss, and make his going up on the morrow more conspicuous.","他不愿按铃叫人，因为他知道这将引起一阵忙乱，明天进城的事就更显眼了。"
"When one grew old, the whole world was in conspiracy to limit freedom, and for what reason?—just to keep the breath in him a little longer.","当人老了，整个世界都在合谋限制他的自由，为的是什么？——只是为了让他多活几口气。"
"He did not want it at such cost.","他不想只为多活一会儿而付出这样的代价。"
"Only the dog Balthasar saw his lonely recovery from that weakness; anxiously watched his master go to the sideboard and drink some brandy, instead of giving him a biscuit.","只有小狗巴尔萨泽看着他一个人从那阵虚弱中恢复了过来，焦急地望着它的主人走到餐具柜旁边，倒了一些白兰地喝，而没有扔给它一块饼干吃。"
"When at last old Jolyon felt able to tackle the stairs he went up to bed.","最后老乔利恩感觉能够自己上台阶时，他就上楼睡觉去了。"
"And, though still shaky next morning, the thought of the evening sustained and strengthened him.","尽管第二天早上他仍觉得有些发抖，但对晚上的期待支持着他，给了他力气。"
"It was always such a pleasure to give her a good dinner—he suspected her of undereating when she was alone; and, at the opera to watch her eyes glow and brighten, the unconscious smiling of her lips.","请她享用一顿丰盛的晚餐总是令他愉快——他猜测她一个人的时候可能吃得不好；在歌剧院里望着她那明亮又溢满光彩的眼睛以及唇边那不经意间流露的微笑，也真让人开心。"
"She hadn’t much pleasure, and this was the last time he would be able to give her that treat.","她的生活中少有乐趣，而这是他最后一次款待她的机会了。"
"But when he was packing his bag he caught himself wishing that he had not the fatigue of dressing for dinner before him, and the exertion, too, of telling her about June’s return.","但收拾行李的时候，他想到晚餐前得换衣服，真麻烦；还得告诉她琼要回来了，也是件费劲的事，要是没有这些事该有多好。"
"The opera that evening was ‘Carmen,’ and he chose the last entr’acte to break the news, instinctively putting it off till the latest moment.","那晚的剧目是《卡门》，他在最后一次幕间休息时才把那消息告诉她，不自觉地把消息拖到了最后一刻。"
"She took it quietly, queerly; in fact, he did not know how she had taken it before the wayward music lifted up again and silence became necessary.","她平静地接受了这个消息，这有点儿蹊跷；实际上，他还没来得及了解她的想法，那恼人的音乐就再次响了起来，大家就都不能说话了。"
"The mask was down over her face, that mask behind which so much went on that he could not see.","她的脸又像是戴上了面具，面具后面的种种情绪起伏，他都看不到。"
"She wanted time to think it over, no doubt!","无疑她需要时间好好想一想！"
"He would not press her, for she would be coming to give her lesson to-morrow afternoon, and he should see her then when she had got used to the idea.","他也不会催她，因为她明天下午还会来教钢琴课，那时她就应该考虑过这件事了，到时候看吧。"
"In the cab he talked only of the Carmen; he had seen better in the old days, but this one was not bad at all.","在马车里，他只谈论着《卡门》，他从前看过更好的，但这次的也很不错。"
"When he took her hand to say good-night, she bent quickly forward and kissed his forehead.","当他握着她的手道晚安时，她飞快地向前俯身，亲吻了他的前额。"
"“Good-bye, dear Uncle Jolyon, you have been so sweet to me.”","“再见，亲爱的乔利恩伯伯，您待我太好了。”"
"“To-morrow then,” he said.","“好，明天见。”他说，"
"“Good-night.","“晚安。"
"Sleep well.”","睡个好觉。”"
"She echoed softly: “Sleep well” and from the cab window, already moving away, he saw her face screwed round towards him, and her hand put out in a gesture which seemed to linger.","她柔声重复着：“睡个好觉。”马车开始走了，他看见车窗里她扭头望着自己，一只手伸出窗外，像是依依不舍的样子。"
"He sought his room slowly.","他慢慢地走回自己的房间。"
"They never gave him the same, and he could not get used to these ‘spick-and-spandy’ bedrooms with new furniture and grey-green carpets sprinkled all over with pink roses.","他们从来不让他住同一间房，他很不习惯这些一尘不染的房间，家具都是新的，灰绿色的地毯上到处印着粉红色的玫瑰花。"
"He was wakeful and that wretched Habanera kept throbbing in his head.","他睡不着，那支可恶的哈巴涅拉舞曲一直在他脑海中回荡着。"
"His French had never been equal to its words, but its sense he knew, if it had any sense, a gipsy thing—wild and unaccountable.","他一直不太懂法文，不过他知道这个名字的意思，如果它有什么意思的话，那是指一个吉卜赛女郎——狂野而神秘。"
"Well, there was in life something which upset all your care and plans—something which made men and women dance to its pipes.","的确，生命中确实有种东西能打翻你所有的顾虑和打算——让男男女女都随着它的管乐跳起舞来。"
"And he lay staring from deep-sunk eyes into the darkness where the unaccountable held sway.","他躺着，一双深陷的眼睛盯着黑暗，那里被神秘的力量统占着。"
"You thought you had hold of life, but it slipped away behind you, took you by the scruff of the neck, forced you here and forced you there, and then, likely as not, squeezed life out of you!","你以为你掌控了人生，它却溜到你身后，抓住你的颈背，逼你去这里去那里，然后还说不定会要了你的命！"
"It took the very stars like that, he shouldn’t wonder, rubbed their noses together and flung them apart; it had never done playing its pranks.","他想，就连星星它也不会放过，把它们攒在一起，再猛地撒开；它有着变不完的戏法。"
"Five million people in this great blunderbuss of a town, and all of them at the mercy of that Life-Force, like a lot of little dried peas hopping about on a board when you struck your fist on it.","五百万人挤在这个大锅似的城市里，都任凭这一生命力的摆布，就像平板上的无数个小干豆，随着拳头撞击平板而上下跳动。"
"Ah, well! Himself would not hop much longer—a good long sleep would do him good!","唉！他也跳不了多久了——好好睡个长觉也好！"
"How hot it was up here!—how noisy!","这城里也太热了！——太吵了！"
"His forehead burned; she had kissed it just where he always worried; just there—as if she had known the very place and wanted to kiss it all away for him.","他的额头发烫，她刚好吻到了他一直感到不舒服的地方，就是那里——仿佛她知道就是那里，想替他把不适都吻掉。"
"But, instead, her lips left a patch of grievous uneasiness.","然而，她的双唇留下的却是一阵强烈的不安。"
"She had never spoken in quite that voice, had never before made that lingering gesture or looked back at him as she drove away.","她从未用那种语气说过话，从未有过那种恋恋不舍的手势，也从未在乘车离去时回头看他。"
"He got out of bed and pulled the curtains aside; his room faced down over the river.","他从床上起来，拉开窗帘，从他的房间可以俯瞰河水。"
"There was little air, but the sight of that breadth of water flowing by, calm, eternal, soothed him.","空气很沉闷，可看着那一大片河水平静地、无休止地流过，他的心情渐渐平复下来。"
"‘The great thing,’ he thought ‘is not to make myself a nuisance.","“最重要的，”他想，“是别让自己变得讨人嫌。"
"I’ll think of my little sweet, and go to sleep.’","我还是想想我的小甜心，睡觉去吧。”"
"But it was long before the heat and throbbing of the London night died out into the short slumber of the summer morning.","伦敦的夏夜，热气和嘈杂很久不散，直到清晨才消停片刻。"
"And old Jolyon had but forty winks.","老乔利恩只打了一个盹。"
"When he reached home next day he went out to the flower garden, and with the help of Holly, who was very delicate with flowers, gathered a great bunch of carnations.","第二天回家后，他去了花园。霍利很懂得花的好坏，在她的帮助下，他采了一大束康乃馨。"
"They were, he told her, for ‘the lady in grey’—a name still bandied between them; and he put them in a bowl in his study where he meant to tackle Irene the moment she came, on the subject of June and future lessons.","他告诉霍利，这些花是为那位“灰衣服女士”准备的——他们之间还用着这个称呼。他把花放在书房的大瓶里，想着艾琳一来，就在那里和她好好谈谈琼的事，说服她继续给霍利上课。"
"Their fragrance and colour would help.","这些花的香味和颜色会有所帮助。"
"After lunch he lay down, for he felt very tired, and the carriage would not bring her from the station till four o’clock.","午饭后他觉得很累，就躺下了，马车四点才能把她从车站接来。"
"But as the hour approached he grew restless, and sought the schoolroom, which overlooked the drive.","不过，随着四点钟临近，他变得不安起来，于是走进那间可以俯视车道的教室。"
"The sun-blinds were down, and Holly was there with Mademoiselle Beauce, sheltered from the heat of a stifling July day, attending to their silkworms.","教室的百叶帘放了下来，以挡住七月里沉闷的热气，霍利和博斯小姐都在那里，照料着她们的蚕。"
"Old Jolyon had a natural antipathy to these methodical creatures, whose heads and colour reminded him of elephants; who nibbled such quantities of holes in nice green leaves; and smelled, as he thought, horrid.","老乔利恩天生不喜欢这些慢条斯理的家伙，它们的头和颜色让他想起大象；它们在漂亮的绿叶子上咬出无数个洞；而且他觉得它们的气味非常糟糕。"
"He sat down on a chintz-covered windowseat whence he could see the drive, and get what air there was; and the dog Balthasar who appreciated chintz on hot days, jumped up beside him.","他在窗下罩着印花棉布的椅子上坐下，在那丽丽他能看到车道，还能呼吸点儿新鲜空气；小狗巴尔塔萨也跳上来呆在他旁边，因为它喜欢热天时在印花棉布上呆着。"
