"zh","en"
"我被一种莫名的感觉牢牢掌控——这种感觉不容分析，而我过去的经验也无从解释，恐怕将来也不会有答案。对于我这样头脑的人来说，考虑将来就是一种不幸。我再也不会——我知道我再也不会——对自己的一套观念的本性感到满意。不过这些观念是含糊的倒也不足为奇，因为他们的来源本就相当怪异。一种新的感觉——一种全新的存在又在我心里生了根。","A feeling, for which I have no name, has taken possession of my soul—a sensation which will admit of no analysis, to which the lessons of bygone times are inadequate, and for which I fear futurity itself will offer me no key.To a mind constituted like my own, the latter consideration is an evil.I shall never—I know that I shall never—be satisfied with regard to the nature of my conceptions.Yet it is not wonderful that these conceptions are indefinite, since they have their origin in sources so utterly novel.A new sense—a new entity is added to my soul."
"我登上这艘恐怖的船已过了很长一段时间，我想我的命运已初见端倪。一帮令人费解的人！他们全都沉浸在一种冥思苦想中，从我身旁经过居然没有注意到我。在全然看不见我的人眼前躲起来，于我而言真是够傻的。刚刚我还从他们眼前大摇大摆地走过去；不久之前我还大胆地去船长的私人船舱拿了些纸笔，就是用它们写下我的见闻的。我会一直坚持把日志写下去。我应该是没什么机会将它公诸于世，不过我还是会竭尽全力的。到最后关头，我会把手稿放在瓶子里，抛到海中。","It is long since I first trod the deck of this terrible ship, and the rays of my destiny are, I think, gathering to a focus.Incomprehensible men!Wrapped up in meditations of a kind which I cannot divine, they pass me by unnoticed.Concealment is utter folly on my part, for the people will not see.It was but just now that I passed directly before the eyes of the mate—it was no long while ago that I ventured into the captain’s own private cabin, and took thence the materials with which I write, and have written.I shall from time to time continue this Journal.It is true that I may not find an opportunity of transmitting it to the world, but I will not fail to make the endeavour.At the last moment I will enclose the MS. in a bottle, and cast it within the sea."
"一件小事的发生给了我更多新的思考空间。莫非这真的是不受控制的命运的安排？我曾冒险到甲板上去，躺在在帆船底部一堆梯绳和旧帆布中间，结果也没有人注意我。当我沉浸在在对自己奇特命运的思考中时，无意中抓着一把柏油刷涂抹着身边一只大桶上一张折得整整齐齐的辅助帆的边缘。现在那辅助帆展开在船上，我用刷子胡乱涂抹的痕迹竟是“发现”这个单词。","An incident has occurred which has given me new room for meditation.Are such things the operation of ungoverned Chance?I had ventured upon deck and thrown myself down, without attracting any notice, among a pile of ratlin-stuff and old sails in the bottom of the yawl.While musing upon the singularity of my fate, I unwittingly daubed with a tar-brush the edges of a neatly-folded studding-sail which lay near me on a barrel.The studding-sail is now bent upon the ship, and the thoughtless touches of the brush are spread out into the word DISCOVERY."
"最近我对大船的构造做了很多观察。尽管大船武装精良，但我觉得它不是一艘战船。船上的索具、船的构造和大体装备，都说明它不是。我能断言它不是什么战船，不过它到底是什么，又实在说不上来。我仔细审查了着它奇特的外形、还有独特的桅杆、巨大的体型、大得离谱的帆，以及极其简易的船头和老式的船尾，心头间或会闪过一种熟悉的感觉，并总是混杂着一些不甚清晰的记忆——对古老的异国编年史和远古时代的无法解释的追忆，我不知道为什么会这样。我一直在观察船骨。它是由一种我所不知的材料制成的。在我看来，这种木材的特质并不适合用来做船骨。我是说，在海上航行时船骨易遭虫蛀，仅是考虑到这一点，这种木头的材质也过于松软，且不说经年累月后木头本来就会腐烂。如果西班牙橡木是使用某种非自然的方法膨胀起来的话，这种木头便具备了它的一切特征——或许这种说法过于挑剔。 ","I have made many observations lately upon the structure of the vessel.Although well armed, she is not, I think, a ship of war.Her rigging, build, and general equipment, all negative a supposition of this kind.What she is not, I can easily perceive—what she is I fear it is impossible to say.I know not how it is, but in scrutinizing her strange model and singular cast of spars, her huge size and overgrown suits of canvas, her severely simple bow and antiquated stern, there will occasionally flash across my mind a sensation of familiar things, and there is always mixed up with such indistinct shadows of recollection, an unaccountable memory of old foreign chronicles and ages long ago.I have been looking at the timbers of the ship.She is built of a material to which I am a stranger.There is a peculiar character about the wood which strikes me as rendering it unfit for the purpose to which it has been applied.I mean its extreme porousness, considered independently by the worm-eaten condition which is a consequence of navigation in these seas, and apart from the rottenness attendant upon age.It will appear perhaps an observation somewhat over-curious, but this wood would have every, characteristic of Spanish oak, if Spanish oak were distended by any unnatural means."
"正读着上面这句的时候，我突然想起了一个饱经风霜的荷兰老航海家的古怪格言。每当有人对他的诚实心存质疑时，他便会说：“这就和船在海水中泡着就会像水手的身体一样被泡得很大是一样的，都是千真万确的。 ","In reading the above sentence a curious apothegm of an old weather-beaten Dutch navigator comes full upon my recollection.“It is as sure,” he was wont to say, when any doubt was entertained of his veracity, “as sure as there is a sea where the ship itself will grow in bulk like the living body of the seaman.”"
"约摸一个小时前，我大着胆子闯进一伙船员中间。虽然我就站在他们正中间，但他们对我毫不理睬，像是根本没意识到我的存在一样。就像我刚开始在船舱里看到的那人一样，他们全都老态龙钟。他们的膝盖因虚弱而颤抖；肩背因衰老而驼得厉害；枯皱的皮肤在风中嘎嘎作响；眼睛里闪烁着年老浑浊的光芒；灰白的头发在暴风中恐怖地飘动着。在他们周围，甲板上到处散落着稀奇古怪、式样过时的数学仪器。 ","About an hour ago, I made bold to thrust myself among a group of the crew.They paid me no manner of attention, and, although I stood in the very midst of them all, seemed utterly unconscious of my presence.Like the one I had at first seen in the hold, they all bore about them the marks of a hoary old age.Their knees trembled with infirmity; their shoulders were bent double with decrepitude; their shrivelled skins rattled in the wind; their voices were low, tremulous and broken; their eyes glistened with the rheum of years; and their gray hairs streamed terribly in the tempest.Around them, on every part of the deck, lay scattered mathematical instruments of the most quaint and obsolete construction."
"我前面提到过辅助帆已经张开了。从那时候起，船便一直顺着狂风继续着恐怖的南行之旅。从桅杆顶端的木冠到帆的下桁，整个船帆在船上迎风鼓起。每时每刻，桁端都会卷进骇人的巨浪之中，海水之恐怖程度，非人所能想象。我发现尽管对船员们来说在甲板上并没什么不便，但于我而言，却是无法立足于此。这艘大船居然没有立时被巨浪所吞没，在我看来当真是奇迹中的奇迹。我们一定是注定了要永远徘徊在永恒的边缘而无法最终一跃入海。船如海鸥一般，箭一样地在我前所未见的惊涛骇浪中滑行。那巨浪抬着头，如同地狱的恶魔一般，却又只限于恐吓，而不会当真毁灭什么。我只能把屡次的侥幸归因为自然因素，因为唯有自然才有此等力量——我只能推测，船是遇到了某种强大的水流或海底逆流。 ","I mentioned some time ago the bending of a studding-sail.From that period the ship, being thrown dead off the wind, has continued her terrific course due south, with every rag of canvas packed upon her, from her trucks to her lower studding-sail booms, and rolling every moment her top-gallant yard-arms into the most appalling hell of water which it can enter into the mind of a man to imagine.I have just left the deck, where I find it impossible to maintain a footing, although the crew seem to experience little inconvenience.It appears to me a miracle of miracles that our enormous bulk is not swallowed up at once and forever.We are surely doomed to hover continually upon the brink of Eternity, without taking a final plunge into the abyss.From billows a thousand times more stupendous than any I have ever seen, we glide away with the facility of the arrowy sea-gull; and the colossal waters rear their heads above us like demons of the deep, but like demons confined to simple threats and forbidden to destroy.I am led to attribute these frequent escapes to the only natural cause which can account for such effect.—I must suppose the ship to be within the influence of some strong current, or impetuous under-tow."
"我曾与船长在他的船舱里面对面地碰见过，但如我所料，他对我视而不见。不经意地一看，他的外表与常人无别，但我凝视他时，心里还是生出了无法抑制的敬畏，以及好奇的感觉。他大概和我差不多高——五英尺八英寸左右。他体格结实紧致，既不粗壮也不十分纤细。但他脸上的表情很是奇异——年老的痕迹是如此明显、触目惊心而又令人毛骨悚然，老得彻底，老得无以复加。这样的脸在我心中激起了一种说不清道不明的感觉。他的前额上尽管没什么皱纹，却像是带着了岁月的印记——他灰白的头发记录着过去，苍白的眼珠预示着未来。船舱的地板上堆积着厚厚一地的奇怪的铁扣对开本书籍、残破的科学仪器以及遭弃很久的过时航海图。他双手捧着低垂的脑袋，凝视着一张纸，眼神炯炯而不安。那纸我看应是一张委任状，上面竟有国王的签名。他低声自言自语着，就像我在船舱里见到的第一个船员那样。他怒冲冲地低声说了几句外国话。尽管他就在我的身旁，但那声音却像从一英里以外传来的一样。","I have seen the captain face to face, and in his own cabin—but, as I expected, he paid me no attention.Although in his appearance there is, to a casual observer, nothing which might bespeak him more or less than man-still a feeling of irrepressible reverence and awe mingled with the sensation of wonder with which I regarded him.In stature he is nearly my own height; that is, about five feet eight inches.He is of a well-knit and compact frame of body, neither robust nor remarkably otherwise.But it is the singularity of the expression which reigns upon the face—it is the intense, the wonderful, the thrilling evidence of old age, so utter, so extreme, which excites within my spirit a sense—a sentiment ineffable.His forehead, although little wrinkled, seems to bear upon it the stamp of a myriad of years.—His gray hairs are records of the past, and his grayer eyes are Sybils of the future.The cabin floor was thickly strewn with strange, iron-clasped folios, and mouldering instruments of science, and obsolete long-forgotten charts.His head was bowed down upon his hands, and he pored, with a fiery unquiet eye, over a paper which I took to be a commission, and which, at all events, bore the signature of a monarch.He muttered to himself, as did the first seaman whom I saw in the hold, some low peevish syllables of a foreign tongue, and although the speaker was close at my elbow, his voice seemed to reach my ears from the distance of a mile."
"这艘船以及船上的一切都散发出一种远古的气息。船员像埋葬了千百年的幽灵般来回飘动，他们的眼神焦灼不安。当他们的指尖在耀眼的战灯光亮下扫过我面前时，我都会生出一种前所未有的感觉，尽管在我的灵魂幻灭之前，一生都在与古物打交道，心中早已投下了巴尔贝克、泰德穆尔、波斯波利斯那倾覆支柱之影。 ","The ship and all in it are imbued with the spirit of Eld.The crew glide to and fro like the ghosts of buried centuries; their eyes have an eager and uneasy meaning; and when their fingers fall athwart my path in the wild glare of the battle-lanterns, I feel as I have never felt before, although I have been all my life a dealer in antiquities, and have imbibed the shadows of fallen columns at Balbec, and Tadmor, and Persepolis, until my very soul has become a ruin."
"我四下看了看，不禁为自己先前的担忧而惭愧。要是看到一直不离左右的狂风就吓得发抖，那看到狂风与海洋之战，还不得吓得呆若木鸡？须知若将此战与龙卷风跟西蒙风相比，后二者是根本不值一提的。船的附近唯有无穷无尽的夜的黑，还有无沫海水的喧嚣，但是在船两侧各一里格远的地方，巨大的冰墙间或隐约可见。它们高耸直入苍凉的天空，看上去就像是宇宙之墙。 ","When I look around me I feel ashamed of my former apprehensions.If I trembled at the blast which has hitherto attended us, shall I not stand aghast at a warring of wind and ocean, to convey any idea of which the words tornado and simoom are trivial and ineffective?All in the immediate vicinity of the ship is the blackness of eternal night, and a chaos of foamless water; but, about a league on either side of us, may be seen, indistinctly and at intervals, stupendous ramparts of ice, towering away into the desolate sky, and looking like the walls of the universe."
"如我所想，这船确实是在水流中前行，若这潮水可称为水流的话。这潮水正在白冰之中怒吼尖叫，如洪水般迅猛地向南奔流而去。","As I imagined, the ship proves to be in a current; if that appellation can properly be given to a tide which, howling and shrieking by the white ice, thunders on to the southward with a velocity like the headlong dashing of a cataract."
"我想我心底的恐惧根本无法形容，不过我决心要探清这个恐怖地带的秘密。这种好奇心战胜了绝望，也使我不惮于那最是可怕的死亡。很显然，我们坐着这船，正匆匆奔着某些激动人心的秘密而去——某些永远无人知晓的秘密，而其结局必然是毁灭。也许水流便是带着我们去到南极的。须得承认，这个猜测虽貌似荒诞，却也是极有可能的。","To conceive the horror of my sensations is, I presume, utterly impossible; yet a curiosity to penetrate the mysteries of these awful regions, predominates even over my despair, and will reconcile me to the most hideous aspect of death.It is evident that we are hurrying onwards to some exciting knowledge—some never-to-be-imparted secret, whose attainment is destruction.Perhaps this current leads us to the southern pole itself.It must be confessed that a supposition apparently so wild has every probability in its favor."
"船员们在甲板上踱来踱去，步子颤抖不安，不过，他们脸上的表情更多的是希望的渴求，而不是绝望的漠然。 ","The crew pace the deck with unquiet and tremulous step; but there is upon their countenances an expression more of the eagerness of hope than of the apathy of despair."
"与此同时，船尾依然被风吹着，由于船帆林立，船时不时会被整个抛离海面——哦，那真是险象环生！那冰忽然向右裂开，接着又向左裂开，我们则头晕目眩地绕着巨大的同心圆打转，一圈又一圈地绕着一个巨大的冰斗转着，而它的冰墙的墙头却远远地消失在黑暗之中。我还没来得及想自己的命运，船绕的圈子迅速地变小了，我们陷在漩涡里，猛地栽了进去。船在海洋和暴风雨雷鸣般的怒吼咆哮声中剧烈颤动，哦，天哪！而且它在下沉。","In the meantime the wind is still in our poop, and, as we carry a crowd of canvas, the ship is at times lifted bodily from out the sea—Oh, horror upon horror!the ice opens suddenly to the right, and to the left, and we are whirling dizzily, in immense concentric circles, round and round the borders of a gigantic amphitheatre, the summit of whose walls is lost in the darkness and the distance.But little time will be left me to ponder upon my destiny—the circles rapidly grow small—we are plunging madly within the grasp of the whirlpool—and amid a roaring, and bellowing, and thundering of ocean and of tempest, the ship is quivering, oh God! and—going down."
"注：《瓶中手稿》最初发表于1831年。直到多年以后，我才对墨卡托画的地图有所了解。地图上表明了海洋从四个入口流入北极湾，然后被地球吸进腹部。北极的标志是高耸入云的黑色巨石。","NOTE.—The “MS. Found in a Bottle,” was originally published in 1831 (1833), and it was not until many years afterwards that I became acquainted with the maps of Mercator, in which the ocean is represented as rushing, by four mouths, into the (northern) Polar Gulf, to be absorbed into the bowels of the earth; the Pole itself being represented by a black rock, towering to a prodigious height."
