"zh","en"
"争吵完之后大约过了半小时，当我正深深地沉浸在我下面那天堂般的美景中时，我被吓了一跳，一个非常冰冷的东西轻柔地压在我的后颈上。不用说，我感到一种难以言表的恐慌。我知道庞培在我的脚下，黛安娜按照我的明确指示正蹲在这个房间最远的角落里。那这是什么呢？天哪！还好我发现得早。把头轻轻转向一侧，我极其恐惧地发现，那每小时转一圈、庞大闪亮的、刀一样的分针已经架在了我的脖子上。我知道要争分夺秒了。我立即把脖子缩回来，可是已经太迟了。让我的头从那个可怕的陷阱中退出来已经不可能了，头不偏不倚正好陷在里面，而陷阱的口正以无法想象的可怕速度变得越来越小。当时的那种痛苦无法想象。我举起双手，用尽全力将那沉重的铁棒往上推。可能我试图把教堂本身也举起来。分针在往下，往下，往下，离得越来越近。我向庞培呼喊求救，但是他说我称他为“无知的老斜眼”伤害了他的感情。我向黛安娜求救，可是它只是“汪汪”叫，意思是说，我已经叫它“绝不要离开那个角落。”因此我不能指望从同伴那获得援助了。","It might have been half an hour after this altercation when, as I was deeply absorbed in the heavenly scenery beneath me, I was startled by something very cold which pressed with a gentle pressure on the back of my neck.It is needless to say that I felt inexpressibly alarmed.I knew that Pompey was beneath my feet, and that Diana was sitting, according to my explicit directions, upon her hind legs, in the farthest corner of the room.What could it be?Alas!I but too soon discovered.Turning my head gently to one side, I perceived, to my extreme horror, that the huge, glittering, scimitar-like minute-hand of the clock had, in the course of its hourly revolution, descended upon my neck.There was, I knew, not a second to be lost.I pulled back at once—but it was too late.There was no chance of forcing my head through the mouth of that terrible trap in which it was so fairly caught, and which grew narrower and narrower with a rapidity too horrible to be conceived.The agony of that moment is not to be imagined.I threw up my hands and endeavored, with all my strength, to force upward the ponderous iron bar.I might as well have tried to lift the cathedral itself.Down, down, down it came, closer and yet closer.I screamed to Pompey for aid; but he said that I had hurt his feelings by calling him ‘an ignorant old squint-eye.’ I yelled to Diana; but she only said ‘bow-wow-wow,’ and that I had told her ‘on no account to stir from the corner.’Thus I had no relief to expect from my associates."
"同时，那把沉重而可怕的“时间镰刀”（我现在明白了这个古典词组的原意）没有停止，也不可能在前进的过程中停止。它仍然在一点一点地往下压。它那锋利的边缘已经切入我的脖子足足一英寸，我的感觉变得模糊而混乱。我一会儿想象自己正在费城与庄重的莫理本利博士在一起，一会儿又想象自己在布莱克伍德先生的后客厅里倾听他无价的教导。接着，我又记起了先前更加美好的时光，那些甜蜜的回忆；我回味着那段快乐的时光，那时候这个世界并不是一片荒原，庞培也没有这么残忍。","Meantime the ponderous and terrific Scythe of Time (for I now discovered the literal import of that classical phrase) had not stopped, nor was it likely to stop, in its career.Down and still down, it came.It had already buried its sharp edge a full inch in my flesh, and my sensations grew indistinct and confused.At one time I fancied myself in Philadelphia with the stately Dr. Moneypenny, at another in the back parlor of Mr. Blackwood receiving his invaluable instructions.And then again the sweet recollection of better and earlier times came over me, and I thought of that happy period when the world was not all a desert, and Pompey not altogether cruel."
"那机械装置发出的滴答声让我快乐。我说它让我快乐是因为，此刻我的感觉已经接近极乐的状态，最微不足道的小事也足以令我欣喜。大钟那永无止境的滴答、滴答、滴答的声音在我的耳里就是最动人的音乐，有时甚至让我想起奥拉波德博士得体的布道演说。接着钟面上出现了许多伟大的身影，他们看上去多么聪明、多么有智慧啊！现在他们开始跳玛祖卡舞，我认为跳得最令我满意的是身影V。那明显是一位有教养的女士。完全没有你们的那种趾高气扬，她的舞姿也毫无不雅之处。她的单足旋转令人羡慕——踮起脚尖旋转。我竭力搬给她一张椅子，因为我看出她似乎跳得精疲力竭了，直到这时我才彻底意识到自己可悲的处境。确实是可悲！那分针切入我的脖子已经有两英寸。我被一种剧烈的疼痛唤醒。我祈求死去，在这一痛苦的时刻，我情不自禁地反复吟起诗人塞万提斯的那几行精美的诗句：","The ticking of the machinery amused me.Amused me, I say, for my sensations now bordered upon perfect happiness, and the most trifling circumstances afforded me pleasure.The eternal click-clack, click-clack, click-clack of the clock was the most melodious of music in my ears, and occasionally even put me in mind of the graceful sermonic harangues of Dr. Ollapod.Then there were the great figures upon the dial-plate—how intelligent, how intellectual, they all looked!And presently they took to dancing the Mazurka, and I think it was the figure V. who performed the most to my satisfaction.She was evidently a lady of breeding.None of your swaggerers, and nothing at all indelicate in her motions.She did the pirouette to admiration—whirling round upon her apex.I made an endeavor to hand her a chair, for I saw that she appeared fatigued with her exertions—and it was not until then that I fully perceived my lamentable situation.Lamentable indeed!The bar had buried itself two inches in my neck.I was aroused to a sense of exquisite pain.I prayed for death, and, in the agony of the moment, could not help repeating those exquisite verses of the poet Miguel De Cervantes:"
"快来吧，死神，","Vanny Buren, tan escondida"
"但别让我看见你到来，","Query no te senty venny"
"以免我见到你时的快乐","Pork and pleasure, delly morry"
"会不幸地让我死而复活！（注：此处是女主人公对“How to Write a Blackwood Articale”一文中提到的四行诗的误写，正确的原文应为：Van muerte tan escondida, Que no te sienta venir,Porque el plazer del morir,No mestorne a dar la vida。）","Nommy, torny, darry, widdy!"
"但是现在一种新的恐惧出现了，事实上这一恐惧足以让最坚强的神经吓一跳。由于那机器的残酷压力，我的眼珠完全从眼窝中鼓了出来。当我在想失去它们以后该怎么办时，一只眼珠实际上从我的眼窝中迸了出来，顺着尖塔陡峭的外墙，滚进了沿主建筑的屋檐延伸出来的雨槽中。与其说是我失去了眼睛，还不如说是这只眼睛获得了独立，它以无礼而且鄙视的眼神看着我。它躺在雨槽里，刚好在我鼻子底下，那副神情如果说不上恶心的话，至少也是可笑的。以前从没见它这样眨过。雨槽中那只眼睛的行为让我很恼火，因为它表现出了明显的傲慢无礼和可耻的忘恩负义，而且也让我感到很不方便，因为一个脑袋上的两只眼睛无论相距多远，彼此之间总是会存在感应。不论我愿意与否，都不得不在一定程度上眨眨眼睛，与躺在我鼻子下面的那个下流坯子保持高度一致。然而，现在另一只眼珠也掉了，我解脱了。下落的时候，它选择了和同伴一样的方向（可能是共同策划的阴谋）。它们一起滚出了雨槽，实际上我很高兴能摆脱它们。","But now a new horror presented itself, and one indeed sufficient to startle the strongest nerves.My eyes, from the cruel pressure of the machine, were absolutely starting from their sockets.While I was thinking how I should possibly manage without them, one actually tumbled out of my head, and, rolling down the steep side of the steeple, lodged in the rain gutter which ran along the eaves of the main building.The loss of the eye was not so much as the insolent air of independence and contempt with which it regarded me after it was out.There it lay in the gutter just under my nose, and the airs it gave itself would have been ridiculous had they not been disgusting.Such a winking and blinking were never before seen.This behavior on the part of my eye in the gutter was not only irritating on account of its manifest insolence and shameful ingratitude, but was also exceedingly inconvenient on account of the sympathy which always exists between two eyes of the same head, however far apart.I was forced, in a manner, to wink and to blink, whether I would or not, in exact concert with the scoundrelly thing that lay just under my nose.I was presently relieved, however, by the dropping out of the other eye.In falling it took the same direction (possibly a concerted plot) as its fellow.Both rolled out of the gutter together, and in truth I was very glad to get rid of them."
"现在，那指针切入我脖子的深度已经有四英寸半，脖子上只剩下一层皮和脑袋相连。我的感觉是完全的快乐，因为我感到再过几分钟，最多几分钟，我就可以从这令人不快的处境中解脱了。我的这个希望并没有落空。下午五点二十五分整，那庞大的分针在它可怕的轨道上转了足够长的时间后，最终切断了我脖子上最后那点儿跟脑袋连着的部分。看见曾让我如此尴尬的脑袋最终与我的身体分离，我并没有难过。它先沿着尖塔的外壁滚下去，接着在雨槽中停了几秒，最后纵身一跃，掉到了大街中间。","The bar was now four inches and a half deep in my neck, and there was only a little bit of skin to cut through.My sensations were those of entire happiness, for I felt that in a few minutes, at farthest, I should be relieved from my disagreeable situation.And in this expectation I was not at all deceived.At twenty-five minutes past five in the afternoon, precisely, the huge minute-hand had proceeded sufficiently far on its terrible revolution to sever the small remainder of my neck.I was not sorry to see the head which had occasioned me so much embarrassment at length make a final separation from my body.It first rolled down the side of the steeple, then lodge, for a few seconds, in the gutter, and then made its way, with a plunge, into the middle of the street."
"我要坦率地承认，我现在的感觉带有一种最奇特的性质，而且是最神秘、最复杂、最难以理解的性质。在同一时刻，我的感觉既在这儿，又在那儿。我一会儿用我的脑袋设想，我的脑袋是真正的普叙赫·泽诺比娅小姐——一会儿我又相信，我的身体才是自己本来的身份。为了弄清我对这一问题的想法，我到口袋里去摸鼻烟盒，可是当我摸到它，努力按平常的方式使用一小撮令人快乐的烟末时，我马上意识到我特殊的缺陷，并立刻把鼻烟盒扔给了我的脑袋。它极其满意地吸了一小撮，接着向我笑了笑表示感谢。紧接着它对我说了一番话，我能够听见，但是由于没有耳朵，我未能听清。然而，我听到的内容足以让我知道，它对我在这种情况下居然还想继续活下去感到很惊讶。在结束语中，它引用了阿里奥斯托的高贵的诗句——","I will candidly confess that my feelings were now of the most singular—nay, of the most mysterious, the most perplexing and incomprehensible character.My senses were here and there at one and the same moment.With my head I imagined, at one time, that I, the head, was the real Signora Psyche Zenobia—at another I felt convinced that myself, the body, was the proper identity.To clear my ideas on this topic I felt in my pocket for my snuff-box, but, upon getting it, and endeavoring to apply a pinch of its grateful contents in the ordinary manner, I became immediately aware of my peculiar deficiency, and threw the box at once down to my head.It took a pinch with great satisfaction, and smiled me an acknowledgement in return.Shortly afterward it made me a speech, which I could hear but indistinctly without ears.I gathered enough, however, to know that it was astonished at my wishing to remain alive under such circumstances.In the concluding sentences it quoted the noble words of Ariosto—"
"Il pover hommy che non sera corty","Il pover hommy che non sera corty"
"And have a combat tenty erry morty;（注：这两行诗是女主人公对“How to Write a Blackwood Article”一文中提到的那两行诗的误写，原文为：Il pover 'huomo che non se'n era accorto, Andava combattendo, e era morto。意思是说，一位伟大的英雄在战斗最激烈的时候没有意识到自己已被杀死，所以仍继续战斗。）","And have a combat tenty erry morty;"
"以此把我比作诗中的那位英雄，他在激烈的战斗中并没有感觉到自己已经死了，继续以不灭的勇气战斗。现在已经没有什么能够阻碍我从高处下来了，我也确实这样做了。我一直都无法知道，庞培从我的外表中看到了什么非常特别的地方。这家伙张大了嘴，紧闭他的双眼，似乎正在努力用上下眼皮夹坚果似的。最后，他扔掉大衣，跃向楼梯，然后就消失了。我向那个无赖恶狠狠地骂出了德摩斯梯尼那句有力的话——","thus comparing me to the hero who, in the heat of the combat, not perceiving that he was dead, continued to contest the battle with inextinguishable valor.There was nothing now to prevent my getting down from my elevation, and I did so.What it was that Pompey saw so very peculiar in my appearance I have never yet been able to find out.The fellow opened his mouth from ear to ear, and shut his two eyes as if he were endeavoring to crack nuts between the lids.Finally, throwing off his overcoat, he made one spring for the staircase and disappeared.I hurled after the scoundrel these vehement words of Demosthenes—"
"安德鲁·奥菲勒格森，你果真仓皇出逃了。","Andrew O’Phlegethon, you really make haste to fly."
"接着我转向了我的心肝宝贝，只有一只眼睛、毛发蓬乱的黛安娜。天哪！我的眼前是一副多么恐怖的景象！那偷偷摸摸正在进洞的是一只老鼠吗？这些是那只大老鼠残忍地吞吃掉小天使后，剔下的残骨吗？天哪！难道我所看到的——是我心爱的鬈毛狗的亡魂、幽灵、鬼魂？我还认为它正忧伤地、优雅地蹲坐在墙脚。听！它在诉说，天哪！它在用德语吟诵席勒的诗句——","and then turned to the darling of my heart, to the one-eyed! the shaggy-haired Diana.Alas! what a horrible vision affronted my eyes?Was that a rat I saw skulking into his hole?Are these the picked bones of the little angel who has been cruelly devoured by the monster?Ye gods! and what do I behold—is that the departed spirit, the shade, the ghost, of my beloved puppy, which I perceive sitting with a grace so melancholy, in the corner?Hearken! for she speaks, and, heavens! it is in the German of Schiller—"
"假若我死去，至少我是","Unt stubby duk, so stubby dun"
"为你而死！为你而死！（注：这原指“How to Write a Blackwood Article”一文中出现的诗句，女主人公在引用时，出现了错误的拼写，原文应为：Und sterb'ich doch, no sterb'ich dennDurch sie—durch sie!）","Duk she!duk she!"
"天啊！它所说的话不是太真实了吗？","Alas! and are not her words too true?"
"如果我死了，至少我是","And if I died, at least I died"
"为你而死——为你而死。","For thee—for thee."
"亲爱的小狗！它也为我牺牲了它自己。没有了狗，没有了黑人，没有了头，现在不高兴的普叙赫·泽诺比娅小姐还有什么？天哪——一无所有！我完蛋了。","Sweet creature! she too has sacrificed herself in my behalf.Dogless, niggerless, headless, what now remains for the unhappy Signora Psyche Zenobia?Alas—nothing!I have done."
