"zh","en"
"我的朋友，伦敦《星期六评论》的书评作家，他不是表面上表现的那样愚蠢或“严肃”的人，正相反，他非常喜欢及欣赏你的书。当我读到《银河》上的那篇文章时，我可以想象得到他由衷地放声大笑的样子。但是他为天主教和英国国教的教徒写作。他高调、陈旧、保守有礼，而当他假装严肃地摇头时，却从让你感到震惊中而获得乐趣。他自己就是一个非常棒的幽默大师。","The London Reviewer, my friend, is not the stupid, “serious” creature he pretends to be, I think; but, on the contrary, has a keep appreciation and enjoyment of your book.As I read his article in THE GALAXY, I could imagine him giving vent to many a hearty laugh.But he is writing for Catholics and Established Church people, and high-toned, antiquated, conservative gentility, whom it is a delight to him to help you shock, while he pretends to shake his head with owlish density.He is a magnificent humorist himself."
"（既然我举止高雅，长相俊美，那么我会脱帽，双脚并立，手放心口向我永远的朋友和伙伴致敬，并用阿拉巴马的方言告诉他：“我不胜荣幸。”）","(Now that is graceful and handsome.I take off my hat to my life-long friend and comrade, and with my feet together and my fingers spread over my heart, I say, in the language of Alabama, “You do me proud.”)"
"身为这篇文章的作者，我感到惭愧，但我并无冒犯之意。在波士顿《广告人》中的一则新闻里，我获悉对我英文版作品的正式的严肃的批评刊登在《星期六邮报》上。冷漠沉闷的英国佬用羽毛笔写的文学早餐，对于天生道德感薄弱的人来说难以接受。于是我回家，模仿它的讽刺腔调，可以说我陶醉于这种模仿之中。在我的模仿评论写成并寄给印刷厂之后，我才亲眼看到《星期六邮报》上的那篇文章。当我拿到那篇评论时，我觉得它粗俗，文笔拙劣，歪曲事实，通篇生硬死板。之前引用的报纸上那段话的作者并未受到评论特点的误导。","I stand guilty of the authorship of the article, but I did not mean any harm.I saw by an item in the Boston ADVERTISER that a solemn, serious critique on the English edition of my book had appeared in the London SATURDAY REVIEW, and the idea of SUCH a literary breakfast by a stolid, ponderous British ogre of the quill was too much for a naturally weak virtue, and I went home and burlesqued it— reveled in it, I may say.I never saw a copy of the real SATURDAY REVIEW criticism until after my burlesque was written and mailed to the printer.But when I did get hold of a copy, I found it to be vulgar, awkwardly written, ill-natured, and entirely serious and in earnest.The gentleman who wrote the newspaper paragraph above quoted had not been misled as to its character."
"如果现在有人怀疑我的话，我会杀了他。不，我不会杀他，我会赢走他的钱。我要跟他以二十比一的赌率打赌，让任何一位纽约出版人下注，就赌关于上面文章的著作权，我的说法是完全真实的。或许我会因此而发财，我愿意参加有关于此问题的所有赌局，假如有人想要更大的投注率，我也会完全同意。但是，他应该查明我是否在赌一件“有把握”的事情，或在拿出钱冒险之前，他可以去公共图书馆查阅一下十月八日的伦敦《星期六评论》，那里面有真正的书评。","If any man doubts my word now, I will kill him.No, I will not kill him; I will win his money.I will bet him twenty to one, and let any New York publisher hold the stakes, that the statements I have above made as to the authorship of the article in question are entirely true.Perhaps I may get wealthy at this, for I am willing to take all the bets that offer; and if a man wants larger odds, I will give him all he requires.But he ought to find out whether I am betting on what is termed “a sure thing” or not before he ventures his money, and he can do that by going to a public library and examining the London SATURDAY REVIEW of October 8th, which contains the real critique."
"天哪！有人以为我才是“被出卖”的人！","Bless me, some people thought that I was the “sold” person!"
"注：我无法抑制对如此有趣的事情发表评论的欲望——这篇简单、得体、富有哲理、体现着作者乐观与自信的评论，摘自《辛辛那提问询报》。","P.S.—I cannot resist the temptation to toss in this most savory thing of all—this easy, graceful, philosophical disquisition, with his happy, chirping confidence.It is from the Cincinnati ENQUIRER:"
"没有什么比一支好雪茄的价值更难以确定的了。如果不知道帕特加雪茄的价格，十分之九的吸烟者会更喜欢普通的国产雪茄，而不是五十五美分的帕特加雪茄。帕特加雪茄的味道对于习惯了康涅狄格州烟叶口味的人来说太淡了。这也很幽默。品质越好，不受认可的危险性就越大。就连马克·吐温都被一篇关于他的作品《傻瓜国外旅行记》的英语评论否定了。马克·吐温绝不是粗俗的幽默家。但英国人的幽默比起他的来太委婉，以致他误把这种幽默当作死板和“过分乏味”。","Nothing is more uncertain than the value of a fine cigar.Nine smokers out of ten would prefer an ordinary domestic article, three for a quarter, to fifty-cent Partaga, if kept in ignorance of the cost of the latter.The flavor of the Partaga is too delicate for palates that have been accustomed to Connecticut seed leaf.So it is with humor.The finer it is in quality, the more danger of its not being recognized at all.Even Mark Twain has been taken in by an English review of his INNOCENTS ABROAD.Mark Twain is by no means a coarse humorist, but the Englishman’s humor is so much finer than his, that he mistakes it for solid earnest, and “lafts most consumedly.”"
"不学习的人只会困住自己。以后，当我写出一篇自己觉得不错的文章时，我有理由担心它的某些部分看起来并不像是美国人写的，我将断言它的作者是英国人，并且它抄袭于一家伦敦的期刊。我会在后排占个座位，享受那热烈的掌声。","A man who cannot learn stands in his own light.Hereafter, when I write an article which I know to be good, but which I may have reason to fear will not, in some quarters, be considered to amount to much, coming from an American, I will aver that an Englishman wrote it and that it is copied from a London journal.And then I will occupy a back seat and enjoy the cordial applause."
"（再后来）","(Still later)"
"马克·吐温最终知道了《星期六评论》上对《傻瓜国外旅行记》的批评不是认真的。他非常懊悔自己曾经有过被恶意出卖的想法。他只得用最后的办法，在上期《银河》上声明是他自己写的那篇评论，然后发表在《银河》上卖给大众。这很有创意，但不幸的是这不是真的。如果有读者不嫌麻烦来办公室询问，我们会给他们看刊登在十月八号《星期六评论》上的原文。比较之下，他们会发现此评论跟《银河》上的那篇一模一样。对于马克来说，最好的做法就是承认他被出卖，并且不再提及此事。","Mark Twain at last sees that the SATURDAY REVIEW’S criticism of his INNOCENTS ABROAD was not serious, and he is intensely mortified at the thought of having been so badly sold.He takes the only course left him, and in the last GALAXY claims that HE wrote the criticism himself, and published it in THE GALAXY to sell the public.This is ingenious, but unfortunately it is not true.If any of our readers will take the trouble to call at this office we sill show them the original article in the SATURDAY REVIEW of October 8th, which, on comparison, will be found to be identical with the one published in THE GALAXY.The best thing for Mark to do will be to admit that he was sold, and say no more about it."
"以上摘自《辛辛那提问询报》，且都不是真的。来看看证据。如果《辛辛那提问询报》的人，能通过任一中介在《银河》办公室里弄到十月八号伦敦《星期六评论》上的那篇书评，比较后与《银河》上的评论一模一样的话，我愿付给那家中介五百美元。此外，在任意指定时间，要是我在同一个地方无法写出十月八号伦敦《星期六评论》中的文章，包括《傻瓜国外旅行记》的长篇书论，并且任一段任一行与我在《银河》上发表的文章完全不同的话，我愿再付给《辛辛那提问询报》五百美元。位于纽约百老汇大街500号的谢尔登出版公司是我的“支持者”。有《辛辛那提问询报》授权的纽约的任何一个人都会立即收到此消息。对于《辛辛那提问询报》的人来说，证明他们在上述言论中没有可耻地故意说谎，就可以轻松挣到钱。他们会尴尬地承认这些谎话，还是会派个代理人去《银河》办公室呢？我想《辛辛那提问询报》的编辑们一定是群小孩子。","The above is from the Cincinnati ENQUIRER, and is a falsehood.Come to the proof.If the ENQUIRER people, through any agent, will produce at THE GALAXY office a London SATURDAY REVIEW of October 8th, containing an “article which, on comparison, will be found to be identical with the one published in THE GALAXY, I will pay to that agent five hundred dollars cash.Moreover, if at any specified time I fail to produce at the same place a copy of the London SATURDAY REVIEW of October 8th, containing a lengthy criticism upon the INNOCENTS ABROAD, entirely different, in every paragraph and sentence, from the one I published in THE GALAXY, I will pay to the ENQUIRER agent another five hundred dollars cash.I offer Sheldon & Co., publishers, 500 Broadway, New York, as my “backers.”Any one in New York, authorized by the ENQUIRER, will receive prompt attention.It is an easy and profitable way for the ENQUIRER people to prove that they have not uttered a pitiful, deliberate falsehood in the above paragraphs.Will they swallow that falsehood ignominiously, or will they send an agent to THE GALAXY office.I think the Cincinnati ENQUIRER must be edited by children."
