"zh","en"
"“告诉你们我准备怎么做吧。夫人，你说的话有些道理。这狗工作得太辛苦了，或许它找到了一个安逸的窝，它也有权去选择。反正，我们把这事交给它去决定吧。它打算怎样，都依它。你们俩就好好坐在这儿。我跟你们道别，然后很平常地走开。它要是想留下，就让它留下。它要是想跟我走，就让它跟来。我不会叫它跟来，你们也不要唤它回去。”","“I’ll tell you what I’ll do.Your remarks, ma’am, has some weight in them.The dog’s worked hard, and maybe he’s earned a soft berth an’ has got a right to choose.Anyway, we’ll leave it up to him.Whatever he says, goes.You people stay right here settin’ down.I’ll say good-by and walk off casual-like.If he wants to stay, he can stay.If he wants to come with me, let ’m come.I won’t call ’m to come an’ don’t you call ’m to come back.”"
"他突然疑心重重地看着马奇，又补充说：“你们要保证公平，不能等我转过身去就撺掇它。”","He looked with sudden suspicion at Madge, and added, “Only you must play fair.No persuadin’ after my back is turned.”"
"“我们会公平的。”马奇说，但是斯基夫·米勒打断了她的保证。","“We’ll play fair,” Madge began, but Skiff Miller broke in on her assurances."
"“我知道女人的行事手段，”他说，“她们的心很软。她们一受触动就愿意作弊，做手脚，出老千，谎话连篇——不好意思，夫人，我只是说一般的女人。”","“I know the ways of women,” he announced.“Their hearts is soft.When their hearts is touched they’re likely to stack the cards, look at the bottom of the deck, an’ lie like the devil—beggin’ your pardon, ma’am.I’m only discoursin’ about women in general.”"
"“我简直不知道怎么感谢你。”马奇的声音都颤抖了。","“I don’t know how to thank you,” Madge quavered."
"“我不知道你有什么要感谢我的，”他答道，“布朗还没有决定呢。我慢慢地走，你们不会介意吧？这样更公平一些，因为我走过一百码就拐过去了。”马奇同意了，又补充说：“我真诚地向你保证，我们不会做任何事来影响它。”","“I don’t see as you’ve got any call to thank me,” he replied.“Brown ain’t decided yet.Now you won’t mind if I go away slow?It’s no more’n fair, seein’ I’ll be out of sight inside a hundred yards.”—Madge agreed, and added, “And I promise you faithfully that we won’t do anything to influence him.”"
"“好吧，那我真要走了。”斯基夫·米勒用平常道别的口吻说道。","“Well, then, I might as well be gettin’ along,” Skiff Miller said in the ordinary tones of one departing."
"听到他声音的变化，沃尔夫马上抬起了头，米勒和马奇握手的时候，它更迅速地站了起来。它蹦了起来，将前爪搭在马奇的腰上，同时又去舔斯基夫·米勒的手。米勒和沃尔特握手的时候，沃尔夫又做了一遍，它把身子搭在沃尔特身上，舔着两人的手。","At this change in his voice, Wolf lifted his head quickly, and still more quickly got to his feet when the man and woman shook hands.He sprang up on his hind legs, resting his fore paws on her hip and at the same time licking Skiff Miller’s hand.When the latter shook hands with Walt, Wolf repeated his act, resting his weight on Walt and licking both men’s hands."
"“我敢说，它不知道要奔哪边去。”克朗代克来客说完这句话，就转过身去，缓缓向上走去。","“It ain’t no picnic, I can tell you that,” were the Klondiker’s last words, as he turned and went slowly up the trail."
"他走出了二十英尺，沃尔夫一直注视着，眼里充满渴望和期盼，好像是在等着这个男人折返回来。接着，沃尔夫发出一声短促的呜呜声，朝他跑了过去；追上他之后，它用嘴轻轻衔住他的手，温柔地拽他，想让他停下来。","For the distance of twenty feet Wolf watched him go, himself all eagerness and expectancy, as though waiting for the man to turn and retrace his steps.Then, with a quick low whine, Wolf sprang after him, overtook him, caught his hand between his teeth with reluctant tenderness, and strove gently to make him pause."
"米勒没有停下来，于是沃尔夫又跑回沃尔特·欧文坐着的地方，咬着他的衣袖，想拉他起来去追赶那个渐行渐远的人，但是又失败了。","Failing in this, Wolf raced back to where Walt Irvine sat, catching his coat-sleeve in his teeth and trying vainly to drag him after the retreating man."
"沃尔夫显得越来越焦躁。它恨不得能到处分身。它想要同时出现在两个地方，跟旧主人和新主人都厮守在一起，而他们的距离已经越拉越远了。它激动而不安地蹦来蹦去，扭来扭去，一会儿跑向这边，一会儿跑向那边；它心乱如麻，无所适从，想要两全齐美，却又无法兼顾，只能发出急促尖利的呜呜声，折腾得气喘吁吁。","Wolf’s perturbation began to wax.He desired ubiquity.He wanted to be in two places at the same time, with the old master and the new, and steadily the distance between them was increasing.He sprang about excitedly, making short nervous leaps and twists, now toward one, now toward the other, in painful indecision, not knowing his own mind, desiring both and unable to choose, uttering quick sharp whines and beginning to pant."
"它突然坐了下来，把鼻子对着天空，一张嘴猛烈地一开一合，越张越大。猛烈的开合还伴随着颈部一阵阵的痉挛，一次比一次剧烈，一次比一次严重。伴随着这些开合和痉挛，它的喉头也开始随着肺部呼出的气流而颤动起来，起初没有声音，接着就发出了调子极低的声响，可能是人类所能听到的最低沉的声音了。这好像是在神经和肌肉上为大声嚎叫做好了准备。","He sat down abruptly on his haunches, thrusting his nose upward, the mouth opening and closing with jerking movements, each time opening wider.These jerking movements were in unison with the recurrent spasms that attacked the throat, each spasm severer and more intense than the preceding one.And in accord with jerks and spasms the larynx began to vibrate, at first silently, accompanied by the rush of air expelled from the lungs, then sounding a low, deep note, the lowest in the register of the human ear.All this was the nervous and muscular preliminary to howling."
"它正要扯开嗓子大声嚎叫的时候，大开的嘴又闭上了，躁动停止了；它长久地笃定地看着那个渐行渐远的人。突然，它又掉过头来，同样笃定地看着沃尔特。这次哀求还是没有得到回应。它没有得到只言片语，哪怕是一个手势的指示，这让它完全不知道应该怎么办。","But just as the howl was on the verge of bursting from the full throat, the wide-opened mouth was closed, the paroxysms ceased, and he looked long and steadily at the retreating man.Suddenly Wolf turned his head, and over his shoulder just as steadily regarded Walt.The appeal was unanswered.Not a word nor a sign did the dog receive, no suggestion and no clew as to what his conduct should be."
"它往前一看，旧主人就要走到路的拐角处了，这让它又激动起来。它低啸一声跳了起来，突然又想到了什么主意，又转向了马奇。它一直忽视了马奇，但是现在，新旧两个男主人都不理睬它，只剩下她了。它走到她面前，把头偎依在她的膝盖上，鼻子轻轻地拱她的手臂——这是它讨好她惯用的一招。它退后一点，开始顽皮地打滚、扭动，蹦来蹦去，半倒立着，用前爪拍击着地面；它眼神魅惑、双耳贴服、尾巴摇动，用尽了浑身解数，只是想表达它没法说出的心里的想法。","A glance ahead to where the old master was nearing the curve of the trail excited him again.He sprang to his feet with a whine, and then, struck by a new idea, turned his attention to Madge.Hitherto he had ignored her, but now, both masters failing him, she alone was left.He went over to her and snuggled his head in her lap, nudging her arm with his nose—an old trick of his when begging for favors.He backed away from her and began writhing and twisting playfully, curvetting and prancing, half rearing and striking his fore paws to the earth, struggling with all his body, from the wheedling eyes and flattening ears to the wagging tail, to express the thought that was in him and that was denied him utterance."
"很快，它也放弃了这种招数。这些从没对它如此冷淡的人现在如此冷漠，让它非常沮丧。它得不到任何回应，得不到任何帮助。他们根本没有考虑它，他们就像死人一样。","This, too, he soon abandoned.He was depressed by the coldness of these humans who had never been cold before.No response could he draw from them, no help could he get.They did not consider him.They were as dead."
"它转过头去，默默地盯着旧主人的身影。斯基夫·米勒已经快走到拐角的地方了。下一刻就会看不到他了。不过他从未回头，只是一直向前走，缓慢而沉着，好像身后正在发生的事跟他没有一点关系似的。","He turned and silently gazed after the old master.Skiff Miller was rounding the curve.In a moment he would be gone from view.Yet he never turned his head, plodding straight onward, slowly and methodically, as though possessed of no interest in what was occurring behind his back."
"就这样，他走出了他们的视线。沃尔夫还在等着他再次出现。它一动不动地，静静地等了好长时间，好像变成了石头——一块满怀渴望和期盼的石头。它轻吠一声，还是等着。接下来，它慢慢地折回了沃尔特·欧文的身边。它嗅了嗅他的手，重重地趴下来，抬眼望着小路上空荡荡的拐角。","And in this fashion he went out of view.Wolf waited for him to reappear.He waited a long minute, silently, quietly, without movement, as though turned to stone—withal stone quick with eagerness and desire.He barked once, and waited.Then he turned and trotted back to Walt Irvine.He sniffed his hand and dropped down heavily at his feet, watching the trail where it curved emptily from view."
"小小的溪流淌过布满青苔的岩石，潺潺的水声似乎突然变大了。除了云雀的欢唱，再无别的声响了。大黄蝶静静地在阳光下飞舞，渐渐隐入了沉寂的阴影。马奇凝视着丈夫，眼中充满胜利的快意。","The tiny stream slipping down the mossy-lipped stone seemed suddenly to increase the volume of its gurgling noise.Save for the meadow-larks, there was no other sound.The great yellow butterflies drifted silently through the sunshine and lost themselves in the drowsy shadows.Madge gazed triumphantly at her husband."
"过了几分钟，沃尔夫站起来了。它的动作显得坚定而从容。它没有朝欧文和马奇看一眼。它的眼睛紧盯着那条小路。它已经做好了决定。两人也看出了这一点。就现在的情形来看，他们明白，最终的考验到了。","A few minutes later Wolf got upon his feet.Decision and deliberation marked his movements.He did not glance at the man and woman.His eyes were fixed up the trail.He had made up his mind.They knew it.And they knew, so far as they were concerned, that the ordeal had just begun."
"它开始小跑起来，而马奇也撅起了嘴，做出一个可以发出亲切呼唤的口型——她多想呼唤出来呀。但是她没有唤出来。她不由自主地看了一眼丈夫，而他正严厉地看着她。撅起的嘴唇松懈了，她非常轻微地叹了口气。","He broke into a trot, and Madge’s lips pursed, forming an avenue for the caressing sound that it was the will of her to send forth.But the caressing sound was not made.She was impelled to look at her husband, and she saw the sternness with which he watched her.The pursed lips relaxed, and she sighed inaudibly."
"沃尔夫的小跑变成了奔跑。它的步子越来越大。它一次都没有回过头，狼一样的尾巴竖直地立在身后。它飞快地闪过小路的拐角，再也看不见了。","Wolf’s trot broke into a run.Wider and wider were the leaps he made.Not once did he turn his head, his wolf’s brush standing out straight behind him.He cut sharply across the curve of the trail and was gone."
