"zh","en"
"“应该是没有吧，”男人回答道，“我也不是来找寒冷天气的。我来找我妹妹。说不定你知道她住哪儿。她叫约翰逊，威廉·约翰逊太太。”","“Should say not,” the man answered.“An’ I ain’t here a-lookin’ for it neither.I’m tryin’ to find my sister.Mebbe you know where she lives.Her name’s Johnson, Mrs. William Johnson.”"
"“你不会就是她在克朗代克的哥哥吧！”马奇叫了起来，眼里闪动着好奇，“我们听说过你好多事情呢。”","“You’re not her Klondike brother!”Madge cried, her eyes bright with interest, “about whom we’ve heard so much?”"
"“是，就是我。”他谦逊地答道。“我叫米勒，斯基夫·米勒。我觉得能给她一个惊喜。”","“Yes’m, that’s me,” he answered modestly.“My name’s Miller, Skiff Miller.I just thought I’d s’prise her.”"
"“这条路没错。只要沿着路走就行。”马奇站起来，指着四分之一英里外的山谷，为他指路道，“你看见那片枯萎的红杉树林没？走那条往右拐的小路。那条是去她家的近路。你一定找得到。”","“You are on the right track then.Only you’ve come by the foot-path.”Madge stood up to direct him, pointing up the canyon a quarter of a mile.“You see that blasted redwood?Take the little trail turning off to the right.It’s the short cut to her house.You can’t miss it.”"
"“好的，谢谢你，夫人。”他说。他似乎是想走，但是双脚笨拙地钉在了原地。他盯着她看，脸上露出毫不掩饰的爱慕之情，而他完全没有注意到自己的行为；他在挣扎，但尴尬还在升级，那份爱慕已经将他吞没了。","“Yes’m, thank you, ma’am,” he said.He made tentative efforts to go, but seemed awkwardly rooted to the spot.He was gazing at her with an open admiration of which he was quite unconscious, and which was drowning, along with him, in the rising sea of embarrassment in which he floundered."
"“我们还想听你聊聊克朗代克呢，”马奇说，“你在你妹妹家的时候，我们可以去拜访么？或者，你过来跟我们共进晚餐？那就更好了。”","“We’d like to hear you tell about the Klondike,” Madge said.“Mayn’t we come over some day while you are at your sister’s?Or, better yet, won’t you come over and have dinner with us?”"
"“好的，谢谢你，夫人。”他机械地嘟哝着。接着，他回过神来，又补充道：“我不会呆很久的。我还得再回北方去。就今晚的火车。我跟政府有邮递合同。”","“Yes’m, thank you, ma’am,” he mumbled mechanically.Then he caught himself up and added: “I ain’t stoppin’ long.I got to be pullin’ north again.I go out on to-night’s train.You see, I’ve got a mail contract with the government.”"
"马奇说实在是太遗憾了，而他又准备走，不过还是没迈动步子。他的目光无法离开马奇的脸。他沉浸在爱慕之中，忘记了尴尬；马奇也脸红了，觉得很不舒服。","When Madge had said that it was too bad, he made another futile effort to go.But he could not take his eyes from her face.He forgot his embarrassment in his admiration, and it was her turn to flush and feel uncomfortable."
"正在这个时候，沃尔特觉得应该说点什么来缓和一下局面，刚才还在灌木丛里钻来钻去的沃尔夫像狼一样小跑了过来。","It was at this juncture, when Walt had just decided it was time for him to be saying something to relieve the strain, that Wolf, who had been away nosing through the brush, trotted wolf-like into view."
"斯基夫·米勒对马奇的痴迷一下子就消失了。眼前的这个漂亮女人一下子移出了他的视野。他的目光全盯到狗身上去了，脸上露出极为惊讶的表情。","Skiff Miller’s abstraction disappeared.The pretty woman before him passed out of his field of vision.He had eyes only for the dog, and a great wonder came into his face."
"“啊，我真是该死啊！”他缓慢而严肃地清楚说出了这句话。","“Well, I’ll be damned!” he enunciated slowly and solemnly."
"他一下子跌坐在那根木材上，倒让马奇站着。听到他的声音，沃尔夫的耳朵垂了下来，高兴地张开嘴，像在笑一样。它慢慢跑到这个陌生人面前，闻闻他的手，接着又用舌头舔了舔。","He sat down ponderingly on the log, leaving Madge standing.At the sound of his voice, Wolf’s ears had flattened down, then his mouth had opened in a laugh.He trotted slowly up to the stranger and first smelled his hands, then licked them with his tongue."
"斯基夫·米勒拍拍狗的头，缓慢而严肃地重复道：“啊，我真是该死啊！”","Skiff Miller patted the dog’s head, and slowly and solemnly repeated, “Well, I’ll be damned!”"
"“夫人，请原谅，”随后，他接着说，“我只是有点吃惊，没别的意思。”","“Excuse me, ma’am,” he said the next moment “I was just s’prised some, that was all.”"
"“我们也很吃惊，”她轻声答道，“我们从没见过沃尔夫亲近一个陌生人。”","“We’re surprised, too,” she answered lightly.“We never saw Wolf make up to a stranger before.”"
"“你们管它叫——沃尔夫？”米勒问道。","“Is that what you call him—Wolf?” the man asked."
"马奇点点头。“但我不明白为什么它对你那么友好——除了因为你来自克朗代克。你也知道，这是一条克朗代克的狗。”","Madge nodded.“But I can’t understand his friendliness toward you—unless it’s because you’re from the Klondike.He’s a Klondike dog, you know.”"
"“是啊。”米勒心不在焉地说。他抬起沃尔夫的前腿，查看了一下脚垫，用拇指按了按，压了压。“有点软了，”他说，“它有好长时间没有走路了。”","“Yes’m,” Miller said absently.He lifted one of Wolf’s fore legs and examined the foot-pads, pressing them and denting them with his thumb.“Kind of SOFT,” he remarked.“He ain’t been on trail for a long time.”"
"“我说，”沃尔特插话说，“它肯听你摆布，真是神了。”","“I say,” Walt broke in, “it is remarkable the way he lets you handle him.”"
"斯基夫·米勒站了起来，不再是被马奇迷得神魂颠倒的样子，而是严厉而利落地问道：“你们拥有这条狗多久了？”","Skiff Miller arose, no longer awkward with admiration of Madge, and in a sharp, businesslike manner asked, “How long have you had him?”"
"而沃尔夫则在这个新来的人的腿上亲昵地蹭来蹭去，还张开嘴，吠叫了一声。这可真是石破天惊的一声，这一声短暂而欢快，但确实是狗的吠叫。","But just then the dog, squirming and rubbing against the newcomer’s legs, opened his mouth and barked.It was an explosive bark, brief and joyous, but a bark."
"“我都觉得挺新鲜。”斯基夫·米勒说。","“That’s a new one on me,” Skiff Miller remarked."
"沃尔特和马奇面面相觑。奇迹发生了。沃尔夫吠了一声。","Walt and Madge stared at each other.The miracle had happened.Wolf had barked."
"“这是它第一次吠叫。”马奇说。","“It’s the first time he ever barked,” Madge said."
"“这也我第一次听见它吠叫。”米勒主动说。","“First time I ever heard him, too,” Miller volunteered."
"马奇对他笑了笑，觉得这个人真是幽默。","Madge smiled at him.The man was evidently a humorist."
"“当然啊，”她说，“五分钟前你才见到它。”","“Of course,” she said, “since you have only seen him for five minutes.”"
"斯基夫·米勒严厉地看着她，怀疑她话中有诈。","Skiff Miller looked at her sharply, seeking in her face the guile her words had led him to suspect."
"“我以为你明白了，”他缓缓地说，“我以为你从它亲近我的举动已经恍然大悟了。它是我的狗。它不叫沃尔夫。它叫布朗。”","“I thought you understood,” he said slowly.“I thought you’d tumbled to it from his makin’ up to me.He’s my dog.His name ain’t Wolf.It’s Brown.”"
"“噢，沃尔特！”马奇本能地喊了一声丈夫。","“Oh, Walt!” was Madge’s instinctive cry to her husband."
"沃尔特马上警觉起来。","Walt was on the defensive at once."
"“你怎么知道它是你的狗？”沃尔特追问道。","“How do you know he’s your dog?” he demanded."
"“因为它就是。”回答就是这样。","“Because he is,” was the reply."
"“强词夺理。”沃尔特不乐意了。","“Mere assertion,” Walt said sharply."
"斯基夫缓慢而深沉地看着沃尔特，朝马奇点点头，接着问道：","In his slow and pondering way, Skiff Miller looked at him, then asked, with a nod of his head toward Madge:"
"“你怎么知道她就是你的妻子呢？你会说：‘因为她就是’，那我也可以说你是强词夺理。这狗就是我的。我喂它，养它，我想我应该知道这一点。看着，我证明给你看。”","“How d’you know she’s your wife?You just say, ‘Because she is,’ and I’ll say it’s mere assertion.The dog’s mine.I bred ’m an’ raised ’m, an’ I guess I ought to know.Look here.I’ll prove it to you.”"
"斯基夫·米勒转向那条狗。“布朗！”他的声音很短促，狗一听到这声音，耳朵马上垂下来，像受到了爱抚一样。“右转！”狗马上转向了右边。“直走！”狗立即停止转动，往前走去，一听到命令又顺从地停了下来。","Skiff Miller turned to the dog.“Brown!”His voice rang out sharply, and at the sound the dog’s ears flattened down as to a caress.“Gee!”The dog made a swinging turn to the right.“Now mush-on!”And the dog ceased his swing abruptly and started straight ahead, halting obediently at command."
"“我光吹口哨也行，”斯基夫·米勒骄傲地说，“它是我的头狗。”","“I can do it with whistles”, Skiff Miller said proudly.“He was my lead dog.”"
"“你不会要把它带走吧？”马奇问话的声音有些颤抖。","“But you are not going to take him away with you?”Madge asked tremulously."
"米勒点点头。","The man nodded."
"“回到可怕的克朗代克去受罪？”","“Back into that awful Klondike world of suffering?”"
"他点点头，又说：“那儿也不是那么糟糕。瞧瞧我。我很健康，是不是？”","He nodded and added: “Oh, it ain’t so bad as all that.Look at me.Pretty healthy specimen, ain’t I?”"
"“但是狗怎么办？严酷可怕的环境，令人心碎的艰辛、饥饿、风霜！噢，我看过有关的书，我知道怎么回事。”","“But the dogs!The terrible hardship, the heart-breaking toil, the starvation, the frost!Oh, I’ve read about it and I know.”"
"“有一次在小鱼河上，我差点吃了它，”米勒忧郁地主动说起来，“我要是没有抓住了那头驼鹿，它就死定了。”","“I nearly ate him once, over on Little Fish River,” Miller volunteered grimly.“If I hadn’t got a moose that day was all that saved ’m.”"
"“我宁愿死也不会那样做的！”马奇大喊起来。","“I’d have died first!”Madge cried."
"“在这儿，情况当然不一样了，”米勒解释道，“你不用吃狗。但在那儿，你的想法会完全不一样的。你没去过那儿，所以你什么都不知道。”","“Things is different down here”, Miller explained.“You don’t have to eat dogs.You think different just about the time you’re all in.You’ve never ben all in, so you don’t know anything about it.”"
"“这就对了，”马奇激动地争辩起来，“在加利福尼亚，狗不会被吃掉。为什么不让它留在这儿呢？它很快乐。它不缺东西吃——你知道的。它将不再挨冻，不再受苦。这儿的一切都温柔、亲切。人和自然都没有那么野蛮。它将不再知道皮鞭为何物。说到天气，这儿从来不下雪。”","“That’s the very point,” she argued warmly.“Dogs are not eaten in California.Why not leave him here?He is happy.He’ll never want for food—you know that.He’ll never suffer from cold and hardship.Here all is softness and gentleness.Neither the human nor nature is savage.He will never know a whip-lash again.And as for the weather—why, it never snows here.”"
"“不好意思，这儿的夏天热得像火烧。”斯基夫·米勒大笑起来。","“But it’s all-fired hot in summer, beggin’ your pardon,” Skiff Miller laughed."
"“但是你还没有回答呢，”马奇还是非常激动，“你在北方能给它什么呢？”","“But you do not answer,” Madge continued passionately.“What have you to offer him in that northland life?”"
"“粮食，只要我有，大多数时间是这样。”米勒回答道。","“Grub, when I’ve got it, and that’s most of the time,” came the answer."
"“剩下的时间呢？”","“And the rest of the time?”"
"“没有东西吃。”","“No grub.”"
"“工作呢？”","“And the work?”"
"“啊，好多活儿要干，”米勒不耐烦地脱口而出，“无休止的工作、饥饿、严寒，还有其他各种痛苦——这就是它跟着我所能得到的。但是它喜欢。它习惯了。它明白那种生活。它就是为那种生活而生的，也为此而长大。你对此一无所知。你不知道你在说什么。这狗就属于那个地方，在那儿它无比开心。”","“Yes, plenty of work,” Miller blurted out impatiently.“Work without end, an’ famine, an’ frost, an all the rest of the miseries—that’s what he’ll get when he comes with me.But he likes it.He is used to it.He knows that life.He was born to it an’ brought up to it.An’ you don’t know anything about it.You don’t know what you’re talking about.That’s where the dog belongs, and that’s where he’ll be happiest.”"
"“狗不会走的，”沃尔特坚决地说，“我们也没有必要接着谈下去了。”","“The dog doesn’t go,” Walt announced in a determined voice.“So there is no need of further discussion.”"
"“你说什么？”斯基夫·米勒追问了一句；他的眉毛低垂下来，倔强的性格使得他气血上涌，额头上都变红了。","“What’s that?”Skiff Miller demanded, his brows lowering and an obstinate flush of blood reddening his forehead."
"“我说狗不会走的，这事儿就结了。我不相信它是你的狗。你可能什么时候见过它。你甚至可能帮它的主人驱赶过它。它是服从阿拉斯加的驱赶口令，但这不能表明它就是你的狗。任何阿拉斯加狗都有可能像它那样服从你。而且，它无疑是一条很值钱的狗，狗在阿拉斯加都很值钱；这就足以解释你为什么竭力想占有它。不管怎么说，你得证明你有对它的所有权。”","“I said the dog doesn’t go, and that settles it.I don’t believe he’s your dog.You may have seen him sometime.You may even sometime have driven him for his owner.But his obeying the ordinary driving commands of the Alaskan trail is no demonstration that he is yours.Any dog in Alaska would obey you as he obeyed.Besides, he is undoubtedly a valuable dog, as dogs go in Alaska, and that is sufficient explanation of your desire to get possession of him.Anyway, you’ve got to prove property.”"
"斯基夫·米勒非常镇静，只是额头上倔强的血色又加深了一些，健硕的肌肉在黑色外套下膨胀；他将这位诗人上上下下打量了一番，好像是在估量他单薄的身躯能有多少力量。","Skiff Miller, cool and collected, the obstinate flush a trifle deeper on his forehead, his huge muscles bulging under the black cloth of his coat, carefully looked the poet up and down as though measuring the strength of his slenderness."
"这位克朗代克的来客现出一副不屑一顾的神情，最后说：“我看眼下这儿没有什么能阻止我带走这条狗。”","The Klondiker’s face took on a contemptuous expression as he said finally, “I reckon there’s nothin’ in sight to prevent me takin’ the dog right here an’ now.”"
"沃尔特的脸涨红了，臂上和肩上的肌肉似乎紧绷起来。他的妻子赶紧担心地介入进来。","Walt’s face reddened, and the striking-muscles of his arms and shoulders seemed to stiffen and grow tense.His wife fluttered apprehensively into the breach."
"“或许米勒先生是对的，”她说，“恐怕他就是对的。沃尔夫好像确实认识他，而且它确实对‘布朗’这个名字有反应。它马上跟他成了朋友，这可是从来没有过的事。而且，听听它那声吠叫。它是很开心才叫的，为什么开心？当然是因为找到了米勒先生。”","“Maybe Mr. Miller is right”, she said.“I am afraid that he is.Wolf does seem to know him, and certainly he answers to the name of ‘Brown.’ He made friends with him instantly, and you know that’s something he never did with anybody before.Besides, look at the way he barked.He was just bursting with joy Joy over what?Without doubt at finding Mr. Miller.”"
"沃尔特的肌肉松弛下来，他的肩头也有气无力地垂下来。","Walt’s striking-muscles relaxed, and his shoulders seemed to droop with hopelessness."
"“马奇，我想你说的对，”他说，“阿狼并不叫沃尔夫，而是叫布朗，它一定是属于米勒先生的。”","“I guess you’re right, Madge,” he said.“Wolf isn’t Wolf, but Brown, and he must belong to Mr. Miller.”"
"“或许米勒先生会卖了它，”她提示说，“而我们可以买过来。”","“Perhaps Mr. Miller will sell him,” she suggested.“We can buy him.”"
"斯基夫·米勒摇了摇头，他也不再显得挑衅，既然对方这么宽宏大量，他也就表现得宽宏大量。","Skiff Miller shook his head, no longer belligerent, but kindly, quick to be generous in response to generousness."
"“我有过五条狗，”他说，寻思着找个办法让他的拒绝不那么让人伤心，“它是头狗。它们是阿拉斯加最好的狗队。没什么能撵得上它们。１８９８年有人出五千美元，我都没有卖掉它们。那个时候，狗确实很值钱，但也不是所有的狗队都能卖到那么诱人的价钱。就我那队可以。布朗是那队里最出色的。那年冬天，有人出一千两百美元买它，我拒绝了。我当时没有卖，现在也不会卖。而且，这条狗对我来说意味着太多了。三年来我都在找它。发现它被偷走的时候，我难受极了——倒不是心疼它值多少钱，而是因为，不好意思，我实在太喜欢它了。就是这样。刚才看到它，我简直不相信自己的眼睛。我以为我在做梦呢。简直太好了，居然是真的。为什么呢，因为是我把它一手养大的。每天晚上，我把它抱到床上，搂着它睡。它的妈妈死了，我就用两美元一罐的炼乳喂它，而我自己在咖啡里都舍不得放一点。它只知道我就是它的妈妈。它经常吮我的指头，这个小东西——喏，就是这个指头！”","“I had five dogs,” he said, casting about for the easiest way to temper his refusal.“He was the leader.They was the crack team of Alaska.Nothin’ could touch ’em.In 1898 I refused five thousand dollars for the bunch.Dogs was high, then, anyway; but that wasn’t what made the fancy price.It was the team itself.Brown was the best in the team.That winter I refused twelve hundred for ’m.I didn’t sell ’m then, an’ I ain’t a-sellin’ ’m now.Besides, I think a mighty lot of that dog.I’ve ben lookin’ for ’m for three years.It made me fair sick when I found he’d ben stole—not the value of him, but the—well, I liked ’m like hell, that’s all, beggin’ your pardon.I couldn’t believe my eyes when I seen ’m just now.I thought I was dreamin’.It was too good to be true.Why, I was his wet-nurse.I put ’m to bed, snug every night.His mother died, and I brought ’m up on condensed milk at two dollars a can when I couldn’t afford it in my own coffee.He never knew any mother but me.He used to suck my finger regular, the darn little cuss—that finger right there!”"
"斯基夫·米勒有点激动得讲不出话来了，他伸出手指让他们看。","And Skiff Miller, too overwrought for speech, held up a fore finger for them to see."
"“就是这个指头。”他有点费劲地一字一句地说，好像这个手指就是他拥有所有权的证据，就是他和狗之间感情的纽带。","“That very finger,” he managed to articulate, as though it somehow clinched the proof of ownership and the bond of affection."
"马奇开始说话了，而米勒还兀自盯着自己的手指。","He was still gazing at his extended finger when Madge began to speak."
"“但是狗，”她说，“你从来没有为狗考虑过。”","“But the dog,” she said.“You haven’t considered the dog.”"
"斯基夫·米勒看上去有些不解。","Skiff Miller looked puzzled."
"“你为它想过吗？”她问道。","“Have you thought about him?” she asked."
"“不知道你要说什么。”米勒回答道。","“Don’t know what you’re drivin’ at,” was the response."
"“或许在这件事情上狗也有选择权的，”马奇接着说，“或许它有它的喜好和愿望。你没有考虑过它。你没有让它选。你从来不曾设想过，有可能它更喜欢加利福尼亚，胜过阿拉斯加。你只想过你喜欢什么。你对待它，就跟对待一袋土豆或是一捆干草一样。”","“Maybe the dog has some choice in the matter,” Madge went on.“Maybe he has his likes and desires.You have not considered him.You give him no choice.It has never entered your mind that possibly he might prefer California to Alaska.You consider only what you like.You do with him as you would with a sack of potatoes or a bale of hay.”"
"这是一个新的视角，米勒看上去很受触动，他自己在脑中思考着这个问题。他犹豫不决的时候，马奇乘胜追击。","This was a new way of looking at it, and Miller was visibly impressed as he debated it in his mind.Madge took advantage of his indecision."
"“如果你真的喜欢它，它的幸福也就是你的幸福。”她趁机说。","“If you really love him, what would be happiness to him would be your happiness also,” she urged."
"斯基夫·米勒还在做着心理斗争，马奇则喜不自禁地瞥了一眼丈夫，丈夫在她背后投去赞许的目光。","Skiff Miller continued to debate with himself, and Madge stole a glance of exultation to her husband, who looked back warm approval."
"“你怎么想？”克朗代克来客突然问道。","“What do you think?” the Klondiker suddenly demanded."
"这下轮到她迷惑不解了。“你说什么意思？”她问道。","It was her turn to be puzzled.“What do you mean?” she asked."
"“你觉得它会呆在加利福尼亚？”","“D’ye think he’d sooner stay in California?”"
"她很肯定地点点头。“我很肯定。”","She nodded her head with positiveness.“I am sure of it.”"
"斯基夫·米勒又开始心理斗争了，不过这次他说出来了，同时公正地盯着这只他们争论不已的狗。","Skiff Miller again debated with himself, though this time aloud, at the same time running his gaze in a judicial way over the mooted animal."
"“它干活儿很棒。它为我干了好多好多活儿。它从不吃白食，而且是个训练狗队的能手。它有头脑。除了说话，它什么都能干。它知道你在说什么。看看吧，它知道我们在谈论它。”","“He was a good worker.He’s done a heap of work for me.He never loafed on me, an’ he was a joe-dandy at hammerin’ a raw team into shape.He’s got a head on him.He can do everything but talk.He knows what you say to him.Look at ’m now.He knows we’re talkin’ about him.”"
"狗正趴在斯基夫·米勒的脚边，头贴在脚爪上，两只耳朵竖得笔直，仔细听着，眼睛随着他们接连说话的声音飞快而热切地转动着。","The dog was lying at Skiff Miller’s feet, head close down on paws, ears erect and listening, and eyes that were quick and eager to follow the sound of speech as it fell from the lips of first one and then the other."
"“它还有好多活儿要干呢。以后的日子它还是会干得很好的。我真的喜欢它。我快要爱死它了。”","“An’ there’s a lot of work in ’m yet.He’s good for years to come.An’ I do like him.I like him like hell.”"
"之后，斯基夫·米勒又张了一两次嘴，却欲言又止。最后，他说：","Once or twice after that Skiff Miller opened his mouth and closed it again without speaking.Finally he said:"
