"zh","en"
"“有的时候在，有时不在——不过那是在新法律颁布以前的事了。”主管连忙补充道。“这部机器闲着吗？”巡官指着约翰尼旁边那台空机器问道，那上面没有装满的线轴正发疯似地旋转着。","“Off and on—but that was before the new law was passed,” the superintendent hastened to add.“Machine idle?” the inspector asked, pointing at the unoccupied machine beside Johnny’s, in which the part-filled bobbins were flying like mad."
"“好像是闲着的。”主管示意监工过来，然后指着机器，对着他的耳朵高声喊了几句。“这部机器是闲着的。”他向巡官报告说。","“Looks that way.”The superintendent motioned the overseer to him and shouted in his ear and pointed at the machine.“Machine’s idle,” he reported back to the inspector."
"他们走过去了，约翰尼回来继续干活。他松了一口气，总算是躲过了一劫。可是独腿的那个男孩却没有那么好的运气。目光敏锐的巡官把胳膊伸到那辆装箱子的手推车里，一把就把他拉了出来。他吓得嘴唇发抖，脸色大变，就像一个人遭遇了一场无可挽回的大祸一样。监工看起来大吃一惊，好像他第一次看到这个孩子似的。主管满脸的震惊和不快。","They passed on, and Johnny returned to his work, relieved in that the ill had been averted.But the one-legged boy was not so fortunate.The sharp-eyed inspector haled him out at arm’s length from the bin truck.His lips were quivering, and his face had all the expression of one upon whom was fallen profound and irremediable disaster.The overseer looked astounded, as though for the first time he had laid eyes on the boy, while the superintendent’s face expressed shock and displeasure."
"“我认识他，”巡官说道，“他十二岁。今年我已经从三家工厂里把他赶了出来。这是第四次了。”","“I know him,” the inspector said.“He’s twelve years old.I’ve had him discharged from three factories inside the year.This makes the fourth.”"
"他转向那个独腿的男孩。“你已经答应过我了，你发过誓要去上学的。”","He turned to the one-legged boy.“You promised me, word and honor, that you’d go to school.”"
"独腿的男孩突然放声哭了起来。“求求您了，巡官先生，我们家已经死了两个小孩了，我们家实在是太穷了。”","The one-legged boy burst into tears.“Please, Mr. Inspector, two babies died on us, and we’re awful poor.”"
"“你怎么咳嗽得这么厉害？”巡官询问着，好像在指责他犯了罪一样。","“What makes you cough that way?” the inspector demanded, as though charging him with crime."
"独腿的男孩像在否认自己的罪行似的回答道：“没有什么的。我只是上星期着凉了。巡官先生，没有什么。”","And as in denial of guilt, the one-legged boy replied: “It ain’t nothin’.I jes’ caught a cold last week, Mr. Inspector, that’s all.”"
"最后，独腿的男孩跟着巡官走了出去，焦虑的主管争辩着什么，也陪着走了。之后，车间里又恢复了单调的气氛。漫长的上午和更漫长的下午过去之后，下班的汽笛声响了起来。约翰尼走出工厂的大门时，夜幕已经降临了。在这一天里，太阳好像把天空当作了一架金梯，让世界都充满了它仁慈的暖意，然后在西边沉下去，消失在被屋顶划得参差不齐的天际线之后。","In the end the one-legged boy went out of the room with the inspector, the latter accompanied by the anxious and protesting superintendent.After that monotony settled down again.The long morning and the longer afternoon wore away and the whistle blew for quitting time.Darkness had already fallen when Johnny passed out through the factory gate.In the interval the sun had made a golden ladder of the sky, flooded the world with its gracious warmth, and dropped down and disappeared in the west behind a ragged sky-line of housetops."
"晚饭是一天中全家在一起吃的一顿饭——约翰尼在这时能遇到自己的弟弟和妹妹。对他来说，这种见面有点儿遭遇战的性质。因为他太老了，而他们却幼稚得令人苦恼。他受不了他们那种过分的、让人吃惊的幼稚。他不理解这个。他自己的童年已经距他太远了。他像一个易怒的老人，被他们幼稚的胡闹弄得心烦气躁，因为在他看来，这真是愚蠢至极。他怒目而视，静静地吃饭。后来想到他们不久也要去上班了，他才找到一些心理平衡。工作会抹掉他们的棱角，而且会使他们变得稳重、威严——正如他一样。约翰尼就是这样，照着一般人的方式，以自身为准绳，去衡量整个世界。","Supper was the family meal of the day—the one meal at which Johnny encountered his younger brothers and sisters.It partook of the nature of an encounter, to him, for he was very old, while they were distressingly young.He had no patience with their excessive and amazing juvenility.He did not understand it.His own childhood was too far behind him.He was like an old and irritable man, annoyed by the turbulence of their young spirits that was to him arrant silliness.He glowered silently over his food, finding compensation in the thought that they would soon have to go to work.That would take the edge off of them and make them sedate and dignified—like him.Thus it was, after the fashion of the human, that Johnny made of himself a yardstick with which to measure the universe."
"吃饭的时候，母亲用尽种种方法不厌其烦地重复解释说，她正在尽力使日子变得更好一些。约翰尼一直听到这顿寒酸的晚饭结束，他把椅子往后一推站了起来，觉得松了一口气。他在床和大门的选择中踌躇了片刻，最后还是走出了大门。他并没有走远。他坐在台阶上，蜷起双膝，瘦瘦的双肩向前垂着，胳膊肘撑在膝盖上，手掌托着下巴。坐在那里，他什么也没有想。他只是休息。就他的脑子而言，却睡着了。随后，他的弟弟妹妹们出来了，跟其他的孩子们一起在他周围吵闹着玩耍。角落里一盏电灯照着这些孩子们嬉戏。孩子们都知道他暴躁易怒，但这些爱冒险的孩子们依旧忍不住去招惹他。孩子们在他面前手拉手，合着拍子摇动着身体，朝着他反复地唱着古怪、刺耳的打油诗。起先，他还咆哮着咒骂他们——用他从形形色色的工头们那儿学来的咒骂的话。后来他发现骂是不管用的，他又想起了自己的尊严，于是他又固执地恢复了沉默。","During the meal, his mother explained in various ways and with infinite repetition that she was trying to do the best she could; so that it was with relief, the scant meal ended, that Johnny shoved back his chair and arose.He debated for a moment between bed and the front door, and finally went out the latter.He did not go far.He sat down on the stoop, his knees drawn up and his narrow shoulders drooping forward, his elbows on his knees and the palms of his hands supporting his chin.As he sat there, he did no thinking.He was just resting.So far as his mind was concerned, it was asleep.His brothers and sisters came out, and with other children played noisily about him.An electric globe on the corner lighted their frolics.He was peevish and irritable, that they knew; but the spirit of adventure lured them into teasing him.They joined hands before him, and, keeping time with their bodies, chanted in his face weird and uncomplimentary doggerel.At first he snarled curses at them—curses he had learned from the lips of various foremen.Finding this futile, and remembering his dignity, he relapsed into dogged silence."
"他的大弟弟威尔，年龄与他最相近，刚刚过了十岁生日，就是这些孩子们的头儿。尤其是对威尔，约翰尼没有一点儿好感。他的生活早就由于不断地为威尔牺牲和妥协让步而变得痛苦不堪了。他明确地感觉到威尔受了他的大恩惠，却是个忘恩负义的家伙。回首过去，在他记不太清的日子里，他的玩耍时间大部分都因为必须照顾威尔而被牺牲掉了。那时威尔还是个小婴儿，他们的母亲就像现在一样整天在工厂里做工。因此，担任小父亲和小母亲的角色就都落到了约翰尼的肩上。","His brother Will, next to him in age, having just passed his tenth birthday, was the ring-leader.Johnny did not possess particularly kindly feelings toward him.His life had early been embittered by continual giving over and giving way to Will.He had a definite feeling that Will was greatly in his debt and was ungrateful about it.In his own playtime, far back in the dim past, he had been robbed of a large part of that playtime by being compelled to take care of Will.Will was a baby then, and then, as now, their mother had spent her days in the mills.To Johnny had fallen the part of little father and little mother as well."
"他的牺牲和让步，威尔看起来是颇为受益的。他发育得很好，相当健壮，个头跟他哥哥一样高，甚至比他哥哥还要沉些。似乎他哥哥的血液流到了弟弟的血管里似的。精神上也是如此。约翰尼总是疲倦不堪、筋疲力尽、没有活力，而威尔则看起来生气勃勃，精力充沛。","Will seemed to show the benefit of the giving over and the giving way.He was well-built, fairly rugged, as tall as his elder brother and even heavier.It was as though the life-blood of the one had been diverted into the other’s veins.And in spirits it was the same.Johnny was jaded, worn out, without resilience, while his younger brother seemed bursting and spilling over with exuberance."
"这时候，嘲笑的歌声越来大了。威尔一面跳舞，一面凑了过来，还冲他吐舌头。约翰尼突然伸出左臂一把搂住威尔的脖子。同时，他用皮包骨的拳头打威尔的鼻子。这个拳头瘦得可怜，但是足够厉害了，从他弟弟疼得尖叫的声音里就可以得到证明。其他的孩子们全吓得喊叫起来，约翰尼的妹妹珍妮赶紧冲回屋里去了。","The mocking chant rose louder and louder.Will leaned closer as he danced, thrusting out his tongue.Johnny’s left arm shot out and caught the other around the neck.At the same time he rapped his bony fist to the other’s nose.It was a pathetically bony fist, but that it was sharp to hurt was evidenced by the squeal of pain it produced.The other children were uttering frightened cries, while Johnny’s sister, Jennie, had dashed into the house."
"他推开威尔，恶狠狠地踢他的小腿，然后抓着他，把他的脸猛地朝下往泥里摔。他把威尔的脸往泥里摔了好几次才罢手放开了他。接着，他母亲像一阵无力的旋风一样赶到了，带着满腔的担忧和母性的愤怒。","He thrust Will from him, kicked him savagely on the shins, then reached for him and slammed him face downward in the dirt.Nor did he release him till the face had been rubbed into the dirt several times.Then the mother arrived, an anaemic whirlwind of solicitude and maternal wrath."
"“为什么他非要惹我呢？”约翰尼挨了母亲的责骂后回答道，“难道他看不出来我很累吗？”","“Why can’t he leave me alone?” was Johnny’s reply to her upbraiding.“Can’t he see I’m tired?”"
"“我和你一样高，”威尔在母亲的怀里气得要命。他的脸被眼泪、鲜血和脏土弄得一塌糊涂。“我现在就和你长得一样大，以后我会超过你。到时候我会揍你——你等着瞧。”","“I’m as big as you,” Will raged in her arms, his face a mess of tears, dirt, and blood.“I’m as big as you now, an’ I’m goin’ to git bigger.Then I’ll lick you—see if I don’t.”"
"“既然你知道自己长得多大，你就该去做工。”约翰尼咆哮道，“你的问题就在这儿。你应该去工作。你的妈妈该让你去工作。”","“You ought to be to work, seein’ how big you are,” Johnny snarled.“That’s what’s the matter with you.You ought to be to work.An’ it’s up to your ma to put you to work.”"
"“但是他太小了，”母亲争辩道，“他还只是个小孩子。”","“But he’s too young,” she protested.“He’s only a little boy.”"
"“我开始做工的时候比他还小呢。”","“I was younger’n him when I started to work.”"
"约翰尼张着嘴，想继续发泄他心中的不平，可是他还是突然止住了。他沮丧地站起来，大步走到屋里睡觉去了。他的房门开着，好让厨房的暖气进来。他在半明半暗的光线里脱衣服的时候，听见了母亲跟来串门的邻家女人说话。母亲在哭泣，话语间还不时地夹杂着无力的抽噎声。","Johnny’s mouth was open, further to express the sense of unfairness that he felt, but the mouth closed with a snap.He turned gloomily on his heel and stalked into the house and to bed.The door of his room was open to let in warmth from the kitchen.As he undressed in the semi-darkness he could hear his mother talking with a neighbor woman who had dropped in.His mother was crying, and her speech was punctuated with spiritless sniffles."
"“我不知道约翰尼怎么回事，”他听到母亲说着，“他从来不这样。以前，他可是个耐心的小天使。","“I can’t make out what’s gittin’ into Johnny,” he could hear her say.“He didn’t used to be this way.He was a patient little angel."
"现在也是个好孩子，”她连忙又为他辩护道，“他干活踏实，而且他确实工作得太早了。但这不是我的错。我确信，我已经尽力了。”","“An’ he is a good boy,” she hastened to defend.“He’s worked faithful, an’ he did go to work too young.But it wasn’t my fault.I do the best I can, I’m sure.”"
"厨房里传来了长长的啜泣声，约翰尼一面合上眼皮，一面喃喃自语：“我本来就是在踏踏实实地干活。”","Prolonged sniffling from the kitchen, and Johnny murmured to himself as his eyelids closed down, “You betcher life I’ve worked faithful.”"
"第二天早晨，约翰尼又被母亲从沉沉的睡梦中硬拖起来。吃过寒酸的早饭，他摸黑赶路，房顶上曙光暗淡，他转身走进工厂的大门。又是一天，一年到头这样的日子，天天如此。","The next morning he was torn bodily by his mother from the grip of sleep.Then came the meagre breakfast, the tramp through the dark, and the pale glimpse of day across the housetops as he turned his back on it and went in through the factory gate.It was another day, of all the days, and all the days were alike."
"然而，有时候是有变化的——有时候他会换工作，有时候他会生病。六岁的时候，他就是威尔和其他更小的弟弟妹妹们的小父亲、小母亲。七岁的时候他去工厂里——在那儿绕线轴。八岁的时候，他去了另一家工厂工作。他的新差事容易极了。他只要坐着，手拿一根小棍子，引导经过他面前川流不息地流过去的布匹就可以了。这些川流不息的布像从机器的胃里出来一样，然后经过一个热滚筒，就流到别处了。可是，他始终坐在一个位置上，日光照不到他，只有一盏煤气灯挂在他头顶上方闪闪发光；他自己也成了机器的一部分。","And yet there had been variety in his life—at the times he changed from one job to another, or was taken sick.When he was six, he was little mother and father to Will and the other children still younger.At seven he went into the mills—winding bobbins.When he was eight, he got work in another mill.His new job was marvellously easy.All he had to do was to sit down with a little stick in his hand and guide a stream of cloth that flowed past him.This stream of cloth came out of the maw of a machine, passed over a hot roller, and went on its way elsewhere.But he sat always in the one place, beyond the reach of daylight, a gas-jet flaring over him, himself part of the mechanism."
"尽管那里又湿又热，他还是很喜欢这个差事，毕竟他还小，充满了梦想和幻想。他一边看着川流不息的布无穷尽地流过去，一边做着自己的美梦。不过这个差事不需要活动，不用动脑子。他的梦想越来越少了，脑子也越来越迟钝，昏昏欲睡的。然而，他每周能挣两块钱。这两块钱意味着急性饥饿和慢性吃不饱之间的区别。","He was very happy at that job, in spite of the moist heat, for he was still young and in possession of dreams and illusions.And wonderful dreams he dreamed as he watched the streaming cloth streaming endlessly by.But there was no exercise about the work, no call upon his mind, and he dreamed less and less, while his mind grew torpid and drowsy.Nevertheless, he earned two dollars a week, and two dollars represented the difference between acute starvation and chronic underfeeding."
"但是，他九岁的时候失业了。因为他得了麻疹。病愈以后，他在一家玻璃厂找了份工作。工资高了些，可是这活儿需要技巧。这是份计件付酬的活计，技术越高，赚钱越多。刺激就在于此。于是在这种刺激下，他渐渐变成了一个出色的工人。","But when he was nine, he lost his job.Measles was the cause of it.After he recovered, he got work in a glass factory.The pay was better, and the work demanded skill.It was piece-work, and the more skilful he was, the bigger wages he earned.Here was incentive.And under this incentive he developed into a remarkable worker."
"这个工作是很简单的，就是给塞在小瓶子里的玻璃塞系绳子。他的腰间带着一捆麻线。他把瓶子夹在双膝当中，这样就可以腾出双手来干活了。就这样，他总是坐着，身子向前倾着。他窄窄的肩膀变驼了，而他的胸部要每天被挤压十个钟头。这对他的肺不好，但是他一天能扎三百打的瓶子。","It was simple work, the tying of glass stoppers into small bottles.At his waist he carried a bundle of twine.He held the bottles between his knees so that he might work with both hands.Thus, in a sitting position and bending over his own knees, his narrow shoulders grew humped and his chest was contracted for ten hours each day.This was not good for the lungs, but he tied three hundred dozen bottles a day."
"主管为有他这样的童工而非常得意，并且总带着一些人来参观。十个小时内，三百打的瓶子就经他的手扎好了。这就意味着，他已经熟练地跟机器一样完美了。没有任何多余的动作。他的瘦胳膊的每一个动作，细手指上肌肉的每一次活动都是迅速而准确的。他工作得非常紧张，结果是他本人都变得神经质了。夜里，睡觉时他的肌肉抽搐着；白天，他更不能放松下来歇着。他一直地紧张着，他的肌肉持续地抽搐着。而且，他的脸色越来越差，飞花导致的咳嗽也越来越严重。后来，被挤压的胸腔里的虚弱的肺患上了肺炎，于是他丢掉了玻璃厂的工作。现在，他又回到了那家麻纺厂，他最初就是从这里开始绕线轴的。但是他提升在望。他是个优秀的工人。接下来，他就要到上浆车间去了，以后还会上到织布车间。至此就算升到顶了，只是他还可以提高工作效率。","The superintendent was very proud of him, and brought visitors to look at him.In ten hours three hundred dozen bottles passed through his hands.This meant that he had attained machine-like perfection.All waste movements were eliminated.Every motion of his thin arms, every movement of a muscle in the thin fingers, was swift and accurate.He worked at high tension, and the result was that he grew nervous.At night his muscles twitched in his sleep, and in the daytime he could not relax and rest.He remained keyed up and his muscles continued to twitch.Also he grew sallow and his lint-cough grew worse.Then pneumonia laid hold of the feeble lungs within the contracted chest, and he lost his job in the glass-works.Now he had returned to the jute mills where he had first begun with winding bobbins.But promotion was waiting for him.He was a good worker.He would next go on the starcher, and later he would go into the loom room.There was nothing after that except increased efficiency."
"机器比他刚上班的时候转得快多了，而他的脑子却转得慢了。他根本不再做梦了，尽管早些年他充满着梦想。曾经他还一度恋爱过。那是他刚开始引布过热滚筒的时候，她是主管的女儿。她比他大得多，一个年轻的女人，他只是远远地看到她五六次。但那没有什么关系。在面前流过的布面上，他勾画出了他灿烂的前程。他艰苦的劳动创造出了奇迹，他发明出神奇的机器，他赢得了厂子的领导权，最后他拥抱着她，庄严地吻着她的前额。","The machinery ran faster than when he had first gone to work, and his mind ran slower.He no longer dreamed at all, though his earlier years had been full of dreaming.Once he had been in love.It was when he first began guiding the cloth over the hot roller, and it was with the daughter of the superintendent.She was much older than he, a young woman, and he had seen her at a distance only a paltry half-dozen times.But that made no difference.On the surface of the cloth stream that poured past him, he pictured radiant futures wherein he performed prodigies of toil, invented miraculous machines, won to the mastership of the mills, and in the end took her in his arms and kissed her soberly on the brow."
"但是那已经是很久以前的事情了。现在他变得太老了，已经疲于恋爱了。况且，她已经嫁人去了别的地方，他也就不再费那份心思了。然而，那毕竟是一段美妙的经历，他常常回想起来，就像其他男女会回想起他们曾经相信童话的年纪一样。他从来都不信童话故事，也不信圣诞老人，但是他曾经暗中坚信过自己在热气腾腾的布流上织出的自己美好的未来。","But that was all in the long ago, before he had grown too old and tired to love.Also, she had married and gone away, and his mind had gone to sleep.Yet it had been a wonderful experience, and he used often to look back upon it as other men and women look back upon the time they believed in fairies.He had never believed in fairies nor Santa Claus; but he had believed implicitly in the smiling future his imagination had wrought into the steaming cloth stream."
"他很早就成熟了。自从七岁那年，当他第一次领到自己的工资，他的青春期就开始了。他萌生了某种自食其力的感觉，接着他和母亲的关系开始发生了变化。不知怎的，作为一个挣钱养家的人，他在世界上有了自己的工作，他跟母亲的地位就平等了。大人，一个十足的大人了，就是在他十一岁那年。那一年，他上了半年的夜班。没有哪个孩子上了夜班后还像个小孩子的。","He had become a man very early in life.At seven, when he drew his first wages, began his adolescence.A certain feeling of independence crept up in him, and the relationship between him and his mother changed.Somehow, as an earner and breadwinner, doing his own work in the world, he was more like an equal with her.Manhood, full-blown manhood, had come when he was eleven, at which time he had gone to work on the night shift for six months.No child works on the night shift and remains a child."
"他的生命中经历过几件大事。一件是他母亲买了一些加利福尼亚的梅干。另外两件是母亲烘了两次蛋奶糕。这些都是大事情。他很亲切地记得。当时，母亲还跟他说过，她还会给他做一种幸运的好吃的——“浮岛”，她说“比蛋奶糕要好吃”。好多年他都盼望着能坐在桌旁，面前摆着浮岛。直到最后，他发现这个想法就是一个地狱边境，里面充满着众多不能实现的理想。","There had been several great events in his life.One of these had been when his mother bought some California prunes.Two others had been the two times when she cooked custard.Those had been events.He remembered them kindly.And at that time his mother had told him of a blissful dish she would sometime make—“floating island,” she had called it, “better than custard.”For years he had looked forward to the day when he would sit down to the table with floating island before him, until at last he had relegated the idea of it to the limbo of unattainable ideals."
