"zh","en"
"但他的声音里没有悲伤的语气。他早就知道母亲为他弟弟所费的苦心，但是想到这种事他再也不痛心了。再也没有什么关系了。甚至他都不把这些事情放在心上了。","But there was no bitterness in his voice.He had long known his mother’s ambition for the younger boy, but the thought of it no longer rankled.Nothing mattered any more.Not even that."
"“妈，我知道你为威尔做的打算——让他继续读书，然后做一个管帐员。但是没有用了，我不干了。他必须去干活。”","“I know, ma, what you’ve ben plannin’ for Will—keepin’ him in school to make a bookkeeper out of him.But it ain’t no use, I’ve quit.He’s got to go to work.”"
"“我把你抚养成人，你就这样啊。”她哭着说，想用围裙蒙脸来着，可是又改变了主意。","“An’ after I have brung you up the way I have,” she wept, starting to cover her head with the apron and changing her mind."
"“你根本没有把我抚养成人，”他用悲凉而又温和的口气说着，“是我把自己抚养长大的，妈，而且我抚养了威尔长大。他块头比我大，比我重，也比我高。我想我小的时候就没有吃饱过。他出世以后只有几岁的时候，我就开始干活，赚钱养活他了。不过已经结束了。威尔可以去干活了，像我一样，或者随他吧，反正我不在乎了。我累了。我现在要走了。你都不跟我说声再会吗？”","“You never brung me up,” he answered with sad kindliness. “I brung myself up, ma, an’ I brung up Will.He’s bigger’n me, an’ heavier, an’ taller.When I was a kid, I reckon I didn’t git enough to eat.When he come along an’ was a kid, I was workin’ an’ earnin’ grub for him too.But that’s done with.Will can go to work, same as me, or he can go to hell, I don’t care which.I’m tired.I’m goin’ now.Ain’t you goin’ to say good-by?”"
"她没有回答。她又用围裙蒙住脸，大哭了起来。走到门口的时候，他停了一下。","She made no reply.The apron had gone over her head again, and she was crying.He paused a moment in the doorway."
"“我肯定我尽了力。”她啜泣着。","“I’m sure I done the best I knew how,” she was sobbing."
"他走出了房子，到了大街上。看见那棵孤单的树，他的脸上露出了一副凄凉的笑容。“我什么也不干了。”他自言自语着，用有些响亮，又似低声哼唱的语气说道。他若有所思地看了看天，耀眼的太阳照得他眼都花了。","He passed out of the house and down the street.A wan delight came into his face at the sight of the lone tree.“Jes’ ain’t goin’ to do nothin’,” he said to himself, half aloud, in a crooning tone.He glanced wistfully up at the sky, but the bright sun dazzled and blinded him."
"他走了很久，但是走得不快。他顺路走过了麻纺厂。织布车间里闷闷的轰隆声传到他的耳朵里，他微微地笑了。那是轻柔的、宁静的微笑。他谁都不恨，甚至不恨那些砰砰作响、震耳欲聋的机器。他的心中没有伤悲，只是极度渴望休息。","It was a long walk he took, and he did not walk fast.It took him past the jute-mill.The muffled roar of the loom room came to his ears, and he smiled.It was a gentle, placid smile.He hated no one, not even the pounding, shrieking machines.There was no bitterness in him, nothing but an inordinate hunger for rest."
"房屋和工厂逐渐稀少了，空旷的地方越来越多，这时他已经快到乡下了。最后，城市在他身后了。他沿着铁路旁一条树木茂盛的小路走去。他走得不像人。他看起来也不像人。他就是对人类的一种嘲弄。他好像个身子扭曲歪斜、发育不良、说不出名堂的活物。他踉踉跄跄地走着，两只胳膊松松垮垮，弓着肩，窄胸膛，样子古怪又可怕，活像一只生病的猿猴。","The houses and factories thinned out and the open spaces increased as he approached the country.At last the city was behind him, and he was walking down a leafy lane beside the railroad track.He did not walk like a man.He did not look like a man.He was a travesty of the human.It was a twisted and stunted and nameless piece of life that shambled like a sickly ape, arms loose-hanging, stoop-shouldered, narrow-chested, grotesque and terrible."
"他路过了一个小火车站，然后便躺到一棵树下的草地上。整个下午他都躺在那儿。有时他打起盹来，他的肌肉在睡梦中抽搐着。醒过来的时候，他一动不动地躺在那儿看着鸟儿，或透过树枝的缝隙看着上面的天空。有一两次，他大笑了起来，不过这跟他看到或感觉到的东西没有任何关系。","He passed by a small railroad station and lay down in the grass under a tree.All afternoon he lay there.Sometimes he dozed, with muscles that twitched in his sleep.When awake, he lay without movement, watching the birds or looking up at the sky through the branches of the tree above him.Once or twice he laughed aloud, but without relevance to anything he had seen or felt."
"黄昏逝去，夜色刚刚降临。一列货车隆隆地驶入车站。当这列货车在岔道上转轨时，约翰尼沿着火车的一侧爬了上去。他拉开一节空车厢的侧门，笨拙地、吃力地爬了进去。他关上了门。火车的汽笛响了。　约翰尼躺了下去，在黑暗中，他笑了。","After twilight had gone, in the first darkness of the night, a freight train rumbled into the station.When the engine was switching cars on to the side-track, Johnny crept along the side of the train.He pulled open the side-door of an empty box-car and awkwardly and laboriously climbed in.He closed the door.The engine whistled.Johnny was lying down, and in the darkness he smiled."
