"zh","en"
"我记不清了。我那时十分恼怒。他总是这样固执于这个形而上学信仰。我记得的下一个场景就是他躺在壁炉边。鲜血横流。太可怕了。他一言不发。一动不动。他一定是晕过去了，撞到了头。我注意到拨火棒上有血。一定是他倒下的时侯头撞到了上面。然而我弄不明白这是怎么发生的，因为我一直把它握在手里。就在我看它的时候还握着它。","I cannot remember.I was very exasperated.He had always been so obstinate in this metaphysical belief of his.The next I knew, he was lying on the hearth.Blood was running.It was terrible.He did not speak.He did not move.He must have fallen in a fit and struck his head.I noticed there was blood on the poker.In falling he must have struck upon it with his head.And yet I fail to see how this can be, for I held it in my hand all the time.I was still holding it in my hand as I looked at it."
"那是幻觉。根据常识可以得出这样的结论。我看着它愈演愈烈。一开始，我只能在最昏暗的光线里看到他坐在椅子上。但是随着时间流逝，幻觉在一遍遍的重现中强化了，他都能在最强烈的光中出现在椅子上。如上就是解释。相当令人满意。","It is an hallucination.That is a conclusion of common sense.I have watched the growth of it.At first it was only in the dimmest light that I could see him sitting in the chair.But as the time passed, and the hallucination, by repetition, strengthened, he was able to appear in the chair under the strongest lights.That is the explanation.It is quite satisfactory."
"我永远都不会忘记我第一次看到它的时候。我独自在楼下吃饭。我从不喝酒，因此发生的一切极为正常。我在夏日的暮光里回到书房。我瞥了一眼桌子。他就在那里，坐着。一切是如此自然，我在没意识到之前就大声喊出“吉姆！”随后我想起了发生的一切。那当然是幻觉。我知道。我提起拨火棒朝它走过去。他没动也没消失。拨火棒劈过这个不存在的物质，打在了椅背上。这都是幻象构造的。拨火棒击打的痕迹现在还留在椅子上。我停止写作，转过身看着它，把指尖压进凹痕之中。","I shall never forget the first time I saw it.I had dined alone downstairs.I never drink wine, so that what happened was eminently normal.It was in the summer twilight that I returned to the study.I glanced at the desk.There he was, sitting.So natural was it, that before I knew I cried out “Jim!”Then I remembered all that had happened.Of course it was an hallucination.I knew that.I took the poker and went over to it.He did not move nor vanish.The poker cleaved through the non-existent substance of the thing and struck the back of the chair.Fabric of fancy, that is all it was.The mark is there on the chair now where the poker struck.I pause from my writing and turn and look at it—press the tips of my fingers into the indentation."
"他的确在继续争论。我今天偷偷地走近，从他肩头看过去。他在记录我们的争论。记录的仍旧是以前形不灭的废话。但是当我接着读下去的时候，他写下了我用拨火棒在他身上进行的实际的试验。这是不公平、虚假的。我没有做什么试验。他是倒下的时候头撞在拨火棒上的。","He did continue the argument.I stole up to-day and looked over his shoulder.He was writing the history of our discussion.It was the same old nonsense about the eternity of forms.But as I continued to read, he wrote down the practical test I had made with the poker.Now this is unfair and untrue.I made no test.In falling he struck his head on the poker."
"有一天，有人会发现并读到他写的东西。那将会很可怕。我怀疑那个仆人，他总是鬼鬼祟祟地想仔细看我写的东西。我得采取点措施。我的每个仆人都很好奇我写了什么。","Some day, somebody will find and read what he writes.This will be terrible.I am suspicious of the servant, who is always peeping and peering, trying to see what I write.I must do something.Every servant I have had is curious about what I write."
"幻想的构造。这就是它的面貌。坐在椅子上的吉姆不存在。我知道的。昨天夜里，当房间里沉寂下来的时候，我下到地窖里，仔细察看烟囱附近的泥土。没有被动过。尸体没有出来。","Fabric of fancy.That is all it is.There is no Jim who sits in the chair.I know that.Last night, when the house was asleep, I went down into the cellar and looked carefully at the soil around the chimney.It was untampered with.The dead do not rise up."
"昨天早上走进书房的时候，他就在椅子上。我把他赶走后，自己在椅子上坐了一整天。我让仆人把饭端到面前。因此几个小时里，我都避过看到他的情景，因为他在椅子上出现。我很累，但是我坐到很晚，直到十一点。然而，当我站起来去睡觉的时候环顾四周，他又出现在那里。他立刻就溜到了椅子上。只是幻想的织造，他整天都盘踞在我的脑子里。一旦椅子空出来，他就占据在椅子上。这些就是他所吹嘘的高等存在所在的星球吗——他弟弟的脑子和一把椅子？然而，他错了吗？他永恒的形体弱化到只是个幻影了吗？幻影是真实存在的实体吗？为什么不？有精神食粮。总有一天我会自己得出问题的结论。","Yesterday morning, when I entered the study, there he was in the chair.When I had dispelled him, I sat in the chair myself all day.I had my meals brought to me.And thus I escaped the sight of him for many hours, for he appears only in the chair.I was weary, but I sat late, until eleven o’clock.Yet, when I stood up to go to bed, I looked around, and there he was.He had slipped into the chair on the instant.Being only fabric of fancy, all day he had resided in my brain.The moment it was unoccupied, he took up his residence in the chair.Are these his boasted higher planes of existence—his brother’s brain and a chair?After all, was he not right?Has his eternal form become so attenuated as to be an hallucination?Are hallucinations real entities?Why not?There is food for thought here.Some day I shall come to a conclusion upon it."
"他今天很烦躁不安。他没法写东西，因为我让仆人把笔装进口袋带出了房间，但是我也没法写东西。","He was very much disturbed to-day.He could not write, for I had made the servant carry the pen out of the room in his pocket But neither could I write."
"仆人从未看到过他。很奇怪。我的目光越发敏锐，能看到别人看不见的东西了吗？更确切地说，这不能证明幽灵是这样的吗——难道是我自己病态意识的产物？","The servant never sees him.This is strange.Have I developed a keener sight for the unseen?Or rather does it not prove the phantom to be what it is—a product of my own morbid consciousness?"
"他又偷走了我的笔。幻觉是不可能偷笔的。这是不可辩驳的。然而我不能总把笔放在房间外面。我自己也要写字。","He has stolen my pen again.Hallucinations cannot steal pens.This is unanswerable.And yet I cannot keep the pen always out of the room.I want to write myself."
"自从我碰上这个麻烦事，已经换了三个仆人，没有一个看到过他。他们的感觉判断是对的吗？还是我的感觉错了？不管怎么说，墨水用得太快了。我更加频繁地灌墨水。而且，只有今天我发现笔的位置不对了。我没有动过它。","I have had three different servants since my trouble came upon me, and not one has seen him.Is the verdict of their senses right?And is that of mine wrong?Nevertheless, the ink goes too rapidly.I fill my pen more often than is necessary.And furthermore, only to-day I found my pen out of order.I did not break it."
"我对他说过很多次话，但他从不搭腔。我坐着看了他一个早上。他老是看着我，很明显他认得我。","I have spoken to him many times, but he never answers.I sat and watched him all morning.Frequently he looked at me, and it was patent that he knew me."
"我用掌根狠狠地击打我的脑侧，这样就能把他的幻象抖出我的视线。然后我就可以坐到椅子上，但是我已经知道要动作迅速才能成功。他经常愚弄我，在我还没能坐下的时候再度出现。","By striking the side of my head violently with the heel of my hand, I can shake the vision of him out of my eyes.Then I can get into the chair; but I have learned that I must move very quickly in order to accomplish this.Often he fools me and is back again before I can sit down."
"事情越来越无法忍受了。他像玩偶盒弹出的小人一样突然出现在椅子上。他不是慢慢呈现外形的。他一下子冒出来。这是描述那情景的唯一方式。我无法忍受再看到他。这样让我发疯，因为它几乎要逼我相信，我知道的事实并不是真的。另外，幻觉不会一下子冒出来。","It is getting unbearable.He is a jack-in-the-box the way he pops into the chair.He does not assume form slowly.He pops.That is the only way to describe it.I cannot stand looking at him much more.That way lies madness, for it compels me almost to believe in the reality of what I know is not.Besides, hallucinations do not pop."
"谢天谢地他只出现在椅子上。只要我占据了椅子，就能摆脱他。","Thank God he only manifests himself in the chair.As long as I occupy the chair I am quit of him."
"我那敲头把他逐出椅子的方法正在失效。我不得不更用力地敲打，数十次才可能成功一次。我头上被不断敲击的地方很痛。我得换只手了。","My device for dislodging him from the chair by striking my head, is failing.I have to hit much more violently, and I do not succeed perhaps more than once in a dozen trials.My head is quite sore where I have so repeatedly struck it.I must use the other hand."
"我哥哥是对的。看不到的世界是存在的。我没有看到吗？我不是一直受着看到它的苦吗？叫它想象，想法，随便你叫它什么，它都在那里。这是无法逃避的。思想就是实体。我们用每一个想法来创造。我创造出了这个坐在我的椅子上，用我的墨水的幽灵。他是我创造的，并不意味他不真实。他是一个想法，一个实体。因此，想法即实体，而实体就是真实存在。","My brother was right.There is an unseen world.Do I not see it?Am I not cursed with the seeing of it all the time?Call it a thought, an idea, anything you will, still it is there.It is unescapable.Thoughts are entities.We create with every act of thinking.I have created this phantom that sits in my chair and uses my ink.Because I have created him is no reason that he is any the less real.He is an idea; he is an entity: ergo, ideas are entities, and an entity is a reality."
"疑问：如果一个人，带着他经历过的一切，能够创造出实体，真实的事物，那关于造物主的假说不就被证实了吗？如果有生命的物质能创造，那么假设存在一个能造出有生命物质的人也是合理的。只是程度不同而已。我还没造出一座山或是太阳系，但是我造出了坐在我椅子上的东西。如果是这样，是不是有一天我就能造出山或者太阳系呢？","Query: If a man, with the whole historical process behind him, can create an entity, a real thing, then is not the hypothesis of a Creator made substantial?If the stuff of life can create, then it is fair to assume that there can be a He who created the stuff of life.It is merely a difference of degree.I have not yet made a mountain nor a solar system, but I have made a something that sits in my chair.This being so, may I not some day be able to make a mountain or a solar system?"
"整个人类史，直至今日，人类都活在一个迷宫之中。没人看到过光。我相信自己将看到光了——不是像我哥哥那样偶然发现才看到的，而是有意地、理智地看到。我哥哥死了。他的生命停止了。这点毫无疑问，因为我又去地窖查看过一次。地面没有被动过。我挖开土来确认，我看到了能让我确定的东西。我哥哥不在了，而我又造出了他。这不是我哥哥，而是我能造出的与我哥哥最相近的东西。我跟别人不一样。我是个神。我创造过。","All his days, down to to-day, man has lived in a maze.He has never seen the light.I am convinced that I am beginning to see the light—not as my brother saw it, by stumbling upon it accidentally, but deliberately and rationally.My brother is dead.He has ceased.There is no doubt about it, for I have made another journey down into the cellar to see.The ground was untouched.I broke it myself to make sure, and I saw what made me sure.My brother has ceased, yet have I recreated him.This is not my old brother, yet it is something as nearly resembling him as I could fashion it.I am unlike other men.I am a god.I have created."
"无论我何时离开房间去睡觉，我回过头，总能看到哥哥坐在椅子上。然后，我就因为想到他要坐着熬过漫漫长夜而无法入睡。早上，我一推开书房的门，他就在那里，我知道他在那坐了一夜。","Whenever I leave the room to go to bed, I look back, and there is my brother sitting in the chair.And then I cannot sleep because of thinking of him sitting through all the long night-hours.And in the morning, when I open the study door, there he is, and I know he has sat there the night long."
"睡眠不足使我变得绝望。我希望能向一个精神医生吐露心事。","I am becoming desperate from lack of sleep.I wish I could confide in a physician."
"上帝保佑我睡着！我最终熬过去了。听我说。昨夜我太累了，坐在椅子上打盹。我摇铃叫来仆人，让他把毯子拿给我。我睡着了。这一整夜，他被逐出了我的椅子，他也就被逐出了我的思想。我要整天保持这种状态。那是个美好的解脱。","Blessed sleep!I have won to it at last.Let me tell you.Last night I was so worn that I found myself dozing in my chair.I rang for the servant and ordered him to bring blankets.I slept.All night was he banished from my thoughts as he was banished from my chair.I shall remain in it all day.It is a wonderful relief."
"在椅子上睡觉并不舒服。但是想着他坐在寒冷的夜里，我一小时又一小时地躺在床上却难以入眠，这滋味更痛苦。","It is uncomfortable to sleep in a chair.But it is more uncomfortable to lie in bed, hour after hour, and not sleep, and to know that he is sitting there in the cold darkness."
"没用的。我将永远都不能再睡在床上了。我现在就试过了，试过无数次，每个这样的夜晚都让我恐惧。要是我能说服他去睡觉就好了！但是我不能。他坐在那里，就坐在那里——我知道他在那里——当我抬头凝视黑暗，想来想去，总是想着他就坐在那里。我希望自己从没听说过形体不灭的说法。","It is no use.I shall never be able to sleep in a bed again.I have tried it now, numerous times, and every such night is a horror.If I could but only persuade him to go to bed!But no.He sits there, and sits there—I know he does—while I stare and stare up into the blackness and think and think, continually think, of him sitting there.I wish I had never heard of the eternity of forms."
"仆人们认为我疯了。那只是将来的预测，因此我从来不请精神医生。","The servants think I am crazy.That is but to be expected, and it is why I have never called in a physician."
"我下定决心了。从今往后幻觉就会停止。从现在起我就呆在椅子上。我永远都不会离开它。我会日日夜夜永远呆在椅子上。","I am resolved.Henceforth this hallucination ceases.From now on I shall remain in the chair.I shall never leave it.I shall remain in it night and day and always."
"我成功了。我已经有两周没看到他了。我再也不会看到他了。我终于得到了哲学思考所必需的镇定。今天我写了整整一章。","I have succeeded.For two weeks I have not seen him.Nor shall I ever see him again.I have at last attained the equanimity of mind necessary for philosophic thought.I wrote a complete chapter to-day."
"坐在椅子上很累。周复一周地过去了，月份轮回，季节交替，仆人相互轮换，而我一直是老样子。只有我还是老样子。我过着奇怪的生活，但是最起码我很平静。","It is very wearisome, sitting in a chair.The weeks pass, the months come and go, the seasons change, the servants replace each other, while I remain.I only remain.It is a strange life I lead, but at least I am at peace."
"他再没出现。形体并不永恒。我证明了这一点。到现在快两年了，我一直呆在这张椅子上，再也没见过他。真的，我的确严格地试过一次。但是我很清楚，我认为自己看到的东西只是幻觉。他从未存在。但我没有离开椅子。我害怕离开椅子。","He comes no more.There is no eternity of forms.I have proved it.For nearly two years now, I have remained in this chair, and I have not seen him once.True, I was severely tried for a time.But it is clear that what I thought I saw was merely hallucination.He never was.Yet I do not leave the chair.I am afraid to leave the chair."
"[1]（强有力的——哈！哈！——鲁道夫·赫克勒在空白处的注解）","[1] (Forcible—ha! ha!—comment of Rudolph Heckler on margin.)"
