"zh","en"
"“哦！”他说，“同你料想得差不多。它只是一篇纯粹的废话。但这正是他们想要的。糟糕透顶，不是吗，威克斯奥小姐？”","“Oh!” he said.“As well as you can expect.It was a piece of pure flummery.But it’s what they want.Awful rot, wasn’t it, Miss Wrexall?”"
"威克斯奥小姐子在凳子上不安地扭动着。","Miss Wrexall moved uneasily on her chair."
"“我挺感兴趣的，”她说，“虽然不及对那部小说那样感兴趣。”","“It interested me,” she said, “though not so much as the novel.”"
"“那部小说？哪部小说？”妻子问，“又有部新的吗？”","“The novel?Which novel?” said the wife.“Is there another new one?”"
"威克斯奥小姐看着他。她绝不会透露有关他文学活动的任何一个字。","Miss Wrexall looked at him.Not for words would she give away any of his literary activities."
"“哦，我只是大致和威克斯奥小姐说了一个想法。”他说。","“Oh, I was just sketching out an idea to Miss Wrexall,” he said."
"“给我们说说吧！”妻子说，“威克斯奥小姐，告诉我们是关于什么的？”","“Tell us about it!” said the wife.“Miss Wrexall, you tell us what it’s about.”"
"她从椅子上转过身来，凝视着小秘书。","She turned on her chair, and fixed the little secretary."
"“我恐怕”——威克斯奥小姐忸怩着——“我自己也不是很清楚。”","“I’m afraid”—Miss Wrexall squirmed—“I haven’t got it very clearly myself, yet.”"
"“哦，说吧！那就告诉我你知道的！”","“Oh, go along!Tell us what you have got then!”"
"威尔克斯奥小姐坐在那里一时语塞，一副很为难的样子。她感觉自己正在被戏弄。她看着自己裙子上的蓝色褶裥。","Miss Wrexall sat dumb and very vexed.She felt she was being baited.She looked at the blue pleatings of her skirt."
"“我恐怕不能说。”她说。","“I’m afraid I can’t,” she said."
"“为什么恐怕不能？你这么能干！我确信你已经对它了如指掌。我想你为吉先生写了很多书吧？真的。他给你提示，你再把内容全填进去。你不是这么做的吗？”她讽刺地说着，像在逗一个小孩。然后她低头看着自己蓝色裙子的漂亮褶裥，很漂亮华贵。","“Why are you afraid you can’t?You’re so very competent.I’m sure you’ve got it all at your finger-ends.I expect you write a good deal of Mr. Gee’s books for him, really.He gives you the hint, and you fill it all in.Isn’t that how you do it?”She spoke ironically, and as if she were teasing a child.And then she glanced down at the fine pleatings of her own blue skirt, very fine and expensive."
"“你肯定不是在说真的？”威尔克斯奥小姐鼓起勇气说。","“Of course you’re not speaking seriously?” said Miss Wrexall, rising on her mettle."
"“我当然是！我怀疑了很长一段时间——至少有一段时间了——你根据吉先生的提示为他写了很多书。”","“Of course I am!I’ve suspected for a long time—at least, for some time—that you write a good deal of Mr. Gee’s books for him, from his hints.”"
"虽然是用开玩笑的口吻说的，但却很残忍。","It was said in a tone of raillery, but it was cruel."
"“我本应该会受宠若惊的，”威克斯奥小姐站直身子说，“如果我知道你不是只想愚弄我的话！”","“I should be terribly flattered,” said Miss Wrexall, straightening herself, “if I didn’t know you were only trying to make me feel a fool.”"
"“愚弄你？我亲爱的孩子！——为什么？我绝不会那么做！你比我聪明一倍，比我能干百万倍。真的，亲爱的孩子，我非常钦佩你！我做不了你所做的事，就是给我印度所有的珍珠我也办不到。不管怎样我都不能——”","“Make you feel a fool?My dear child!—why, nothing could be farther from me!You’re twice as clever, and a million times as competent as I am.Why, my dear child, I’ve the greatest admiration for you!I wouldn’t do what you do, not for all the pearls in India.I couldn’t anyhow—”"
"威克斯奥小姐闭上了嘴，不再吭声。","Miss Wrexall closed up and was silent."
"“你的意思是我的书读起来像——”他暴跳如雷，用痛苦的声音开始说道。","“Do you mean to say my books read as if—” he began, rearing up and speaking in a harrowed voice."
"“是的！”妻子说，“就像威克斯奥小姐按你提示写出来的一样。我真的以为是她代你写的——当你太忙时——”","“I do!” said the wife.“Just as if Miss Wrexall had written them from your hints.I honestly thought she did—when you were too busy—”"
"“你真聪明！”他说。","“How very clever of you!” he said."
"“特别聪明！”她说，“尤其要是我错了的话！”","“Very!” she said.“Especially if I was wrong!”"
"“你是错了！”他说。","“Which you were,” he said."
"“多奇怪啊！”她喊道，“好吧，又是我错了！”","“How very extraordinary!” she cried.“Well, I am once more mistaken!”"
"完全的沉寂。","There was a complete pause."
"是威克斯奥小姐打破了这一僵局，她紧张地绞着手指。","It was broken by Miss Wrexall, who was nervously twisting her fingers."
"“你想毁掉我们之间的关系，我看得出！”她悲痛地说。","“You want to spoil what there is between me and him, I can see that,” she said bitterly."
"“亲爱的，你和他之间有什么关系？”妻子问。","“My dear, but what is there between you and him?” asked the wife."
"“我乐意和他一起工作，乐意为他工作！为他工作我很快乐！”威克斯奥小姐喊道，眼里充满了气愤和委屈的泪水。","“I was happy working with him, working for him!I was happy working for him!” cried Miss Wrexall, tears of indignant anger and chagrin in her eyes."
"“我亲爱的孩子！”妻子喊道，假装很激动，“继续快乐地和他一起工作啊，如果你可以，继续快乐呀！如果这能让你高兴，为什么不好好享受呢！当然！你觉得我会残忍地剥夺你这个快乐吗？——和他一起工作？我不会速记、打字，和复式记账，或是等等诸如此类的事。我告诉你，我是彻底什么都不会。我从未挣过一分钱。我就是英国橡树的寄生虫，像槲寄生。蓝鸟不会在我脚边拍打翅膀。也许我的脚太大，容易踩到它。”","“My dear child!” cried the wife, with simulated excitement, “go on being happy working with him, go on being happy while you can!If it makes you happy, why then, enjoy it!Of course!Do you think I’d be so cruel as to want to take it away from you?—working with him?I can’t do shorthand and typewriting and double-entrance book-keeping, or whatever it’s called.I tell you, I’m utterly incompetent.I never earn anything.I’m the parasite of the British oak, like the mistletoe.The blue bird doesn’t flutter round my feet.Perhaps they’re too big and trampling.”"
"她低头看着她那双昂贵的鞋。","She looked down at her expensive shoes."
"“如果我要批评谁的话，”她转向丈夫说，“那也是批评你，卡梅伦，因为你从她那得到太多却从不回报。”","“If I did have a word of criticism to offer,” she said turning to her husband, “it would be to you, Cameron, for taking so much from her and giving her nothing.”"
"“但他给了我一切，一切！”威克斯奥小姐喊道，“他给了我一切！”","“But he gives me everything, everything!” cried Miss Wrexall.“He gives me everything!”"
"“你说的一切是指什么？”妻子说，严肃地转向她。","“What do you mean by everything?” said the wife, turning on her sternly."
"威克斯奥小姐突然停住了。空气中仿佛有什么突然折断，气流也发生了变化。","Miss Wrexall pulled up short.There was a snap in the air, and a change of currents."
"“我的意思是你没必要嫉妒我，”小秘书傲慢地说，“我从未干过贬低自己的事。”","“I mean nothing that you need begrudge me,” said the little secretary rather haughtily.“I’ve never made myself cheap.”"
"空白的停顿。","There was a blank pause."
"“我的天！”妻子说，“你那样还说不是贬低自己？哎，我可以说你从未从他那得到任何东西，你只是付出！难道你认为那样还不算贬低你自己——我的天！”","“My God!” said the wife.“You don’t call that being cheap?Why, I should say you got nothing out of him at all, you only give!And if you don’t call that making yourself cheap—my God!”"
"“你看，我们看法不一样！”秘书说。","“You see, we see things different,” said the secretary."
"“我想确实不一样！——感谢上帝！”妻子回答说。","“I should say we do!—thank God!” rejoined the wife."
"“你在代表谁感谢上帝？”他嘲讽地问。","“On whose behalf are you thanking God?” he asked sarcastically."
"“代表每个人，我想！为你，因为你得到一切却不付出，为她，因为她似乎还乐在其中，还为我，因为我还可以置身事外！”","“Everybody’s, I suppose!Yours, because you get everything for nothing, and Miss Wrexall’s, because she seems to like it, and mine because I’m well out of it all.”"
"“你不必置身事外，”威克斯奥小姐大度地喊道，“如果你不让自己置身事外的话。”","“You needn’t be out of it all,” cried Miss Wrexall magnanimously, “if you didn’t put yourself out of it all.”"
"“谢谢你，亲爱的，谢谢你的建议。”妻子说着，站起身，“但恐怕没有人希望两只幸福的蓝鸟在他的脚边扑打翅膀，相互撕扯羽毛！”","“Thank you, my dear, for your offer,” said the wife, rising, “but I’m afraid no man can expect two blue birds of happiness to flutter round his feet, tearing out their little feathers!”"
"说完，她走开了。","With which she walked away."
"在一阵紧张和绝望的停顿后，威克斯奥小姐喊道：“真的，一个女人有必要嫉妒我吗？”","After a tense and desperate interim, Miss Wrexall cried: “And really, need any woman be jealous of me?”"
"“当然！”他说。","“Quite!” he said."
"那就是他说的全部的话。","And that was all he did say."
