"zh","en"
"她肯定不会想去速记他说的话，并在打字机上把那些话再次打出来。而且她并不真的想他吻她，因为她太了解他了。是的，她太了解他了。如果你过于了解一个男人，你就不会想他吻你。","She certainly didn’t want to take him down in shorthand, and type out again all those words.And she didn’t really want him to kiss her; she knew him too well.Yes, she knew him too well.If you know a man too well, you don’t want him to kiss you."
"然后呢？她想要什么呢？为什么她对他还是这么地念念不忘？只是因为她是他妻子吗？她为什么如此“喜欢”与别的男人在一起——并对此乐此不疲——但却从不把他们当回事？而为什么当她不再真正“喜欢”与他在一起时，却还是如此地看重他？","What then?What did she want?Why had she such an extraordinary hang-over about him?Just because she was his wife?Why did she rather ‘enjoy’ other men—and she was relentless about enjoyment—without ever taking them seriously?And why must she take him so damn seriously, when she never really ‘enjoyed’ him?"
"当然，她曾和他有过快乐的日子，在过去，以前——啊！当初就算有一千件快乐的事，现在也不值一提了。但她已经不喜欢他了。她不再喜欢与他一起厮守。他们之间有着一种挣不断的无言的紧张关系，即使相隔千里也从未消失。","Of course she had had good times with him, in the past, before—ah!Before a thousand things, all amounting really to nothing.But she enjoyed him no more.She never even enjoyed being with him.There was a silent, ceaseless tension between them, that never broke, even when they were a thousand miles apart."
"真可怕！那就是所谓的婚姻！能拿它怎么办呢？可笑，明明知道一切的问题所在，就是不知道拿它如何是好！","Awful!That’s what you call being married!What’s to be done about it?Ridiculous, to know it all and not do anything about it!"
"她又回来了，回到了自己的家里，却感觉自己像个上宾，即使在他面前也是如此。秘书一家人对他算是尽心尽力。","She came back once more, and there she was, in her own house, a sort of super-guest, even to him.And the secretarial family devoting their lives to him."
"把命都献给他了！事实也是如此！三个女人夜以继日地把自己的整个生命都奉献给了他。而她们得到了什么回报呢？连一个吻都没有！工资很低，因为她们知道他还欠着债，所以她们把帮他还债看成了自己终身的事业！别无所求！一天工作十二个小时！相对的与世隔绝，因为他不见任何人。","Devoting their lives to him!But actually!Three women pouring out their lives for him day and night!And what did they get in return?Not one kiss!Very little money, because they knew all about his debts, and had made it their life business to get them paid off!No expectations!Twelve hours’ work a day!Comparative isolation, for he saw nobody!"
"而除此之外呢？什么都没有！也许会有地位提高、受到重视的感觉吧，因为她们有时会在报纸上看到他的名字和照片。但是谁会相信这就够了呢？","And beyond that?Nothing!Perhaps a sense of uplift and importance because they saw his name and photograph in the newspaper sometimes.But would anybody believe that it was good enough?"
"然而她们却喜欢这种感觉。她们看上去十分满足，就像背负使命的人一样。太不可思议了！","Yet they adored it!They seemed to get a deep satisfaction out of it, like people with a mission.Extraordinary!"
"好吧！如果她们愿意，就随她们去吧。当然，她们只是平庸之辈，对她们来说，这其中可能大有魅力。","Well, if they did, let them.They were, of course, rather common, ‘of the people’; there might be a sort of glamour in it for them."
"但这对他来说却不是好事。毋庸置疑。他的作品越来越冗长，质量也每况愈下——这也难怪！难怪他的整体格调都在下降——愈来愈平庸。这对他当然是不利的。","But it was bad for him.No doubt about it.His work was getting diffuse and poor in quality—and what wonder!His whole tone was going down—becoming commoner.Of course it was bad for him."
"作为妻子，她觉得她应该做点什么来挽救他。但她又能如何做呢？对那忠心耿耿、了不起的秘书一家，她又怎么能够去非难他们呢？然而她很想将她们扫地出门。她们确实对他不利：正在葬送他的工作，葬送他作家的名声，葬送他的生活。正在用她们奴隶般的伺候毁灭他。","Being his wife, she felt she ought to do something to save him.But how could she?That perfectly devoted, marvellous secretarial family, how could she make an attack on them?Yet she’d love to sweep them into oblivion.Of course they were bad for him: ruining his work, ruining his reputation as a writer, ruining his life.Ruining him with their slavish service."
"她当然要对她们展开一轮攻击！但她要怎样做呢？如此忠心！而她自己又能做些什么去代替她们呢？她当然不会对他奴隶般地忠心耿耿，也不会去记录他滔滔不绝的口述！绝对不会！","Of course she ought to make an onslaught on them!But how could she?Such devotion!And what had she herself to offer in their place?Certainly not slavish devotion to him, nor to his flow of words!Certainly not!"
"一想到把女秘书及其家人从他身边赶走后他的处境，她就不禁浑身打颤。这就像把光着身子的婴儿丢到垃圾桶一般。不能这么做！","She imagined him stripped once more naked of secretary and secretarial family, and she shuddered.It was like throwing the naked baby in the dust-bin.Couldn’t do that!"
"但总得做些什么。她知道了。她几乎想再欠上一千英镑的负债，然后把账单递送给他，或是像平常一样，差人送给他。","Yet something must be done.She felt it.She was almost tempted to get into debt for another thousand pounds, and send in the bill, or have it sent in to him, as usual."
"不行！要来点更狠的！","But no!Something more drastic!"
"来点狠的，还是来点温和的。她在两者之间摇摆不定。她就这样摇摆不定着，先是什么也没做，打不定主意，之后又茫然地拖了一天又一天，等着养足精神准备再次离开。","Something more drastic, or perhaps more gentle.She wavered between the two.And wavering, she first did nothing, came to no decision, dragged vacantly on from day to day, waiting for sufficient energy to take her departure once more."
"现在是春天！在春天回来，她真是个蠢才。她已经四十岁了！活到了四十岁的蠢女人！","It was spring!What a fool she had been to come up in spring!And she was forty!What an idiot of a woman to go and be forty!"
"一个温暖的下午，鸟儿在树阴里大声叽啾，天空低沉而温暖，她走在花园里，无事可干。花园里到处都是花儿，他爱花，因为它们妖娆多姿。丁香和荚蒾属植物，金链花和红色山楂花，郁金香和银莲花，还有多彩的雏菊。好多花啊！整片的勿忘我！矢车菊！多荒诞的花名啊！她本会叫它们蓝点，黄斑和白褶边的。压根儿不会那么多愁善感！","She went down the garden in the warm afternoon, when birds were whistling loudly from the cover, the sky being low and warm, and she had nothing to do.The garden was full of flowers: he loved them for their theatrical display.Lilac and snowball bushes, and laburnum and red may, tulips and anemones and coloured daisies.Lots of flowers!Borders of forget-me-nots!Bachelor’s buttons!What absurd names flowers had!She would have called them blue dots and yellow blobs and white frills.Not so much sentiment after all!"
"欣欣向荣的绿叶，合唱队姑娘般密集的花朵，这纯粹是春天艳丽做作的无用之物，除非你内心有什么能与之呼应。而她没有。","There is a certain nonsense, something showy and stagey about spring, with its pushing leaves and chorus-girl flowers, unless you have something corresponding inside you.Which she hadn’t."
"噢，上帝啊！她听到篱笆那边传来一个声音，沉稳而充满戏剧效果的声音。噢，上帝！他正在花园里对着秘书口述。天啊！没有地方可以躲开吗？","Oh, heaven!Beyond the hedge she heard a voice, a steady rather theatrical voice.Oh, heaven!He was dictating to his secretary in the garden.Good God, was there nowhere to get away from it!"
"她环顾四周，的确有很多地方可供逃跑。但逃跑的好处是什么呢？他会一直继续。她一边静静地走向篱笆，一边听着。","She looked around: there was indeed plenty of escape.But what was the good of escaping?He would go on and on.She went quietly towards the hedge, and listened."
"他正在口述一篇关于现代小说的杂志文章。“现代小说缺的是结构。”天啊！结构！他不妨这样说：现代小说缺的是鲸须，或是茶匙或是一颗掉落的牙齿。","He was dictating a magazine article about the modern novel.“What the modern novel lacks is architecture.”Good God!Architecture!He might just as well say: What the modern novel lacks is whalebone, or a teaspoon, or a tooth stopped."
"可是秘书仍然记下了，记下，记下！不，不能再这样继续了！任何一个有血有肉的人都不能忍受。","Yet the secretary took it down, took it down, took it down!No, this could not go on!It was more than flesh and blood could bear."
"她静静地沿着篱笆走着，像狼一样地潜行——一个肩宽体壮的女人穿着昂贵的芥末色丝质毛衫和奶油色的百褶裙。她的腿长而匀称，鞋也很贵。","She went quietly along the hedge, somewhat wolf-like in her prowl, a broad, strong woman in an expensive mustard-coloured silk jersey and cream-coloured pleated skirt.Her legs were long and shapely, and her shoes were expensive."
"她像一只好奇的狼，悄悄转过篱笆，朝那个被树阴遮挡的小草坪望去，那儿雏菊正在疯长。“他”斜斜地倚在彩色吊床上，穿着白色的哔叽裤和漂亮的黄色亚麻衬衣，头顶是开着粉红花朵的七叶树。他的手优雅地垂在吊床的一侧，和着他说的话打着模糊的拍子。藤桌边的那个小秘书，穿着绿色针织连衣裙，黑色的头一直埋在笔记本上，勤奋地写着那可怕的速记符号。他的话不难记录，因为他说得很慢，还保持着某种节奏，用他垂着的手打着拍子。","With a curious wolf-like stealth she turned the hedge and looked across at the small, shaded lawn where the daisies grew impertinently.‘He’ was reclining in a coloured hammock under the pink-flowering horse-chestnut tree, dressed in white serge with a fine yellow-coloured linen shirt.His elegant hand dropped over the side of the hammock and beat a sort of vague rhythm to his words.At a little wicker table the little secretary, in a green knitted frock, bent her dark head over her note-book, and diligently made those awful shorthand marks.He was not difficult to take down, as he dictated slowly, and kept a sort of rhythm, beating time with his dangling hand."
"“每部小说都必须有一个能引起我们共鸣的突出角色——我们始终与他感同身受——即使我们意识到了这一点——甚至当我们明显意识到人性的弱点的时候。”","“In every novel there must be one outstanding character with which we always sympathise—with whom we always sympathise—even though we recognise it—even when we are most aware of the human frailties—”"
"每个男人都是自己的英雄，妻子冷冷地想，却忘了每个女人更是自己的女英雄。","Every man his own hero, thought the wife grimly, forgetting that every woman is intensely her own heroine."
"但是一只蓝色的鸟把妻子吓了一跳，它在全神贯注忙着速记的小秘书脚边冲来撞去。它至少是只蓝山雀，带点灰和黄的蓝。但对妻子来说它似乎就是蓝色，在这水灵灵的春日，在这透明的下午。蓝鸟在小秘书那漂亮却很普通的小脚周围扑腾着翅膀。","But what did startle her was a blue bird dashing about near the feet of the absorbed, shorthand-scribbling little secretary.At least it was a blue-tit, blue with grey and some yellow.But to the wife it seemed blue, that juicy spring day, in the translucent afternoon.The blue bird, fluttering round the pretty but rather common little feet of the little secretary."
"蓝鸟啊！幸福的蓝鸟！哎呦，上帝保佑，——妻子想。哎呦，上帝保佑！","The blue bird!The blue bird of happiness!Well, I’m blest,—thought the wife.Well, I’m blest!"
"她正叫老天时，另一只蓝鸟出现了——那是另外一只蓝山雀——开始与第一只角力。一对代表幸福的蓝鸟，为幸福打了起来。哎呦，上帝保佑！","And as she was being blest, appeared another blue bird—that is, another blue-tit—and began to wrestle with the first blue-tit.A couple of blue birds of happiness, having a fight over it!Well, I’m blest!"
"两个专心致志的人几乎都没有看到她。但“他”却被打架的蓝鸟扰到了，它们的小羽毛四处飘散。","She was more or less out of sight of the human preoccupied pair.But ‘he’ was disturbed by the fighting blue birds, whose little feathers began to float loose."
"“走开！”他温柔地对它们说，拿着一块深黄色的手帕挥向它们，“到别处去打你们的小架，解决你们的私事，我亲爱的小绅士们。”","“Get out!” he said to them mildly, waving a dark-yellow handkerchief at them.“Fight your little fight, and settle your private affairs elsewhere, my dear little gentlemen.”"
"小秘书快速地抬头看了一眼，因为她已经开始记下这句话了。他给了她一个扭曲又古怪的笑容。","The little secretary looked up quickly, for she had already begun to write it down.He smiled at her his twisted whimsical smile."
"“不！那个别记！”他温柔地说，“你看到那两只山雀在打架吗？”","“No, don’t take that down,” he said affectionately.“Did you see those two tits laying into one another?”"
"“没！”小秘书说道，欢快地左顾右盼，眼睛由于工作太久而有点暗淡。","“No!” said the little secretary, gazing brightly round, her eyes half-blinded with work."
"然而，当她看到身后的妻子那奇怪、强大、优雅、有如狼一般的身影时，她的眼里马上充满了恐惧。","But she saw the queer, powerful, elegant, wolf-like figure of the wife, behind her, and terror came into her eyes."
"“我看到了！”妻子说，用短裙下那双好奇、匀称、母狼般的腿慢慢走上前来。","“I did!” said the wife, stepping forward with those curious, shapely, she-wolf legs of hers, under the very short skirt."
"“难道它们不是邪恶的小野兽吗？”他说。","“Aren’t they extraordinarily vicious little beasts?” said he."
"“非常邪恶！”她附和道，俯身捡起一根小小的胸部羽毛，“非常邪恶！看看这些羽毛飞得！”","“Extraordinarily!” she re-echoed, stooping and picking up a little breast-feather.“Extraordinarily!See how the feathers fly!”"
"她把羽毛放在指尖上，看着它。接着看看女秘书，然后又看了看他。她的眉间有种奇怪的的表情，就像狼人一般。","And she got the feather on the tip of her finger, and looked at it.Then she looked at the secretary, then she looked at him.She had a queer, were-wolf expression between her brows."
"“我想，”他开口道，“这些应该是最令人愉快的下午了，没有阳光的直射，而所有的声音、颜色和气味都有几分融入到，你也知道，空气里，所有的事物都浸泡着，浸泡在这春日之中。就像在内部，你知道我的意思，像在蛋里面，马上就要破壳而出。”","“I think,” he began, “these are the loveliest afternoons, when there’s no direct sun, but all the sounds and the colours and the scents are sort of dissolved, don’t you know, in the air, and the whole thing is steeped, steeped in spring.It’s like being on the inside; you know how I mean, like being inside the egg and just ready to chip the shell.”"
"“就是那样！”她赞同道，却不确信。","“Quite like that!” she assented, without conviction."
"片刻的停顿。秘书没说话。他们在等着妻子再次离开。","There was a little pause.The secretary said nothing.They were waiting for the wife to depart again."
"“我想，”后者说，“你和平常一样忙吧？”","“I suppose,” said the latter, “you’re awfully busy, as usual?”"
"“和平时差不多。”他说着，不乐意地撅起嘴来。","“Just about the same,” he said, pursing his mouth deprecatingly."
"又是茫然的停顿，他在等她再次离开。","Again the blank pause, in which he waited for her to go away again."
"“我知道我打扰你了。”她说。","“I know I’m interrupting you,” she said."
"“事实上，”他说，“我刚刚只是在看那两只蓝山雀。”","“As a matter of fact,” he said, “I was just watching those two blue-tits.”"
"“一对小魔鬼！”妻子说着，吹走了指尖的黄羽毛。","“Pair of little demons!” said the wife, blowing away the yellow feather from her finger-tip."
"“当然。”他说。","“Absolutely!” he said."
"“好吧，我最好还是走吧，让你继续你的工作。”她说。","“Well, I’d better go, and let you get on with your work,” she said."
"“不急！”他说，神情宽容而冷漠，“事实上，我觉得在户外也做不成什么事。”","“No hurry!” he said, with benevolent nonchalance.“As a matter of fact, I don’t think it’s a great success, working out of doors.”"
"“那你为何还要尝试呢？”妻子说，“你知道你从来无法在户外工作的！”","“What made you try it?” said the wife.“You know you never could do it.”"
"“威克斯奥小姐建议改变一下。但我觉得这没有什么帮助，你认为呢，威克斯奥小姐？”","“Miss Wrexall suggested it might make a change.But I don’t think it altogether helps, do you, Miss Wrexall?”"
"“对不起。”小秘书说。","“I’m sorry,” said the little secretary."
"“为什么要对不起？”妻子说，带着几分仁慈低头看着她，就像一头狼低头看着一只黑棕相间的杂种狗，“我相信你是为他好才这么建议的！”","“Why should you be sorry?” said the wife, looking down at her as a wolf might look down half-benignly at a little black-and-tan mongrel.“You only suggested it for his good, I’m sure!”"
"“我想多呼吸些空气对他可能有好处。”秘书承认道。","“I thought the air might be good for him,” the secretary admitted."
"“为什么像你们这样的人从来不为自己着想？”妻子问。","“Why do people like you never think about yourselves?” the wife asked."
"女秘书看着她的眼睛。","The secretary looked her in the eye."
"“我想我们有为自己着想，只是以一种不同的方式而已。”她说。","“I suppose we do, in a different way,” she said."
"“真是一种非比寻常的方式！”妻子讽刺地说。“为什么不让他想想你呢？”她又加上一句，慢吞吞故意拉长调子地说着，“在这样一个宜人的春日下午，你应该让他向你口述一些诗歌，关于幸福的蓝鸟在你秀美的小脚边飞来飞去的诗。如果我是他的秘书，我知道我会这么做。”","“A very different way!” said the wife ironically.“Why don’t you make him think about you?” she added, slowly, with a sort of drawl.“On a soft spring afternoon like this, you ought to have him dictating poems to you, about the blue birds of happiness fluttering round your dainty little feet.I know I would, if I were his secretary.”"
"一阵死一般的沉寂。妻子一动不动地站着，雕像似的，以她特有的姿态，用背斜对着小秘书。她用背斜对着一切。","There was a dead pause.The wife stood immobile and statuesque, in an attitude characteristic of her, half turning back to the little secretary, half averted.She half turned her back on everything."
"女秘书看着他。","The secretary looked at him."
"“事实上，”他说，“我正在写一篇题为《小说未来》的文章。”","“As a matter of fact,” he said, “I was doing an article on the Future of the Novel.”"
"“我知道。”妻子说，“那太可怕了！为何不写点小说家生活中的趣事呢？”","“I know that,” said the wife.“That’s what’s so awful!Why not something lively in the life of the novelist?”"
"又是一阵持续的沉默，他看起来受到了伤害，有些冷淡，像尊雕像。小秘书耷拉着头。妻子慢慢地走开了。","There was a prolonged silence, in which he looked pained, and somewhat remote, statuesque.The little secretary hung her head.The wife sauntered slowly away."
"“我们刚说到哪儿了，威克斯奥小姐？”他的声音又响了起来。","“Just where were we, Miss Wrexall?” came the sound of his voice."
"小秘书吓了一跳。她感到极度愤怒。他们美好的关系，他和她的，竟被如此侮辱！","The little secretary started.She was feeling profoundly indignant.Their beautiful relationship, his and hers, to be so insulted!"
"但是她很快就转回到连绵不断的口述听写中来了，除了忙碌的喜悦，再没有时间产生任何其他的情绪。","But soon she was veering down-stream on the flow of his words, too busy to have any feelings, except one of elation at being so busy."
"喝茶的时间到了，妹妹端着茶盘走进花园。很快，妻子出现了。她换了衣服，穿了件菊苣蓝的上等布料做的裙子。小秘书收好了她的纸正要离开，她的鞋跟很高。","Tea-time came; the sister brought out the tea-tray into the garden.And immediately, the wife appeared.She had changed, and was wearing a chicory-blue dress of fine cloth.The little secretary had gathered up her papers and was departing, on rather high heels."
"“别走，威克斯奥小姐。”妻子说。","“Don’t go, Miss Wrexall,” said the wife."
"小秘书突然停住了，然后犹豫不决。","The little secretary stopped short, then hesitated."
"“妈妈会等我的。”她说。","“Mother will be expecting me,” she said."
"“告诉她你不去了。叫你妹妹再拿个杯子来。我想你和我们一起喝茶。”","“Tell her you’re not coming.And ask your sister to bring another cup.I want you to have tea with us.”"
"威克斯奥小姐看看那个男人，他正一手撑着吊床，看起来像哈姆雷特一样神秘莫测。","Miss Wrexall looked at the man, who was reared on one elbow in the hammock, and was looking enigmatical, Hamletish."
"他迅速地瞟了她一眼，接着孩子气般不在乎地撅起嘴。","He glanced at her quickly, then pursed his mouth in a boyish negligence."
"“对，就留下和我们一起喝回茶吧，”他说，“我看见草莓了，我知道你喜欢草莓。”","“Yes, stay and have tea with us for once,” he said.“I see strawberries, and I know you’re the bird for them.”"
"她瞟了他一眼，苍白地笑了一下，便匆匆离去去通知她的母亲。她甚至费时换了条丝裙。","She glanced at him, smiled wanly, and hurried away to tell her mother.She even stayed long enough to slip on a silk dress."
"“哇，你多漂亮啊！”妻子说，当小秘书穿着一条菊苣蓝的丝裙再次出现在草坪上时。","“Why, how smart you are!” said the wife, when the little secretary reappeared on the lawn, in chicory-blue silk."
"“噢，别看我的裙子，和您的没法比！”威克斯奥小姐说。他们是同样的颜色，千真万确！","“Oh, don’t look at my dress, compared to yours!” said Miss Wrexall.They were of the same colour, indeed!"
"“至少你是自己赚来的，比我好多了。”妻子边倒茶边说，“你喜欢浓茶吗？”","“At least you earned yours, which is more than I did mine,” said the wife, as she poured tea.“You like it strong?”"
"她用阴郁的眼神看着那这个矮小的年轻女人——她像个小鸟一样被蓝色包裹着，由于工作而过度操劳——妻子的眼神似乎在诉说着许多费解和隐晦的话语。","She looked with her heavy eyes at the smallish, birdy, blue-clad, overworked young woman, and her eyes seemed to speak many inexplicable dark volumes."
"“哦，随便，谢谢。”威克斯奥小姐说道，紧张地向前倾了倾身。","“Oh, as it comes, thank you,” said Miss Wrexall, leaning nervously forward."
"“茶太浓了，会破坏你的消化系统的。”妻子说。","“It’s coming pretty black, if you want to ruin your digestion,” said the wife."
"“哦，那么，我加些水进去吧。”","“Oh, I’ll have some water in it, then.”"
"“那就好多了，我想！”","“Better, I should say.”"
"“工作进行得如何？——还好吧？”妻子问，他们喝着茶，两个女人看着彼此的蓝裙子。","“How’d the work go—all right?” asked the wife, as they drank tea, and the two women looked at each other’s blue dresses."
