"zh","en"
"在外面，男人坐在地上，使劲地挣脱绳子。可是，即便这样，想把自己松开并不容易。所以，绑着手的男人努力站了起来，走到旧墙脚，抵着粗糙的墙边磨起绳子。这绳子是草拧成的，不一会儿就磨散了，他自由了。他身上好几处瘀伤。他的胳臂伤到了，由于捆绑而变得淤青。他慢慢地揉着伤处。接着，他把衣服拉直，弯下腰，戴上帽子，挣扎着穿上外套，走开了。","The man seated on the ground outside worked and strained at the rope.But it was not so easy to undo himself even now.So, with hands bound, making an effort, he got on his feet, and went and worked the cord against the rough edge of an old wall.The rope, being of a kind of plaited grass, soon frayed and broke, and he freed himself.He had various contusions.His arms were hurt and bruised from the bonds.He rubbed them slowly.Then he pulled his clothes straight, stooped, put on his cap, struggled into his overcoat, and walked away."
"星光格外明亮。悬崖下的灯塔射出水晶般清澈的光束，有节奏地划过黑夜。男人沿着这条路，茫然地往前走，经过教堂的院落。接着，他停下来，靠在墙上，站了好一阵。","The stars were very brilliant.Clear as crystal, the beam from the lighthouse under the cliffs struck rhythmically on the night.Dazed, the man walked along the road past the churchyard.Then he stood leaning up against a wall, for a long time."
"他清醒过来了，因为脚太冷了。因此，他振作起来，在静谧的黑夜中，又朝小酒馆方向走去。","He was roused because his feet were so cold.So he pulled himself together, and turned again in the silent night, back towards the inn."
"酒馆一片漆黑。但厨房里还亮着灯。他迟疑了一下。接着，他轻轻地试着推了一下门。","The bar was in darkness.But there was a light in the kitchen.He hesitated.Then very quietly he tried the door."
"他很吃惊，发现门是开着的。他走进去，轻轻地把身后的门带上。接着，他绕过吧台，顺着楼梯往下，走到了亮灯的厨房门口。他老婆坐在那儿，呆呆地在火炉前面，荆豆秸秆在灶膛里烧得很旺。她坐在正对着炉灶前的椅子上，岔开两腿，脚抵在围栏上。他进来时，她抬头看了他一眼，但什么也没有说。接着，她又盯着火。","He was surprised to find it open.He entered, and quietly closed it behind him.Then he went down the step past the bar-counter, and through to the lighted doorway of the kitchen.There sat his wife, planted in front of the range, where a furze fire was burning.She sat in a chair full in front of the range, her knees wide apart on the fender.She looked over her shoulder at him as he entered, but she did not speak.Then she stared in the fire again."
"这是一间狭小的厨房。他把帽子放在桌上，上面铺着黄色的美国式的桌布，他背对着墙在火炉边坐下。他的妻子仍然岔开膝盖，两脚放在钢质的围栏上坐着，盯着火，一动不动。火光下，她的皮肤光滑而红润。屋里的每件东西都干净而明亮。男人也默默地坐着，低着头。他们就这样一直坐着。","It was a small, narrow kitchen.He dropped his cap on the table that was covered with yellowish American cloth, and took a seat with his back to the wall, near the oven.His wife still sat with her knees apart, her feet on the steel fender and stared into the fire, motionless.Her skin was smooth and rosy in the firelight.Everything in the house was very clean and bright.The man sat silent, too, his head dropped.And thus they remained."
"谁先开口就成了一个问题。女人俯身向前，在火炉的围栏之间拨弄着荆豆秸秆的一头。他抬起头看看她。","It was a question who would speak first.The woman leaned forward and poked the ends of the sticks in between the bars of the range.He lifted his head and looked at her."
"“其他人都去睡觉了，对吧？”他问。","‘Others gone to bed, have they?’ he asked."
"可她还是保持沉默。","But she remained closed in silence."
"“晚上外面真冷啊。”他好像自言自语地说。","‘’S a cold night, out,’ he said, as if to himself."
"然后，他把宽大但却好看的工人的手掌放在火炉上方，那炉子打磨成黑色，像天鹅绒一样光滑。她虽然没有朝他看，但却从眼角瞥见了他。","And he laid his large, yet well-shapen workman’s hand on the top of the stove, that was polished black and smooth as velvet.She would not look at him, yet she glanced out of the corners of her eyes."
"他两眼闪亮，直勾勾地盯着她，瞳孔放大，像猫的眼睛一样，摄人心魄。","His eyes were fixed brightly on her, the pupils large and electric like those of a cat."
"“我能在茫茫人海中认出你来。”他说，“尽管你比我想的要胖点儿。你可是丰满了许多。”","‘I should have picked you out among thousands,’ he said.‘Though you’re bigger than I’d have believed.Fine flesh you’ve made.’"
"她沉默了一阵。然后，她坐着，身体转向他。","She was silent for some time.Then she turned in her chair upon him."
"“你以为你是谁？”她说，“十五年后，像这样回来找我？你想过没有，我从没听到过你的消息，无论是在比尤特城，还是其他地方？”","‘What do you think of yourself,’ she said, ‘coming back on me like this after over fifteen years?You don’t think I’ve not heard of you, neither, in Butte City and elsewhere?’"
"他看着她，眼睛清澈、半透明，毫不躲闪。","He was watching her with his clear, translucent, unchallenged eyes."
"“不是的。”他说，“伙计们来来往往——我不时地听到你的消息。”","‘Yes,’ he said.‘Chaps comes an’ goes—I’ve heard tell of you from time to time.’"
"她挺直腰板。","She drew herself up."
"“那你都听到了关于我的什么谎话？”她迫切地追问。","‘And what lies have you heard about me?’ she demanded superbly."
"“我没有听到任何谎言——除了说你过得很好之类的话。”","‘I dunno as I’ve heard any lies at all—’cept as you was getting on very well, like.’"
"他的语气显得谨慎而冷漠。她的火气又一次猛地上来了。但她压着火，因为他身上的危险性，也许，更是因为他好看的头型和像画出来的整齐的眉毛，她不忍舍弃它们。","His voice ran warily and detached.Her anger stirred again in her violently.But she subdued it, because of the danger there was in him, and more, perhaps, because of the beauty of his head and his level drawn brows, which she could not bear to forfeit."
"“关于你，我说也说不完。”她说，“我听到的关于你的事都是凶多吉少。”","‘That’s more than I can say of you,’ she said.‘I’ve heard more harm than good about you.’"
"“啊，是吗！”他盯着炉火回答。他看着荆豆秸秆燃烧已经好一会儿了，才自言自语说道。两人又是一阵沉默，在这阵沉默中，她看着他的脸。","‘Ay, I dessay,’ he said, looking in the fire.It was a long time since he had seen the furze burning, he said to himself.There was a silence, during which she watched his face."
"“你还敢说自己是个男人吗？”她说，与其说是生气，不如说是轻蔑地指责。“你什么都不顾地离我而去——现在你又这样出现，一句为自己解释的话都没有。”","‘Do you call yourself a man?’ she said, more in contemptuous reproach than in anger.‘Leave a woman as you’ve left me, you don’t care to what!—and then to turn up in this fashion, without a word to say for yourself.’"
"他在椅子上动来动去，两腿分开，胳臂放在膝盖上，目不转睛地盯着火苗，一句话也没有回答。他的头和他浓密的黑头发离她是如此地近，她几乎忍不住想要移开，仿佛它们会咬她一样。","He stirred in his chair, planted his feet apart, and resting his arms on his knees, looked steadily into the fire, without answering.So near to her was his head, and the close black hair, she could scarcely refrain from starting away, as if it would bite her."
"“这能称得上是男人的行为吗？”她又一次追问。","‘Do you call that the action of a man?’ she repeated."
"“不能。”他说着，伸手去拿这些小的荆豆秸秆，把它们拨弄到火里。“据我所知，这什么也称不上。在我看来，无论怎么样，以任何的名义来称呼这种行为都会认为这是不正当的。”","‘No,’ he said, reaching and poking the bits of wood into the fire with his fingers.‘I didn’t call it anything, as I know of.It’s no good calling things by any names whatsoever, as I know of.’"
"她观察着他的举止。话语间的停顿一次比一次长，尽管两人都没有意识到这一点。","She watched him in his actions.There was a longer and longer pause between each speech, though neither knew it."
"“我很想知道，你是怎么看待你自己的！”她恼怒地强调，高声地喊着，“我想知道你把自己当成什么人！”她茫然失措，非常生气。","‘I wonder what you think of yourself!’ she exclaimed, with vexed emphasis.‘I wonder what sort of a fellow you take yourself to be!’She was really perplexed as well as angry."
"“哎，”他说，抬起头看着她，“我想，要是人人都得为自己的行为负责，那么我也要为我的错误负责。”","‘Well,’ he said, lifting his head to look at her, ‘I guess I’ll answer for my own faults, if everybody else’ll answer for theirs.’"
"当他仰起脸看着她的时候，她的心怦怦地激烈地跳动着。她呼吸急促，别过脸去，几乎失去了自控力。","Her heart beat fiery hot as he lifted his face to her.She breathed heavily, averting her face, almost losing her self-control."
"“那你把我当什么？”她无助地大声喊道。","‘And what do you take me to be?’ she cried, in real helplessness."
"他仰起脸看着她温柔的扭到一边的脸，看着她轻轻起伏的丰满的胸部。","His face was lifted watching her, watching her soft, averted face, and the softly heaving mass of her breasts."
"“我把你当作，”他像对她行使权力似的简洁而坦率地说道，“这么好的可人儿——我竟看不出你是这样一个漂亮的女人。我竟然没有料到你有这么一副好身段：真的，我真没有想到。”","‘I take you,’ he said, with that laconic truthfulness which exercised such power over her, ‘to be the deuce of a fine woman—darn me if you’re not as fine a built woman as I’ve seen, handsome with it as well.I shouldn’t have expected you to put on such handsome flesh: ’struth I shouldn’t.’"
"当他那双宝石般明亮的眼睛紧紧地盯着她的时候，她的心怦怦猛跳。","Her heart beat fiery hot, as he watched her with those bright agate eyes, fixedly."
"“而你十五年都那么英俊，我的老天啊！”她回答道。","‘Been very handsome to you, for fifteen years, my sakes!’ she replied."
"他对此没有回答，只是坐在那里，用明亮而充满活力的眼睛看着她。","He made no answer to this, but sat with his bright, quick eyes upon her."
"接着他站起来。她不由自主地吃了一惊。可他却只是简短地、谨慎地说：","Then he rose.She started involuntarily.But he only said, in his laconic, measured way:"
"“现在这儿真是暖和啊。”","‘It’s warm in here now.’"
"然后他脱掉外衣，把它扔在桌子上。他这样做的时候，她坐在那儿，好像有点吓着了。","And he pulled off his overcoat, throwing it on the table.She sat as if slightly cowed, whilst he did so."
"“这绳子把我的胳臂弄得——哦，天啊——”他拉长语调，用手揉着胳臂。","‘Them ropes has given my arms something, by Ga-ard,’ he drawled, feeling his arms with his hands."
"她仍然坐在他面前的椅子上，有点胆怯。","Still she sat in her chair before him, slightly cowed."
"“你真是厉害，是吧，像那样抓住我，呃？”他温柔地笑起来，“老天，你把我修理得恰到好处，恰到好处。我真该死，你修理得好——很好，你做得很好。”","‘You was sharp, wasn’t you, to catch me like that, eh?’ he smiled slowly.‘By Ga-ard, you had me fixed proper, proper you had.Darn me, you fixed me up proper—proper, you did.’"
"他坐在椅子上，身体俯向她。","He leaned forwards in his chair towards her."
"“我觉得这样对你没有什么不好，没什么不好，要是我那样想，我就真的该死了。我欣赏女人身上的这种胆识。是的，我欣赏。”","‘I don’t think no worse of you for it, no, darned if I do.Fine pluck in a woman’s what I admire.That I do, indeed.’"
"她只是凝视着炉火。","She only gazed into the fire."
"“我们一开始很快乐，是吧。而且，我敢保证，从你看见我的那一刻开始，你和我有一样的感觉。该死，你对我太厉害了。这个该死的好婆娘，干了一场漂亮的架。妈的，在美国任何地方，都找不到一个女人能像那样把我放倒的，只有你了。说真的，你真是一个好女人，尤其是这个时候。”","‘We fet from the start, we did.And, my word, you begin again quick the minute you see me, you did.Darn me, you was too sharp for me.A darn fine woman, puts up a darn good fight.Darn me if I could find a woman in all the darn States as could get me down like that.Wonderful fine woman you be, truth to say, at this minute.’"
"她仍然坐在那儿怒视着炉火。","She only sat glowering into the fire."
"“任何有胆识的男人，都希望找到一个好女人，像我一样。”他说着，伸出手，试探性地、悄悄地触摸她丰满而温暖的胸部。","‘As grand a pluck as a man could wish to find in a woman, true as I’m here,’ he said, reaching forward his hand and tentatively touching her between her full, warm breasts, quietly."
"她吃了一惊，似乎颤抖了一下。可在她继续盯着火的时候，他的手慢慢地伸到了她的乳房之间。","She started, and seemed to shudder.But his hand insinuated itself between her breasts, as she continued to gaze in the fire."
"“难不成你以为我回到这儿是为了讨生活。”他说，“在我名下有一千多英镑，我有钱。对了，打这场架真让我高兴，真的。但是这样并不意味着你就能否认你是我老婆啊……”","‘And don’t you think I’ve come back here a-begging,’ he said.‘I’ve more than one thousand pounds to my name, I have.And a bit of a fight for a how-de-do pleases me, that it do.But that doesn’t mean as you’re going to deny as you’re my Missis....’"
