"zh","en"
"他说得好像一切都是公认的事实那样。他的脸很帅气，带着一种奇怪的警觉，而且他对自己的信念非常坚定，这使她发狂。","He spoke as if it were an accepted fact.His face was handsome, with a strange, watchful alertness and a fundamental fixity of intention that maddened her."
"“你这恶棍！”她叫喊道，“你这恶棍，敢到这屋里来这样对我说话。你这恶棍，你简直就是无赖！”","‘You villain!’ she cried.‘You villain, to come to this house and dare to speak to me.You villain, you down-right rascal!’"
"他看着她。","He looked at her."
"“嘿。”他无动于衷地说，“够了吧。”在她面前，他有点不自在。只是，他不怕她。在他身上有些让人看不穿的东西，就像他的眼睛一样，像玛瑙一样耀眼。","‘Ay,’ he said, unmoved.‘All that.’He was uneasy before her.Only he was not afraid of her.There was something impenetrable about him, like his eyes, which were as bright as agate."
"她气得跳起来，充满威胁地走近他。","She towered, and drew near to him menacingly."
"“你快出去，走不走?”——她突然发疯地跺着脚，“马上离开！”","‘You’re going out of this house, aren’t you?’—She stamped her foot in sudden madness.‘This minute!’"
"他看着她。他知道她想揍他了。","He watched her.He knew she wanted to strike him."
"“不，”他说，压制着强调的口吻。“我已经告诉你了，我就留在这儿。”","‘No,’ he said, with suppressed emphasis.‘I’ve told you, I’m stopping here.’"
"他惧怕她的个性，但这并没使他改变。她颤抖了一下。她那黄褐色的小眼睛聚合着强烈的、隐形的怒火，就像一只愤怒的老虎。男人在畏缩，但仍站着没有动。此时她想了想。她要去找人来。","He was afraid of her personality, but it did not alter him.She wavered.Her small, tawny-brown eyes concentrated in a point of vivid, sightless fury, like a tiger’s.The man was wincing, but he stood his ground.Then she bethought herself.She would gather her forces."
"“我倒要看看你是不是要留在这儿。”她说。接着，她鼓着奇怪的令人害怕的眼睛，转身冲出了房间。这个男人听见她上楼，听见她敲了一间卧室的门，听见她说：“你们能下来一会儿吗，伙计们？我需要你们。我遇到麻烦了。”","‘We’ll see whether you’re stopping here,’ she said.And she turned, with a curious, frightening lifting of her eyes, and surged out of the room.The man, listening, heard her go upstairs, heard her tapping at a bedroom door, heard her saying: ‘Do you mind coming down a minute, boys?I want you.I’m in trouble.’"
"酒馆里的这个男人摘下他的帽子，脱下他的黑外套，把它们扔到他后面的座位上。他的黑头发很短，鬓角处有点儿灰白的头发。他穿着一件深灰色的美式翻领西装，西装剪裁精良，穿上去很合体。他看来很有钱，身体结实健康。他的肩膀看上去相当僵硬，那是因为在矿井中工作时，他的锁骨断过两次。","The man in the bar took off his cap and his black overcoat, and threw them on the seat behind him.His black hair was short and touched with grey at the temples.He wore a well-cut, well-fitting suit of dark grey, American in style, and a turn-down collar.He looked well-to-do, a fine, solid figure of a man.The rather rigid look of the shoulders came from his having had his collar-bone twice broken in the mines."
"这个像小狗崽一样、穿着脏兮兮的卡其布军服的中士偷偷地看着他。","The little terrier of a sergeant, in dirty khaki, looked at him furtively."
"“她是你老婆？”他朝女人离开的方向扭了一下头，问道。","‘She’s your Missis?’ he asked, jerking his head in the direction of the departed woman."
"“是的，她是。”男人咆哮着，“她就是，我确信。”","‘Yes, she is,’ barked the man.‘She’s that, sure enough.’"
"“很久没见她了，是吧？”","‘Not seen her for a long time, haven’t ye?’"
"“到三月份就整整十六年了。”","‘Sixteen years come March month.’"
"“唔！”","‘Hm!’"
"中士很快就又继续开始吸烟。","And the sergeant laconically resumed his smoking."
"老板娘回来了，跟着三个年轻的士兵，他们进来的时候相当羞怯，穿着裤子，衬衫和袜子，却没穿鞋。女人装腔作势地站在酒馆的一头，大声叫喊着：","The landlady was coming back, followed by the three young soldiers, who entered rather sheepishly, in trousers and shirt and stocking-feet.The woman stood histrionically at the end of the bar, and exclaimed:"
"“这男人拒绝离开这间屋子，他声称要在这儿过夜。你们都十分清楚我这儿没有空床了，对吧？而且这屋子从不给旅客提供住宿。尽管如此，他还是要死皮赖脸地留在这儿！但是只要我还有一滴血，还有最后一口气，我都不会同意的。要是你们还算是名副其实的男人，那就帮帮这个没人帮忙的女人吧。”","‘That man refuses to leave the house, claims he’s stopping the night here.You know very well I have no bed, don’t you?And this house doesn’t accommodate travellers.Yet he’s going to stop in spite of all!But not while I’ve a drop of blood in my body, that I declare with my dying breath.And not if you men are worth the name of men, and will help a woman as has no one to help her.’"
"她眼睛闪着光，脸也涨红了。她笔直地站着，像一名亚马孙女战士一般。","Her eyes sparkled, her face was flushed pink.She was drawn up like an Amazon."
"年轻的士兵们不知道应该怎么办。他们看着这个男人，又看着中士，其中一个低下头系紧了裤子背带，扣在第二颗纽扣上。","The young soldiers did not quite know what to do.They looked at the man, they looked at the sergeant, one of them looked down and fastened his braces on the second button."
"“怎么回事，中士？”其中一个士兵恶作剧地问道，脸上闪着光。","‘What say, sergeant?’ asked one whose face twinkled for a little devilment."
"“这男人说他是南克维斯太太的丈夫。”中士回答。","‘Man says he’s husband to Mrs. Nankervis,’ said the sergeant."
"“他不是我丈夫。我声明，今晚之前我从未见过他。这是个龌龊的伎俩，没别的，龌龊的伎俩。”","‘He’s no husband of mine.I declare I never set eyes on him before this night.It’s a dirty trick, nothing else, it’s a dirty trick.’"
"“什么，你这谎话精，说你之前从未见过我。”男人靠近壁炉，大声地咆哮着。“你嫁给我了，还有那个女孩儿玛丽安是你和我生的——这你相当清楚。”","‘Why, you’re a liar, saying you never set eyes on me before,’ barked the man near the hearth.‘You’re married to me, and that girl Maryann you had by me—well enough you know it.’"
"年轻的士兵们兴奋地看着，中士冷静地抽着烟。","The young soldiers looked on in delight, the sergeant smoked imperturbed."
"“是。”老板娘唱歌似的回答，极具嘲讽地慢慢晃着脑袋，“听起来不赖，是吧？但你看着吧，我们一个字也不相信，你怎么证明？”她狡猾地笑了笑。","‘Yes,’ sang the landlady, slowly shaking her head in supreme sarcasm, ‘it sounds very pretty, doesn’t it?But you see we don’t believe a word of it, and how are you going to prove it?’She smiled nastily."
"男人看着她，沉默了一会儿，然后他说：","The man watched in silence for a moment, then he said:"
"“不用证明。”","‘It wants no proof.’"
"“哦，是吗？但是需要证明。哦，需要，可这需要证明，先生，需要很多证据！”女人带着讥讽唱歌式地回应着。“我们可不是那种傻瓜，把你说的都信以为真。”","‘Oh, yes, but it does!Oh, yes, but it does, sir, it wants a lot of proving!’ sang the lady’s sarcasm.‘We’re not such gulls as all that, to swallow your words whole.’"
"可是，他站在炉火边一动不动。她把手搭在镀锌的吧台上，站在那儿，中士跷着二郎腿，坐在他们两人中间吸烟，三个年轻的士兵只穿着衬衫和背带，站在吧台后面的暗处，冷得一直打颤。屋里一片沉寂。","But he stood unmoved near the fire.She stood with one hand resting on the zinc-covered bar, the sergeant sat with legs crossed, smoking, on the seat halfway between them, the three young soldiers in their shirts and braces stood wavering in the gloom behind the bar.There was silence."
"“南克维斯太太，你知道任何关于你丈夫的下落吗？他还活着吗？”中士审慎地问道。","‘Do you know anything of the whereabouts of your husband, Mrs. Nankervis?Is he still living?’ asked the sergeant, in his judicious fashion."
"突然，老板娘开始嚎啕大哭，热泪满面，把年轻的士兵吓呆了。","Suddenly the landlady began to cry, great scalding tears, that left the young men aghast."
"“我对他一无所知。”她哽咽着，把手伸进口袋里摸手帕，“玛丽安还是个婴儿的时候，他就离我而去了，他到美国去开矿，之后大约半年的时间里从未给我写过一个字，也没有寄过一分钱。我不知道他是死是活，这个恶棍。我听说的都是关于他的坏消息——而现在我好几年都没有听到关于他的消息了。”她使劲地抽泣。","‘I know nothing of him,’ she sobbed, feeling for her pocket handkerchief.‘He left me when Maryann was a baby, went mining to America, and after about six months never wrote a line nor sent me a penny bit.I can’t say whether he’s alive or dead, the villain.All I’ve heard of him’s to the bad—and I’ve heard nothing for years an’ all, now.’She sobbed violently."
"在她痛哭的时候，那有着古铜肤色、长相帅气的男人站在火旁边看着她。他惊恐不已，苦恼而又迷惑，但没有一种情感能动摇他的内心。","The golden-skinned, handsome man near the fire watched her as she wept.He was frightened, he was troubled, he was bewildered, but none of his emotions altered him underneath."
"房间里一片寂静，只听到老板娘在嚎啕大哭。男人们全都被震慑住了。","There was no sound in the room but the violent sobbing of the landlady.The men, one and all, were overcome."
"“你不认为你今晚最好离开？”中士好言好语、通情达理地对男人说，“你最好离开一会儿，再处理你们之间的事情。我想，如果真是她说的那样，你不能对一个女人要求太多。而且，你回来看她，也太突然了。”","‘Don’t you think as you’d better go, for tonight?’ said the sergeant to the man, with sweet reasonableness.‘You’d better leave it a bit, and arrange something between you.You can’t have much claim on a woman, I should imagine, if it’s how she says.And you’ve come down on her a bit too sudden-like.’"
"老板娘哭得撕心裂肺。男人看着她丰满的胸部在抖动。它们似乎对他的大脑施了魔法。","The landlady sobbed heart-brokenly.The man watched her large breasts shaken.They seemed to cast a spell over his mind."
"“我怎么对她已经不重要了。”他答道，“我已经回来了，并且我要留在我的家里——无论如何，就一会儿也好。你明白了吧。”","‘How I’ve treated her, that’s no matter,’ he replied.‘I’ve come back, and I’m going to stop in my own home—for a bit, anyhow.There you’ve got it.’"
"“这是卑鄙行为。”中士说，脸气得通红，愤怒不已。“真是卑鄙，怎么，抛弃一个女人这么多年以后，你还想勉强她接受你吗！卑鄙行为——法律也不允许这样。”","‘A dirty action,’ said the sergeant, his face flushing dark.‘A dirty action, to come, after deserting a woman for that number of years, and want to force yourself on her!A dirty action—as isn’t allowed by the law.’"
"老板娘擦干眼泪。","The landlady wiped her eyes."
"“管你什么法律不法律。”男人用一种出奇强硬的声音吼道，“我今晚不打算离开这酒馆了。”","‘Never you mind about law nor nothing,’ cried the man, in a strange, strong voice.‘I’m not moving out of this public tonight.’"
"女人转身对着她后面的士兵，带着挖苦和哄骗的口吻说：","The woman turned to the soldiers behind her, and said in a wheedling, sarcastic tone:"
"“我们打算忍受这个吗，伙计们？——我们就这样算了，托马斯中士，一个无赖，一个横行霸道的家伙，抛弃了妻子和襁褓中的婴儿，任由她自己挣扎求生，在美国矿区过着不值一提的日子，现在回来后还想破坏一个穷女人的生活，抢夺她的财物？要是没有人站出来为我出头，那真是丢脸——丢脸到家了——！”","‘Are we going to stand it, boys?—Are we going to be done like this, Sergeant Thomas, by a scoundrel and a bully as has led a life beyond mention, in those American mining-camps, and then wants to come back and make havoc of a poor woman’s life and savings, after having left her with a baby in arms to struggle as best she might?It’s a crying shame if nobody will stand up for me—a crying shame—!’"
"士兵们和小个子中士被激怒了。女人弯着腰，在柜台下面乱翻了一阵。然后，趁着站在炉火边的男人不注意的时候，她把一根打包用的拧成一股的草绳扔在吧台后面的暗处，士兵的脚跟前。","The soldiers and the little sergeant were bristling.The woman stooped and rummaged under the counter for a minute.Then, unseen to the man away near the fire, she threw out a plaited grass rope, such as is used for binding bales, and left it lying near the feet of the young soldiers, in the gloom at the back of the bar."
"接着，她站起身，正视着眼前的局面。","Then she rose and fronted the situation."
"“走吧。”她用理智、冷漠而又略带哄骗的口吻对男人说，“把衣服穿上走吧。像个男人样，不要比德国畜牲还可恶。在圣贾斯特你很容易就能找到一张床过夜，如果你没钱，中士会借给你几先令的，我保证他会给你。”","‘Come now,’ she said to the man, in a reasonable, coldly-coaxing tone, ‘put your coat on and leave us alone.Be a man, and not worse than a brute of a German.You can get a bed easy enough in St Just, and if you’ve nothing to pay for it sergeant would lend you a couple of shillings, I’m sure he would.’"
"所有人的眼睛都注视着这个男人。他正低着头，盯着这个女人，好像着了魔或是被某个魔鬼故意施了魔咒的动物。","All eyes were fixed on the man.He was looking down at the woman like a creature spell-bound or possessed by some devil’s own intention."
"“我自己有钱。”他说，“你不要因为你的钱而害怕，眼下，我有的是钱。”","‘I’ve got money of my own,’ he said.‘Don’t you be frightened for your money, I’ve plenty of that, for the time.’"
"“那好。”女人哄骗地说道，冷漠中带着嘲讽和安抚，“把你的衣服穿上，爱上哪儿上哪儿——像个男人样，别做个德国畜牲。”","‘Well, then,’ she coaxed, in a cold, almost sneering propitiation, ‘put your coat on and go where you’re wanted—be a man, not a brute of a German.’"
"她带着挑衅和哄骗的意图，朝他走去。他低头看着她，脸上一副陶醉的神情。","She had drawn quite near to him, in her challenging coaxing intentness.He looked down at her with his bewitched face."
"“不，我不走。”他说，“我不会那样做。今晚你得留我住下。”","‘No, I shan’t,’ he said.‘I shan’t do no such thing.You’ll put me up for tonight.’"
"“我留你？！”她大声叫嚷着。突然，她抡起胳膊勒住他，全身的重量吊在他身上，朝士兵们喊道：“快拿绳子，伙计们，把他给捆上。艾尔弗雷德——约翰，快啊——”","‘Shall I!’ she cried.And suddenly she flung her arms round him, hung on to him with all her powerful weight, calling to the soldiers: ‘Get the rope, boys, and fasten him up.Alfred—John, quick now—’"
"男人站直身体，发疯似的环视四周，全身用力挣扎。可是，这女人力气也不小，而且她很重，下定决心要死死抓住他。她那欣喜而可怕的报复表情出现在他的面前；他疯狂地向后转头，想要摆脱这样的神情。与此同时，年轻的士兵们看着这可怕的“拉奥孔”左右摆动，过了一阵，他们才忙乱起来，那个心怀恶意的士兵拿着绳子飞快地冲了过去。绳子有点拧了。","The man reared, looked round with maddened eyes, and heaved his powerful body.But the woman was powerful also, and very heavy, and was clenched with the determination of death.Her face, with its exulting, horribly vindictive look, was turned up to him from his own breast; he reached back his head frantically, to get away from it.Meanwhile the young soldiers, after having watched this frightful Laocoon swaying for a moment, stirred, and the malicious one darted swiftly with the rope.It was tangled a little."
"“把那头给我。”中士喊道。","‘Give me the end here,’ cried the sergeant."
"此时，这个大个子男人喘着粗气使劲挣扎，用他的爆发力将女人甩来甩去，打翻了椅子和桌子，想获得自由。但她就像乌贼一样用力地缠着他的胳臂。他喘着气左右挣扎，他们在屋里东撞西撞，士兵们跳来跳去，家具也被撞得东倒西歪。","Meanwhile the big man heaved and struggled, swung the woman round against the seat and the table, in his convulsive effort to get free.But she pinned down his arms like a cuttlefish wreathed heavily upon him.And he heaved and swayed, and they crashed about the room, the soldiers hopping, the furniture bumping."
"年轻的士兵已经把绳子绕了一圈，中士敏捷地帮着他。女人使劲将身体一沉，他们把绳子捆了好几圈。在挣扎中，这个受害者跌倒在桌子上。他们狠狠地勒紧绳子，直到他的胳臂一动不能动。这个女人抓住他的膝盖。另一个士兵灵机一动，用一副背带把这个陌生男人的脚绑住了。椅子被撞得东倒西歪，桌子也被推到了墙边，可这男人被绑住了，他的胳臂贴在身体两边，脚也是捆着的。他半躺着靠在桌子边，安静了一会儿。","The young soldier had got the rope once round, the brisk sergeant helping him.The woman sank heavily lower, they got the rope round several times.In the struggle the victim fell over against the table.The ropes tightened till they cut his arms.The woman clung to his knees.Another soldier ran in a flash of genius, and fastened the strange man’s feet with the pair of braces.Seats had crashed over, the table was thrown against the wall, but the man was bound, his arms pinned against his sides, his feet tied.He lay half fallen, sunk against the table, still for a moment."
"女人站起来，觉得有点眩晕，又坐在了靠墙的椅子上。她的胸部剧烈地起伏着，一句话也说不出来，她以为自己快死了。这个被绑着的男人躺在被掀翻的桌子上，他的衣服在绳子缠绕下扭曲着，腰部也露了出来。士兵们站在四周，有点茫然，但却因为这场打斗而感到兴奋。","The woman rose, and sank, faint, on to the seat against the wall.Her breast heaved, she could not speak, she thought she was going to die.The bound man lay against the overturned table, his coat all twisted and pulled up beneath the ropes, leaving the loins exposed.The soldiers stood around, a little dazed, but excited with the row."
"男人又开始挣扎，本能地鼓着气，想把绳子挣断，使劲地吸气。他古铜色的脸因过于用力而涨得通红，可他还是继续吸气。他脖子上的血管暴起。但却没有用，他休息了一下。接着，他又开始了，猛地把脚挣脱了。","The man began to struggle again, heaving instinctively against the ropes, taking great, deep breaths.His face, with its golden skin, flushed dark and surcharged, he heaved again.The great veins in his neck stood out.But it was no good, he went relaxed.Then again, suddenly, he jerked his feet."
"“再拿一副背带来，威廉。”激动的士兵大声喊道。他用自己的身体压在这个绑着的男人的腿上，捆住了他的膝盖。屋里又是一片沉寂。他们能听见钟表的滴答声。","‘Another pair of braces, William,’ cried the excited soldier.He threw himself on the legs of the bound man, and managed to fasten the knees.Then again there was stillness.They could hear the clock tick."
"女人看着这个倒在地上的人，强壮笔直的四肢，被绑着的强壮的后背，那张长着大眼睛的脸，使她想起了捆在麻袋里装载在车上的牛犊子，只能安静地向后伸脑袋。终于，她胜利了。","The woman looked at the prostrate figure, the strong, straight limbs, the strong back bound in subjection, the wide-eyed face that reminded her of a calf tied in a sack in a cart, only its head stretched dumbly backwards.And she triumphed."
"被绑住的男人又开始挣扎。她入神地看着他的肌肉在活动，肩膀，臀部，粗壮干净的大腿。即便是这会儿，他还有可能挣断绳子。她有点害怕。但这个充满活力的年轻士兵坐在了这个被绑住的男人的肩膀上，经过片刻的危险，又是一片沉静。","The bound-up body began to struggle again.She watched fascinated the muscles working, the shoulders, the hips, the large, clean thighs.Even now he might break the ropes.She was afraid.But the lively young soldier sat on the shoulders of the bound man, and after a few perilous moments, there was stillness again."
"“现在，”中士谨慎地对绑着的男人说，“如果我们把你松开，你得保证马上离开并且不再来找麻烦。”","‘Now,’ said the judicious sergeant to the bound man, ‘if we untie you, will you promise to go off and make no more trouble.’"
"“你们不能在这儿把他给放了。”女人喊道，“我可不相信他，到这份儿上，我都能揍他一顿。”","‘You’ll not untie him in here,’ cried the woman.‘I wouldn’t trust him as far as I could blow him.’"
"一阵沉默。","There was silence."
"“我们可以把他抬到外面，然后松开他。”一个士兵说，“要是他再惹麻烦，我们就叫警察。”","‘We might carry him outside, and undo him there,’ said the soldier.‘Then we could get the policeman, if he made any bother.’"
"“好的。”中士说，“我们就这样办。”之后，他改变了口气，用严厉语调对这个犯人说：“如果我们在外面把你放了，你会拿着你的衣服离开，不再捣乱吗？”","‘Yes,’ said the sergeant.‘We could do that.’Then again, in an altered, almost severe tone, to the prisoner.‘If we undo you outside, will you take your coat and go without creating any more disturbance?’"
"但这犯人不回答，他只是躺着，明亮的黑眼睛睁得大大的，像一只被缚的动物。又是一阵说不清的沉默。","But the prisoner would not answer, he only lay with wide, dark, bright, eyes, like a bound animal.There was a space of perplexed silence."
"“那好吧，就照你们说的做吧。”女人恼火地说，“你们把他抬出去，然后我们关门。”","‘Well, then, do as you say,’ said the woman irritably.‘Carry him out amongst you, and let us shut up the house.’"
"他们照办了。四个士兵把绑着的男人抬起来，笨拙而蹒跚地走到小酒馆前方安静的广场上，女人拿着帽子和大衣跟在后面。年轻的士兵们快速地从犯人的腿上解开背带，跳进屋里。他们只穿着袜子，外面的星星冰冷地闪烁着。他们站在门口看着。男人躺在冷冰冰的地上一动不动。","They did so.Picking up the bound man, the four soldiers staggered clumsily into the silent square in front of the inn, the woman following with the cap and the overcoat.The young soldiers quickly unfastened the braces from the prisoner’s legs, and they hopped indoors.They were in their stocking-feet, and outside the stars flashed cold.They stood in the doorway watching.The man lay quite still on the cold ground."
"“现在，”中士压低声音说，“你进去，夫人，我把绳结松开，他自己能挣脱。”","‘Now,’ said the sergeant, in a subdued voice, ‘I’ll loosen the knot, and he can work himself free, if you go in, Missis.’"
"她最后看了一眼这个坐在地上的、衣衫不整的、被缚着的男人。然后，她就进屋了，中士迅速地跟着。接着就传来了他们关门、上门闩的声音。","She gave a last look at the dishevelled, bound man, as he sat on the ground.Then she went indoors, followed quickly by the sergeant.Then they were heard locking and barring the door."
