"zh","en"
"男爵站在门口，看着那四个穿制服的身影穿过纵横交错的椴树林的阴影。巴克曼机械麻木地走着，仿佛行尸走肉一般。中尉冷冷地远远走着，两名士兵在旁边缓慢地费力行进。他们走出院子，进入明媚的晨曦中，渐行渐远，朝军营走去。","The Baron stood in the doorway watching the four figures in uniform pass through the chequered shadow under the lime trees.Bachmann was walking neutralized, as if he were not there.The lieutenant went brittle and long, the two soldiers lumbered beside.They passed out into the sunny morning, growing smaller, going towards the barracks."
"男爵转身进入厨房。埃米莉正在切面包。","The Baron turned into the kitchen.Emilie was cutting bread."
"“这么说，他昨天在这儿过的夜？”他问道。","“So he stayed the night here?”  he said."
"女孩望着他，但几乎视而不见。她太自以为是了。男爵从她视而不见的双眼中看见了她黑暗、赤裸的灵魂。","The girl looked at him, scarcely seeing.She was too much herself.The Baron saw the dark, naked soul of her body in her unseeing eyes."
"“你们是怎么打算的？”他问。","“What were you going to do?”  he asked."
"“他计划去美国。”她答道，声音平静。","“He was going to America,” she replied, in a still voice."
"“呸！你应该立即把他送回军营。”男爵怒吼道。","“Pah! You should have sent him straight back, ” fired the Baron."
"埃米莉站在那里，对他的说辞无动于衷。","Emilie stood at his bidding, untouched."
"“他现在算是完了。”他说。","“He’s done for now,” he said."
"但他无法忍受她眼神中透出的黑暗、深沉、赤裸的灵魂，在这种痛苦折磨下都几乎没有变化。","But he could not bear the dark, deep nakedness of her eyes, that scarcely changed under this suffering."
"“简直是个蠢才。”他一边重复着，一边愤然离去，准备做些他力所能及的事。","“Nothing but a fool,” he repeated, going away in agitation, and preparing himself for what he could do."
