"zh","en"
"他鼓起勇气，畏畏缩缩地登上了出城朝军营方向疾驰的小电车。坐在车上，他纹丝不动、镇定自若。","Blenching as he took courage, he mounted the small, quick-hurrying tram that ran out of the town in the direction of the barracks.He sat motionless and composed, static."
"他在终点站下车，沿路往前走。风还在刮着。他听到黑麦地传来模糊的沙沙声；一阵强风袭来，黑麦地就发出更为响亮的嗖嗖声。周围不见一个人影。他感到孤单冷清、被人疏离，沿着低矮藤蔓之间的田间小径往前走。许多小藤蔓盘旋生长，绽出粉色嫩芽，卷须在风中摇曳着。他清楚地看到这一切，不禁感到惊奇。不远的地里，男男女女们正在收割干草。牛车停在路旁，男人们穿着蓝色衬衫，女人头上裹着白布；他们正将干草抱上车。在收割后的亮绿色田野的映衬下，一切显得明亮而清晰。他感到自己身处黑暗之中，注视着周围这迷人、灿烂、美丽的世界，而自己却不能置身其中。","He got out at the terminus and went down the road.A wind was still running.He could hear the faint whisper of the rye, and the stronger swish as a sudden gust was upon it.No one was about.Feeling detached and impersonal, he went down a field-path between the low vines.Many little vine trees rose up in spires, holding out tender pink shoots, waving their tendrils.He saw them distinctly and wondered over them.In a field a little way off, men and women were taking up the hay.The bullock-waggon stood by on the path, the men in their blue shirts, the women with white cloths over their heads carried hay in their arms to the cart, all brilliant and distinct upon the shorn, glowing green acres.He felt himself looking out of darkness on to the glamorous, brilliant beauty of the world around him, outside him."
"男爵的房子四平八稳地坐落在绿树、花园和田野间。埃米莉是男爵家的女佣。这是一座古老的法式田庄。军营近在咫尺。巴克曼朝院子走去，心里只有一个念头。他迈进宽敞遮阳的阴凉院子。院里的狗看见是个士兵进来，只是跳起来，呜呜叫着表示问候。一个水泵静静地立在角落里，在阴凉处的一棵椴树下。","The Baron’s house, where Emilie was maidservant, stood square and mellow among trees and garden and fields.It was an old French grange.The barracks was quite near.Bachmann walked, drawn by a single purpose, towards the courtyard.He entered the spacious, shadowy, sun-swept place.The dog, seeing a soldier, only jumped and whined for greeting.The pump stood peacefully in a corner, under a lime tree, in the shade."
"厨房的门开着。他犹豫片刻，然后进了厨房，腼腆地说了句话，勉强地笑了笑。两个女人吃了一惊，但是很高兴。埃米莉正在为下午的咖啡准备碟子。她站在桌子那头，停下手中的活，表情中含着惊讶、挑逗和欣喜。她的双眼骄傲、羞涩，就像某种野生动物，某种高傲的动物。她黑色的头发扎得紧紧的，灰色的眼睛定定地看着他。她穿着乡下式样的蓝色棉裙，上面饰有红色小玫瑰图案，胸前扣得紧紧的，掩着少女结实的乳房。","The kitchen door was open.He hesitated, then walked in, speaking shyly and smiling involuntarily.The two women started, but with pleasure.Emilie was preparing the tray for afternoon coffee.She stood beyond the table, drawn up, startled, and challenging, and glad.She had the proud, timid eyes of some wild animal, some proud animal.Her black hair was closely banded, her grey eyes watched steadily.She wore a peasant dress of blue cotton sprigged with little red roses, that buttoned tight over her strong maiden breasts."
"桌旁坐着另一名年轻女子。她是男爵家的保育员，正在一大堆樱桃中挑拣着，将挑出的樱桃丢进碗里。她年轻漂亮，脸上长着雀斑。","At the table sat another young woman, the nursery governess, who was picking cherries from a huge heap, and dropping them into a bowl.She was young, pretty, freckled."
"“好啊！”她快乐地说，“不速之客啊。”","“Good day!” she said pleasantly.“The unexpected.”"
"埃米莉一言不发。微黑的脸颊泛起了红晕。她仍站在那里看着，半是害怕，欲夺门而出；半是喜悦，舍不得离开。","Emilie did not speak.The flush came in her dark cheek.She still stood watching, between fear and a desire to escape, and on the other hand joy that kept her in his presence."
"“是的。”他局促不安地应答。两个女人的眼神仍然停留在他的身上。“我这次惹上大麻烦了。”","“Yes,” he said, bashful and strained, while the eyes of the two women were upon him.“I’ve got myself in a mess this time.”"
"“怎么啦？”保育员双手垂在膝上问道。埃米莉僵硬地站着。","“What?” asked the nursery governess, dropping her hands in her lap.Emilie stood rigid."
"巴克曼无颜抬头。他斜视那些灿烂如红宝石般的樱桃。他无法恢复常态。","Bachmann could not raise his head.He looked sideways at the glistening, ruddy cherries.He could not recover the normal world."
"“我把休伯中士从防御工事上打下了壕沟，”他说，“这是个意外——但是——”","“I knocked Sergeant Huber over the fortifications down into the moat,” he said.“It was an accident—but—”"
"不知不觉地，他抓起樱桃吃了起来，只听到埃米莉小声地惊叹了一下。","And he grasped at the cherries, and began to eat them, unknowing, hearing only Emilie’s little exclamation."
"“你把他从防御工事上打下去了！”赫西小姐重复着，大惊失色。“这是怎么回事？”","“You knocked him over the fortifications!” echoed Fräulein Hesse in horror.“How?”"
"他将樱桃核吐在手上，机械但专注地将事情经过讲给她们听。","Spitting the cherry-stones into his hand, mechanically, absorbedly, he told them."
"“啊！”埃米莉尖叫了一声。","“Ach!” exclaimed Emilie sharply."
"“你怎么到这儿来的？”赫西小姐问道。","“And how did you get here?” asked Fräulein Hesse."
"“我逃出来的。”他说。","“I ran off,” he said."
"继而是死一般的沉寂。他站起身，任由两个女人摆布。炉子上传来嘶嘶声，以及咖啡浓浓的香味。埃米莉迅速转过身去。在她俯向炉子时，他看到她平直的后背和结实的臀部。","There was a dead silence.He stood, putting himself at the mercy of the women.There came a hissing from the stove, and a stronger smell of coffee.Emilie turned swiftly away.He saw her flat, straight back and her strong loins, as she bent over the stove."
"“可是你打算怎么做呢？”赫西小姐问，有些吓呆了。","“But what are you going to do?” asked Fräulein Hesse, aghast."
"“不知道。”他说完又抓了些樱桃。他不再言语。","“I don’t know,” he said, grasping at more cherries.He had come to an end."
"“你最好回军营去。”她说，“我们会让男爵先生来处理这事情。”","“You’d better go to the barracks,” she said.“We’ll get the Herr Baron to come and see about it.”"
"埃米莉静静地、麻利地准备着碟子。她拾起碟子，站在熠熠生辉的瓷器和银器前，面无表情，等待他的回答。巴克曼仍然垂着头，面色惨白，十分固执。他无法忍受回去的结局。","Emilie was swiftly and quietly preparing the tray.She picked it up, and stood with the glittering china and silver before her, impassive, waiting for his reply.Bachmann remained with his head dropped, pale and obstinate.He could not bear to go back."
"“我想试试到法国去。”他说。","“I’m going to try to get into France,” he said."
"“不错，但他们会逮住你的。”赫西小姐说。","“Yes, but they’ll catch you,” said Fräulein Hesse."
"埃米莉用沉着、警惕的灰色眼睛注视着他。","Emilie watched with steady, watchful grey eyes."
"“我可以试试，只要我能躲过今晚。”他说。","“I can have a try, if I could hide till to-night,” he said."
"两个女人都明白他的想法。她们也都清楚这是徒劳的。埃米莉拿起碟子，走出了厨房。巴克曼依旧垂首而立。他内心感受到耻辱和无能在作祟。","Both women knew what he wanted.And they all knew it was no good.Emilie picked up the tray, and went out.Bachmann stood with his head dropped.Within himself he felt the dross of shame and incapacity."
"“你不可能逃得了。”保育员说。","“You’d never get away,” said the governess."
"“我可以试一试。”他答道。","“I can try,” he said."
"今天，他不能将自己置于军方的股掌之间。如果今天能逃过一劫，他们明天爱怎么处置就怎么处置吧。","To-day he could not put himself between the hands of the military.Let them do as they liked with him tomorrow, if he escaped today."
"他们都一言不发。他吃着樱桃。樱桃的颜色将年轻保育员的脸颊映得绯红。","They were silent.He ate cherries.The colour flushed bright into the cheek of the young governess."
"埃米莉回来准备另一个碟子。","Emilie returned to prepare another tray"
"“他可以藏在你房里。”保育员对她说。","“He could hide in your room,” the governess said to her."
"女孩往后退了一下。她容不得这种冒犯。","The girl drew herself away.She could not bear the intrusion."
"“这是我能想到的唯一不会被孩子们打扰的地方。”赫西小姐说。","“That is all I can think of that is safe from the children,” said Fräulein Hesse."
"埃米莉没有作声。巴克曼站着，等待两个女人做出决定。埃米莉不想与他关系过密。","Emilie gave no answer.Bachmann stood waiting for the two women.Emilie did not want the close contact with him."
"“你可以和我睡。”赫西小姐对她说。","“You could sleep with me,” Fräulein Hesse said to her."
"埃米莉抬眼看着年轻人，直接坦露出不可冒犯的神情。","Emilie lifted her eyes and looked at the young man, direct, clear, reserving herself."
"“你想那样吗？”她问道，强烈的处女情结不容他触犯。","“Do you want that?” she asked, her strong virginity proof against him."
"“是——是的——”他犹豫不决地说，彻底被耻辱摧垮了。","“Yes—yes—” he said uncertainly, destroyed by shame."
"她又低下头。","She put back her head."
"“好吧。”她喃喃自语。","“Yes,” she murmured to herself."
"她迅速装好碟子，走了出去。","Quickly she filled the tray, and went out."
"“但你不可能一个晚上就穿过边境。”赫西小姐说。","“But you can’t walk over the frontier in a night,” said Fräulein Hesse."
"“我可以骑自行车。”他说。","“I can cycle,” he said."
"埃米莉回来了，举止拘谨、态度矜持、不卑不亢。","Emilie returned, a restraint, a neutrality, in her bearing."
"“我看看是否一切妥当。”保育员说。","“I’ll see if it’s all right,” said the governess."
"片刻之后，巴克曼跟在埃米莉身后穿过方形大厅。大厅的墙上挂着巨幅地图。他看到挂钩上有件带铜纽扣的蓝色儿童外套，想起了自己曾坐在椴树下看男爵家最小的孩子牵着埃米莉的手学步的情形。这已经是很久以前的事了。那是一种他丢失已久的自由，如今取而代之的是迫在眉睫的焦虑。","In a moment or two Bachmann was following Emilie through the square hall, where hung large maps on the walls.He noticed a child’s blue coat with brass buttons on the peg, and it reminded him of Emilie walking holding the hand of the youngest child, whilst he watched, sitting under the lime tree.Already this was a long way off.That was a sort of freedom he had lost, changed for a new, immediate anxiety."
"他们胆怯地迅速登上楼梯，然后走过一条漫长的走廊。埃米莉打开房间门，他走了进去，一脸的羞愧。","They went quickly, fearfully up the stairs and down a long corridor.Emilie opened her door, and he entered, ashamed, into her room."
"“我得下去了。”她喃喃道，然后离开，轻轻合上了门。　","“I must go down,” she murmured, and she departed, closing the door softly."
"房间小巧洁净，没有什么家具。只有一个盛圣水的小碟，一幅圣心图，一个十字架，一个祈祷台。 小床上的白色床单一尘不染，一个洗手用的红陶土钵立在光秃秃的桌子上，还有一面小镜子和一个小五斗橱。仅此而已。","It was a small, bare, neat room.There was a little dish for holy-water, a picture of the Sacred Heart, a crucifix, and a prie-Dieu.The small bed lay white and untouched, the wash-hand bowl of red earth stood on a bare table, there was a little mirror and a small chest of drawers.That was all."
"在这个避难所里，他感到无比安全。他走到窗前，越过庭院，眺望着这午后灿烂的乡村。他将要离开这个地方，这种生活了。他已经身处在陌生之地了。","Feeling safe, in sanctuary, he went to the window, looking over the courtyard at the shimmering, afternoon country.He was going to leave this land, this life.Already he was in the unknown."
"他退回到房间里。这个天主教气息十足的小房间简朴、严肃得令人称奇，让他感到异样却有种归属感。他看着耶稣受难十字架。这个农民模样的、高瘦的耶稣是黑森林的一位农民雕刻的。巴克曼有生以来头一次将这个形像视之为人。它表现的是一个悬在绞架上的、于无助中受尽折磨的男人。他凝眸细看，似乎在寻觅新知。","He drew away into the room.The curious simplicity and severity of the little Roman Catholic bedroom was foreign but restoring to him.He looked at the crucifix.It was a long, lean, peasant Christ carved by a peasant in the Black Forest.For the first time in his life, Bachmann saw the figure as a human thing.It represented a man hanging there in helpless torture.He stared at it, closely, as if for new knowledge."
"难以平复的耻辱在他体内灼烧、闷燃。他无法振作起来。灵魂似乎出现了裂口。内心的羞耻感似乎取代了他的力量和男子气概。","Within his own flesh burned and smouldered the restless shame.He could not gather himself together.There was a gap in his soul.The shame within him seemed to displace his strength and his manhood."
"他在椅子上坐下。这种耻辱、这种公然受辱的感觉被激发了，作用于他的大脑，令他心情沉重，难以名状的沉重。","He sat down on his chair.The shame, the roused feeling of exposure acted on his brain, made him heavy, unutterably heavy."
"他心智全无，机械地脱下靴子、腰带和短上衣，搁在一旁，然后他沉沉地躺下了，陷入麻醉状的沉睡之中。","Mechanically, his wits all gone, he took off his boots, his belt, his tunic, put them aside, and lay down, heavy, and fell into a kind of drugged sleep."
"不一会儿，埃米莉进来看他。但他在沉睡。她见他躺在那里浑然不动，完全静止，她感到害怕。他的衬衫在颈部敞开着。她看到他洁白无暇的身体，非常干净、漂亮。他一动不动地睡着。他躺在那里，腿上穿着蓝色军裤，脚上套着粗布长袜，与她的床格格不入。她转身离开了。","Emilie came in a little while, and looked at him.But he was sunk in sleep.She saw him lying there inert, and terribly still, and she was afraid.His shirt was unfastened at the throat.She saw his pure white flesh, very clean and beautiful.And he slept inert.His legs, in the blue uniform trousers, his feet in the coarse stockings, lay foreign on her bed.She went away."
"第三章","Chapter III"
"她心神不宁，每一根神经都局促不安。她想洁身自好，不被任何人染指。一种狂热的本能使她在任何可能对她伸手的人面前退却。","She was uneasy, perturbed to her last fibre.She wanted to remain clear, with no touch on her.A wild instinct made her shrink away from any hands which might be laid on her."
"她是弃儿，可能是吉普赛人，在罗马天主教救济所长大。她是个天真的异教徒，从十四岁起就跟随男爵夫人，已为之服务了七年。","She was a foundling, probably of some gipsy race, brought up in a Roman Catholic Rescue Home.A naïve, paganly religious being, she was attached to the Baroness, with whom she had served for seven years, since she was fourteen."
"除了保育员艾达·赫西，她不与任何人来往。艾达是个精明、心地善良、不很直爽、喜欢卖弄风骚的人。她父亲是个贫穷的乡村医生。在与埃米莉的交往中，她们逐渐形成了一种同盟胜过依赖的关系，她不认为二人之间有等级差别。她们一起干活、唱歌、散步，一同去艾达的心上人弗朗兹·布兰德的住所玩。三人一起说笑，或是她们俩一起听林务员弗朗兹拉小提琴。","She came into contact with no one, unless it were with Ida Hesse, the governess.Ida was a calculating, good-natured, not very straight-forward flirt.She was the daughter of a poor country doctor.Having gradually come into connection with Emilie, more an alliance than an attachment, she put no distinction of grade between the two of them.They worked together, sang together, walked together, and went together to the rooms of Franz Brand, Ida’s sweetheart.There the three talked and laughed together, or the women listened to Franz, who was a forester, playing on his violin."
"两个年轻女人在她们的结盟中没有任何私密。埃米莉天性孤僻、内向含蓄、单纯自然。艾达把她当作权衡自己轻浮行为的砝码。但机灵狡猾的保育员总是忙于对付她的爱慕者，使出浑身解数改变埃米莉的鲜明个性，让她和男人发生点关系。","In all this alliance there was no personal intimacy between the young women.Emilie was naturally secluded in herself, of a reserved, native race.Ida used her as a kind of weight to balance her own flighty movement.But the quick, shifty governess, occupied always in her dealings with admirers, did all she could to move the violent nature of Emilie towards some connection with men."
"但这个皮肤微黑、简单质朴，却极其敏感的姑娘有着浓烈的处女情结。她路过时，若有粗俗的士兵在她身后发出长长的咂嘴飞吻的声音，她就血往上涌，怒不可遏。她憎恨他们近似揶揄的求婚。男爵夫人给予了她很好的保护。","But the dark girl, primitive yet sensitive to a high degree, was fiercely virgin.Her blood flamed with rage when the common soldiers made the long, sucking, kissing noise behind her as she passed.She hated them for their almost jeering offers.She was well protected by the Baroness."
"她对凡夫俗子的蔑视是不可言喻的。但她喜欢男爵夫人，敬重男爵。在为绅士服务时，她感到轻松自在。在为真正的先生、太太服务时，她整个性情都非常平和。在她看来，绅士有着某种神秘的品质，让她在服侍他们时感觉轻松与自豪。而那些粗俗的士兵则形同兽类，一无是处。她的愿望就是服侍他人。","And her contempt of the common men in general was ineffable.But she loved the Baroness, and she revered the Baron, and she was at her ease when she was doing something for the service of a gentleman.Her whole nature was at peace in the service of real masters or mistresses.For her, a gentleman had some mystic quality that left her free and proud in service.The common soldiers were brutes, merely nothing.Her desire was to serve."
"她自恃清高。每逢周六下午，她路过市政大楼，从窗户中看见士兵与俗气的姑娘跳舞时，冷冰冰的厌恶和愤怒就会占据她的心头。士兵们脱去腰带，敞开束腰短上衣，迈着舞步，衬衣从松垮的短上衣中显露出来。他们步伐粗野，脸孔扭曲着，大汗淋漓。他们粗糙的双手将粗俗的姑娘搂在腋窝下，拽着她们往自己胸口上贴，看到这些让她忍无可忍。她讨厌看到他们胸对胸地扭在一起，男人的腿下流地舞动着。","She held herself aloof.When, on Sunday afternoon, she had looked through the windows of the Reichshalle in passing, and had seen the soldiers dancing with the common girls, a cold revulsion and anger had possessed her.She could not bear to see the soldiers taking off their belts and pulling open their tunics, dancing with their shirts showing through the open, sagging tunic, their movements gross, their faces transfigured and sweaty, their coarse hands holding their coarse girls under the arm-pits, drawing the female up to their breasts.She hated to see them clutched breast to breast, the legs of the men moving grossly in the dance."
"夜晚在花园里，当她听到树篱另一端传来姑娘在士兵搂抱下发出性感的、含糊不清的喊叫时，她恼羞成怒，厉声叫道：","At evening, when she had been in the garden, and heard on the other side of the hedge the sexual inarticulate cries of the girls in the embraces of the soldiers, her anger had been too much for her, and she had cried, loud and cold:"
"“你们在树篱里干什么勾当？”","“What are you doing there, in the hedge?”"
"她真想鞭打他们一通。","She would have had them whipped."
"但巴克曼不是名粗俗的士兵。赫西小姐相中了他，并把他和埃米莉撮合在了一起。他年轻英俊，金发白肤，腰杆笔直，步履间带着一种无意识的、却又很明显的骄傲。并且，他家世代富有，经营农牧业。他父亲已故，时下，是他母亲掌管全部家财。但是任何时候，只要巴克曼想要一百英镑，都能如愿以偿。他和他的一个兄弟以造四轮马车为营生。他家经营村里的农场、铁匠铺和马车铺。他们之所以干活，只是因为这是他们所熟悉的生活方式。如果愿意的话，他们靠自己的财产就可以独立生活。","But Bachmann was not quite a common soldier.Fräulein Hesse had found out about him, and had drawn him and Emilie together.For he was a handsome, blond youth, erect and walking with a kind of pride, unconscious yet clear.Moreover, he came of a rich farming stock, rich for many generations.His father was dead, his mother controlled the moneys for the time being.But if Bachmann wanted a hundred pounds at any moment, he could have them.By trade he, with one of his brothers, was a waggon-builder.The family had the farming, smithy, and waggon-building of their village.They worked because that was the form of life they knew.If they had chosen, they could have lived independent upon their means."
"这样一来，感觉上他就是一名绅士了，尽管心智未开。他有足够的钱买任何东西。而且，他拥有单纯、良好的教养。埃米莉在他面前心旌动摇。因此，他成了她的恋人，她亦渴望拥有他。但她是个处女，很羞涩，需要被征服，因为她尚未开化，既不知道文明的生活方式，也不了解文明的意图。","In this way, he was a gentleman in sensibility, though his intellect was not developed.He could afford to pay freely for things.He had, moreover, his native, fine breeding.Emilie wavered uncertainly before him.So he became her sweetheart, and she hungered after him.But she was virgin, and shy, and needed to be in subjection, because she was primitive and had no grasp on civilized forms of living, nor on civilized purposes."
"第四章","Chapter IV"
"六点钟，有士兵来盘问：看到过巴克曼吗？赫西小姐很高兴在其中扮演一个角色，便回答道：","At six o’clock came the inquiry of the soldiers: Had anything been seen of Bachmann?Fräulein Hesse answered, pleased to be playing a rôle:"
"“没有啊，自打周日就没见过他——埃米莉，你呢？”","“No, I’ve not seen him since Sunday—have you, Emilie?”"
"“没有，我没见过他。”埃米莉说，她的笨拙被看成是忸怩。艾达·赫西意犹未尽，还问了些问题，继续她的表演。","“No, I haven’t seen him,” said Emilie, and her awkwardness was construed as bashfulness.Ida Hesse, stimulated, asked questions, and played her part."
"“休伯中士没有丧命吧？”她惊愕地大声问道。","“But it hasn’t killed Sergeant Huber?” she cried in consternation."
"“没有，他掉到水里了。但他受惊不小，一只脚撞到了壕沟的一侧。他现在在医院里。巴克曼处境很不妙。”","“No. He fell into the water.But it gave him a bad shock, and smashed his foot on the side of the moat.He’s in hospital.It’s a bad look-out for Bachmann.”"
"埃米莉感觉自己受到了牵连，无法逃脱干系了，便站在一旁观望。在应对这种管理体制时，她不再那么从容，这是一种她视之为神圣却无法理解的体制。她被置于尴尬的境地。巴克曼在她房里，她不再是忠于职守的、虔诚的信徒。","Emilie, implicated and captive, stood looking on.She was no longer free, working with all this regulated system which she could not understand and which was almost god-like to her.She was put out of her place.Bachmann was in her room, she was no longer the faithful in service serving with religious surety."
