"zh","en"
"胎痣","The Birthmark"
"胎痣","The Birthmark"
"作者：纳撒尼尔·霍桑","by Nathaniel Hawthorne"
"上世纪后半叶，有一位科学家，在自然哲学的每个分支领域都声名显赫。在讲述下面的故事之前，首先要说的是，他让人感受到的内在亲和力，胜似任何一种化学药品的药效。他把实验室交给助手看管，擦掉那俊朗面容上的炉烟，洗去手指酸液的痕迹，并说服一位美人成为自己的妻子。那时，人类刚刚探索出了电领域的自然奥秘，这似乎开辟了一条通往奇迹的道路。因此，当一个人对科学满腔热忱，而对女人又充满爱意时，这二者通常会在程度和吸引力上进行较量。只有不断地追求目标，才可能维持高于常人的智力、想象力、斗志、甚至毅力，一些狂热于目标的哲人认为，沿着智慧的阶梯不断提高人生追求，才能捕捉到创造力的奥秘，才能创造出属于自己的新天地。我们不知道艾尔默是否怀有足够的信心，相信人类最终能够战胜自然。然而，他毫无保留地致力于科学研究，从未有其他任何事情使他如此激情四溢、坚定不移。在这两种爱当中，他对妻子的爱更为强烈；然而，只有当他对妻子的爱意与对科学的热忱交织在一起，当追求科学的动力与他自身的精神力量融为一体时，才会这样。","In the latter part of the last century there lived a man of science, an eminent proficient in every branch of natural philosophy, who not long before our story opens had made experience of a spiritual affinity more attractive than any chemical one.He had left his laboratory to the care of an assistant, cleared his fine countenance from the furnace smoke, washed the stain of acids from his fingers, and persuaded a beautiful woman to become his wife.In those days when the comparatively recent discovery of electricity and other kindred mysteries of Nature seemed to open paths into the region of miracle, it was not unusual for the love of science to rival the love of woman in its depth and absorbing energy.The higher intellect, the imagination, the spirit, and even the heart might all find their congenial aliment in pursuits which, as some of their ardent votaries believed, would ascend from one step of powerful intelligence to another, until the philosopher should lay his hand on the secret of creative force and perhaps make new worlds for himself.We know not whether Aylmer possessed this degree of faith in man’s ultimate control over Nature.He had devoted himself, however, too unreservedly to scientific studies ever to be weaned from them by any second passion.His love for his young wife might prove the stronger of the two; but it could only be by intertwining itself with his love of science, and uniting the strength of the latter to his own."
"于是这些结合产生了，并且其结果令人深思，其教训十分深刻。他们婚后不久的一天，艾尔默一边坐着，一边盯着妻子看，越看越苦恼，最终他开口了。","Such a union accordingly took place, and was attended with truly remarkable consequences and a deeply impressive moral.One day, very soon after their marriage, Aylmer sat gazing at his wife with a trouble in his countenance that grew stronger until he spoke."
"“乔治亚娜，”他问，“你从没想过把脸上的那颗痣给祛掉吗？”","“Georgiana,” said he, “has it never occurred to you that the mark upon your cheek might be removed?”"
"“没，还真没有。”乔治亚娜微笑着说；但是，察觉到丈夫并非开玩笑后，她羞得满脸通红，“老实跟你说，别人经常说这是种魅力，所以我也没多想，觉得可能是这样吧。”","“No, indeed,” said she, smiling; but perceiving the seriousness of his manner, she blushed deeply.“To tell you the truth it has been so often called a charm that I was simple enough to imagine it might be so.”"
"“哦，在别人脸上或许是吧，”她丈夫回答道，“可在你脸上绝对不是。不，亲爱的乔治亚娜，大自然把你造得几近完美，因此这个最微不足道的瑕疵——我们下不了定论说它是瑕疵还是美人痣——但这颗痣让我感到震惊，因为它是人间缺陷的印记。”","“Ah, upon another face perhaps it might,” replied her husband; “but never on yours.No, dearest Georgiana, you came so nearly perfect from the hand of Nature that this slightest possible defect, which we hesitate whether to term a defect or a beauty, shocks me, as being the visible mark of earthly imperfection.”"
"“居然让你震惊了，我的夫君啊！”乔治亚娜叫道，她感觉自己十分受伤；起初是由于那一瞬间的愤怒而满脸通红，紧接着突然哭了起来，“那你为什么要从我母亲身边将我带走？你不可能爱上让你震惊的东西！”","“Shocks you, my husband!” cried Georgiana, deeply hurt; at first reddening with momentary anger, but then bursting into tears.“Then why did you take me from my mother’s side?You cannot love what shocks you!”"
"要把这段对话解释清楚，首先必须说明一件事——乔治亚娜左脸正中有一颗独特的痣，深深地嵌入面部肌肉组织里。通常情况下，她脸庞娇嫩，健康红润——这颗痣略显深红，在周围的玫瑰红的映衬下，形状不是很清晰。乔治亚娜突然脸红的时候，这颗痣就会渐渐模糊，随着血液上涌，红晕泛起，这颗痣便几乎看不到了。但若她情绪变化，脸色苍白，这颗痣又会出现，犹如白雪之中一点红，十分明显，有时几乎让艾尔默觉得可怕。这颗痣的形状很像人的手，尽管只有最小个儿侏儒的手那么大。乔治亚娜的追求者们总是说，在她出生的时候，某位仙女将自己的小手按在她这个婴儿的脸颊上，把这个印记留在那里，象征一种奇妙的恩赐，赋予她倾倒众生的魅力。许多疯狂的求爱者为了得到亲吻这神秘玉手的特权，不惜以生命为代价。然而，无须讳言，由于人们性情各异，这位仙女的手印留给人的印象便迥异万千。某些吹毛求疵的人——无一例外都是女性——断言那只血手——她们有意这样称呼——严重破坏了乔治亚娜的美貌，把她变得面目可憎。但是，只需最纯净的大理石上的一小块蓝色斑痕，就能将出自鲍威斯之手的夏娃变成一个怪物，这似乎也不无道理。而男性关注者呢，如果这个胎记不能让他们艳羡十足，就期望它消失，以获得心理满足感。这样，这个世上便可存有一个美轮美奂、毫无瑕疵的活标本。艾尔默婚后便发现自己遇到了这种情况——因为他以前很少去想这个问题，甚至根本不想。","To explain this conversation it must be mentioned that in the centre of Georgiana’s left cheek there was a singular mark, deeply interwoven, as it were, with the texture and substance of her face.In the usual state of her complexion—a healthy though delicate bloom—the mark wore a tint of deeper crimson, which imperfectly defined its shape amid the surrounding rosiness.When she blushed it gradually became more indistinct, and finally vanished amid the triumphant rush of blood that bathed the whole cheek with its brilliant glow.But if any shifting motion caused her to turn pale there was the mark again, a crimson stain upon the snow, in what Aylmer sometimes deemed an almost fearful distinctness.Its shape bore not a little similarity to the human hand, though of the smallest pygmy size.Georgiana’s lovers were wont to say that some fairy at her birth hour had laid her tiny hand upon the infant’s cheek, and left this impress there in token of the magic endowments that were to give her such sway over all hearts.Many a desperate swain would have risked life for the privilege of pressing his lips to the mysterious hand.It must not be concealed, however, that the impression wrought by this fairy sign manual varied exceedingly, according to the difference of temperament in the beholders.Some fastidious persons—but they were exclusively of her own sex—affirmed that the bloody hand, as they chose to call it, quite destroyed the effect of Georgiana’s beauty, and rendered her countenance even hideous.But it would be as reasonable to say that one of those small blue stains which sometimes occur in the purest statuary marble would convert the Eve of Powers to a monster.Masculine observers, if the birthmark did not heighten their admiration, contented themselves with wishing it away, that the world might possess one living specimen of ideal loveliness without the semblance of a flaw.After his marriage,—for he thought little or nothing of the matter before,—Aylmer discovered that this was the case with himself."
"如果她没有那么漂亮——如果嫉妒女神能找到其他人来嘲笑的话，那他也许觉得自己会因这小巧可人的手印而情感升温，这手印时而轮廓模糊，时而消失不见，时而悄然出现，随着她内心情感的波动若隐若现；可是她却如此完美，因此他们一起生活得越久，他就越无法容忍这瑕疵。这是人类一大致命的瑕疵，自然之神以种种形式给她的造物留下不可磨灭的印记，或意味着生命短暂而有限，或意味着追求完美则必将经受苦痛。而这深红色的手印表明，人类无法挣脱命运的束缚，死亡紧紧抓住人世间最高贵最纯洁的造物，把他们贬低到最卑贱的地位、甚至与畜生同列。他们的形体也会如畜生一样回归尘土。因此，从这个角度出发，艾尔默就把这个胎记看作是妻子难逃罪孽、悲痛、堕落和死亡的象征。不久，他悲观地把胎记想象成可怕之物，这给他带来的苦恼与恐惧，远超过乔治亚娜的美貌与善心带来的快乐。","Had she been less beautiful,—if Envy’s self could have found aught else to sneer at,—he might have felt his affection heightened by the prettiness of this mimic hand, now vaguely portrayed, now lost, now stealing forth again and glimmering to and fro with every pulse of emotion that throbbed within her heart; but seeing her otherwise so perfect, he found this one defect grow more and more intolerable with every moment of their united lives.It was the fatal flaw of humanity which Nature, in one shape or another, stamps ineffaceably on all her productions, either to imply that they are temporary and finite, or that their perfection must be wrought by toil and pain.The crimson hand expressed the ineludible gripe in which mortality clutches the highest and purest of earthly mould, degrading them into kindred with the lowest, and even with the very brutes, like whom their visible frames return to dust.In this manner, selecting it as the symbol of his wife’s liability to sin, sorrow, decay, and death, Aylmer’s sombre imagination was not long in rendering the birthmark a frightful object, causing him more trouble and horror than ever Georgiana’s beauty, whether of soul or sense, had given him delight."
"在本该是他们最幸福的日子里，他总会回到这个灾难性的话题上来。这并非他的本意，甚至他还尽量回避这个话题。起先，这个话题不值一提，然而它却引发了一连串不同想法与情感，并与其紧密相连，于是就变成了所有事情的焦点。在清晨曙光里，艾尔默睁开双眼，注视着妻子的脸颊，一下子就认出了这个残缺的标记；晚上，他们一起坐在炉火旁，艾尔默的目光又悄悄游离在她的脸上，在摇曳的火光中，那幽灵般的手忽隐忽现，在他本可以欣然爱慕的地方写下死亡的印记。很快，乔治亚娜就意识到了这一点，每当丈夫凝视时，她就不由得浑身发抖。只需瞥一眼艾尔默脸上那特有的怪异表情，乔治亚娜红润的脸颊霎时就会变得死一般的惨白。脸上的那只深红色手印也会越发明显，恰似洁白大理石上的红宝石浅浮雕。","At all the seasons which should have been their happiest, he invariably and without intending it, nay, in spite of a purpose to the contrary, reverted to this one disastrous topic.Trifling as it at first appeared, it so connected itself with innumerable trains of thought and modes of feeling that it became the central point of all.With the morning twilight Aylmer opened his eyes upon his wife’s face and recognized the symbol of imperfection; and when they sat together at the evening hearth his eyes wandered stealthily to her cheek, and beheld, flickering with the blaze of the wood fire, the spectral hand that wrote mortality where he would fain have worshipped.Georgiana soon learned to shudder at his gaze.It needed but a glance with the peculiar expression that his face often wore to change the roses of her cheek into a deathlike paleness, amid which the crimson hand was brought strongly out, like a bass-relief of ruby on the whitest marble."
"一天深夜，炉火逐渐变暗，那位可怜的妻子脸颊上的瑕疵几乎看不出来；而她自己却首次主动提起这个话题。","Late one night when the lights were growing dim, so as hardly to betray the stain on the poor wife’s cheek, she herself, for the first time, voluntarily took up the subject."
"“我亲爱的艾尔默，你记不记得，”她勉强挤出一丝笑容说，“你昨天晚上做了一个梦，与这只可恶的手有关？”","“Do you remember, my dear Aylmer,” said she, with a feeble attempt at a smile, “have you any recollection of a dream last night about this odious hand?”"
"“没有！什么梦也没有做！”艾尔默惊异地回答道；但接着他又干巴巴冷冰冰地补充了句，好掩饰他内心深处的真实感受，“我可能梦见了吧；因为睡着之前这只小手着实让我遐想了一番。”","“None! none whatever!” replied Aylmer, starting; but then he added, in a dry, cold tone, affected for the sake of concealing the real depth of his emotion, “I might well dream of it; for before I fell asleep it had taken a pretty firm hold of my fancy.”"
"“那你梦见这只手了？”乔治亚娜接着急切地问道；惟恐泪水夺眶而出，打断自己不得不说的话，“一个可怕的梦！我不信你会忘记这个梦。但是可能忘记这句话吗？——‘它已经长到她心里了；我们必须要把它挖出来！’回忆一下，我的夫君；因为无论如何我都要让你回忆起那个梦。”","“And you did dream of it?” continued Georgiana, hastily; for she dreaded lest a gush of tears should interrupt what she had to say.“A terrible dream!I wonder that you can forget it.Is it possible to forget this one expression?—‘It is in her heart now; we must have it out!’Reflect, my husband; for by all means I would have you recall that dream.”"
"当无所不及的睡梦之神无法将她的精灵们禁锢在她那阴暗的势力范围内时，反而任由他们迸发出来，用内心深处的秘密来恐吓现实生活，这种心境真是太悲凉了。这时艾尔默记起了自己的梦。在梦中，艾尔默想象自己与助手阿米纳达布一道，试图通过手术来祛除那颗胎痣；但是刀进得越深，那只手就陷得越深，直到最后，这只小手紧紧抓住了乔治亚娜的心脏；然而，艾尔默却下定决心非要切除这颗胎痣。","The mind is in a sad state when Sleep, the all-involving, cannot confine her spectres within the dim region of her sway, but suffers them to break forth, affrighting this actual life with secrets that perchance belong to a deeper one.Aylmer now remembered his dream.He had fancied himself with his servant Aminadab, attempting an operation for the removal of the birthmark; but the deeper went the knife, the deeper sank the hand, until at length its tiny grasp appeared to have caught hold of Georgiana’s heart; whence, however, her husband was inexorably resolved to cut or wrench it away."
"当艾尔默清晰地记起这个梦时，他坐在妻子面前，心里十分内疚。通常，当脑袋被包裹在睡袍中时，真相就会出现，然后直言相陈我们在清醒时无意识的自我欺骗行为。直到现在，艾尔默才意识到自己已为另一个想法所左右，而为了得到内心的安宁，他会采取一定的行动。","When the dream had shaped itself perfectly in his memory, Aylmer sat in his wife’s presence with a guilty feeling.Truth often finds its way to the mind close muffled in robes of sleep, and then speaks with uncompromising directness of matters in regard to which we practise an unconscious self-deception during our waking moments.Until now he had not been aware of the tyrannizing influence acquired by one idea over his mind, and of the lengths which he might find in his heart to go for the sake of giving himself peace."
"“艾尔默，”乔治亚娜接着严肃地说，“我不知道祛除这颗要命的胎痣，咱俩得付出怎样的代价。或许祛除这颗痣会落下无法医治的残疾；或者这个瑕疵就是生命深刻的印记。我再问一遍：不惜一切代价，有没有可能摆脱这在我出生前就将我紧紧束缚的小手呢？”","“Aylmer,” resumed Georgiana, solemnly, “I know not what may be the cost to both of us to rid me of this fatal birthmark.Perhaps its removal may cause cureless deformity; or it may be the stain goes as deep as life itself.Again: do we know that there is a possibility, on any terms, of unclasping the firm gripe of this little hand which was laid upon me before I came into the world?”"
"“最亲爱的乔治亚娜，这个问题我已经考虑很久了，”艾尔默急切地打断她，“我相信祛除这颗痣是绝对可行的。”","“Dearest Georgiana, I have spent much thought upon the subject,” hastily interrupted Aylmer.“I am convinced of the perfect practicability of its removal.”"
"“哪怕只有一点点可能性，”乔治亚娜继续说，“无论冒怎样的风险，我们都要试试。危险对我来说不算什么；因为，当这个可恨的标记使我成为你恐惧和厌恶的对象时——生命就是一个负担，我只想心甘情愿地摆脱它。要么去掉这只可怕的手，要么就拿走我这可怜的生命！你知识渊博。世间有目共睹。你创造过那么多伟大的奇迹。我两只小手指尖就能把这颗小小的胎痣盖住，难道你就祛不掉它吗？为了你自己的安宁，为了拯救你可怜的妻子，好不让她发疯，这难道不是你力所能及的吗？”","“If there be the remotest possibility of it,” continued Georgiana, “let the attempt be made at whatever risk.Danger is nothing to me; for life, while this hateful mark makes me the object of your horror and disgust,—life is a burden which I would fling down with joy.Either remove this dreadful hand, or take my wretched life!You have deep science.All the world bears witness of it.You have achieved great wonders.Cannot you remove this little, little mark, which I cover with the tips of two small fingers?Is this beyond your power, for the sake of your own peace, and to save your poor wife from madness?”"
"“我最高贵、最亲爱、最温柔的妻子啊，”艾尔默狂喜地叫道，“不要怀疑我的能力。我已深入思考过此事——它让我深受启发，几乎能造出一个比你稍欠完美的人来。乔治亚娜，你带领我进一步踏入科学的中心地带。我觉得自己完全有能力使这一侧的面颊同另一侧一样完美无瑕；而且，我最亲爱的，如果我能修复大自然最美丽的杰作，那我将取得怎样的胜利啊！即使皮格马利翁手下的女雕像拥有了生命，他也不会像我这样狂喜。”","“Noblest, dearest, tenderest wife,” cried Aylmer, rapturously, “doubt not my power.I have already given this matter the deepest thought—thought which might almost have enlightened me to create a being less perfect than yourself.Georgiana, you have led me deeper than ever into the heart of science.I feel myself fully competent to render this dear cheek as faultless as its fellow; and then, most beloved, what will be my triumph when I shall have corrected what Nature left imperfect in her fairest work!Even Pygmalion, when his sculptured woman assumed life, felt not greater ecstasy than mine will be.”"
"“那就这么决定了，”乔治亚娜说，淡淡地笑道，“还有，艾尔默，即使你发现这颗胎痣最终躲进我的心脏，也不要对我手下留情。”","“It is resolved, then,” said Georgiana, faintly smiling.“And, Aylmer, spare me not, though you should find the birthmark take refuge in my heart at last.”"
"丈夫温柔地亲了亲她的脸颊——当然是她的右脸——不是那个有深红色手印的半边脸。","Her husband tenderly kissed her cheek—her right cheek—not that which bore the impress of the crimson hand."
"第二天，艾尔默向妻子通报了拟好的方案，这样他就有机会深思熟虑，专心观察，这是做手术必需的；而乔治亚娜也可以安心静养，这对手术成功至关重要。他们要与外界隔离，住进艾尔默用作实验室的大房子里去；艾尔默年轻时在那里奋力劳作，发现了大自然的原动力，受到了整个欧洲学术界的钦佩与赞扬。这位面色苍白的哲学家曾静坐于实验室里，探索出了最高云层与最深矿藏的奥秘；为查明了火山爆发与不断喷火的原因而心满意足；他还解开了泉水的奥秘，解释了为何从黑暗的地心喷涌而出的泉水，有的清澈甘醇，有的则富有医疗功效。更早的时候，他还在这里研究了人体结构的奥秘，试图彻底了解大自然怎样从大地和天空中、从精神世界中吸取她所有宝贵的力量，来创造和培育它的杰作——人类。然而，这项研究已被艾尔默搁置已久，因为他很不情愿承认一个事实——如果否认这个事实，所有探索者迟早都会栽跟头——那就是，我们伟大而富于创造的自然母亲，表面上在光天化日下创造奇迹，这让我们感到愉悦，但又严守自己的奥秘，尽管她装得十分坦诚，可展示给我们的只有结果而无过程。确实，她允许我们进行破坏，却极少允许我们去修补，就像一个心怀妒忌的专利者，绝不允许我们进行创造。然而，现在艾尔默重新开始这几乎已被遗忘的研究；当然并不抱当初的希望或愿望；因为这些研究涉及到许多生理学的真理，并且妨碍了他原先为乔治亚娜拟定的治疗方案。","The next day Aylmer apprised his wife of a plan that he had formed whereby he might have opportunity for the intense thought and constant watchfulness which the proposed operation would require; while Georgiana, likewise, would enjoy the perfect repose essential to its success.They were to seclude themselves in the extensive apartments occupied by Aylmer as a laboratory, and where, during his toilsome youth, he had made discoveries in the elemental powers of Nature that had roused the admiration of all the learned societies in Europe.Seated calmly in this laboratory, the pale philosopher had investigated the secrets of the highest cloud region and of the profoundest mines; he had satisfied himself of the causes that kindled and kept alive the fires of the volcano; and had explained the mystery of fountains, and how it is that they gush forth, some so bright and pure, and others with such rich medicinal virtues, from the dark bosom of the earth.Here, too, at an earlier period, he had studied the wonders of the human frame, and attempted to fathom the very process by which Nature assimilates all her precious influences from earth and air, and from the spiritual world, to create and foster man, her masterpiece.The latter pursuit, however, Aylmer had long laid aside in unwilling recognition of the truth—against which all seekers sooner or later stumble—that our great creative Mother, while she amuses us with apparently working in the broadest sunshine, is yet severely careful to keep her own secrets, and, in spite of her pretended openness, shows us nothing but results.She permits us, indeed, to mar, but seldom to mend, and, like a jealous patentee, on no account to make.Now, however, Aylmer resumed these half-forgotten investigations; not, of course, with such hopes or wishes as first suggested them; but because they involved much physiological truth and lay in the path of his proposed scheme for the treatment of Georgiana."
"当他领着乔治亚娜跨过实验室的门槛时，乔治亚娜不禁发冷，浑身发抖。艾尔默兴高采烈地看着妻子的面庞，本想宽慰宽慰她，但却吃惊地看到妻子白皙的脸颊上，那块胎痣赫然在目，这让他不由地剧烈抽搐了一下。他的妻子晕厥了过去。","As he led her over the threshold of the laboratory, Georgiana was cold and tremulous.Aylmer looked cheerfully into her face, with intent to reassure her, but was so startled with the intense glow of the birthmark upon the whiteness of her cheek that he could not restrain a strong convulsive shudder.His wife fainted."
"“阿米纳达布！阿米纳达布！”艾尔默大叫道，用力乱跺着双脚。","“Aminadab!Aminadab!” shouted Aylmer, stamping violently on the floor."
