"zh","en"
"从里屋立即蹿出来一个矮个子，身形笨重，满头的乱发遮着他的脸，因熔炉的烟熏火燎而面色灰暗。在艾尔默的整个科学生涯中，这个人一直是他的得力助手，他技能娴熟，非常称职。虽对科学原理一窍不通，却也能够完成主人各项实验中的具体工作。他力大无比，头发蓬乱，满面烟尘，浑身透着难以名状的质朴气息，外表一如其他凡夫俗子；而艾尔默身材修长、肤色白皙、一脸智慧，是人类精神素质的最佳典型。","Forthwith there issued from an inner apartment a man of low stature, but bulky frame, with shaggy hair hanging about his visage, which was grimed with the vapors of the furnace.This personage had been Aylmer’s underworker during his whole scientific career, and was admirably fitted for that office by his great mechanical readiness, and the skill with which, while incapable of comprehending a single principle, he executed all the details of his master’s experiments.With his vast strength, his shaggy hair, his smoky aspect, and the indescribable earthiness that incrusted him, he seemed to represent man’s physical nature; while Aylmer’s slender figure, and pale, intellectual face, were no less apt a type of the spiritual element."
"“把化妆室的门打开，阿米纳达布，”艾尔默说，“再烧一个香锭。”","“Throw open the door of the boudoir, Aminadab,” said Aylmer, “and burn a pastil.”"
"“是，主人，”阿米纳达布关切地看了眼无精打采的乔治亚娜，然后喃喃自语道，“如果她是我的妻子，我是绝对不会把那颗胎痣祛掉的。”","“Yes, master,” answered Aminadab, looking intently at the lifeless form of Georgiana; and then he muttered to himself, “If she were my wife, I’d never part with that birthmark.”"
"乔治亚娜恢复意识后，觉得一阵芳香扑鼻，那温和的效力把她从死一般的晕厥中唤醒。周围是一片魔幻般的景象。艾尔默早把那些烟雾弥漫、肮脏昏暗的屋子改成了一套漂亮的房间，给一个可爱的女士作隐居之所十分合适，他那些探求奥秘的光辉岁月便在那儿度过。墙壁上挂着华丽的窗帘，集庄严和优雅于一体，任何其他的装饰都无法达到这种效果；窗帘从屋顶直落地面，布满褶皱，显得十分厚重，挡住了所有的棱角和线条，似乎把这里与无限的空间隔开。乔治亚娜觉得，这兴许是空中楼阁呢。艾尔默遮挡住了阳光，因为这可能会影响他做化学实验，给屋里点上了散发香味的灯盏，跳动着五颜六色的火焰，融合成一道柔和的紫色光芒。这时，他跪在妻子身边，热切地注视着她，却毫不惊恐；因为他对自己的科学实验有信心，相信自己可以在妻子身边划一个妖孽难入的魔圈。","When Georgiana recovered consciousness she found herself breathing an atmosphere of penetrating fragrance, the gentle potency of which had recalled her from her deathlike faintness.The scene around her looked like enchantment.Aylmer had converted those smoky, dingy, sombre rooms, where he had spent his brightest years in recondite pursuits, into a series of beautiful apartments not unfit to be the secluded abode of a lovely woman.The walls were hung with gorgeous curtains, which imparted the combination of grandeur and grace that no other species of adornment can achieve; and as they fell from the ceiling to the floor, their rich and ponderous folds, concealing all angles and straight lines, appeared to shut in the scene from infinite space.For aught Georgiana knew, it might be a pavilion among the clouds.And Aylmer, excluding the sunshine, which would have interfered with his chemical processes, had supplied its place with perfumed lamps, emitting flames of various hue, but all uniting in a soft, impurpled radiance.He now knelt by his wife’s side, watching her earnestly, but without alarm; for he was confident in his science, and felt that he could draw a magic circle round her within which no evil might intrude."
"“我在哪儿？啊，我想起来了，”乔治亚娜无力地说；她把手按在脸颊上，想遮住那个可怕的痣，不让丈夫看到。","“Where am I?Ah, I remember,” said Georgiana, faintly; and she placed her hand over her cheek to hide the terrible mark from her husband’s eyes."
"“别害怕，亲爱的！”他大叫，“别躲着我！相信我，乔治亚娜，我甚至为这个瑕疵感到高兴，因为能祛掉它真是让我欣喜若狂。”","“Fear not, dearest!” exclaimed he.“Do not shrink from me!Believe me, Georgiana, I even rejoice in this single imperfection, since it will be such a rapture to remove it.”"
"“噢，饶了我吧！”妻子难过地回答道，“求求你别再看那颗痣。我永远也忘不了你抽搐般的战栗。”","“Oh, spare me!” sadly replied his wife.“Pray do not look at it again.I never can forget that convulsive shudder.”"
"为了安抚乔治亚娜，或者说是为了让她摆脱现实的烦恼，艾尔默用了一些轻松而有趣的奥秘，这些是他从博大精深的科学中学到的。虚幻的人物、无形的意念、飘渺的美景一齐出现，舞动在她的眼前，在道道光束上留下它们转瞬即逝的脚步。尽管乔治亚娜对如何制造这些光学现象略知一二，但这种幻觉近乎于完美，这足以使她相信自己的丈夫有支配精神世界的力量。接着，她想从这密室往外看看，但很快，就像这念头得到了回应似的，外界的一切顺次从她的眼帘掠过。现实生活中的景象与人物都完美地展现在她的眼前，风格迥异而令人心醉神迷。而这种迥异的风格往往能创造出高于原作的画卷、影像、或是影子。看够这些后，艾尔默让乔治亚娜看一个装了土的容器。乔治亚娜看了过去，刚开始没怎么在意；但很快便惊奇地发现，一颗胚芽正破土而出。接着长出了纤细的根茎，叶片也渐渐舒展开来，中间开了一朵娇嫩可爱的花。","In order to soothe Georgiana, and, as it were, to release her mind from the burden of actual things, Aylmer now put in practice some of the light and playful secrets which science had taught him among its profounder lore.Airy figures, absolutely bodiless ideas, and forms of unsubstantial beauty came and danced before her, imprinting their momentary footsteps on beams of light.Though she had some indistinct idea of the method of these optical phenomena, still the illusion was almost perfect enough to warrant the belief that her husband possessed sway over the spiritual world.Then again, when she felt a wish to look forth from her seclusion, immediately, as if her thoughts were answered, the procession of external existence flitted across a screen.The scenery and the figures of actual life were perfectly represented, but with that bewitching, yet indescribable difference which always makes a picture, an image, or a shadow so much more attractive than the original.When wearied of this, Aylmer bade her cast her eyes upon a vessel containing a quantity of earth.She did so, with little interest at first; but was soon startled to perceive the germ of a plant shooting upward from the soil.Then came the slender stalk; the leaves gradually unfolded themselves; and amid them was a perfect and lovely flower."
"“太神奇了！”乔治亚娜叫道，“可我不敢碰它。”","“It is magical!” cried Georgiana.“I dare not touch it.”"
"“别怕，把那朵花摘下来，”艾尔默回答道，“摘下来，赶紧吸进那瞬间的花香。这花一会儿就要枯萎，除了棕色的种子壳什么也不会留下；但是它将繁衍出与它一样短命的花来。”","“Nay, pluck it,” answered Aylmer,—“pluck it, and inhale its brief perfume while you may.The flower will wither in a few moments and leave nothing save its brown seed vessels; but thence may be perpetuated a race as ephemeral as itself.”"
"但是乔治亚娜一碰到那朵花，整棵花就枯萎了，叶子变得炭黑，就像被火烧过一样。","But Georgiana had no sooner touched the flower than the whole plant suffered a blight, its leaves turning coal-black as if by the agency of fire."
"“这种刺激太强烈了。”艾尔默若有所思地说。","“There was too powerful a stimulus,” said Aylmer, thoughtfully."
"为了补偿这失败的实验，艾尔默提议用自己发明的一种科学方法，给妻子画一幅肖像。这要通过光线射在抛光的金属板上来实现。乔治亚娜同意了；但是一看结果，那个肖像轮廓模糊，难以辨认，把她吓了一跳；而本来应该是脸颊的地方却出现了一只手形。艾尔默一把抓过那个金属板，扔到一坛腐蚀酸中。","To make up for this abortive experiment, he proposed to take her portrait by a scientific process of his own invention.It was to be effected by rays of light striking upon a polished plate of metal.Georgiana assented; but, on looking at the result, was affrighted to find the features of the portrait blurred and indefinable; while the minute figure of a hand appeared where the cheek should have been.Aylmer snatched the metallic plate and threw it into a jar of corrosive acid."
"然而，他很快就忘记了那些羞辱难当的失败。在进行研究和化学实验的空档，他跑到乔治亚娜跟前，满脸通红，精疲力竭，但似乎有她在身边又精神百倍，于是眉飞色舞地谈论着他那些成果所用的科学手段。他说起一代代的炼金术士那些人长年累月寻求一种万能溶剂，它可以从所有恶劣低俗的事物中提炼出黄金来。艾尔默似乎相信，凭着最简单的科学原理，要找到人们追寻已久的这一媒介还是有可能的；“但是，”他补充说，“任何为了练就此本领而深入钻研的哲学家都智慧非凡，而不屑于屈尊去做这种事。”关于这长生不老药的发展历程，他的观点很独特。他毫不隐讳地声称，他可以随意配制一种药水，将生命无限延长；但这会破坏自然界的和谐，主要是那些服用这长生不老药的人会来诅咒。","Soon, however, he forgot these mortifying failures.In the intervals of study and chemical experiment he came to her flushed and exhausted, but seemed invigorated by her presence, and spoke in glowing language of the resources of his art.He gave a history of the long dynasty of the alchemists, who spent so many ages in quest of the universal solvent by which the golden principle might be elicited from all things vile and base.Aylmer appeared to believe that, by the plainest scientific logic, it was altogether within the limits of possibility to discover this long-sought medium; “but,” he added, “a philosopher who should go deep enough to acquire the power would attain too lofty a wisdom to stoop to the exercise of it.”Not less singular were his opinions in regard to the elixir vitae.He more than intimated that it was at his option to concoct a liquid that should prolong life for years, perhaps interminably; but that it would produce a discord in Nature which all the world, and chiefly the quaffer of the immortal nostrum, would find cause to curse."
"“艾尔默，你说的是真的？”乔治亚娜看着他，心中又惊又怕，“有这样的能力太可怕了，甚至希望有这样的能力也很可怕。”","“Aylmer, are you in earnest?” asked Georgiana, looking at him with amazement and fear.“It is terrible to possess such power, or even to dream of possessing it.”"
"“哦，我亲爱的，别发抖，”艾尔默说，“我不会给我们的生活带来这些乱七八糟的影响，这会害了咱俩；但我要你想想，相比较而言，祛除这只小手印所需要的技能是多么微不足道。”","“Oh, do not tremble, my love,” said her husband.“I would not wrong either you or myself by working such inharmonious effects upon our lives; but I would have you consider how trifling, in comparison, is the skill requisite to remove this little hand.”"
"一提到那颗胎痣，乔治亚娜又像平常一样畏缩起来，像是一块炽热的烙铁烫到她的脸一样。","At the mention of the birthmark, Georgiana, as usual, shrank as if a redhot iron had touched her cheek."
"艾尔默又投身到自己的工作中。乔治亚娜可以听到远处锅炉房里丈夫指挥阿米纳达布的声音，阿米纳达布应答的声音刺耳粗俗而又古怪，更像是一头野兽在嘟囔或咆哮，而不是人在说话。几个小时后，艾尔默又回来了，他提议妻子去检查他那放置化学品和大自然宝藏的橱柜。艾尔默从化学药品中挑了一个小药水瓶给妻子看，他说里面装的是一种温和却威力十足的香精，可以使吹遍全国的微风都带上这种香味。这个小瓶子里的东西是无价之宝；他边说边洒了几滴到空气里，整个房间立即弥漫着沁人心脾、令人快活的香味儿。","Again Aylmer applied himself to his labors.She could hear his voice in the distant furnace room giving directions to Aminadab, whose harsh, uncouth, misshapen tones were audible in response, more like the grunt or growl of a brute than human speech.After hours of absence, Aylmer reappeared and proposed that she should now examine his cabinet of chemical products and natural treasures of the earth.Among the former he showed her a small vial, in which, he remarked, was contained a gentle yet most powerful fragrance, capable of impregnating all the breezes that blow across a kingdom.They were of inestimable value, the contents of that little vial; and, as he said so, he threw some of the perfume into the air and filled the room with piercing and invigorating delight."
"“那这是什么？”乔治亚娜指着一个盛着金色液体的小玻璃球问道，“这个真好看，我想这就是延年益寿的灵丹妙药吧。”","“And what is this?” asked Georgiana, pointing to a small crystal globe containing a gold-colored liquid.“It is so beautiful to the eye that I could imagine it the elixir of life.”"
"“从某种意义上来说是的，”艾尔默回答说，“或者说就是长生不老药。这是世上迄今为止配制出来的最宝贵的毒药。有了它，无论你指向哪个人，我都可以限定这人的寿命。这剂药的效力可以决定他是可以苟延残喘几年，还是突然倒地身亡。即使戒备森严，也没有哪个国王可以保住性命，如果我在自己的实验室决定，为了百万民众的福祉，需要夺取他的生命的话。”","“In one sense it is,” replied Aylmer; “or, rather, the elixir of immortality.It is the most precious poison that ever was concocted in this world.By its aid I could apportion the lifetime of any mortal at whom you might point your finger.The strength of the dose would determine whether he were to linger out years, or drop dead in the midst of a breath.No king on his guarded throne could keep his life if I, in my private station, should deem that the welfare of millions justified me in depriving him of it.”"
"“你为什么要保留这么可怕的药水？”乔治亚娜吓坏了。","“Why do you keep such a terrific drug?” inquired Georgiana in horror."
"“不要怀疑我，亲爱的，”这位丈夫微笑着说，“它药效的好处比害处要大得多。你看看！这是多么奇妙的化妆品啊。在一瓶水里滴上几滴，雀斑很容易就可以洗掉，就像把手洗干净一样。如果提高溶液浓度，就能去掉脸上的血色，把脸色最红润的美女变成一个苍白的幽灵。”","“Do not mistrust me, dearest,” said her husband, smiling; “its virtuous potency is yet greater than its harmful one.But see! here is a powerful cosmetic.With a few drops of this in a vase of water, freckles may be washed away as easily as the hands are cleansed.A stronger infusion would take the blood out of the cheek, and leave the rosiest beauty a pale ghost.”"
"“你是不是打算用这溶液来给我洗脸啊？”乔治亚娜急切地问道。","“Is it with this lotion that you intend to bathe my cheek?” asked Georgiana, anxiously."
"“哦，不，”丈夫急忙回答说，“这只用于表面治疗。你的情况需要一种效力更高的药物。”","“Oh, no,” hastily replied her husband; “this is merely superficial.Your case demands a remedy that shall go deeper.”"
"艾尔默与乔治亚娜交谈时，通常要细细询问她感受如何，是否适应这足不出户的生活和屋里的气温。这些问题有着特殊的用意，乔治亚娜开始怀疑自己的身体受到了一定的影响，或是因为她吸入了那些芳香的空气，或是食物没吃对。她还幻想着，但可能也只能幻想，她的整个身体在翻腾——一种奇怪、难以言状的感觉在血管里流淌，在她的心里激发起喜忧参半的感觉。无论她什么时候鼓足勇气照照镜子，都能看到那如白玫瑰般苍白的脸，还有脸上那颗深红色的胎痣。现在乔治亚娜比艾尔默都更憎恨这颗胎痣了。","In his interviews with Georgiana, Aylmer generally made minute inquiries as to her sensations and whether the confinement of the rooms and the temperature of the atmosphere agreed with her.These questions had such a particular drift that Georgiana began to conjecture that she was already subjected to certain physical influences, either breathed in with the fragrant air or taken with her food.She fancied likewise, but it might be altogether fancy, that there was a stirring up of her system—a strange, indefinite sensation creeping through her veins, and tingling, half painfully, half pleasurably, at her heart.Still, whenever she dared to look into the mirror, there she beheld herself pale as a white rose and with the crimson birthmark stamped upon her cheek.Not even Aylmer now hated it so much as she."
"丈夫潜心去做合成分析了，为了打发这段无聊的时间，乔治亚娜翻开了丈夫科研室里的几本书。在一堆灰暗陈旧的大部头书里，她读到了几个章节，其内容都是传奇小说和诗歌。这是中世纪哲学家的作品，比如大阿尔伯图斯、科尔内留斯·阿格里帕、帕拉塞尔瑟斯，还有那个著名的行乞修道士，是他造就了有预言能力的“黄铜头颅”。所有这些古老的自然主义学者都走在其所处时代的前列，然而却容易为那些时代所迷惑，因此他们也得到了人们的信任，或许他们还以为自己从对大自然的研究中获得了超越大自然的力量，从物质世界获得了支配精神世界的力量。早期的《皇家学会会刊》也充满好奇心和想象力，其成员对自然潜力的界限知之甚少，却不断地记载奇迹或提出可以创造奇迹的办法。","To dispel the tedium of the hours which her husband found it necessary to devote to the processes of combination and analysis, Georgiana turned over the volumes of his scientific library.In many dark old tomes she met with chapters full of romance and poetry.They were the works of philosophers of the middle ages, such as Albertus Magnus, Cornelius Agrippa, Paracelsus, and the famous friar who created the prophetic Brazen Head.All these antique naturalists stood in advance of their centuries, yet were imbued with some of their credulity, and therefore were believed, and perhaps imagined themselves to have acquired from the investigation of Nature a power above Nature, and from physics a sway over the spiritual world.Hardly less curious and imaginative were the early volumes of the Transactions of the Royal Society, in which the members, knowing little of the limits of natural possibility, were continually recording wonders or proposing methods whereby wonders might be wrought."
"但对于乔治亚娜而言，最引人入胜的是她丈夫亲手写的一大本日志，里面记录了他科研生涯里的每一个实验，实验的最初目标，实验过程所采用的各种方法，实验是以成功还是失败告终，以及导致这些结果的原因。事实上，这本书记载并象征着艾尔默热情洋溢、雄心勃勃、富于想象且务实、勤奋的生活。对他而言，掌握自然科学的种种细节是件至高无上的事情；然而他把所有细节都精神化，用他对这个浩瀚宇宙强烈而迫切的渴望把自己从物质主义中解救出来。在他看来，连最结实的土疙瘩也有了灵魂。乔治亚娜一边读，一边更加敬仰和喜爱艾尔默了，但却不像以前那样盲目相信他的观点了。尽管丈夫成就卓著，乔治亚娜却认为，如果同丈夫所追求的理想目标相比，他那些最辉煌的成功几乎无一例外都是失败。与那些无法企及的无价之宝相比，他最闪亮的钻石不过就是鹅卵石。而只有他自己认为它是钻石。那本日志里记载的全是为作者赢得荣誉的成就，然而它们却充满忧伤，就像出自于死神之笔一样。这本书是忏悔录，笔调悲伤，例证丰富，描述了这位复杂人物的种种缺点——其精神之下仍然是泥土和劳作的物质实体，还描述了他发现自己遭到世俗的阻挠时悲痛欲绝的心情。也许任何领域的天才都会在艾尔默的日志中找到自己过往的影子。","But to Georgiana the most engrossing volume was a large folio from her husband’s own hand, in which he had recorded every experiment of his scientific career, its original aim, the methods adopted for its development, and its final success or failure, with the circumstances to which either event was attributable.The book, in truth, was both the history and emblem of his ardent, ambitious, imaginative, yet practical and laborious life.He handled physical details as if there were nothing beyond them; yet spiritualized them all, and redeemed himself from materialism by his strong and eager aspiration towards the infinite.In his grasp the veriest clod of earth assumed a soul.Georgiana, as she read, reverenced Aylmer and loved him more profoundly than ever, but with a less entire dependence on his judgment than heretofore.Much as he had accomplished, she could not but observe that his most splendid successes were almost invariably failures, if compared with the ideal at which he aimed.His brightest diamonds were the merest pebbles, and felt to be so by himself, in comparison with the inestimable gems which lay hidden beyond his reach.The volume, rich with achievements that had won renown for its author, was yet as melancholy a record as ever mortal hand had penned.It was the sad confession and continual exemplification of the shortcomings of the composite man, the spirit burdened with clay and working in matter, and of the despair that assails the higher nature at finding itself so miserably thwarted by the earthly part.Perhaps every man of genius in whatever sphere might recognize the image of his own experience in Aylmer’s journal."
"这些回忆录深深打动了乔治亚娜，她把脸埋在翻开的书页中，泪水夺眶而出。正在这时，丈夫发现了她。","So deeply did these reflections affect Georgiana that she laid her face upon the open volume and burst into tears.In this situation she was found by her husband."
"“读一个男巫士的书是很危险的，”他微笑着说，尽管他的表情很不自在，也很不快，“乔治亚娜，那本册子里有几页我都读不下去，它们无法让我冷静。小心它们会同样伤害到你。”","“It is dangerous to read in a sorcerer’s books,” said he with a smile, though his countenance was uneasy and displeased.“Georgiana, there are pages in that volume which I can scarcely glance over and keep my senses.Take heed lest it prove as detrimental to you.”"
"“这书让我比以前更加崇拜你了。”乔治亚娜说。","“It has made me worship you more than ever,” said she."
"“啊，等这个实验成功，”他又说，“那时再来崇拜我吧，如果你还愿意的话。我认为我很值得崇拜。不过，来吧，我一直在找寻你悦耳的声音。给我唱唱歌吧，亲爱的。”","“Ah, wait for this one success,” rejoined he, “then worship me if you will.I shall deem myself hardly unworthy of it.But come, I have sought you for the luxury of your voice.Sing to me, dearest.”"
"于是，乔治亚娜唱出美妙的歌曲，以解除他精神上的饥渴。然后，他像一个孩童般满怀欣喜地离开，向她保证她还是得继续滞留，只是需要一点儿时间，实验结果已经很明确了。他刚刚离开，乔治亚娜涌起一股难以抗拒的冲动，想要跟着他去。她忘了告诉艾尔默，两三个小时之前，她注意到自己的身体出现了一个症状。是有关那颗致命的胎痣的感受，不痛，但是让她整个人很不自在。她快步跟在丈夫身后，第一次闯进这个实验室。","So she poured out the liquid music of her voice to quench the thirst of his spirit.He then took his leave with a boyish exuberance of gayety, assuring her that her seclusion would endure but a little longer, and that the result was already certain.Scarcely had he departed when Georgiana felt irresistibly impelled to follow him.She had forgotten to inform Aylmer of a symptom which for two or three hours past had begun to excite her attention.It was a sensation in the fatal birthmark, not painful, but which induced a restlessness throughout her system.Hastening after her husband, she intruded for the first time into the laboratory."
