"zh","en"
"“‘是啊，先生，是啊，戈弗雷少爷就是这个样子，总是充满了勇气。告诉您吧，先生，这园子里没有哪棵树他没上去过。他什么都不怕。他以前是个好小伙子——噢，先生，以前他可真是个好小伙子。’","“ ‘Yes, sir, yes, that is Master Godfrey all over. He was always courageous. There’s not a tree in the park, sir, that he has not climbed. Nothing would stop him. He was a fine boy—and oh, sir, he was a fine man.’"
"“我一下子跳了起来。","“I sprang to my feet."
"“‘听着！’我大叫一声。‘你说他以前是个好小伙子，听上去就跟他已经死了一样。你们干吗要搞得这么神神秘秘？戈弗雷·埃姆斯沃思到底出了什么事情？’","“ ‘Look here!’ I cried. ‘You say he *was*. You speak as if he were dead. What is all this mystery? What has become of Godfrey Emsworth?’"
"“我抓住老管家的肩膀，他闪身挣脱了我。","“I gripped the old man by the shoulder, but he shrank away."
"“‘我听不懂您在说什么，先生。要知道戈弗雷少爷的事情，您就去问老爷吧。他知道这些事情，轮不到我来插手。’","“ ‘I don’t know what you mean, sir. Ask the master about Master Godfrey . He knows. It is not for me to interfere.’"
"“他打算往外走，可我抓住了他的胳膊。","“He was leaving the room, but I held his arm."
"“‘听着，’我说。‘出去之前，你一定得回答我最后一个问题，不然的话，我一整夜都不会松手。戈弗雷死了吗？’","“ ‘Listen,’ I said. ‘You are going to answer one question before you leave if I have to hold you all night. Is Godfrey dead?’"
"“他不敢面对我的目光，看上去就跟中了催眠术一样。接下来，他千辛万苦地挤出了一个回答，一个出人意料的可怕回答。","“He could not face my eyes. He was like a man hypnotized.The answer was dragged from his lips. It was a terrible and unexpected one."
"“‘死了倒好！’他大叫一声，挣脱我的掌握，飞也似地冲出了房间。","“ ‘I wish to God he was!’ he cried, and, tearing himself free, he dashed from the room."
"“可想而知，福尔摩斯先生，坐回椅子上的时候，我的心情说不上特别地愉快。在我看来，老管家的话只能有一种含义。我那个倒霉的朋友显然是卷进了某种犯罪活动，退一万步说也是卷进了某种有损家声的可耻勾当。为了防止丑闻曝光，作风严厉的老爷子已经把儿子打发到了别处，不让他在社会上抛头露面。戈弗雷是个天不怕地不怕的家伙，很容易受身边众人的影响。毫无疑问，他一定是交友不慎，被人引上了身败名裂的歧途。真是那样的话，那可就太让人惋惜了。即便如此，我仍然有责任找到他，看看我能不能帮上他的忙。我正在心急火燎地盘算这件事情，无意中抬头一看，戈弗雷·埃姆斯沃思就站在我的眼前。”","“You will think, Mr. Holmes, that I returned to my chair in no very happy state of mind. The old man’s words seemed to me to bear only one interpretation. Clearly my poor friend had become involved in some criminal or, at the least, disreputable transaction which touched the family honour. That stern old man had sent his son away and hidden himfrom the world lest some scandal should come to light. Godfrey was areckless fellow. He was easily influenced by those around him. No doubthe had fallen into bad hands and been misled to his ruin. It was a piteous business, if it was indeed so, but even now it was my duty to hunt him out and see if I could aid him. I was anxiously pondering the matter when I looked up, and there was Godfrey Emsworth standing before me.”"
"我的主顾突然打住了话头，看样子是激动得不行。","My client had paused as one in deep emotion."
"“接着讲吧。”我说道。“从某些方面来说，您这件案子还真是很不寻常哩。”","“Pray continue,” I said. “Your problem presents some very unusual features.”"
"“他站在窗子外面，福尔摩斯先生，还把脸贴在了窗玻璃上。刚才我跟您说了，当晚我曾经拉开窗帘往外看。看完之后，我并没有把窗帘拉严实。到这会儿，他的身影就出现在了窗帘的缝隙之中。窗子是落地式的，所以我可以看见他的全身，可我顾不上看别的，只知道直勾勾地盯着他的脸。他的脸白得跟死人一样，我从来没见过白成那样的人。依我看，只有鬼魂才会是那种模样，可他的眼睛迎上了我的眼睛，那双眼睛分明属于一个活着的人。他发现我正在看他，于是就往后一蹿，消失在了黑暗当中。","“He was outside the window, Mr. Holmes, with his face pressed against the glass. I have told you that I looked out at the night. When I did so I left the curtains partly open. His figure was framed in this gap. The window came down to the ground and I could see the whole length of it, but it was his face which held my gaze. He was deadly pale—never have Iseen a man so white. I reckon ghosts may look like that; but his eyes met mine, and they were the eyes of a living man. He sprang back when he saw that I was looking at him, and he vanished into the darkness."
"“他的样子着实让人惊骇，福尔摩斯先生。这不仅仅是因为他的脸在黑暗之中闪着奶酪一般的白光，看起来形同鬼魅，还因为他那种不易察觉的神色，那是一种偷偷摸摸、鬼鬼祟祟、做贼心虚的神色，跟我以前认识的那个坦率阳刚的小伙子大不相同。看到他如此模样，我觉得毛骨悚然。","“There was something shocking about the man, Mr. Holmes. It wasn’t merely that ghastly face glimmering as white as cheese in the darkness. It was more subtle than that— something slinking, something furtive, something guilty— something very unlike the frank, manly lad that I had known. It left a feeling of horror in my mind."
"“不过，如果你当过一两年兵，成天都在跟布尔兄弟玩游戏，那你肯定能学会处变不惊，果断行事。这么着，戈弗雷的身影还没消失，我已经冲到了窗子跟前。窗闩很不灵便，我费了点儿工夫才把它弄开。接下来，我急匆匆地跑上花园里的小径，朝着我估计他逃走的方向追了过去。","“But when a man has been soldiering for a year or two with brother Boer as a playmate, he keeps his nerve and acts quickly. Godfrey had hardly vanished before I was at the window. There was an awkward catch, and I was some little time before I could throw it up. Then I nipped through and ran down the garden path in the direction that I thought he might have taken."
"“小径很长，光线也不太好，可我还是隐约看到前面有东西在动。我边跑边喊他的名字，只可惜没有任何用处。小径的尽头出现了几条方向各不相同的岔路，分别通往庭园各处的几座小屋。我正在那里犹豫不决，耳边却清清楚楚地传来了关门的声音。声音不是来自我身后的宅子，而是来自前方的暗处。这声音足以让我断定，福尔摩斯先生，刚才我看见的并不是一个幻影。戈弗雷确实从我眼前逃了开去，并且跑进了某座小屋，关上了小屋的门。这些都是铁板钉钉的事实。","“It was a long path and the light was not very good, but it seemed to me something was moving ahead of me. I ran on and called his name, but it was no use. When I got to the end of the path there were several others branching in different directions to various outhouses. I stood hesitating, and as I did so I heard distinctly the sound of a closing door. It was not behind me in the house, but ahead of me, somewhere in the darkness. That was enough, Mr. Holmes, to assure me that what I had seen was not a vision. Godfrey had run away from me, and he had shut a door behind him. Of that I was certain."
"“我已经无计可施，只好转身回房，心神不宁地过了一夜，翻来覆去地掂量着这件事情，想找到一个足以涵盖所有事实的解释。到了第二天，我发现上校的态度好了许多。这一来，等他妻子提到附近有几处名胜的时候，我赶紧抓住机会问了一句，方不方便留我再住一宿。老爷子勉勉强强地表示默许，我由此赢得了一整天的时间，可以好好地观察观察。我已经确切地知道戈弗雷藏在附近，不知道的则是他具体藏在哪里，为什么要藏起来。","“There was nothing more I could do, and I spent an uneasy night turning the matter over in my mind and trying to find some theory which would cover the facts. Next day I found the colonel rather more conciliatory , and as his wife remarked that there were some places of interest in the neighbourhood, it gave me an opening to ask whether my presence for one more night would incommode them. A somewhat grudging acquiescence from the old man gave me a clear day in which to make my observations. I was already perfectly convinced that Godfrey was in hiding somewhere near, but where and why remained to be solved."
"“他家的宅子大得要命，格局也乱得要命，就算藏了一个团的人也不会被人发现。秘密如果是藏在宅子里的话，打探起来自然是非常费劲。还好，我听见的关门声肯定不是从宅子里来的。如此说来，我必须把花园搜查一遍，看看能有什么样的发现。这方面倒没有什么障碍，因为老人家也有自个儿的事情要忙，我可以自行其是。","“The house was so large and so rambling that a regiment might be hid away in it and no one the wiser. If the secret lay there it was difficult for me to penetrate it. But the door which I had heard close was certainly not in the house. I must explore the garden and see what I could find. There was no difficulty in the way , for the old people were busy in their own fashion and left me to my own devices."
"“庭园里的几座屋子都很小，花园的尽头却有一座略具规模的独立建筑，大得可以充当花匠或者猎场看守的住所。难不成，关门的声音就是从这儿来的吗？我摆出一副在庭园里随意闲逛的架势，溜溜达达地走到了屋子跟前。就在这时，一个身材矮小、动作麻利的大胡子男人从屋里走了出来。他穿着一件黑色的大衣，戴着一顶圆顶礼帽，样子跟那些当花匠的完全不同。出乎我意料的是，他一出来就锁上了门，还把钥匙装进了衣兜。看到我的时候，他显得有点儿惊讶。","“There were several small outhouses, but at the end of the garden there was a detached building of some size— large enough for a gardener’s or a gamekeeper’s residence. Could this be the place whence the sound of that shutting door had come? I approached it in a careless fashion as though I were strolling aimlessly round the grounds. As I did so, a small, brisk, bearded man in a black coat and bowler hat—not at all the gardener type—came out of the door. To my surprise, he locked it after him and put the key in his pocket. Then he looked at me with some surprise on his face."
"“‘您是这儿的客人吗？’他问我。“我告诉他，我确实是这儿的客人，同时告诉他，我还是戈弗雷的朋友。","“ ‘ Are you a visitor here?’ he asked."
"“‘真是不凑巧，他居然旅游去了，因为他肯定很想跟我见面。 ’我补充了一句。","“I explained that I was and that I was a friend of Godfrey’s."
"“‘是啊，确实不凑巧。’他的口气听着有点儿内疚。‘当然喽，您可以挑个更合适的时间再来一趟。’他从我身边走了过去，可是，等到我转过身去的时候，却发现他站在花园远端的月桂树丛里，探出了半个身子，正在观察我的动静。","“ ‘What a pity that he should be away on his travels, for he would have so liked to see me,’ I continued."
"“从那座小屋旁边走过的时候，我看得非常仔细，只可惜小屋拉着厚厚的窗帘，怎么看也只是一座空屋。表现得太过鲁莽的话，我没准儿会亲手毁掉自己的计划，甚至可能被他们扫地出门，因为我仍然感觉得到，有人在监视我的行动。想到这里，我溜达着走回了宅子，到晚上才再次展开调查。夜黑人静的时候，我从窗子溜了出去，径直奔向那座神秘的小屋，尽量不发出任何声音。","“ ‘Quite so. Exactly ,’ said he with a rather guilty air. ‘No doubt you will renew your visit at some more propitious time.’ He passed on, but when I turned I observed that he was standing watching me, half-concealed by the laurels at the far end of the garden."
"“刚才我只是说小屋拉着厚厚的窗帘，眼下我才发现，它那些窗子还上着窗板。还好，有一扇窗子透着一点儿灯光，于是我一门心思地盯上了这扇窗子。算我走运，这扇窗子的窗帘没拉严实，窗板上又有一道裂缝，所以我可以看到屋里的情形。屋里的气氛相当欢快，灯光明亮，炉火熊熊。我早上见过的那个矮小男人坐在正对着我的位置，一边抽烟斗，一边阅读报刊。”","“I had a good look at that little house as I passed it, but the windows were heavily curtained, and, so far as one could see, it was empty. I might spoil my own game and even be ordered off the premises if I were too audacious, for I was still conscious that I was being watched. Therefore, I strolled back to the house and waited for night before I went on with my inquiry . When all was dark and quiet I slipped out of my window and made my way as silently as possible to the mysterious lodge."
"“什么报刊？”我问道。","“I have said that it was heavily curtained, but now I found that the windows were shuttered as well. Some light, however, was breaking through one of them, so I concentrated my attention upon this. I was in luck, for the curtain had not been quite closed, and there was a crack in the shutter, so that I could see the inside of the room. It was a cheery place enough, a bright lamp and a blazing fire. Opposite to me was seated the little man whom I had seen in the morning. He was smoking a pipe and reading a paper.”"
"我这么一打岔，我的主顾似乎不太高兴。","“What paper?” I asked. My client seemed annoyed at the interruption of his narrative."
"“这有什么要紧的呢？”他问道。","“Can it matter?” he asked."
"“再要紧不过了。”","“It is most essential.”"
"“我真的没注意。”","“I really took no notice.”"
"“可您多半能注意到，它的开本是跟大报一样大，还是像周刊那么小。”","“Possibly you observed whether it was a broad-leafed paper or of that smaller type which one associates with weeklies.”"
"“您这么一说，我倒是想起来了，他手里的报刊确实不大，兴许是《旁观者》杂志[^10]吧。话说回来，当时我真的顾不上研究这样的细节，因为屋里还有个背对窗子坐着的人，而我可以发誓，这个人就是戈弗雷。我虽然看不见他的脸，可我认得他肩膀倾斜的线条。他用一只手支着脑袋，一副痛心疾首的架势，身子则对着炉火。我正在琢磨接下来该怎么办，肩膀上就重重地挨了一下，转头一看，埃姆斯沃思上校已经站在了我的身旁。","“Now that you mention it, it was not large. It might have been the *Spectator*. However, I had little thought to spare upon such details, for a second man was seated with his back to the window, and I could swear that this second man was Godfrey. I could not see his face, but I knew the familiar slope of his shoulders. He was leaning upon his elbow in an attitude of great melancholy , his body turned towards the fire. I was hesitating as to what I should do when there was a sharp tap on my shoulder, and there was Colonel Emsworth beside me."
"“‘这边请，先生！’他低声说了一句。他一声不吭地走向宅子，我只好跟在后面，一直走进了我自个儿的卧室。他手里有一本列车时刻表，是他从大厅里拿来的。","“ ‘This way , sir!’ said he in a low voice. He walked in silence to the house, and I followed him into my own bedroom. He had picked up a timetable in the hall."
"“‘明早八点半有一班去伦敦的火车，’他说。‘八点钟的时候，马车会到门口来接你。’","“ ‘There is a train to London at 8:30,’ said he. ‘The trap will be at the door at eight.’"
"“他气得脸都白了，说实在的，我自个儿也觉得无地自容，只能结结巴巴地一边道歉，一边竭力强调，我这么做都是因为我担心朋友的安危。","“He was white with rage, and, indeed, I felt myself in so difficult a position that I could only stammer out a few incoherent apologies in which I tried to excuse myself by urging my anxiety for my friend."
"“‘这件事情没有商量的余地。’他突然打断了我。‘你这么刺探我们家的隐私，实在是可恶之极。你到我们这儿来作客，眼下却干起了间谍的勾当。我已经无话可说，先生，只剩下最后一句，我再也不想见到你。’","“ ‘The matter will not bear discussion,’ said he abruptly. ‘You have made a most damnable intrusion into the privacy of our family . You were here as a guest and you have become a spy. I have nothing more to say, sir, save that I have no wish ever to see you again.’"
"“听了这句话，福尔摩斯先生，我一下子怒不可遏，言辞也变得激烈起来。","“At this I lost my temper, Mr. Holmes, and I spoke with some warmth."
"“‘我已经看见了您的儿子，而我深信不疑，您不让他接触社会，完全是出于您自个儿的考虑。我虽然不知道您为什么要用这种方法来禁锢他，可我肯定他已经丧失了人身自由。我警告您，埃姆斯沃思上校，除非我确知我朋友平安无事，否则我绝不会半途而废，一定要把这件谜案查个水落石出！还有啊，我绝不会胆怯收手，不管您怎么说，怎么做。’","“ ‘I have seen your son, and I am convinced that for some reason of your own you are concealing him from the world. I have no idea what your motives are in cutting him off in this fashion, but I am sure that he is no longer a free agent. I warn you, Colonel Emsworth, that until I am assured as to the safety and well-being of my friend I shall never desist in my efforts to get to the bottom of the mystery, and I shall certainly not allow myself to be intimidated by anything which you may say or do.’"
"“老家伙露出了恶魔似的凶相，我真以为他打算跟我动手哩。我说过他是个瘦削凶暴的老巨人，所以呢，尽管我并不是什么弱不禁风的软蛋，对付他也不是那么容易。不过，他只是火冒三丈地瞪了我半天，最终还是转过身去，就这么走出了房间。我呢，今早就坐上了他指定的那班火车，一心只想着我在信里跟您约好的这次会面，想着要直接过来找您，寻求您的指教和帮助。”","“The old fellow looked diabolical, and I really thought he was about to attack me. I have said that he was a gaunt, fierce old giant, and though I am no weakling I might have been hard put to it to hold my own against him. However, after a long glare of rage he turned upon his heel and walked out of the room. For my part, I took the appointed train in the morning, with the full intention of coming straight to you and asking for your advice and assistance at the appointment for which I had already written.”"
"以上就是客人摆在我面前的问题。机敏的读者肯定已经发现，这个问题一点儿也不难，原因是可能的答案少之又少，稍加筛选就可以求得正解。话说回来，这个问题虽然简单之极，终归也包含着一些新奇有趣的特点，值得我把它记录下来。到这会儿，我便用上了我滚瓜烂熟的逻辑分析方法，开始对可能的答案进行筛选。","Such was the problem which my visitor laid before me. It presented, as the astute reader will have already perceived, few difficulties in its solution, for a very limited choice of alternatives must get to the root of the matter. Still, elementary as it was, there were points of interest and novelty about it which may excuse my placing it upon record. I now proceeded, using my familiar method of logical analysis, to narrow down the possible solutions."
"“宅子里的仆人，”我问道，“一共有几个呢？”","“The servants,” I asked; “how many were in the house?”"
"“据我所知是只有老管家夫妇二人。看情形，这家人的生活简单极了。 ”","“To the best of my belief there were only the old butler and his wife. They seemed to live in the simplest fashion.”"
"“如此说来，那座独立的屋子里并没有仆人喽？”","“There was no servant, then, in the detached house?”"
"“没有，除非那个身材矮小的大胡子扮演着仆人的角色。不过，他的地位似乎远在仆人之上。”","“None, unless the little man with the beard acted as such. He seemed, however, to be quite a superior person.”"
"“这似乎很能说明问题。您有没有看到过宅子里的人往小屋里送食物呢？”","“That seems very suggestive. Had you any indication that food was conveyed from the one house to the other?”"
"“您的问题倒是提醒了我，我确实看见过老拉尔夫顺着花园小径往小屋的方向走，手里还拎着一个篮子。只不过，当时我并没有往食物那方面想。”","“Now that you mention it, I did see old Ralph carrying a basket down the garden walk and going in the direction of this house. The idea of food did not occur to me at the moment.”"
"“您有没有找当地人打听打听呢？”","“Did you make any local inquiries?”"
"“有的，我打听过。我跟车站的站长聊过，还有村里的客栈老板。当时我直截了当地问他俩，知不知道我老战友戈弗雷·埃姆斯沃思的情况。他俩都信誓旦旦地告诉我，他坐船环游世界去了。他俩还说，他差不多是刚一回家就踏上了旅程。显而易见，大家都接受了上校的说法。”","“Yes, I did. I spoke to the station-master and also to the innkeeper in the village. I simply asked if they knew anything of my old comrade, Godfrey Emsworth. Both of them assured me that he had gone for a voyage round the world. He had come home and then had almost at once started off again. The story was evidently universally accepted.”"
"“您没有跟他们说起您的怀疑吧？”","“You said nothing of your suspicions?”"
"“一个字儿也没说。”","“Nothing.”"
"“您做得非常明智。这件事情确实应该查一查，我打算跟您一起去塔克斯伯里老庄园。”","“That was very wise. The matter should certainly be inquired into. I will go back with you to Tuxbury Old Park.”"
"“今天吗？”","“Today?”"
"不巧的是，当时我正在做一件案子的扫尾工作，那件案子就是我朋友华生写过的“修院学堂案”，跟格雷敏斯特公爵关联至深[^11]。除此之外，我还接下了土耳其苏丹委办的一件案子，必须立刻采取行动，否则就可能导致极其严重的政治后果。这样一来，按照我日记当中的记录，直到接下来这个星期刚刚开始的时候，我总算是腾出了空闲，可以跟詹姆斯·M.多德先生一起去料理贝德福德郡的这件案子。坐马车前往尤斯顿车站的途中，我们接上了一位面色铁青、神情严峻、沉默寡言的先生，因为我跟这位先生有约在先。","It happened that at the moment I was clearing up the case which my friend Watson has described as that of the Abbey School, in which the Duke of Greyminster was so deeply involved. I had also a commission from the Sultan of Turkey which called for immediate action, as political consequences of the gravest kind might arise from its neglect. Therefore it was not until the beginning of the next week, as my diary records, that I was able to start forth on my mission to Bedfordshire in company with Mr. James M. Dodd. As we drove to Euston we picked up a grave and taciturn gentleman of iron-gray aspect, with whom I had made the necessary arrangements."
"“这位是我的老朋友。”我告诉多德。“我请他跟咱们一块儿去，有可能毫无必要，也有可能至关紧要。眼下这个阶段，咱们用不着细究这个问题。”","“This is an old friend,” said I to Dodd. “It is possible that his presence may be entirely unnecessary , and, on the other hand, it may be essential. It is not necessary at the present stage to go further into the matter.”"
"毫无疑问，华生的记述已经让读者们习惯了一个事实，也就是说，我绝不会为尚在权衡之中的案子浪费唇舌，也不会透露自己的想法。看到有人加入，多德似乎吃了一惊，不过他并没有说什么，我们三个便继续赶路。上了火车之后，我又问了多德一个问题，特意要让同行的这位先生听见。","The narratives of Watson, have accustomed the reader, no doubt, to the fact that I do not waste words or disclose my thoughts while a case is actually under consideration. Dodd seemed surprised, but nothing more was said, and the three of us continued our journey together. In the train I asked Dodd one more question which I wished our companion to hear."
