"zh","en"
"“想想吧，有人连他都忍心伤害。”他低头看着小胖墩儿脖子上那个鲜红刺目的小小疤痕，不由得喃喃自语。","“Fancy anyone having the heart to hurt him,” he muttered as he glanced down at the small, angry red pucker upon the cherub throat."
"就在这个时候，我无意中瞥了一眼福尔摩斯，发现他脸上带着一种极其古怪的专注神情。他的面容凝固不变，如同一件古老的牙雕，他的眼睛只在父子俩的身上停留了一个瞬间，这会儿已经充满好奇地盯住了房间对面。我顺着他的目光看了看，但却只能推想他看的是窗外那个水珠滴答的阴郁花园。窗外的景色确实已经被窗板遮掉了一半，可我仍然能够断定，他专心凝望的正是那扇窗子。","It was at this moment that I chanced to glance at Holmes and saw a most singular intentness in his expression. His face was as set as if it had been carved out of old ivory, and his eyes, which had glanced for a moment at father and child, were now fixed with eager curiosity upon something at the other side of the room. Following his gaze I could only guess that he was looking out through the window at the melancholy, dripping garden. It is true that a shutter had half closed outside and obstructed the view, but none the less it was certainly at the window that Holmes was fixing his concentrated attention."
"接下来，他微微一笑，目光回到了婴孩身上。婴孩的脖子胖乎乎的，上面印着那个小小的疤痕。福尔摩斯不声不响地把伤疤仔细检查了一遍，然后就握了握婴孩的小拳头。肉嘟嘟的小拳头漾着小涡，一直在他面前晃来晃去。","Then he smiled, and his eyes came back to the baby . On its chubby neck there was this small puckered mark. Without speaking, Holmes examined it with care. Finally he shook one of the dimpled fists which waved in front of him."
"“再见，小家伙。你的人生起点可真是不同寻常啊。保姆，我想跟你私下聊两句。”","“Good-bye, little man. You have made a strange start in life. Nurse, I should wish to have a word with you in private.”"
"他把保姆带到一边，郑重其事地聊了几分钟。我只听见了他最后的一句话：“照我看，你很快就不用再担心啦。”从外表上看，保姆是一个性情乖僻、沉默寡言的人。聊完之后，她抱着婴孩离开了房间。","He took her aside and spoke earnestly for a few minutes. I only heard the last words, which were: “Your anxiety will soon, I hope, be set at rest.” The woman, who seemed to be a sour, silent kind of creature, withdrew with the child."
"“梅森太太这个人怎么样呢？”福尔摩斯问道。","“What is Mrs. Mason like?” asked Holmes."
"“您也看见了，她的样子不怎么讨人喜欢，可她有一颗金子般的心，对小家伙也非常疼爱。”","“Not very prepossessing externally, as you can see, but a heart of gold, and devoted to the child.”"
"“你喜欢她吗，杰克？”福尔摩斯突然转向了那个少年。少年摇了摇头，表情丰富的脸庞阴云密布。","“Do you like her, Jack?” Holmes turned suddenly upon the boy. His expressive mobile face shadowed over, and he shook his head."
"“杰克是个爱憎分明的孩子。”弗格森一边说，一边把少年搂在怀里。“还好，我属于他喜欢的那一类。”","“Jacky has very strong likes and dislikes,” said Ferguson, putting his arm round the boy. “Luckily I am one of his likes.”"
"少年哼哼唧唧地一头扎进父亲怀里，弗格森轻轻地推开了他。","The boy cooed and nestled his head upon his father’s breast. Ferguson gently disengaged him."
"“去吧，小杰克。”他说了一句，然后就深情地目送着儿子走出房间。“好了，福尔摩斯先生，”少年出去之后，他接着说道，“我真的觉得，这次我让您白跑了一趟，除了同情之外，您还能给我什么呢？从您的角度来看，这肯定是一件格外难办、格外复杂的事情。”","“Run away, little Jacky,” said he, and he watched his son with loving eyes until he disappeared. “Now, Mr. Holmes,” he continued when the boy was gone, “I really feel that I have brought you on a fool’s errand, for what can you possibly do save give me your sympathy? It must be an exceedingly delicate and complex affair from your point of view.”"
"“难办是肯定的，”我朋友被主人的话逗得笑了起来，“复杂嘛，我到现在还没觉得。我的想法原本只是主观演绎的成果，不过，互不相关的众多细节已经一点一点地证明了我的演绎成果，这样一来，主观就变成了客观，咱们也就可以胸有成竹地宣布，咱们的目标已经实现。事实上，早在咱们离开贝克街之前，我已经实现了这个目标，剩下的工作仅仅是观察和确证而已。”","“It is certainly delicate,” said my friend with an amused smile, “but I have not been struck up to now with its complexity . It has been a case for intellectual deduction, but when this original intellectual deduction is confirmed point by point by quite a number of independent incidents, then the subjective becomes objective and we can say confidently that we have reached our goal. I had, in fact, reached it before we left Baker Street, and the rest has merely been observation and confirmation.”"
"弗格森大手一举，捂住了紧皱的额头。","Ferguson put his big hand to his furrowed forehead."
"“看在上帝分上，福尔摩斯，”他急得嗓子都哑了。“既然您看到了事情的真相，那就别让我担惊受怕了吧。我面临的是什么样的处境？究竟该怎么应付？我并不关心您的真相是怎么来的，只要它确实是真相就行。”","“For heaven’s sake, Holmes,” he said hoarsely; “if you can see the truth in this matter, do not keep me in suspense. How do I stand? What shall I do? I care nothing as to how you have found your facts so long as you have really got them.”"
"“我确实欠您一个解释，您也肯定能听到我的解释。不过，您总得允许我按我自己的方法来处理问题吧？那位女士可以见咱们吗，华生？”","“Certainly I owe you an explanation, and you shall have it. But you will permit me to handle the matter in my own way? Is the lady capable of seeing us, Watson?”"
"“她虽然病了，神志还是挺清醒的。”","“She is ill, but she is quite rational.”"
"“很好。她不在场的话，咱们就没法澄清这件事情。咱们上楼看她去吧。”","“Very good. It is only in her presence that we can clear the matter up. Let us go up to her.”"
"“她不会见我的。”弗格森叫道。","“She will not see me,” cried Ferguson."
"“哦，会的，她会见的。”福尔摩斯说道。他拿起一张纸，草草地写了几行字。“不管怎么样，你还是有通行证的，华生。能不能麻烦你把这张条子带给那位女士呢？”","“Oh, yes, she will,” said Holmes. He scribbled a few lines upon a sheet of paper. “You at least have the entrée, Watson. Will you have the goodness to give the lady this note?”"
"我又一次上了楼，多洛雷丝如临大敌地打开了房门，我把条子交给了她。一分钟之后，房间里响起一声惊喜交集的呼喊，多洛雷丝探出头来。","I ascended again and handed the note to Dolores, who cautiously opened the door. A minute later I heard a cry from within, a cry in which joy and surprise seemed to be blended. Dolores looked out."
"“她愿意见他们，愿意听他们解释。”她如是说道。","“She will see them. She will leesten,” said she."
"听到我的召唤，弗格森和福尔摩斯也上了楼。我们走进房间的时候，弗格森的妻子已经从床上坐起身来。弗格森赶紧往床边走了两步，做妻子的却抬手止住了他，他只好颓然坐进了一把扶手椅。福尔摩斯冲女士躬身施礼，然后就在弗格森的身边坐了下来。女士双眼圆睁，惊异地看着福尔摩斯。","At my summons Ferguson and Holmes came up. As we entered the room Ferguson took a step or two towards his wife, who had raised herself in the bed, but she held out her hand to repulse him. He sank into an armchair, while Holmes seated himself beside him, after bowing to the lady, who looked at him with wide-eyed amazement."
"“依我看，这里没有多洛雷丝的事了，”福尔摩斯说道。“呃，好吧，夫人，您要是希望她留下的话，我看也未尝不可。好了，弗格森先生，我是个俗务缠身的劳碌命，因此就只能采用直截了当的方法。手术越快，痛苦越少。容我首先跟您说一句宽心的话，您的妻子是一位非常善良、非常体贴、非常冤屈的女人。”","“I think we can dispense with Dolores,” said Holmes. “Oh, very well, madame, if you would rather she stayed I can see no objection. Now, Mr. Ferguson, I am a busy man with many calls, and my methods have to be short and direct. The swiftest surgery is the least painful. Let me first say what will ease your mind. Your wife is a very good, a very loving, and a very ill-used woman.”"
"弗格森欢呼一声，挺起了腰板。","Ferguson sat up with a cry of joy."
"“说说您的理由，福尔摩斯先生，我一辈子都感恩不尽。”","“Prove that, Mr. Holmes, and I am your debtor forever.”"
"“我这就说，只不过，为了把这方面的理由说清楚，我只能让您在另一个方面承受巨大的伤害。”","“I will do so, but in doing so I must wound you deeply in another direction.”"
"“只要您能洗清我妻子的冤屈，别的事情我都不在乎。跟这相比，世上的一切都只能说是无关紧要。”","“I care nothing so long as you clear my wife. Everything on earth is insignificant compared to that.”"
"“那我就跟您讲讲，在贝克街的时候，从我心头掠过的是怎样一串环环相扣的演绎。我一向觉得，吸血鬼的说法纯属荒诞无稽。那样的事情绝不会出现在英格兰的犯罪活动当中。话又说回来，您的观察结果倒是准确无误。您看见的事情是这位女士从婴儿床旁边直起身来，嘴上还沾着鲜血。”","“Let me tell you, then, the train of reasoning which passed through my mind in Baker Street. The idea of a vampire was to me absurd. Such things do not happen in criminal practice in England. And yet your observation was precise. You had seen the lady rise from beside the child’s cot with the blood upon her lips.”"
"“确实如此。”","“I did.”"
"“可是，吮吸流血的伤口不一定是为了吸血，没准儿是另有目的，您难道没有想到吗？英格兰的一位王后[^14]就曾经用这种方法把伤口里的毒吸出来，不是吗？”","“Did it not occur to you that a bleeding wound may be sucked for some other purpose than to draw the blood from it? Was there not a queen in English history who sucked such a wound to draw poison from it?”"
"“毒！”","“Poison!”"
"“您这户人家跟南美有点儿渊源，所以呢，眼睛还没看到您墙上那些武器的时候，直觉就已经让我意识到了它们的存在。小家伙中的也可能是其他类型的毒，可我当时想到的确实是南美武器。等我看到那张小小的射鸟弓，看到它旁边那个空箭壶的时候，感觉不过是意料中事而已。那种箭浸过箭毒[^15]之类的歹毒药物，如果有人用它扎伤了小家伙的话，不把毒吸出来是会致命的。","“A South American household. My instinct felt the presence of those weapons upon the wall before my eyes ever saw them. It might have been other poison, but that was what occurred to me. When I saw that little empty quiver beside the small bird-bow, it was just what I expected to see. If the child were pricked with one of those arrows dipped in curare or some other devilish drug, it would mean death if the venom were not sucked out."
"“还有那条小狗！如果有人打算使用这样的毒物，肯定会通过试验来确定它没有失效，这不是理所当然的吗？小狗的事情并不在我的意料之中，可我至少是一眼看清了它的遭遇，而它的遭遇也跟我的推测不谋而合。","“And the dog! If one were to use such a poison, would one not try it first in order to see that it had not lost its power? I did not foresee the dog, but at least I understand him and he fitted into my reconstruction."
"“现在您应该明白了吧？您的妻子一直都在担心这样的袭击。她曾经亲眼看见小家伙遭受袭击，还救了小家伙的命，可她不敢把全部的真相告诉您，因为她知道您有多疼那个大孩子，怕的是伤您的心。”","“Now do you understand? Your wife feared such an attack. She saw it made and saved the child’s life, and yet she shrank from telling you all the truth, for she knew how you loved the boy and feared lest it break your heart.”"
"“杰克！”","“Jacky!”"
"“刚才您抚弄小家伙的时候，我特意观察了一下杰克的反应。有了窗板的衬托，他的脸清清楚楚地映在了窗玻璃上。他脸上写着那么强烈的妒忌、那么刻毒的仇恨，我还很少在其他人的脸上看到呢。”","“I watched him as you fondled the child just now. His face was clearly reflected in the glass of the window where the shutter formed a background. I saw such jealousy, such cruel hatred, as I have seldom seen in a human face.”"
"“我的杰克！”","“My Jacky!”"
"“您只能面对现实，弗格森先生。格外让人痛苦的是，他的举动恰恰是出自一种扭曲的爱、一种膨胀到了疯狂地步的爱，这种爱的目标不光是您，兴许还包括他去世的母亲。仇恨的烈火吞噬了他的灵魂，他恨那个漂亮的小家伙，因为小家伙的健美正好衬出了他自个儿的缺陷。”","“You have to face it, Mr. Ferguson. It is the more painful because it is a distorted love, a maniacal exaggerated love for you, and possibly for his dead mother, which has prompted his action. His very soul is consumed with hatred for this splendid child, whose health and beauty are a contrast to his own weakness.”"
"“老天啊！这不可能！”","“Good God! It is incredible!”"
"“我说的是事实吗，夫人？”","“Have I spoken the truth, madame?”"
"女士已经抽泣起来，把脸埋在了枕头里面。听到福尔摩斯的问话，她转向了自己的丈夫。","The lady was sobbing, with her face buried in the pillows. Now she turned to her husband."
"“我怎么敢告诉你呢，鲍勃？我完全能够体会到，这样的事情会对你造成多大的打击。我觉得我应该守口如瓶，等别人来把这件事情告诉你，这样才会好一些。刚才啊，这位魔法师一般的先生写条子说他全都知道了，看到他的条子，我真是高兴极了。”","“How could I tell you, Bob? I felt the blow it would be to you. It was better that I should wait and that it should come from some other lips than mine. When this gentleman, who seems to have powers of magic, wrote that he knew all, I was glad.”"
"“依我看，为期一年的海上航行应该会对杰克少爷有所帮助。”福尔摩斯一边说，一边站了起来。“只有一件事情我仍然不太明白，夫人。我们完全可以理解您殴打杰克少爷的事情，母亲的忍耐终归是有限度的。可是，前面这两天，您怎么敢撇下小家伙不管呢？”","“I think a year at sea would be my prescription for Master Jacky ,” said Holmes, rising from his chair. “Only one thing is still clouded, madame. We can quite understand your attacks upon Master Jacky. There is a limit to a mother’s patience. But how did you dare to leave the child these last two days?”"
"“我跟梅森太太说了，她知道这件事情。 ”","“I had told Mrs. Mason. She knew.”"
"“这就对了，跟我的推测一样。”","“Exactly. So I imagined.”"
"站在床边的弗格森已经泣不成声，向妻子伸出了颤抖的双手。","Ferguson was standing by the bed, choking, his hands outstretched and quivering."
"“照我看，华生，咱们退场的时候已经到了。”福尔摩斯轻声说道。“多洛雷丝未免有点儿忠诚过头啦，麻烦你搀住她的一只胳膊，我来搀另外一只。好了，”带上房门之后，他又补了一句，“要我说，剩下的事情都可以让他俩自己解决。”","“This, I fancy, is the time for our exit, Watson,” said Holmes in a whisper. “If you will take one elbow of the too faithful Dolores, I will take the other. There, now,” he added as he closed the door behind him, “I think we may leave them to settle the rest among themselves.”"
"这件案子只有一点需要补充，那便是福尔摩斯针对故事开头那封短柬的最终答复。他的回信全文如下：","I have only one further note of this case. It is the letter which Holmes wrote in final answer to that with which the narrative begins. It ran thus: "
"> 事由：吸血鬼 ","Baker Street, "
"> 敬启者：","*Nov. 21st.*"
"> 尊驾十九日大函已悉，特此冒昧告知，贵行主顾敏星巷弗格森-缪尔黑德茶行之罗伯特·弗格森先生所询之事，敝人业已斟酌办理，所得结局亦洽人意。承蒙引荐，不胜感激。","> *Re* Vampires"
"> 歇洛克·福尔摩斯","> Sir:"
"> 谨启","> Referring to your letter of the 19th, I beg to state that I have looked into the inquiry of your client, Mr. Robert Ferguson, of Ferguson and Muirhead, tea brokers, of Mincing Lane, and that the matter has been brought to a satisfactory conclusion. With thanks for your recommendation, I am, sir,"
"> 十一月二十一日","> Faithfully yours, "
"> 贝克街","> Sherlock holmes."
