"作者：弗吉尼亚·伍尔夫","by Virginia Woolf "
"“瞧那里。”她说着，插了一支玫瑰在帽子边。她从未觉得如此幸福！她一生中从未有过！","“There,” she said, pinning a rose to one side of the hat.Never had she felt so happy!Never in her life!"
"不过那还愈发荒谬了，塞普蒂默斯说道。那个可怜的女人戴上了就会像集市上的一头猪。（没人会像塞普蒂默斯一样使她大笑。）","But that was still more ridiculous, Septimus said.Now the poor woman looked like a pig at a fair.(Nobody ever made her laugh as Septimus did.)"
"她在针线盒中放了什么东西呢？她放了丝带和小珠子、流苏、人造花。她将这些都倒在桌上。他开始将色彩怪异的玩意儿放在一起——因为虽然他没有灵巧的手指，甚至连个小包也不会扎，却有个好眼力，并且他往往是正确的，当然有时也会很荒唐，不过有时是惊人地正确。","What had she got in her work-box?She had ribbons and beads, tassels, artificial flowers.She tumbled them out on the table.He began putting odd colours together—for though he had no fingers, could not even do up a parcel, he had a wonderful eye, and often he was right, sometimes absurd, of course, but sometimes wonderfully right."
"“她会戴上好看的帽子啦！”他嘀咕着，挑这捡那的，雷齐娅在他身旁跪着，从他肩上看过去。现在做好了——更确切地说是式样设计好了，她必须缝起来。不过她得十分、十分谨慎，他说道，要按他做的式样来缝。","“She shall have a beautiful hat!” he murmured, taking up this and that, Rezia kneeling by his side, looking over his shoulder.Now it was finished—that is to say the design; she must stitch it together.But she must be very, very careful, he said, to keep it just as he had made it."
"她就这样缝了。他想她缝纫时发出的声音就像炉盘上的壶，冒着气泡，发出噗噗声。她一直在忙，那小而有力的尖尖手指又捏又戳，手中的针闪闪发光。太阳时隐时现，洒在流苏上，洒在墙纸上。可他会等会儿，他想，他的脚伸开去，注视着沙发一端的环纹短袜。他会在这温暖的地方，这空气不流通的口袋似的地方等着。有时你在傍晚在树林边缘会遇到这种情况，由于地面向下倾斜，或者树的某种排列（人最重要的是有科学性，科学性），使得暖暖的空气逗留片刻，微风恰似鸟翼轻拂脸颊。","So she sewed.When she sewed, he thought, she made a sound like a kettle on the hob; bubbling, murmuring, always busy, her strong little pointed fingers pinching and poking; her needle flashing straight.The sun might go in and out, on the tassels, on the wall-paper, but he would wait, he thought, stretching out his feet, looking at his ringed sock at the end of the sofa; he would wait in this warm place, this pocket of still air, which one comes on at the edge of a wood sometimes in the evening, when, because of a fall in the ground, or some arrangement of the trees (one must be scientific above all, scientific), warmth lingers, and the air buffets the cheek like the wing of a bird."
"“做好了。”雷齐娅说着，在指尖上旋转彼得斯夫人的帽子。“姑且就那样吧。以后嘛……”她的话像没有关上的水龙头，心满意足地滴答、滴答、滴答。","“There it is,” said Rezia, twirling Mrs. Peters’ hat on the tips of her fingers.“That’ll do for the moment.Later...” her sentence bubbled away drip, drip, drip, like a contented tap left running."
"美妙极了。他还从来没有做过这样让自己得意的事情呢。如此真切，如此实在，彼得斯夫人的帽子。","It was wonderful.Never had he done anything which made him feel so proud.It was so real, it was so substantial, Mrs. Peters’ hat."
"“瞧一眼吧。”他说道。","“Just look at it,” he said."
"不错，一见到那帽子，她就会开心。这时他已变回自己了，他笑了。他俩单独在一起了。她将一直喜爱那个帽子。","Yes, it would always make her happy to see that hat.He had become himself then, he had laughed then.They had been alone together.Always she would like that hat."
"他让她试戴一下。","He told her to try it on."
"“但我戴上去肯定看起来很怪！”她大声说道，匆匆跑到镜子面前瞅瞅这、瞅瞅那。随后她又突然取下帽子，因为传来一阵敲门声。是不是威廉·布拉德肖爵士？他已来请他们了吗？","“But I must look so queer!” she cried, running over to the glass and looking first this side then that.Then she snatched it off again, for there was a tap at the door.Could it be Sir William Bradshaw?Had he sent already?"
"不！只是那送晚报的小女孩。","No! it was only the small girl with the evening paper."
"无一例外发生的事情这时发生了——每晚都在他们生活中发生的事。那小女孩在门口吮着拇指，雷齐娅屈膝跪下，她温柔地说着话并吻了这孩子，她还从桌子抽屉中掏出来一袋糖果。天天发生这样的事。首先是一桩事，又来另一桩。她就是如此建造起来，先做一桩，又做另一桩。她们跳啊，蹦啊，在屋里转圈圈。他拿起了报纸。他读道萨里全力以赴。出现一股热浪。雷齐娅跟着念：萨里全力以赴。出现一股热浪，她使这消息成了她和菲尔默夫人孙女玩耍的一部分，她俩又说又笑地玩着。他十分疲惫了。他又十分高兴。他想睡觉。他合上双眼。可是他一看不到东西，她俩玩游戏的声响就变弱了，变奇怪了，听着犹如人们寻觅什么又没找到时的呼喊声，那声响渐行渐远。她俩找不到他了！","What always happened, then happened—what happened every night of their lives.The small girl sucked her thumb at the door; Rezia went down on her knees; Rezia cooed and kissed; Rezia got a bag of sweets out of the table drawer.For so it always happened.First one thing, then another.So she built it up, first one thing and then another.Dancing, skipping, round and round the room they went.He took the paper.Surrey was all out, he read.There was a heat wave.Rezia repeated: Surrey was all out.There was a heat wave, making it part of the game she was playing with Mrs. Filmer’s grandchild, both of them laughing, chattering at the same time, at their game.He was very tired.He was very happy.He would sleep.He shut his eyes.But directly he saw nothing the sounds of the game became fainter and stranger and sounded like the cries of people seeking and not finding, and passing further and further away.They had lost him!"
"他在恐惧中惊起。他看到了什么？餐柜上放着一盘香蕉。屋里没人（雷齐娅带着那孩子回她妈妈那里了。就寝时间到了）。就是如此：永远孤独。这就是在米兰已经注定了的命运。当他走进那个房间，发现她们用剪刀剪硬麻布帽型时，就注定了要永远孤独。","He started up in terror.What did he see?The plate of bananas on the sideboard.Nobody was there (Rezia had taken the child to its mother.It was bedtime).That was it: to be alone forever.That was the doom pronounced in Milan when he came into the room and saw them cutting out buckram shapes with their scissors; to be alone forever."
"他与餐柜和香蕉单独在一起。他一个人暴露在这荒凉的高处，伸直四肢——可并不在山顶，不在峭壁上，而是在菲尔默夫人客厅的沙发上。至于那些幻觉，那些死者的面孔和声音又在哪里？他眼前有个屏风，上面是黑色的芦苇和蓝色的燕子。他以前在那个地方看到过山脉，看到过人脸，看到过美丽，现在却只是一道屏风。","He was alone with the sideboard and the bananas.He was alone, exposed on this bleak eminence, stretched out—but not on a hill-top; not on a crag; on Mrs. Filmer’s sitting-room sofa.As for the visions, the faces, the voices of the dead, where were they?There was a screen in front of him, with black bulrushes and blue swallows.Where he had once seen mountains, where he had seen faces, where he had seen beauty, there was a screen."
"“埃文斯啊！”他大喊道。没有回答。有只老鼠发出吱吱声，或许是帷幕沙沙作响。那些是死者发出的声音。屏风、煤斗、餐柜仍与他作伴。让他面对那屏风、煤斗和餐柜……可雷齐娅喋喋不休地闯了进来。","“Evans!” he cried.There was no answer.A mouse had squeaked, or a curtain rustled.Those were the voices of the dead.The screen, the coalscuttle, the sideboard remained to him.Let him then face the screen, the coal-scuttle and the sideboard... but Rezia burst into the room chattering."
"有封信到了。每个人的计划都发生了变化。菲尔默夫人终究还是不能到布赖顿去。没工夫告知威廉斯夫人了，雷齐娅认为这真的十分、十分恼人。此时她一下子就看到那帽子，心想……也许……她……可以小小的……她那美妙的、心满意足的声音渐渐消失不见了。","Some letter had come.Everybody’s plans were changed.Mrs. Filmer would not be able to go to Brighton after all.There was no time to let Mrs. Williams know, and really Rezia thought it very, very annoying, when she caught sight of the hat and thought... perhaps... she... might just make a little....Her voice died out in contented melody."
"“呃，该死的！”她大喊（她说粗话是他俩之间的一种玩笑），针折了。帽子、小孩、布赖顿、针。她逐步建造起来，先做一桩，又做另一桩，她逐步建造起来，缝着。","“Ah, damn!” she cried (it was a joke of theirs, her swearing), the needle had broken.Hat, child, Brighton, needle.She built it up; first one thing, then another, she built it up, sewing."
"她想听他讲一下是否挪一下玫瑰花的位置就可以使帽子更好看些。她坐在沙发的一端。","She wanted him to say whether by moving the rose she had improved the hat.She sat on the end of the sofa."
"此刻他们非常幸福，她说着，忽然就放下帽子。因为她现在可以对他说任何事情。脑子里想到什么就能说什么。那差不多是她对他初次的感觉，那天晚上他和他的英国朋友走进咖啡馆。他走进来，很害羞，环顾四周，他挂帽子的时候却掉到了地上。她还记得那情形。她清楚他是个英国人，尽管并非她的姊妹倾佩的那种高大的英国人，因为他老是很瘦削。不过他气色非常好，还有一个大鼻子，一双明眸，坐的时候习惯性地向前倾，令她想起一头幼鹰，她常对他这样说。她第一次见到他的那个晚上，那时他们在玩多米诺牌，他就进来了——如一头幼鹰。可他待她向来很温存。她从来没有看见过他发狂或醉酒，仅仅因为经历了这场恐怖的战争而有时感到痛苦，可虽然这样，在她进来之后，他会把痛苦放在一边。她会给他说任何事，整个世界上的任何事，任何工作上的一点小烦恼，任何她想说的事都对他说，而他马上就会懂。甚至她自己的家人也不如他。他大她几岁，还那么机灵——他多严肃啊，竟想让她读莎士比亚的剧本，那时她甚至还读不懂英文的儿童故事！他的经验也更丰富，能帮助她。而她也能帮他。","They were perfectly happy now, she said, suddenly, putting the hat down.For she could say anything to him now.She could say whatever came into her head.That was almost the first thing she had felt about him, that night in the cafe when he had come in with his English friends.He had come in, rather shyly, looking round him, and his hat had fallen when he hung it up.That she could remember.She knew he was English, though not one of the large Englishmen her sister admired, for he was always thin; but he had a beautiful fresh colour; and with his big nose, his bright eyes, his way of sitting a little hunched made her think, she had often told him, of a young hawk, that first evening she saw him, when they were playing dominoes, and he had come in—of a young hawk; but with her he was always very gentle.She had never seen him wild or drunk, only suffering sometimes through this terrible war, but even so, when she came in, he would put it all away.Anything, anything in the whole world, any little bother with her work, anything that struck her to say she would tell him, and he understood at once.Her own family even were not the same.Being older than she was and being so clever—how serious he was, wanting her to read Shakespeare before she could even read a child’s story in English!—being so much more experienced, he could help her.And she too could help him."
"不过现在说说这帽子。接着（天色渐晚）就要谈到威廉·布拉德肖爵士了。","But this hat now.And then (it was getting late) Sir William Bradshaw."
"她把双手放在头上，等他说是否喜欢这帽子。当她坐在那里等着，眼睛向下看的时候，他能感受她的思绪，像一只鸟在树枝间跳跃，总是能停落得非常稳当。她自然地摆出一种散漫轻松的姿势坐在那里时，他可以跟上她的思绪，如果他说点什么，她会马上露出微笑，如一只小鸟落在枝头，爪子牢牢地抓住树枝。","She held her hands to her head, waiting for him to say did he like the hat or not, and as she sat there, waiting, looking down, he could feel her mind, like a bird, falling from branch to branch, and always alighting, quite rightly; he could follow her mind, as she sat there in one of those loose lax poses that came to her naturally and, if he should say anything, at once she smiled, like a bird alighting with all its claws firm upon the bough."
"不过他记得布拉德肖曾经说过：“我们最爱的人在我们患病时对我们没有益处。”布拉德肖说得教他如何休息。还说他俩一定要分开。","But he remembered Bradshaw said, “The people we are most fond of are not good for us when we are ill.”Bradshaw said, he must be taught to rest.Bradshaw said they must be separated."
"“一定”，“一定”，为什么“一定”呢？布拉德肖有什么权力命令他呢？“布拉德肖凭什么权力叫我‘一定’？”他诘问道。","“Must,” “must,” why “must”?What power had Bradshaw over him?“What right has Bradshaw to say ‘must’ to me?” he demanded."
"“由于你说过要自杀。”雷齐娅说道。（不幸中的万幸，她如今能对塞普蒂默斯说任何事了。）","“It is because you talked of killing yourself,” said Rezia.(Mercifully, she could now say anything to Septimus.)"
"那么他处在他们控制之下了！霍姆斯与布拉德肖跟他干上了！那个鼻孔红红的畜生把鼻子伸到了每一个私密的地方！它竟敢说“一定”！他的稿子在哪里？他写的东西在哪里？","So he was in their power!Holmes and Bradshaw were on him!The brute with the red nostrils was snuffing into every secret place!“Must” it could say!Where were his papers?the things he had written?"
"她拿来了他的稿子，他写的东西，她替他写的那些东西。她把那些稿子往沙发上一扔。他俩一起看着。有图表、设计图、矮小的男女舞动着棍子当武器，背后还长着翅膀——是翅膀吗？绕着一先令和六便士的钱币画的圈——那是太阳与星星。蜿蜒曲折的绝壁，简直就像许许多多刀叉，上面有用绳子系在一起的登山者向上攀爬。有的上面画着一片片海，小小的、笑着的人脸浮在也许代表波浪的画面上。还有一幅世界地图。烧了它们！他嚷道。再看看他的稿子吧。死者怎样在杜鹃花丛后咏唱，时光的颂歌，同莎士比亚交谈，埃文斯、埃文斯、埃文斯——来自死者的讯息，别砍伐树木，告知首相。博爱：世间的意义。烧了它们！他嚷道。","She brought him his papers, the things he had written, things she had written for him.She tumbled them out on to the sofa.They looked at them together.Diagrams, designs, little men and women brandishing sticks for arms, with wings—were they?—on their backs; circles traced round shillings and sixpences—the suns and stars; zigzagging precipices with mountaineers ascending roped together, exactly like knives and forks; sea pieces with little faces laughing out of what might perhaps be waves: the map of the world.Burn them! he cried.Now for his writings; how the dead sing behind rhododendron bushes; odes to Time; conversations with Shakespeare; Evans, Evans, Evans—his messages from the dead; do not cut down trees; tell the Prime Minister.Universal love: the meaning of the world.Burn them! he cried."
"可是雷齐娅把手压在稿子上。有些很美，她认为。她会用一根丝线将它们扎好（由于她没信封）。","But Rezia laid her hands on them.Some were very beautiful, she thought.She would tie them up (for she had no envelope) with a piece of silk."
"纵然他们带走他，她说道，她也会跟他一起走。他们不能违背他俩的意愿分开他俩，她说道。","Even if they took him, she said, she would go with him.They could not separate them against their wills, she said."
"她把纸边对齐，把文稿整理好，几乎没看一眼就系好了包裹，挨着他坐着。他觉得似乎她身上的所有花瓣都开了。她是一株鲜花盛开的树，从她的树枝间透出一位立法者的面孔，她已经来到圣殿，在那里，她不畏惧任何人，不畏惧霍姆斯，不畏惧布拉德肖。这是一个奇迹、一个胜利，是最后的、也是最伟大的胜利。他注视着她蹒跚地登上那可怕的楼梯，背着霍姆斯与布拉德肖，这两个男人的体重都从未在一百六十磅之下。他俩把妻子送到法庭去。他们一年收入一万英镑却大谈什么平衡。他俩的判断不一样（因为霍姆斯说这回事，布拉德肖却说另一回事），但他俩都是审判官。他俩搞混了幻象与餐柜，什么也看不清楚，但还做出裁决、处以惩罚。他俩说“一定”。她把他俩征服了。","Shuffling the edges straight, she did up the papers, and tied the parcel almost without looking, sitting beside him, he thought, as if all her petals were about her.She was a flowering tree; and through her branches looked out the face of a lawgiver, who had reached a sanctuary where she feared no one; not Holmes; not Bradshaw; a miracle, a triumph, the last and greatest.Staggering he saw her mount the appalling staircase, laden with Holmes and Bradshaw, men who never weighed less than eleven stone six, who sent their wives to Court, men who made ten thousand a year and talked of proportion; who different in their verdicts (for Holmes said one thing, Bradshaw another), yet judges they were; who mixed the vision and the sideboard; saw nothing clear, yet ruled, yet inflicted.“Must” they said.Over them she triumphed."
"“好了！”她说道。文稿都扎好了。谁也别想得到它们。她会将它们收起来。","“There!” she said.The papers were tied up.No one should get at them.She would put them away."
"并且，她说道，没有什么能分开他们。她坐在他身边，并称他为鹰或者乌鸦，因为它们很坏，毁坏庄稼，跟他像极了。没人能分开他们，她说道。","And, she said, nothing should separate them.She sat down beside him and called him by the name of that hawk or crow which being malicious and a great destroyer of crops was precisely like him.No one could separate them, she said."
"于是她站起来走进卧室去整理东西，但听到楼下有声音，她寻思可能是霍姆斯医生来访了，就奔下去阻止他上楼。","Then she got up to go into the bedroom to pack their things, but hearing voices downstairs and thinking that Dr. Holmes had perhaps called, ran down to prevent him coming up."
"塞普蒂默斯可以听到她与霍姆斯在楼梯上谈话。","Septimus could hear her talking to Holmes on the staircase."
"“亲爱的太太，我是以一个朋友的身份来访的。”霍姆斯说着。","“My dear lady, I have come as a friend,” Holmes was saying."
"“不，我是不会让你见我丈夫的。”她说道。","“No. I will not allow you to see my husband,” she said."
"他可以想象她的模样，像一只小母鸡，张开翅膀，阻拦他的去路。可霍姆斯仍然坚持。","He could see her, like a little hen, with her wings spread barring his passage.But Holmes persevered."
"“亲爱的太太，就让我……”霍姆斯说着，一把推开她（霍姆斯是一个体魄强健的男人）。","“My dear lady, allow me...”Holmes said, putting her aside (Holmes was a powerfully built man)."
"霍姆斯正在上楼。霍姆斯将猛然打开门。霍姆斯会说：“害怕了吧，嗯？”霍姆斯将抓住他。但是不，不能让霍姆斯、不能让布拉德肖抓住他。他晃晃悠悠地站起来，实在是单脚轮换着往前跳，思量着菲尔默夫人那把刀柄上刻有“面包”字样的——切面包用的精致干净的刀。啊，不能糟践了那把刀。点着煤气？可是现在太晚了。霍姆斯来啦。他也许有刀片，但是雷齐娅已经都收拾起来了，她总是这样做。唯一可用的是窗户，布卢姆斯伯里的公寓的大窗，然后就是推开窗跳下楼，真是件令人生厌、苦恼、颇有戏剧性的事。这就是他们所认为的悲剧，而非他或雷齐娅的（因为她是赞成他的）。霍姆斯与布拉德肖喜欢那种事。他在窗台上坐着。不过他会等着，直到最后关头。他并不想死去。生活是美好的。太阳是热的。只是人类——他们要的是什么呢？一个从对面楼梯走下来的老头停下来盯着他。霍姆斯在门口。“我拿给你吧！”他大叫着，然后用力蓦地一跳，狠狠地摔到菲尔默夫人宅子的栏杆上。","Holmes was coming upstairs.Holmes would burst open the door.Holmes would say “In a funk, eh?”Holmes would get him.But no; not Holmes; not Bradshaw.Getting up rather unsteadily, hopping indeed from foot to foot, he considered Mrs. Filmer’s nice clean bread knife with “Bread” carved on the handle.Ah, but one mustn’t spoil that.The gas fire?But it was too late now.Holmes was coming.Razors he might have got, but Rezia, who always did that sort of thing, had packed them.There remained only the window, the large Bloomsbury-lodging house window, the tiresome, the troublesome, and rather melodramatic business of opening the window and throwing himself out.It was their idea of tragedy, not his or Rezia’s (for she was with him).Holmes and Bradshaw like that sort of thing.(He sat on the sill.) But he would wait till the very last moment.He did not want to die.Life was good.The sun hot.Only human beings—what did THEY want?Coming down the staircase opposite an old man stopped and stared at him.Holmes was at the door.“I’ll give it you!” he cried, and flung himself vigorously, violently down on to Mrs. Filmer’s area railings."
"“胆小鬼！”霍姆斯医生大叫着，猛地打开门。雷齐娅向窗户奔去，她看到了，她了解了。霍姆斯医生与菲尔默夫人撞到了一起。菲尔默夫人舞动着她的围裙，叫雷齐娅去卧室把眼睛遮住。很多人在楼梯上跑上跑下。霍姆斯医生进来了——面如白纸，全身颤抖，手中拿着一只玻璃杯。她一定得勇敢，得喝点什么，他说道（是什么呢？甜的东西），因为她的丈夫摔得很严重，不会恢复知觉了。她断不能去见他，得尽量减轻她的痛苦。她还要经受审讯，不幸的年轻女人。这谁能预料啊？一时冲动，怪不得任何人（他告诉菲尔默夫人）。那他到底为何要这样做，霍姆斯医生无法想象。","“The coward!” cried Dr. Holmes, bursting the door open.Rezia ran to the window, she saw; she understood.Dr. Holmes and Mrs. Filmer collided with each other.Mrs. Filmer flapped her apron and made her hide her eyes in the bedroom.There was a great deal of running up and down stairs.Dr. Holmes came in—white as a sheet, shaking all over, with a glass in his hand.She must be brave and drink something, he said (What was it?Something sweet), for her husband was horribly mangled, would not recover consciousness, she must not see him, must be spared as much as possible, would have the inquest to go through, poor young woman.Who could have foretold it?A sudden impulse, no one was in the least to blame (he told Mrs. Filmer).And why the devil he did it, Dr. Holmes could not conceive."
