"作者：弗吉尼亚·伍尔夫","by Virginia Woolf "
"还不迟，刚好十一点半，她说道。可是，虽然她完全正确，她的嗓音，她女主人的嗓音，却不情愿显露个性。压抑她的是对过去的某种悲痛，对现在的某种担心。十一点半了，她说道，圣玛格丽特的钟声潜入了心底深处，在一圈圈的声波中隐没，像是什么有生命的东西要向自己吐露心声，驱散自己，随着快乐的颤栗而静止——就像克拉丽莎自己，彼得·沃尔什寻思着，一边穿着白衣在钟声响起时走下楼来。那是克拉丽莎自己，他想着，情绪激动，格外清醒，又十分困惑地追忆着她，似乎这钟声几年前就回响在屋里，在某个时刻他们非常亲昵地坐在那里，互吐衷肠，像一只蜜蜂采蜜归去，载满那一刻的甜蜜而去。然而是在哪间屋子？什么时刻？在钟声敲响时，他又为何觉得如此透彻心扉地愉悦？于是，在圣玛格丽特的钟声减弱时，他想，她患过病，而这钟声就表示虚弱和苦痛。她有心脏病，他想起来了，突然变得响亮的最后一次钟声是死亡的丧钟，在生命的中途突至而来。克拉丽莎倒在了她站立的地方，她的客厅中。不行！不行！他喊道。她没死！","No, it is precisely half-past eleven, she says.Yet, though she is perfectly right, her voice, being the voice of the hostess, is reluctant to inflict its individuality.Some grief for the past holds it back; some concern for the present.It is half-past eleven, she says, and the sound of St. Margaret’s glides into the recesses of the heart and buries itself in ring after ring of sound, like something alive which wants to confide itself, to disperse itself, to be, with a tremor of delight, at rest—like Clarissa herself, thought Peter Walsh, coming down the stairs on the stroke of the hour in white.It is Clarissa herself, he thought, with a deep emotion, and an extraordinarily clear, yet puzzling, recollection of her, as if this bell had come into the room years ago, where they sat at some moment of great intimacy, and had gone from one to the other and had left, like a bee with honey, laden with the moment.But what room?What moment?And why had he been so profoundly happy when the clock was striking?Then, as the sound of St. Margaret’s languished, he thought. She has been ill, and the sound expressed languor and suffering.It was her heart, he remembered; and the sudden loudness of the final stroke tolled for death that surprised in the midst of life, Clarissa falling where she stood, in her drawing-room.No! No! he cried. She is not dead!"
"我没有老，他哭喊，又沿着怀特霍尔街前行，似乎他那朝气蓬勃的、永恒的将来朝他滚滚而来。","I am not old, he cried, and marched up Whitehall, as if there rolled down to him, vigorous, unending, his future."
"他丝毫没老，也不固执、不乏味。至于别人怎么说他——达洛维一家、惠特布雷德一家，还有他们那群人，他毫不介意——丝毫不介意（尽管他的确早晚得考虑理查德能否可以帮他找个差事）。他大步流星，目不转睛，直盯着坎布里奇公爵的雕像。他被牛津开除过——千真万确。他过去是个社会主义信奉者，从某种意义上来看是个失败者——千真万确。不过他认为，文明的前景掌握在那样的年轻人手里，好比三十年前的他那样的年轻人手里，他们热爱抽象原理，从伦敦订购书刊，一直寄到喜马拉雅山的一个巅峰，他们阅读科学，阅读哲学。未来就在那样的年轻人的掌握中，他想道。","He was not old, or set, or dried in the least.As for caring what they said of him—the Dalloways, the Whitbreads, and their set, he cared not a straw—not a straw (though it was true he would have, some time or other, to see whether Richard couldn’t help him to some job).Striding, staring, he glared at the statue of the Duke of Cambridge.He had been sent down from Oxford—true.He had been a Socialist, in some sense a failure—true.Still the future of civilisation lies, he thought, in the hands of young men like that; of young men such as he was, thirty years ago; with their love of abstract principles; getting books sent out to them all the way from London to a peak in the Himalayas; reading science; reading philosophy.The future lies in the hands of young men like that, he thought."
"他背后传出类似树丛中叶子翻飞的啪哒声，带有一点沙沙声和有规律的砰砰声，这声音赶上他后，击打着他的思绪，令他止不住严格地和着这拍子，走在怀特霍尔街上。男孩们穿着制服，端着枪，双眼凝视前方行进，行进。他们的臂膀僵直，面部表情犹如刻在雕像底座周围的赞颂尽职、感恩、忠贞、热爱英国的铭文。","A patter like the patter of leaves in a wood came from behind, and with it a rustling, regular thudding sound, which as it overtook him drummed his thoughts, strict in step, up Whitehall, without his doing.Boys in uniform, carrying guns, marched with their eyes ahead of them, marched, their arms stiff, and on their faces an expression like the letters of a legend written round the base of a statue praising duty, gratitude, fidelity, love of England."
"彼得·沃尔什开始与他们保持步调一致，感到这是一个很好的锻炼。可他们看起来并不健壮。这些十六岁的男孩多半是瘦弱的，或许明天就会在放有一碗碗米饭、一块块肥皂的柜台后站着。此时他们带着从芬斯伯里大街取来花环的同样的肃穆表情——毫未参杂感官享乐或日常烦扰——去把花圈祭奠给那座空墓。他们已经起誓。来往的车辆敬重他们，货车止行。","It is, thought Peter Walsh, beginning to keep step with them, a very fine training.But they did not look robust.They were weedy for the most part, boys of sixteen, who might, tomorrow, stand behind bowls of rice, cakes of soap on counters.Now they wore on them unmixed with sensual pleasure or daily preoccupations the solemnity of the wreath which they had fetched from Finsbury Pavement to the empty tomb.They had taken their vow.The traffic respected it; vans were stopped."
"我跟不上他们了，彼得·沃尔什想道，他们正朝着怀特霍尔街行进，果真如此，他们继续行进着，超越了他，超越了每个人，步伐稳健，似乎有一个意志使手腿一致。而生活，变化多端、生气勃勃的，被压在了纪念碑和花环铺就的路面下，为纪律麻痹成一具瞪眼的僵尸。人们只好尊重它，人们或许会嘲笑，不过必须得尊重它，他想。他们走到那边去了，彼得·沃尔什想着，一边在人行道边上停了下来。所有那些高耸的塑像，纳尔逊、戈登、哈夫洛克，那些伟大战士的伟岸的黑色身影矗立着眺望前方，似乎他们也作了相同的克己牺牲（彼得·沃尔什觉得他也如此，作了伟大的克己牺牲），把相同的引诱踩在脚下，终究变成那大理石像上冷漠的目光。然而彼得·沃尔什自身丝毫不想要这种目光，虽然他能尊重他人的这种目光。他能尊重男孩们的这种目光。他们尚未懂得众生的烦扰，他想，此时朝滨河马路前进的男孩们慢慢消失了——那一切我都经历过了，他想，一边穿过马路，站在戈登的塑像下，还在他孩提时，就崇拜戈登。戈登孤零零地伫立在那里，抬起一条腿，交叉着双臂——可怜的戈登，他想道。","I can’t keep up with them, Peter Walsh thought, as they marched up Whitehall, and sure enough, on they marched, past him, past every one, in their steady way, as if one will worked legs and arms uniformly, and life, with its varieties, its irreticences, had been laid under a pavement of monuments and wreaths and drugged into a stiff yet staring corpse by discipline.One had to respect it; one might laugh; but one had to respect it, he thought.There they go, thought Peter Walsh, pausing at the edge of the pavement; and all the exalted statues, Nelson, Gordon, Havelock, the black, the spectacular images of great soldiers stood looking ahead of them, as if they too had made the same renunciation (Peter Walsh felt he too had made it, the great renunciation), trampled under the same temptations, and achieved at length a marble stare.But the stare Peter Walsh did not want for himself in the least; though he could respect it in others.He could respect it in boys.They don’t know the troubles of the flesh yet, he thought, as the marching boys disappeared in the direction of the Strand—all that I’ve been through, he thought, crossing the road, and standing under Gordon’s statue, Gordon whom as a boy he had worshipped; Gordon standing lonely with one leg raised and his arms crossed,—poor Gordon, he thought."
"恰好因为谁也不知晓他在伦敦，克拉丽莎除外，而且航行之后，对他而言大地依然像座岛屿，因而当他独自一人、充满活力、无人知悉地于十一点半站在特拉法尔加广场时的陌生之感令他无法忍受。这是怎么回事？我在哪里？究竟为何有人要做这件事？他思索着，离婚看似纯粹空谈。他的心情低落得平如沼泽，三种强烈的情感击倒了他：领悟，无边的博爱，最后是压抑不住的无比快乐，似乎这是其他两种情感的产物。好似他的头脑里有其他人的手在拽动绳子，移动百叶窗，而他与这一切没有任何瓜葛，站在无止境的大道路口，假如他愿意便可顺着大道漫步。多年以来他都没有觉得如此年轻。","And just because nobody yet knew he was in London, except Clarissa, and the earth, after the voyage, still seemed an island to him, the strangeness of standing alone, alive, unknown, at half-past eleven in Trafalgar Square overcame him.What is it?Where am I?And why, after all, does one do it?he thought, the divorce seeming all moonshine.And down his mind went flat as a marsh, and three great emotions bowled over him; understanding; a vast philanthropy; and finally, as if the result of the others, an irrepressible, exquisite delight; as if inside his brain by another hand strings were pulled, shutters moved, and he, having nothing to do with it, yet stood at the opening of endless avenues, down which if he chose he might wander.He had not felt so young for years."
"他已逃脱！彻底自由了——就如习惯遭破坏后，心灵就像未受保护的火苗，上下乱窜，恍惚即将被从灯台上吹下来。多年以来我都没觉得如此年轻了！彼得想着，逃脱了原本的他（当然仅仅只有一小时左右），就像一个跑到户外的孩子，奔跑时看见他的老保姆在一个搞错的窗边朝他挥手。不过她格外地迷人，他想，一边穿越特拉法尔加广场，朝干草市方向走去。迎面走来一位妙龄女郞，她走过戈登的塑像时，彼得·沃尔什觉得（他十分敏感），似乎退下了一层层面纱，终于变成他一直心仪的那位女子——青春却又庄重，快乐却又慎重，皮肤黝黑却十分迷人。","He had escaped!was utterly free—as happens in the downfall of habit when the mind, like an unguarded flame, bows and bends and seems about to blow from its holding.I haven’t felt so young for years!thought Peter, escaping (only of course for an hour or so) from being precisely what he was, and feeling like a child who runs out of doors, and sees, as he runs, his old nurse waving at the wrong window.But she’s extraordinarily attractive, he thought, as, walking across Trafalgar Square in the direction of the Haymarket, came a young woman who, as she passed Gordon’s statue, seemed, Peter Walsh thought (susceptible as he was), to shed veil after veil, until she became the very woman he had always had in mind; young, but stately; merry, but discreet; black, but enchanting."
"他挺了挺身子，悄悄地拨弄着折刀，开始跟在这女郎身后，追寻他心仪的女子。这种激动，即便是背对着他，好像也给他带来一丝光亮，将他们连在一起，突出了他，似乎车水马龙随意的喧嚣声透过空握着的双手耳语着他的名字，并非彼得，而是他沉思时称呼自己的秘密名字。“你。”她说道，只有一声“你”，她用白手套和肩膀说道。随后她走过科克斯珀街上的登特商店时，风掀起她又薄又长的披风，带着包容一切的慈悲、凄婉的温柔，像是会张开来把疲惫之人拥入怀中的双臂——","Straightening himself and stealthily fingering his pocket-knife he started after her to follow this woman, this excitement, which seemed even with its back turned to shed on him a light which connected them, which singled him out, as if the random uproar of the traffic had whispered through hollowed hands his name, not Peter, but his private name which he called himself in his own thoughts.“You,” she said, only “you,” saying it with her white gloves and her shoulders.Then the thin long cloak which the wind stirred as she walked past Dent’s shop in Cockspur Street blew out with an enveloping kindness, a mournful tenderness, as of arms that would open and take the tired—"
"不过她尚未嫁人，她是年轻的，非常年轻，彼得想着。他瞧见她穿越特拉法尔加广场时佩戴的那朵红色康乃馨又在他眼里点燃了，使她的唇变得通红。不过她在人行道的边上等着。她有一种高贵的气质。她不如克拉丽莎那么俗气，不如克拉丽莎那么殷富。她走起来时，他思忖着，她是个体面女人吗？机智、能言善辩，他想着（因为人一定要虚构点什么，一定要给自己找点乐子），一种沉着的、呼之欲出的机智，毫不张扬。","But she’s not married; she’s young; quite young, thought Peter, the red carnation he had seen her wear as she came across Trafalgar Square burning again in his eyes and making her lips red.But she waited at the kerbstone.There was a dignity about her.She was not worldly, like Clarissa; not rich, like Clarissa.Was she, he wondered as she moved, respectable?Witty, with a lizard’s flickering tongue, he thought (for one must invent, must allow oneself a little diversion), a cool waiting wit, a darting wit; not noisy."
"她开始走起来，穿过了街道，他跟在她后面。他最不愿做的就是使她难堪。不过要是她停下来，他就会说：“来吃个冰淇淋吧。”他会说的，而她也会非常简明地回答：“那好吧。”","She moved; she crossed; he followed her.To embarrass her was the last thing he wished.Still if she stopped he would say “Come and have an ice,” he would say, and she would answer, perfectly simply, “Oh yes.”"
"可街道上的其他人阻在他们中间，挡住了他，遮住了她。他追随着，她有了变化。她的两颊泛红，眼神透出讥讽。他认为自己是一个冒险者，不计后果、迅捷、大胆，确实（事实上他昨晚才从印度抵达这里）是一个富于传奇色彩的海盗，不在乎这一切糟透了的繁文缛节，商店橱窗中的黄色晨袍、烟管、钓竿，也不在乎是否得体、晚宴、背心下面穿着白色内衣的、衣着整洁的老头。他是一个海盗。她继续走着，穿越了皮卡迪利大街，往摄政街走去。她的披风、手套、肩膀，结合橱窗中的流苏、蕾丝、羽毛围巾，形成了华丽而怪异的精神，渐渐减弱，从商店散到人行道上，就像夜晚的灯光摇曳地照耀着黑暗中的树篱。","But other people got between them in the street, obstructing him, blotting her out.He pursued; she changed.There was colour in her cheeks; mockery in her eyes; he was an adventurer, reckless, he thought, swift, daring, indeed (landed as he was last night from India) a romantic buccaneer, careless of all these damned proprieties, yellow dressing-gowns, pipes, fishing-rods, in the shop windows; and respectability and evening parties and spruce old men wearing white slips beneath their waistcoats.He was a buccaneer.On and on she went, across Piccadilly, and up Regent Street, ahead of him, her cloak, her gloves, her shoulders combining with the fringes and the laces and the feather boas in the windows to make the spirit of finery and whimsy which dwindled out of the shops on to the pavement, as the light of a lamp goes wavering at night over hedges in the darkness."
"她高兴地笑着，越过牛津街和大波特兰街，转入一条小街道下行，此时，此刻，这伟大的一刻即将来临，因为这时她放慢脚步，打开了包，往他的方向看了一眼，可不是在看他，那是告别的一瞥，总结了整个局面，成功地永远地离开了它，她将钥匙放入锁眼里，把门打开，不见了。克拉丽莎的话回荡在他的耳畔，记得我的聚会，记得我的聚会。这房子是那种单调的红房子，吊着暧昧不雅的花篮。这件事就结束了。","Laughing and delightful, she had crossed Oxford Street and Great Portland Street and turned down one of the little streets, and now, and now, the great moment was approaching, for now she slackened, opened her bag, and with one look in his direction, but not at him, one look that bade farewell, summed up the whole situation and dismissed it triumphantly, for ever, had fitted her key, opened the door, and gone!Clarissa’s voice saying, Remember my party, Remember my party, sang in his ears.The house was one of those flat red houses with hanging flower-baskets of vague impropriety.It was over."
"好吧，我挺开心的，我挺开心，他心想，同时抬头望着摇摆的、装着浅色天竺葵的篮子。但是它的快乐一下子被击得粉碎，因为他很清楚那快乐有一半是虚构的，是编造出来的。刚才与那位女孩的调情，是虚构出来的，好比人们虚构生活中美好的一面，他思索着——虚构自己，虚构她，营造无比地快乐，还有更多的什么。虽然很古怪，但又很真实。你永远无法与别人分享这一切——它被击得粉碎。","Well, I’ve had my fun; I’ve had it, he thought, looking up at the swinging baskets of pale geraniums.And it was smashed to atoms—his fun, for it was half made up, as he knew very well; invented, this escapade with the girl; made up, as one makes up the better part of life, he thought—making oneself up; making her up; creating an exquisite amusement, and something more.But odd it was, and quite true; all this one could never share—it smashed to atoms."
"他转过身，顺着街走，想要找一处地方坐坐，一直到了该去林肯法律协会——胡珀和格雷特利律师事务所——的时候。","He turned; went up the street, thinking to find somewhere to sit, till it was time for Lincoln’s Inn—for Messrs. Hooper and Grateley."
"他应去哪里啊？不要紧。那么，顺着这条路走，走向摄政公园。他的靴子在人行道上说着“不要紧”。因为时间尚早，仍然很早。","Where should he go?No matter.Up the street, then, towards Regent’s Park.His boots on the pavement struck out “no matter”; for it was early, still very early."
"这又是一个绚烂的早晨。街上处处洋溢着生机，就像一颗完好无损的心脏在跳动。没有摸索——没有踌躇。一辆汽车疾驰而来，突然转了个弯，就在那适当的一瞬间准确地、悄然无息地停在一扇门前。一个身材瘦削的女孩走下车来，她穿着长筒丝袜，头插羽饰，然而对他而言并不是格外地引人注目（因为他已恣意享乐过）。彼得透过敞开的门朝大厅望去，令人钦佩的男管家、棕黄色的中国狗，大厅铺着黑白相间的菱形地板，白色百叶窗飘舞着，他十分欣赏这一切。毕竟，伦敦以其自己的方式成就了一个辉煌的成绩，它的季节，它的文明。他出身在一个有威望的盎格鲁-印度家庭，起码有三代先辈曾参与过大陆事务的管理（他心想，真是奇怪，自己居然有这样的思想感情，他是那么讨厌印度、讨厌帝国，讨厌军队）。有时候，文明，即便是诸如此类的文明，也像私人物品一样令他感到珍贵。有时，他为英国自豪，为男管家、中国狗、为生活有保障的女孩感到自豪。","It was a splendid morning too.Like the pulse of a perfect heart, life struck straight through the streets.There was no fumbling—no hesitation.Sweeping and swerving, accurately, punctually, noiselessly, there, precisely at the right instant, the motor-car stopped at the door.The girl, silk-stockinged, feathered, evanescent, but not to him particularly attractive (for he had had his fling), alighted.Admirable butlers, tawny chow dogs, halls laid in black and white lozenges with white blinds blowing, Peter saw through the opened door and approved of.A splendid achievement in its own way, after all, London; the season; civilisation.Coming as he did from a respectable Anglo-Indian family which for at least three generations had administered the affairs of a continent (it’s strange, he thought, what a sentiment I have about that, disliking India, and empire, and army as he did), there were moments when civilisation, even of this sort, seemed dear to him as a personal possession; moments of pride in England; in butlers; chow dogs; girls in their security."
"真是荒唐可笑，可这情感仍然存在，他想。那些医生、商人，以及能干的女人都在忙着自己的事务，他们都准时、机警、健壮。对他来说，似乎都值得敬佩。他们是可以托付生命的好人，是生存技术方面的伴侣，可与之有难同当。这里啊，那里啊，眼前的景象还过得去，他要在树阴下坐下来，抽一支烟。","Ridiculous enough, still there it is, he thought.And the doctors and men of business and capable women all going about their business, punctual, alert, robust, seemed to him wholly admirable, good fellows, to whom one would entrust one’s life, companions in the art of living, who would see one through.What with one thing and another, the show was really very tolerable; and he would sit down in the shade and smoke."
"那就是摄政公园了。不错。他儿时曾在摄政公园散步——好奇怪，他心想，儿时的记忆怎么总是浮现在我的脑海——或许是看到了克拉丽莎的缘故吧，因为女人们比我们更多地活在往事中，他思索着。她们依恋着一些地方，依恋着父亲——女人永远为自己的父亲感到自豪。伯顿是一个不错的地方，一个很好的地方。不过，我和这老头永远也相处不了，他想。有一天夜里，我们大吵了一番——争论一件什么事情，至于具体是什么，他记不住了。可能是政治方面的事。","There was Regent’s Park.Yes.As a child he had walked in Regent’s Park—odd, he thought, how the thought of childhood keeps coming back to me—the result of seeing Clarissa, perhaps; for women live much more in the past than we do, he thought.They attach themselves to places; and their fathers—a woman’s always proud of her father.Bourton was a nice place, a very nice place, but I could never get on with the old man, he thought.There was quite a scene one night—an argument about something or other, what, he could not remember.Politics presumably."
"不错，他记得摄政公园。那又长又直的小路，左边售卖气球的小屋，有个地方还有一尊刻写着铭文的荒唐雕像。他在找一个空座位。他不想因为被人问时间而受到打扰（他觉得有些困倦）。一位年老的灰白头发的保姆，身边有个婴儿睡在童车里——这是他能为自己找到的最好的座位了。他就在保姆座位的另一端坐下来。","Yes, he remembered Regent’s Park; the long straight walk; the little house where one bought air-balls to the left; an absurd statue with an inscription somewhere or other.He looked for an empty seat.He did not want to be bothered (feeling a little drowsy as he did) by people asking him the time.An elderly grey nurse, with a baby asleep in its perambulator—that was the best he could do for himself; sit down at the far end of the seat by that nurse."
"他忽然记起伊丽莎白走进屋站在她母亲身边的样子，他想，她是个相貌奇特的女孩。身材高大，几乎长大成人了。不能算美，只能算端庄，她顶多十八岁。或许她与克拉丽莎的关系不大好。“这是我的伊丽莎白。”——诸如此类的事——为何不是简单地说“这是伊丽莎白”？——和多数母亲一样，想假装事情并非如此。她过分信赖自己的魅力了，他想。她做得过头了。","She’s a queer-looking girl, he thought, suddenly remembering Elizabeth as she came into the room and stood by her mother.Grown big; quite grown-up, not exactly pretty; handsome rather; and she can’t be more than eighteen.Probably she doesn’t get on with Clarissa.“There’s my Elizabeth”—that sort of thing—why not “Here’s Elizabeth” simply?—trying to make out, like most mothers, that things are what they’re not.She trusts to her charm too much, he thought.She overdoes it."
