"作者：弗吉尼亚·伍尔夫","by Virginia Woolf "
"“他没犯过什么过失。”雷齐娅向医生保证。要是史密斯先生可以等等，威廉爵士说，他愿意同史密斯夫人在隔壁屋子谈谈。她丈夫病情十分严重，威廉爵士说。他是否恐吓说要自杀？","“He has done nothing wrong whatever,” Rezia assured the doctor.If Mr. Smith would wait, said Sir William, he would speak to Mrs. Smith in the next room.Her husband was very seriously ill, Sir William said.Did he threaten to kill himself?"
"噢，他这么说过，她哭着说。不过他并非想要这样，她说道。当然不是这样的。这仅仅是一个休养问题，威廉爵士说道。休养、休养、休养、在床上长期休养。在乡下有一处令人愉快的休养院，在那里她丈夫会得到很好的照顾。让他远离她吗？她问道。真不幸，是的。我们最在乎的人在我们患病时对我们并无好处。但他没疯，不是吗？威廉爵士称他从未说过“疯狂”一词，他称之为没有平衡感。可她丈夫讨厌医生。他会拒绝到休养院去的。威廉爵士简略又亲切地向她说明病状。他曾恐吓说要自杀。没别的选择。这是个法律问题。他会在乡下一座美丽的宅子里卧床休养。那些护士很出色。威廉爵士每周会去探望他一次。要是沃伦·史密斯夫人确定没有别的问题要问——他从不催促他的病人——他们就回到她丈夫那里。她不再提问了——不再询问威廉爵士了。","Oh, he did, she cried.But he did not mean it, she said.Of course not.It was merely a question of rest, said Sir William; of rest, rest, rest; a long rest in bed.There was a delightful home down in the country where her husband would be perfectly looked after.Away from her? she asked.Unfortunately, yes; the people we care for most are not good for us when we are ill.But he was not mad, was he?Sir William said he never spoke of “madness”; he called it not having a sense of proportion.But her husband did not like doctors.He would refuse to go there.Shortly and kindly Sir William explained to her the state of the case.He had threatened to kill himself.There was no alternative.It was a question of law.He would lie in bed in a beautiful house in the country.The nurses were admirable.Sir William would visit him once a week.If Mrs. Warren Smith was quite sure she had no more questions to ask—he never hurried his patients—they would return to her husband.She had nothing more to ask—not of Sir William."
"所以他们返回了人类中最崇高的那个人那里。他是面向法官的罪人、暴露在高处的受害者、亡命之人、溺死的水手、不朽颂歌的诗作者、由生入死的上帝。塞普蒂默斯·沃伦·史密斯坐在天窗下的扶手椅上，凝视着布拉德肖女士穿宫廷服的照片，低声咕哝着关于美的言语。","So they returned to the most exalted of mankind; the criminal who faced his judges; the victim exposed on the heights; the fugitive; the drowned sailor; the poet of the immortal ode; the Lord who had gone from life to death; to Septimus Warren Smith, who sat in the arm-chair under the skylight staring at a photograph of Lady Bradshaw in Court dress, muttering messages about beauty."
"“我们略谈了一会。”威廉爵士说道。“他说你的病情十分十分严重。”雷齐娅高声说道。","“We have had our little talk,” said Sir William.“He says you are very, very ill,” Rezia cried."
"“我们准备安排你去一个休养院。”威廉爵士说道。“霍姆斯办的休养院中的一个吗？”塞普蒂默斯讥笑着。","“We have been arranging that you should go into a home,” said Sir William.“One of Holmes’s homes?” sneered Septimus."
"这个家伙留下的印象令人不愉快。因为威廉爵士之父是一个商人，他对教养与装扮有一种自然的敬重，衣衫不整会惹怒他。此外，更深层的原因是，威廉爵士从没时间阅读，对有教养的人有一种深埋心底的怨恨。那些人走进他的诊疗室，暗示医生并非是受到过教育的人，虽然这个职业需要才智超凡的人持续紧绷的精力。","The fellow made a distasteful impression.For there was in Sir William, whose father had been a tradesman, a natural respect for breeding and clothing, which shabbiness nettled; again, more profoundly, there was in Sir William, who had never had time for reading, a grudge, deeply buried, against cultivated people who came into his room and intimated that doctors, whose profession is a constant strain upon all the highest faculties, are not educated men."
"“是我的一个休养院，沃伦·史密斯先生。”他说，“我们将在那里教你如何休养。”","“One of MY homes, Mr. Warren Smith,” he said, “where we will teach you to rest.”"
"仅还有一桩事情了。","And there was just one thing more."
"他非常肯定沃伦·史密斯先生病好时，会是世上最不愿吓唬自己妻子的人。但他曾谈及自杀。","He was quite certain that when Mr. Warren Smith was well he was the last man in the world to frighten his wife.But he had talked of killing himself."
"“我们都有消沉的时刻。”威廉爵士说道。","“We all have our moments of depression,” said Sir William."
"一旦你堕落了，塞普蒂默斯自言自语重复道，人性就会把你攫住。霍姆斯和布拉德肖就会把你攫住。他们走遍沙漠去搜寻。他们尖啸着在荒漠中飞奔。他们用刑架和拇指夹来惩罚。人性冷酷无情。","Once you fall, Septimus repeated to himself, human nature is on you.Holmes and Bradshaw are on you.They scour the desert.They fly screaming into the wilderness.The rack and the thumbscrew are applied.Human nature is remorseless."
"“他有时会突然冲动吗？”威廉爵士问，他把铅笔放在粉红病历卡上。","“Impulses came upon him sometimes?”Sir William asked, with his pencil on a pink card."
"那是他本人的事，塞普蒂默斯回答。","That was his own affair, said Septimus."
"“没人只为自己而活。”威廉爵士说道，瞥了一下他妻子身着宫廷服的照片。","“Nobody lives for himself alone,” said Sir William, glancing at the photograph of his wife in Court dress."
"“你的前面还有光明的事业。”威廉爵士说道。布鲁尔先生的信放在桌上。“非常光明的事业。”","“And you have a brilliant career before you,” said Sir William.There was Mr. Brewer’s letter on the table.“An exceptionally brilliant career.”"
"但假如他忏悔呢？假如他说出想法呢？那么，他的折磨者们会饶过他吗？","But if he confessed?If he communicated?Would they let him off then, his torturers?"
"“我——我——”他结巴地说。","“I—I—” he stammered."
"但他的罪行是什么？他无法想起。","But what was his crime?He could not remember it."
"“什么？”威廉爵士鼓励他说。（但是时间渐渐晚了。）爱、树木、没有罪行——他想传达什么？他无法想起。","“Yes?” Sir William encouraged him.(But it was growing late.) Love, trees, there is no crime—what was his message?He could not remember it."
"“我——我——”塞普蒂默斯结巴地说。","“I—I—” Septimus stammered."
"“尽可能少想自己。”威廉爵士亲切地说。确实，他不宜四处走动。","“Try to think as little about yourself as possible,” said Sir William kindly.Really, he was not fit to be about."
"他们还有别的事想问他吗？威廉爵士会做好一切安排（他对雷齐娅小声说道），他会于那晚五六点钟之间告诉她的，他小声说。","Was there anything else they wished to ask him?Sir William would make all arrangements (he murmured to Rezia) and he would let her know between five and six that evening he murmured."
"“把一切都托付于我吧。”他说道，随后便打发他们走了。","“Trust everything to me,” he said, and dismissed them."
"雷齐娅的一生从未受过如此巨大的痛苦，从来没有！她请求帮助却为人所弃！他令他们失望！威廉·布拉德肖爵士并非一个友好的人。","Never, never had Rezia felt such agony in her life!She had asked for help and been deserted!He had failed them!Sir William Bradshaw was not a nice man."
"仅是那汽车的保养必定使他花销不菲，塞普蒂默斯说，此时他们已经出来走到了街上。","The upkeep of that motor car alone must cost him quite a lot, said Septimus, when they got out into the street."
"她抱紧他一只手臂。他们被遗弃了。","She clung to his arm.They had been deserted."
"可是她还想要什么呢？","But what more did she want?"
"他给病人的时间是三刻钟。假如在这门缜密的科学里，毕竟这是一个我们对之一无所知的领域——神经系统、人类大脑——一个医生丧失了平衡感，就是一个失败的医生。健康是我们肯定需要的，而健康就表示平衡。所以当有人进入你的诊疗室并称他就是基督（一个普遍的幻觉），还带来了启示，像他们大都有启示一样，并如他们经常所做的一样威胁要自杀，你就得采取平衡的方法，命令病人上床休息，独自休息，静养，休息时不会见朋友，不看书，不交流。修养六个月，直到以一百零五磅的体重进来的病人以一百六十八磅的重量出院。","To his patients he gave three-quarters of an hour; and if in this exacting science which has to do with what, after all, we know nothing about—the nervous system, the human brain—a doctor loses his sense of proportion, as a doctor he fails.Health we must have; and health is proportion; so that when a man comes into your room and says he is Christ (a common delusion), and has a message, as they mostly have, and threatens, as they often do, to kill himself, you invoke proportion; order rest in bed; rest in solitude; silence and rest; rest without friends, without books, without messages; six months’ rest; until a man who went in weighing seven stone six comes out weighing twelve."
"平衡，神圣的平衡，真是威廉爵士的女神。它来源于威廉爵士巡视医院，捕大马哈鱼，布拉德肖女士在哈利街生儿子等等的各种时刻。布拉德肖女士自己也要捕大马哈鱼，她拍摄的照片简直能与职业摄影师的作品匹敌。因为他尊崇平衡，威廉爵士不仅自己成功了，也使英国繁荣起来，隔离了英国的疯子，禁止生育，对悲观情绪予以惩罚，使不健全的人不能传播他们的观念，一直到他们也接纳他的平衡感——假如是男性，就接纳他的观念，假如是女性，就接纳布拉德肖女士的观念（她绣花、编织、一周七晚要花四晚在家陪儿子）。所以不仅是他的同事尊重他，下属惧怕他，而且患者的亲朋对他怀着最衷心的感激。因为他坚持这些预言世界末日、或基督显灵的男女基督预言家们，应遵循威廉爵士的命令躺在床上喝牛奶。威廉爵士有三十年诊治这类病例的经验，还有万无一失的直觉，这感觉，就是疯狂；其实，就是他的平衡感。","Proportion, divine proportion, Sir William’s goddess, was acquired by Sir William walking hospitals, catching salmon, begetting one son in Harley Street by Lady Bradshaw, who caught salmon herself and took photographs scarcely to be distinguished from the work of professionals.Worshipping proportion, Sir William not only prospered himself but made England prosper, secluded her lunatics, forbade childbirth, penalised despair, made it impossible for the unfit to propagate their views until they, too, shared his sense of proportion—his, if they were men, Lady Bradshaw’s if they were women (she embroidered, knitted, spent four nights out of seven at home with her son), so that not only did his colleagues respect him, his subordinates fear him, but the friends and relations of his patients felt for him the keenest gratitude for insisting that these prophetic Christs and Christesses, who prophesied the end of the world, or the advent of God, should drink milk in bed, as Sir William ordered; Sir William with his thirty years’ experience of these kinds of cases, and his infallible instinct, this is madness, this sense; in fact, his sense of proportion."
"不过平衡有个姊妹，不那么爱笑，更让人敬畏，是一个女神，即使此刻也忙于——在印度炎热的沙漠中，在非洲泥泞的沼泽地里，在伦敦的贫民窟内，简而言之，无论何处，只要是在气候或魔鬼诱使人们遗弃自身真实信念的地方——即使此刻也忙于冲毁神龛，打碎圣像而代之以她那严峻的表情。她的名字是信奉，她尽情吞噬弱者的意志，爱惹人注意，对人施压，崇拜自己印刻在民众脸上的容貌。她站在海德公园角的一个桶上传教。她身裹白衣，伪装出兄弟般仁爱的样子悔悟地走过工厂与议会。她提供帮助，但是渴求权力；粗暴地攻击异己或不服的人；恩赐那些仰视她，顺从地从她眼里看见自己的光明的人。这个女神（雷齐娅·沃伦·史密斯预言）还存在于威廉爵士的内心。虽然像大多时候一样，隐藏在某个似乎合理的伪装下，像某个受人尊重的名字，爱、职责、自我牺牲。他会多么努力地工作呀——多么努力地筹款，宣扬改革，兴建机构呀！然而信奉，这个挑剔的女神，喜欢血液胜过砖瓦，还甚为玄妙地尽情吞噬人类的意志。例如，布拉德肖女士。她十五年前已经俯首屈从了。你不能指出任何确切的例子。没有大吵大闹，没有厉声呵斥，唯有她的意志像浸透了水般逐渐消沉，与他的意志融为一体。她带着甜蜜的微笑，快速服从了。哈利街房屋里的晚餐有八九道菜，宴请十或十五位专业人士，她进展得很顺利，待客有礼。唯有晚上她流露出很轻微的呆滞表情，或可能是不安，神经紧张性地抽动，说话支吾、犹豫、慌乱，这些都表明那可怜的夫人撒了谎——要相信这些真是痛苦。曾经，很久以前，她自由地捕起大马哈鱼。现在，为尽快满足能使她丈夫的眼睛闪现出油腻腻光芒的追求控制、追求权力的欲望。她抽搐、挤压、克制、修剪自己，她退缩、窥探。因此，尽管她不明白到底什么导致了晚餐的不愉快，还让她有头昏脑胀的感觉，很可能缘于职业性的交谈，或者缘于那伟大的医生疲劳过度，布拉德肖女士说他的生命“不属于他自己，而属于他的病人”。晚餐总而言之就是使人不愉快。因此，钟声敲响十点的时候，宾客们甚至是满心狂喜吸入哈利街的空气。可是，这种解脱不是他的患者能享受到的。","But Proportion has a sister, less smiling, more formidable, a Goddess even now engaged—in the heat and sands of India, the mud and swamp of Africa, the purlieus of London, wherever in short the climate or the devil tempts men to fall from the true belief which is her own—is even now engaged in dashing down shrines, smashing idols, and setting up in their place her own stern countenance.Conversion is her name and she feasts on the wills of the weakly, loving to impress, to impose, adoring her own features stamped on the face of the populace.At Hyde Park Corner on a tub she stands preaching; shrouds herself in white and walks penitentially disguised as brotherly love through factories and parliaments; offers help, but desires power; smites out of her way roughly the dissentient, or dissatisfied; bestows her blessing on those who, looking upward, catch submissively from her eyes the light of their own.This lady too (Rezia Warren Smith divined it) had her dwelling in Sir William’s heart, though concealed, as she mostly is, under some plausible disguise; some venerable name; love, duty, self sacrifice.How he would work—how toil to raise funds, propagate reforms, initiate institutions!But conversion, fastidious Goddess, loves blood better than brick, and feasts most subtly on the human will.For example, Lady Bradshaw.Fifteen years ago she had gone under.It was nothing you could put your finger on; there had been no scene, no snap; only the slow sinking, water-logged, of her will into his.Sweet was her smile, swift her submission; dinner in Harley Street, numbering eight or nine courses, feeding ten or fifteen guests of the professional classes, was smooth and urbane.Only as the evening wore on a very slight dulness, or uneasiness perhaps, a nervous twitch, fumble, stumble and confusion indicated, what it was really painful to believe—that the poor lady lied.Once, long ago, she had caught salmon freely: now, quick to minister to the craving which lit her husband’s eye so oilily for dominion, for power, she cramped, squeezed, pared, pruned, drew back, peeped through; so that without knowing precisely what made the evening disagreeable, and caused this pressure on the top of the head (which might well be imputed to the professional conversation, or the fatigue of a great doctor whose life, Lady Bradshaw said, “is not his own but his patients’”) disagreeable it was: so that guests, when the clock struck ten, breathed in the air of Harley Street even with rapture; which relief, however, was denied to his patients."
"那间灰色的房间的墙上挂着画，房间内摆设着名贵家具。在磨砂玻璃的天窗之下，患者们了解了自身过错的严重程度。他们在扶手椅中缩成一团，注视着他为了他们的裨益运用手臂进行一种古怪的锻炼。他猛地伸出胳臂，又敏捷地收至臀部，为了证实（假如病人顽固不化）威廉爵士能够操控自己的行动，可病人不能。有些软弱者在诊疗室崩溃了，抽泣着，屈服了。其他人呢，天知道受了什么放纵的、疯狂的刺激，当面咒骂威廉爵士是一个可恶的骗子，甚至更加不恭敬地质疑生命本身。为何要活着？他们想知道。威廉爵士答复说因为生活很美好。对布拉德肖女士而言当然如此。她带着鸵鸟毛帽子拍的照片就悬挂在壁炉架上方。至于他的收入，一年能有一万两千来英镑呢。而对我们而言，病人抗议道，生活并没赋予这样的恩惠。威廉爵士勉强赞同。他们缺少平衡感。可能，归根到底，人间没有上帝吧？他耸耸肩。简而言之，活着还是死亡不是我们自己的事吗？但这一点上病人错了。威廉爵士有位朋友住在萨里，人们在那里教授一项威廉爵士坦率承认很难的艺术——平衡感。另外，还有家庭关怀、荣誉、勇气、以及辉煌的事业。威廉爵士是拥护这一切的坚定战士。假如这些令他失望，他只好支持警察和社会善意。威廉爵士非常平静地说，在萨里，这些力量负责控制反社会冲动行为。这些行动大多是由出身卑微导致的。然后那个女神就会从她的藏匿之处偷偷溜出来，坐上她的御座，她的欲望是镇压反抗，把自己的形象永不磨灭地印刻在别人的圣殿上。那些赤裸裸、不能自卫、疲惫不堪、无依无靠的人因此便对威廉爵士的意志留下了深刻的印象。他猛扑上去，狼吞虎咽。他把人关紧闭。正是这样的决心和人道的结合使威廉爵士如此受到他的受害者亲属的钟爱。","There in the grey room, with the pictures on the wall, and the valuable furniture, under the ground glass skylight, they learnt the extent of their transgressions; huddled up in arm-chairs, they watched him go through, for their benefit, a curious exercise with the arms, which he shot out, brought sharply back to his hip, to prove (if the patient was obstinate) that Sir William was master of his own actions, which the patient was not.There some weakly broke down; sobbed, submitted; others, inspired by Heaven knows what intemperate madness, called Sir William to his face a damnable humbug; questioned, even more impiously, life itself.Why live? they demanded.Sir William replied that life was good.Certainly Lady Bradshaw in ostrich feathers hung over the mantelpiece, and as for his income it was quite twelve thousand a year.But to us, they protested, life has given no such bounty.He acquiesced.They lacked a sense of proportion.And perhaps, after all, there is no God?He shrugged his shoulders.In short, this living or not living is an affair of our own?But there they were mistaken.Sir William had a friend in Surrey where they taught, what Sir William frankly admitted was a difficult art—a sense of proportion.There were, moreover, family affection; honour; courage; and a brilliant career.All of these had in Sir William a resolute champion.If they failed him, he had to support police and the good of society, which, he remarked very quietly, would take care, down in Surrey, that these unsocial impulses, bred more than anything by the lack of good blood, were held in control.And then stole out from her hiding-place and mounted her throne that Goddess whose lust is to override opposition, to stamp indelibly in the sanctuaries of others the image of herself.Naked, defenceless, the exhausted, the friendless received the impress of Sir William’s will.He swooped; he devoured.He shut people up.It was this combination of decision and humanity that endeared Sir William so greatly to the relations of his victims."
"但雷齐娅·沃伦·史密斯在哈利街上前行时喊道，她并不喜欢那个人。","But Rezia Warren Smith cried, walking down Harley Street, that she did not like that man."
"哈利街上的钟声蚕食着六月的这一天，将其切条成片，分了再分，在劝人屈服、拥护权威，齐鸣宣告平衡感至高无上的优越性，直到大量的报时声减弱到只剩下悬挂在牛津街一家商店上头的广告钟温柔友好地鸣响一点半的钟声，似乎里格比先生和郎兹先生乐意无偿提供时讯。","Shredding and slicing, dividing and subdividing, the clocks of Harley Street nibbled at the June day, counselled submission, upheld authority, and pointed out in chorus the supreme advantages of a sense of proportion, until the mound of time was so far diminished that a commercial clock, suspended above a shop in Oxford Street, announced, genially and fraternally, as if it were a pleasure to Messrs. Rigby and Lowndes to give the information gratis, that it was half-past one."
"向上望去，看来里格比与郎兹的每个字母都表示一个时刻。潜意识里人们对里格比与郎兹提供格林威治认可的标准时间心怀感激。此种感激（休·惠特布雷德在那家商店的橱窗前闲逛时，心里就是这么想的）自然会在此后形成人们去里格比与郎兹商店买鞋袜的现象。他就是这么想的。他习惯如此。他不会深刻地思考。他只是轻触表面，废弃的语言、正在使用的语言、君士坦丁堡、巴黎、罗马的生活、骑马、射猎、网球，都是他一度所爱。心存不良的人宣称他如今在白金汉宫做守卫，身穿丝袜与及膝短裤，看守什么也无人知晓。可他极其称职。他已经在英国上层社会虚度了五十五年。他结识过一些首相。据了解，他对他们感情颇深。要是那时他真的没投身过任何重大运动，也没有担当重要职位，那有一两次的温和改革应算是他的功劳：一是改善公共避难所；一是对诺福克的猫头鹰的保护。女佣们有充分的理由感激他。他给《泰晤士报》写过一些信，请求筹款，呼吁大众维护公益，保护环境，清除垃圾，减少烟雾，禁止公园内不雅行为，那些信末尾他的署名令人敬重。","Looking up, it appeared that each letter of their names stood for one of the hours; subconsciously one was grateful to Rigby and Lowndes for giving one time ratified by Greenwich; and this gratitude (so Hugh Whitbread ruminated, dallying there in front of the shop window), naturally took the form later of buying off Rigby and Lowndes socks or shoes.So he ruminated.It was his habit.He did not go deeply.He brushed surfaces; the dead languages, the living, life in Constantinople, Paris, Rome; riding, shooting, tennis, it had been once.The malicious asserted that he now kept guard at Buckingham Palace, dressed in silk stockings and knee-breeches, over what nobody knew.But he did it extremely efficiently.He had been afloat on the cream of English society for fifty-five years.He had known Prime Ministers.His affections were understood to be deep.And if it were true that he had not taken part in any of the great movements of the time or held important office, one or two humble reforms stood to his credit; an improvement in public shelters was one; the protection of owls in Norfolk another; servant girls had reason to be grateful to him; and his name at the end of letters to the @Times@, asking for funds, appealing to the public to protect, to preserve, to clear up litter, to abate smoke, and stamp out immorality in parks, commanded respect."
