"1、幸存偏误",""
"今天，任何人重读2007年的经济预测，都会惊讶于当时专家们对2008~2010年前景的展望有多么乐观。一年之后，2008年，金融危机爆发了。问到金融危机的起因，还是那些专家们今天会给出相同的答案：格林斯潘统治下货币的泛滥、资金放贷的宽松、腐败的信贷评级机构、随意的自有资本规定等。回顾之下金融危机的发生似乎完全符合逻辑，是不可避免的。可没有一位经济学家——全世界的经济学家有近百万名——预言到了它的准确发展。相反，很少有哪个专家团体会这么深地落入事后诸葛亮偏误的圈套。",""
"事后诸葛亮偏误绝对是最顽固的思维错误之一，可以恰如其分地称为“我早知道现象”，即事后回顾时一切都显得是可以理解的、不可避免的。",""
"事后回顾时，一位靠幸运获得成功的首席执行官，对他的成功概率的估计要远远高于客观估计。评论员们事后发现罗纳德•里根在1980年总统选举中大败吉米•卡特是可以理解的，是必然的——虽然直到第二次投票选举日前几天他们还不分胜负。今天，经济记者们写道，谷歌的成功是不可逆转的——虽然如果有人在1998年预测这家网络企业将有如此辉煌的未来一定会遭到他们的嘲笑。还有一个特别明显的例子：事后看来，1914年萨拉热窝的一枪会在接下来的30年彻底改变世界，夺去5000万条人命。但在当年，1914年，却没有人担心过这种事。它听起来太荒唐了。",""
"事后诸葛亮偏误为什么这么危险呢？因为它让我们相信自己是很好的预言家，而事实却不是这样。这会导致我们傲慢，误导我们作出错误的决定。在私事上也是如此。“你听说了吗？西尔维娅和克劳斯分道扬镳了。他俩差别那么大，不分手才怪。”或者：“他俩实在是太相似了，不分手才怪。”又或者：“这两人老黏在一起，不分手才怪。”再或者：“他们几乎难得见面，不分手才怪。”",""
"与事后诸葛亮偏误作斗争并不容易。研究表明，知道这种偏误的人，也常像其他所有人一样掉进它的陷阱。",""
"但我还有一个建议，这建议更多是来自个人经验而不是科学：请你记日记。请你写下你的预测——有关政治、事业、体重、股市等。请你不时地拿你的记载与实际情况相比较。你会惊讶你是个多么糟糕的预测家。另外，请你也同样读历史。不是事后的、成熟的理论，而是那个时代的日记、剪报、备忘录。这会让你更好地感觉到世界的不可预见性。",""
"13、司机的知识",""
"**你为什么不可以把新闻播音员说的话当真**",""
"马克斯•普朗克于1918年荣获诺贝尔物理学奖，之后他在全德国作巡回报告。不管被邀请到哪里，他都会就新的量子力学演讲一番。他的司机渐渐对他的报告烂熟于心。“普朗克教授，老作同样的报告，你一定觉得无聊。我建议，在慕尼黑由我代你作报告，你坐最前排，戴上我的司机帽。让咱俩换换花样。”普朗克兴致盎然，欣然同意。于是司机为一群专家级听众作了一番有关量子力学的长篇报告。之后，一位物理学教授举手提问。司机回答说：“我压根儿没想到，在慕尼黑这样先进的城市里还会有人提出这么简单的问题。请我的司机来回答这个问题吧。”",""
"查理•芒格是全球最优秀的投资家之一，普朗克的故事我就是从他那里听来的。他认为知识有两种：一种是真知识，来自那些投入大量时间和思考以获得知识的人们；另一种就是司机的知识，按芒格故事里的意思，司机是指那些装得好像他们知道的人。他们会模仿别人表演，他们也可能拥有动听的声音或具有说服力的形象。但他们传播的知识是空洞的，他们高谈阔论地挥霍着华丽词汇。",""
"可惜越来越难将真知识与司机的知识区分开来。在新闻播音员身上还算简单，他们是演员，仅此而已。这一点人人都知道。但人们对这些“套话大师”是那么尊敬，这一点让人讶异不已。人们付给他们很多钱，邀请他们主持他们几乎力不从心的调查和访谈节目。",""
"这种区分在记者身上就困难一些。他们中的有些人确实掌握着扎实的知识，多是学习了很长时间的学生，或是那些长年专门研究某个领域的记者。他们真正努力理解和描绘一个复杂的事实。他们倾向于长篇大论，阐明多个事件和例外。",""
"可惜多数记者都属于司机范畴。他们变魔术似的会在最短的时间内从帽子里变出任意一篇内容的文章，或者，说得更准确些——从互联网里。他们的文章只有一页，简短、诙谐，经常是作为他们的司机知识的补偿。",""
"一家企业越大，人们就越期望它的首席执行官具有表演才能——所谓的交际能力。一个安静、固执但可靠的创造者是不行的，至少不能担任最高领导。股东和经济记者们显然相信，一个擅长宣传的人会带来更好的结果——实际上当然不是这么回事。",""
"查理•芒格的合作伙伴沃伦•巴菲特使用了一个美妙的概念：“能力范围”。在这个范围之内的，人们都像专家一样精通；在这个范围之外的，就不懂或只懂一部分。巴菲特的生活信条是：“请认清你的能力范围，并待在里面。这个范围有多大，并不重要。重要的是知道这个范围的界线在哪里。”查理•芒格重复说：“你必须找出自己的才能在哪里。我几乎可以向你保证，如果你必须在你的能力范围之外碰运气，你的职业生涯将会非常糟糕。”",""
"<font size=""2"" color=""orange"">结论：请你不要信任司机的知识。请你不要将公司新闻发言人、爱出风头的人、新闻播音员、唠叨鬼、花言巧语者、爱说闲话的人与一个真正有知识的人搞混。你怎么能区分出来呢？这里有个明确的信号。真正有知识的人知道他们知道什么，也知道他们不知道什么。这类人一旦来到他的“能力范围”之外，他要么什么也不说，要么就说“我不知道”。他这么说时不会觉得难为情，甚至还会带着一定的骄傲。而从“司机们”那儿，你别的什么话都能听到，就是听不到这一句。</font>",""
"14、控制错觉",""
"**控制错觉是指：相信我们能够控制或影响某种我们客观上无法控制或影响的东西的倾向。**",""
"**你实际控制的少于你以为的**",""
"每天上午快9点时，一个头戴红帽子的男人就会站在一座广场上，疯狂地将帽子挥来挥去。5分钟后他又消失了。有一天一位警察走到他面前：“你到底在做什么？”“我在驱赶长颈鹿。”“这儿没有长颈鹿。”“没错，这正是因为我干活干得好。”",""
"一位朋友腿骨折了，被绑在床上，他请我去邮局为他买张彩票。我圈了6个数字，在上面写下他的名字，付了费。当我将彩票复印件递给他时，他粗暴地说：“你为什么帮我填好了彩票？我本来想自己填的。你填的数字我肯定什么也赢不到！”“你真以为，你能通过亲手圈数字在某种程度上影响那些球吗？”我回答道。他茫然不解地望着我。",""
"在赌场里，当人们想要一个大数字时，大多数人会尽可能使劲地掷色子；当人们希望得到一个小数字时，他们会尽可能掷得温柔。这自然与球迷们的手势和脚部动作一样没有意义。球迷们那么做，好像他们真能干预比赛似的。许多人都存有这样的幻想：他们想靠传播正能量影响世界。",""
"控制错觉是指：相信我们能够控制或影响某种我们客观上无法控制或影响的东西的倾向。这是詹金斯和沃德两位研究人员在1965年发现的。试验规则很简单：两只开关和一盏灯，灯或开或关。詹金斯和沃德可以调节开关和灯光互相制约的强度。即使是在灯纯属偶然地开、关的情况下，受试者也坚信，按开关能够在某种程度上影响灯。",""
"一位美国科学家将人们关在一间音响室里，不断提高音量，直到受试者表示拒绝，以此调查人们对噪音的疼痛承受程度。有两间音响室，A音响室和B音响室，它们一模一样，只有一个区别：B音响室的墙上有个红色的紧急按钮。结果呢？B音响室里的人们承受的噪音明显要大得多。可笑的是，那个紧急按钮根本不管用。错觉本身足够提高人们承受疼痛的极限。如果你读过亚历山大•索尔仁尼琴、维克多•弗兰克尔或普里莫•利瓦伊的作品，这个结果就不会让你感到意外。能够稍许影响自己命运的错觉能够让犯人有勇气活下去。",""
"在曼哈顿横穿街道时，人们会按一个红绿灯按钮。事实上他们按的是个不起作用的按钮。那为什么还要有这个按钮呢？就是为了让行人们相信，他们能影响信号控制器。事实证明，这样他们就能更好地忍受在红绿灯前的等待。许多电梯里的“开门、关门”按钮也是这样的，它们与电梯控制器其实并不相连。科学里称它们为“安慰按钮”。还有大办公室里的空调温度调节开关：有人觉得太热，另一些人觉得太冷。聪明的工程师会利用控制错觉，在每一层楼都安装一个假的温度调节按钮。这样一来，投诉的数量明显减少了。",""
"央行行长和经济部长也常常使用“安慰按钮”的伎俩。这些按钮是不起作用的，日本人20多年前就看出来了，美国人是近几年才看出来的。但我们听任他们这么做，他们也继续这么做着。承认世界经济是个基本上无法操纵的系统，对所有参与者都是无法忍受的。",""
"那么你呢？你控制了你的生活吗？你实际控制的很可能比你以为的要少。你别以为自己是那个淡泊地克制自己的马尔克•奥莱尔，你更像是那个戴红帽子的男人。因此，请你将注意力集中于你真正能影响的少量东西——坚定不移地只关注其中最重要的那些。其他的，听之任之吧。",""
"15、激励过敏倾向",""
"**你为什么不该按实际开销付钱给你的律师**",""
"河内的法国殖民政府曾经颁布过一条法令：人们每交出一只死老鼠，政府就给他发钱。政府这样做本是想控制鼠灾，但这条法令却导致人们养殖老鼠。",""
"1947年，当死海的卷轴被发现时，考古学家们悬赏收集每一张新发现的羊皮纸手稿。结果，为了增加手稿数量，那些羊皮纸被撕碎了。同样的事也发生在19世纪的中国，当悬赏征购恐龙骨时，农民们会将挖出的完好恐龙骨砸碎，再去领赏。",""
"一家企业的董事会向管理层承诺，一旦实现一个目标就颁发一份特殊津贴。结果如何呢•经理们将更多的精力用来商定尽量多的目标，而不是思考如何让企业赚钱。",""
"这是激励过敏倾向的例子。它先是说明了一个平庸的事实：人们会对激励机制做出反应。这不奇怪。人都会做对自己有益的事情。令人吃惊的是两个次要方面：第一，一旦有激励加入游戏或改变了激励，人们就会迅速而剧烈地改变自己的行为；第二，人们是对激励做出反应，而不是对激励背后的目的做出反应。",""
"好的激励机制会将目的和激励联系起来。举个例子：在古罗马，当一座桥竣工通行时，工程师必须站在桥拱下。这种机制相当好，会鞭策工程师将桥建得足够稳固。相反，差的激励机制则与目的不符，甚至有损目的。所以，一般来说，对一本书的审查会让书的内容更好；而银行职员，如果他们每签署一份贷款合同就能得到钱，那么他们就会堆积很多糟糕的贷款文件。",""
"你想影响人们或组织的行为吗？那你可以通过价值观和愿景进行说教，但通过激励似乎总是更简单。这些激励不必是货币，从学分到诺贝尔奖再到未来生活的特殊待遇，什么都可以。",""
"我很长时间都在问自己，在中世纪盛期，为什么精神健康、以贵族为主的人们会跃上战马，参加十字军东征？前往耶路撒冷的艰难骑行会持续至少6个月，才能穿越敌人的危险地带。所有这些，参与者都是知道的。那他们为什么还要这样冒险呢？就是因为激励机制。如果活着回来，他们可以保留战利品；如果死去，他们会作为殉难者前往彼岸——带着殉难者身份应有的所有好处。这是一件稳赢不输的事。",""
"按实际开销付钱给律师、建筑师、咨询师、会计师或驾校老师是愚蠢的。这些人受到激励，就会尽可能多花钱。因此请你事先约定一个固定价格。专科医生总想尽可能全面地为你治疗和动手术——即使没那个必要。投资顾问乐于向你“推荐”任何金融产品，因为他们会得到一份销售佣金。企业家和投资银行家的生意计划没有价值，因为这些人参与金融交易的直接利益。古老的谚语怎么说来着？“千万别问理发师你是否需要理发。”",""
"<font size=""2"" color=""orange"">结论：请小心激励过敏倾向。如果你对某个人或某个组织的行为感到吃惊，请你想想，那后面隐藏着什么激励机制。我保证，你可以这样解释90%的行为。激情、精神疾病、心理障碍或恶意最多占到10%。",""
"投资大师查理•芒格走进一家渔具店，突然在一个支架前停下，拿起一只一闪一闪、引人注目的塑料鱼饵，问店主：“请问，鱼类真的会喜欢这种东西吗？”店主笑笑：“查理，这玩意儿我们可不是卖给鱼的。”</font>",""
"16、回归均值",""
"**医生、顾问、教练及心理治疗师的作用令人怀疑**",""
"有位男士经常背痛，疼痛时强时弱。有时他觉得自己充满活力，有时他几乎动弹不得。每次碰上这种情况——幸好很少——他妻子就会开车送他去找心理治疗师。每次这样做的第二天，他就明显好多了。于是他逢人就推荐他的心理治疗师。",""
"另一个年轻人，高尔夫球打得非常好，他逢人便夸他的高尔夫球老师。如果某天他的球打得糟糕，他就去这位老师那儿学上1小时，下回他就又打得很好了。",""
"第三个人是一家著名银行的投资顾问，他发明了一种“雨舞”。每当他在交易所的表现下滑时，他就在卫生间里跳“雨舞”。不管跳舞时他觉得自己有多荒谬，这支舞都是必须跳的：事实证明，他在交易所的表现好转了。",""
"将以上三个人联系在一起的其实就是回归均值。",""
"假定你正在经历一次破纪录的严寒，接下来的几天气温就极有可能回升——朝着月度均值的方向。每逢酷暑、干旱和雨季时也是这样，气候会围绕一个均值波动。这同样适用于慢性疼痛、高尔夫球成绩、股市业绩、恋爱运气、主观舒适感、职场成功、考试分数等。总之，剧烈的背痛很有可能不用找心理治疗师也会减弱；高尔夫球成绩不用额外上课也会重新变好；那位投资顾问的表现不用跳“雨舞”也会移向均值。",""
"极端成绩与不太极端的成绩总是来回交替。已经连续3年表现优异的股票几乎不可能在接下来的3年继续走强。因此许多运动员在比赛取得好成绩，并因此登上报刊头版后心中往往会产生恐慌的情绪：潜意识中他们预感到，下回比赛时他们可能再也不会取得这一最高成绩了——这当然与头版毫无关系，而是与他们成绩的自然波动有关。",""
"以一位企业地区负责人为例，他将员工中最不积极的3%送进一个激励培训班，想以此来促进企业员工的积极性。结果呢？当他下回调查时，这3个人不是都在最不积极的3%里了——其他人取而代之。这就说明培训有用了吗？很难说，因为这些人的积极性不用培训可能也会围绕他们个人的均值摇摆。抑郁症患者的情况也类似，离开医院时他们的抑郁程度通常都减轻了。不过，很有可能，这与住院毫无关系。",""
"还有一个例子：在波士顿，测试成绩最差的学校要接受一个复杂的学习提升项目。次年这些学校不再是成绩最差的了——国家监督机构就将这一好转归功于该项目，而不是自然的回归均值。",""
"忽视回归均值，可能会造成严重后果：比如老师（或经理）会得出结论，处罚比夸奖更有效。因为通常考试成绩最优秀的学生会受到夸奖，最差的则会遭到处罚。而在下次考试中——纯随机地——可能就会是另一些学生处于成绩最高和最低的位置。老师因此得出结论：处罚有效，夸奖有害。这当然是一个谬论。",""
"<font size=""2"" color=""orange"">结论：当你听到诸如“我病了，去看医生，现在我好了，因此是那位医生帮助了我”或“这一年公司业绩很糟糕，我们请了个顾问回来，现在业绩恢复正常了”的话时，很有可能就是回归均值在起作用。</font>",""
"17、公地悲剧",""
"**为什么理性的人不去诉诸理性**",""
"请你设想有一块肥沃的土地，一座村庄的所有农民均可使用。可以预料，每个农民都会将尽量多的奶牛赶到这块土地上去放牧。只要没有人偷猎、没有疾病蔓延，这件事就行得通，简言之：只要奶牛总数不超过一定数量，也就是土地不被剥削殆尽即可。可是，一旦事情不是这样，公地的美丽想法就会突转为悲剧。作为理性的人，每个农民都试图将他的利润最大化。他心想：“我要是再多将一头奶牛赶去公地，我会得到什么好处呢？”他可以得到多出售一头奶牛的额外好处。多一头奶牛造成的过度放牧的害处由所有人承担，单个农民承担的损失极小。所以从他的角度看，将更多的奶牛赶到公地上去放牧是理性的。于是再来一头、再来一头，直至公地被毁掉，这就是公地悲剧。",""
"公地的真实意义是一处公共场所，希望通过教育、启蒙、信息宣传、呼吁“社会责任感”、教皇训谕或摇滚明星的布道从根本上解决公地悲剧是不可能的。如果有人真想解决公地问题，只有两种可能：将公地私有化或加强管理。具体地说，就是将这块沃土交到私人手里，或封住草地的入口。比如管理，就意味着由国家制定规则：也许是收取使用费，也许是进行时间限制，也许是根据眼睛的颜色（或眉毛、奶牛的颜色）来决定谁享有优先使用权。",""
"私有化是较为简单的解决方法，但加强管理也有据可援。为什么这两者做起来这么难呢？为什么我们总是沉湎于公地的想法呢？因为我们还没有为解决这一社会难题作好准备。原因有二：第一，在整个人类的发展史上我们几乎一直拥有无限的资源可供支配；第二，一万年来我们都生活在一个50人左右的小群体里。彼此间相互认识，如果有人只考虑自己的好处，滥用公众利益，就会被发觉，并遭到最严厉的惩罚——失去名誉。在小范围内，道德的制裁至今还有效（虽然没有警察在场，我也不会在聚会中将我朋友们的冰箱洗劫一空），但在一个匿名社会里道德就没那么管用了。",""
"凡好处归个人而成本由集体承担的地方，就潜伏着公地悲剧：二氧化碳的排放无度、乱砍滥伐树木、水污染、灌溉无节制、无线频率的过度使用、公用厕所的脏乱差，太空垃圾不回收、“大而不倒”的银行等。但这并不是说，自利的行为是绝对不道德的。将多一头奶牛赶去公地的农民不一定是悲剧制造者。这个悲剧只有当群体超出100人左右、我们到达了系统再生能力的极限时才会出现。显然，我们将越来越多地遇到这个问题。",""
"公地悲剧本是亚当•斯密的“无形的手”的对立面。特殊情形下市场这只无形的手并不能指向最佳效果——而是恰恰相反。",""
"自然，有些人会特别重视他们的行为对人类和经济体系的影响，但在这种自我负责基础上制定政策是盲目的，我们不可以指望人类的道德理性。厄普顿•辛克莱说得一针见血：“如果某人的收入取决于不理解某事，要让他理解就会很难。”",""
"简言之，只有上述两种解决方法：将公地私有化或加强管理。对于无法私有化的东西，如臭氧层、海洋、卫星运行轨道等，必须加强管理。",""
