"1、幸存偏误",""
"下列试验表明了要怀疑自己的理论有多困难。一位教授让他的学生看一组数字：2、4、6，要他们找出其中的基本规则。教授将规则写在了一张纸的背面。他要求受试者说出下一个数字，教授要么回答“符合规则”，要么回答“不符合规则”。受试者可以想说多少个数字就说多少个，但规则只能猜一次。大多数学生说的是“8”，教授的回答是“符合规则”。为保险起见，他们还试了“10”、“12”和“14”，教授每次都回答“符合规则”。于是学生们得出一个简单的结论：“那么规则就是：在前一个数字的基础上加上2。”教授摇摇头：“写在纸背后的规则不是这样的。”",""
"唯一一位头脑灵活的学生是用不同的方法破解这道题的。他试了“4”，教授说：“不符合规则。”“7呢？”“符合规则。”这位学生又用各种数字试了一阵儿，“–24”、“9”、“–43”……他显然有个想法，并试图证明它不对。直到再也找不到反例了，他才说道：“规则是：下一个数字必须大于前一个。”教授将那张纸翻过来，上面正是这么写的。这位机智的学生与他的同学的区别在哪里呢？他的同学只想证明他们的理论是对的，而他试图证明他的理论是错的——有意识地寻找反驳证据。确认偏误如何影响我们的生活？且听下回分解。",""
"6、确认偏误之二",""
"**谁在生活中抱有“人是善良的”想法，他会找到这一理论的足够证明；谁在生活中抱有“人是邪恶的”想法，他同样也能找到足够证明。**",""
"**干掉你的宠儿**",""
"上一章我们认识了所有思维错误之父——确认偏误。这里再举几个例子。我们大家都被迫就世界、生活、经济、投资、事业等提出种种理论。没有假设不行，可一种理论越是模糊，确认偏误就越强。谁在生活中抱有“人是善良的”想法，他会找到这一理论的足够证明；谁在生活中抱有“人是邪恶的”想法，他同样也能找到足够证明。慈善家和愤世嫉俗者，双方都将过滤掉反驳证据（相反的证据），得到支撑他们世界观的大量证明。",""
"占星学家和经济学家的行事原则也是一样。他们的说法如此含糊，它们像磁铁一样吸引证明，例如“接下来的几星期你会经历悲伤的瞬间”、“中期看，美元存在贬值压力”。什么叫作中期？什么是贬值压力？与什么比会贬值——黄金、日元、比索、小麦、柏林克罗伊兹贝格区的房产还是咖喱烤肠的价格？",""
"宗教信念和哲学信念因其含糊性更是确认偏误的杰出温床，它在这里疯狂地滋生。信徒们一步步看到神存在的证明。神不直接现身——除了向沙漠里和偏僻山村里的文盲现身，从不出现在法兰克福或纽约这样的都市里——这表明确认偏误是多么强大，就连最有力的异议也被过滤掉了。",""
"确认偏误对经济记者的影响之大非其他行业可比。他们常抛出一种廉价理论，再提供两三个“证明”，就算完成了一篇文章。比如：“谷歌如此成功，是因为这家公司拥有一种创造性文化。”于是记者就会去找出两三家同样有创造性文化并成功了（确认证据）的公司。但他不会努力去挖掘反驳证据，也就是找出那些提倡创造性文化却不成功的公司，还有那些成功了但没有创造性文化的公司。两种公司各有很多，但记者故意忽视它们。他若提到其中的一种，他的文章就会被扔进垃圾桶了。",""
"成功指南和生活援助手册也是按照这个原则撰写的。摆上台面的都是最无聊的理论，比如：“冥想是开启幸福之门的钥匙。”聪明的作者当然有大量例子证明这一理论。相反，寻找反驳证据则是徒劳，即寻找那些未冥想而幸福的人和虽冥想却不幸福的人。有多少读者上了这种图书的当啊，真是可悲。",""
"该死的是认识不到确认偏误。当然，我们不喜欢我们的信念被攻击得千疮百孔。但实际情况不是我们在我们的信念前竖起了一块挡箭牌，实际情况恰似对方在使用消音器朝我们射击：子弹落下，而我们听不到枪声。",""
"互联网让我们很容易就能找到志同道合者。我们阅读支持我们理论的博客。新闻个人化使得相反的意见根本不会出现在我们的电脑屏幕上。我们越来越多地活动在思想一致者的社区里，这更加加深了确认偏误。",""
"我们怎样才能保护自己呢？作家亚瑟•奎勒•库奇的一句话很有帮助：“干掉你的宠儿。”他的这句话是对那些经常舍不得删除漂亮但多余的句子的作家们讲的。他的呼吁不仅适用于优柔寡断的作者，也适用于我们大家。",""
"<font size=""2"" color=""orange"">结论：请你与确认偏误作斗争。请你写下你的信条——有关世界观、投资、婚姻、健康预防措施、节食、成功策略的，然后寻找反驳证据。干掉自己最心爱的理论，这是一桩艰苦的工作，但作为聪明人士，你不会躲避的。</font>",""
"7、权威偏误",""
"**关于权威有两个问题。首先是令人警醒的跟踪记录。这个星球上有大约100万受过培训的经济学家，没有一位精确预言了金融危机发生的时间，更别说房地产泡沫的破裂、信用违约互换的瓦解直到通货膨胀引发的经济危机的顺序了。**",""
"**你为什么该藐视权威**",""
"如果不服从权威，会发生什么事？《圣经》第一章就说得明明白白：会被逐出天堂。各个领域的权威们——政治家、科学家、医生、首席执行官、经济学家、政府官员、体育评论员、企业顾问和证券大师们——也想让我们相信此事。",""
"关于权威有两个问题。首先是令人警醒的跟踪记录。这个星球上有大约100万受过培训的经济学家，没有一位精确预言了金融危机发生的时间，更别说房地产泡沫的破裂、信用违约互换的瓦解直到通货膨胀引发的经济危机的顺序了。再没有哪个专家群体失灵得比这更惊人了。让我们再举一个医学界的例子：事实可以证明，在1900年之前，病人都不怎么去看医生，因为医生只会使病情恶化（由于当时卫生条件不够，医生只会采用放血和其他不当方法）。",""
"其次，经常可以证明，权威也会出错。出错是人类的通病，但重要的是，面对权威我们会将独立思考调低一级。面对专家意见时我们往往会比面对其他意见粗心许多。还有，我们会服从权威，哪怕是在理性或道德上毫无意义的地方。这就是权威偏误。",""
"年轻的心理学家斯坦利•米尔格拉姆1961年做了一个试验，将权威偏误揭示得一览无遗。试验时他请求一位受试者电击坐在玻璃窗另一侧的一个人，并逐渐增加电压。从15伏开始，然后是30伏、45伏，以此类推，直到几乎致命的450伏。即使受折磨的那个人痛得大喊大叫，浑身颤抖（事实上没有电流，那只是一位演员），受试者想中断实验，但只要米尔格拉姆平静地说“请继续，实验要求这样做”，大多数人都会继续做下去。半数以上的受试者将电压升到了最高——纯粹是在服从权威。",""
"近几十年来，航空公司明白了权威偏误有可能造成危险。许多意外事故之所以发生，都是因为机长犯了错，副机长察觉了错误，但出于相信权威不敢指出来。大约15年以来，几乎所有航空公司的飞行员都接受了所谓的“机组资源管理”训练，学习坦率、迅速指出毛病。换句话说：他们训练自己努力摆脱权威偏误。",""
"几十年后，许多公司纷纷向航空公司学习。特别是当有一位强势的首席执行官时，员工患上权威偏误的危险就更大，这对公司很不利。",""
"专家们希望被人认出，为此他们必须用某种信号显示他们的身份。医生和研究人员是通过他们的白大褂，银行行长则是通过西服和领带。领带没有作用，它只是一种信号。国王们头戴王冠，军队中有军衔标志，基督教会里的权威信号更是明显。其他信号还有名人访谈的邀请、图书和其他出版物等。",""
"任何时候都有不同的权威“流行”。有时是神职人员，有时是国王、武士、罗马教皇、哲学家、诗人、摇滚明星、电视制作人、互联网公司创始人、对冲基金经理、银行总裁。因此存在权威时，社会总是乐于跟从。如果权威们想跨界得到认真对待，将会引起混乱。比如，当一位职业网球运动员推荐咖啡机或一位女演员推荐治疗扁桃腺炎的药的时候。有关这方面的更多内容请参见光环效应那一章。",""
"不管什么时候遇到一位专家，我都会设法向他挑战。请你也这么做。你对权威的批判性越强，你就越自由，就越相信自己有更多的能力。",""
"8、对比效应",""
"**对比效应是常见的思维错误之一。你会为你的新车订购真皮车座，因为你觉得3000欧元相对于6万欧元的车价来说只是笔小钱。所有靠销售装潢用品生存的部门都在玩弄这一把戏。**",""
"**你为什么最好别找模特儿等级的朋友一起出门**",""
"罗伯特•西奥迪尼在他的《影响力》一书里介绍了希德和哈利两兄弟的故事。20世纪30年代，他们在美国经营一家服装店。希德负责销售，哈利负责裁剪。每当希德发现站在镜子前的顾客真的喜欢一套西服时，他就会假装有点耳聋。当顾客询问价格时，希德就对他的兄弟喊：“哈利，这套西服多少钱？”哈利就从他的裁剪台上抬起头，回答说：“这套漂亮的棉质西服42美元。”这价格在当时高得离谱。希德假装他没听懂似的又问：“多少钱？”哈利重复那个价格：“42美元！”希德听完后向他的顾客转过身来说：“他说22美元。”那位顾客听到后就赶紧将22美元放到桌上，抢在可怜的希德发觉“错误”之前，带着昂贵的衣服匆匆离去。",""
"你在学生时代可能做过以下实验：你拿来两只桶，在第一只桶里倒进温水，在第二只桶里倒进冰水。你先将右手插进冰水里一分钟，然后将两只手同时插进温水里。你有什么感觉？左手感觉水是温的，右手却感觉水是烫的。",""
"希德和哈利的故事与水的试验都是建立在对比效应的基础上：当我们同时面对某种难看、便宜、小的东西时，我们就会判断出另一种东西更漂亮、更贵、更大。我们很难作出绝对的判断。",""
"对比效应是常见的思维错误之一。你会为你的新车订购真皮车座，因为你觉得3000欧元相对于6万欧元的车价来说只是笔小钱。所有靠销售装潢用品生存的部门都在玩弄这一把戏。",""
"但对比效应在别处也有效。试验表明，为了节约10欧元，人们会走10分钟的路去购买一种食物。可是，如果能在街道另一端花979欧元而不是989欧元买一套西服，谁也不会想到要去走这10分钟的路。这是一种非理性的行为，因为10分钟还是10分钟，10欧元还是10欧元。",""
"没有对比效应，就完全无法想象打折生意。一种从100欧元降到70欧元的产品，会显得比一直就卖70欧元的产品更便宜。而事实上最初的价格根本无关紧要。不久前一位投资者对我说：“这只股票便宜，因为它只有最高价的50%。”我轻轻摇摇头。股票价格永远不会“低”或“高”。它是怎么样就是怎么样，唯一值得考虑的是它从这一刻起是会涨还是会跌。",""
"我们就像鸟儿听到枪声一样会对对比做出反应。我们扑翅飞起，很快行动起来。不利的一面是，我们发觉不到逐渐发生的小变化。魔术师能够偷走你的表，是因为他对你身体的另一部位使劲用力，让你根本注意不到你手腕上的轻微接触。我们同样不会注意我们的钱是如何消失的。它的价值不断下跌，但我们发觉不到，因为通货膨胀是逐渐发生的。假如它以无情的税收形式让我们承担——原则上是这样的——我们就会发怒。",""
"对比效应有时能够毁掉你的整个生活：一个漂亮女人嫁给了一个相当普通的男人。为什么？因为她的父母都很厉害，她觉得普通男人更好，虽然他实际上并没有那么好。最后：在超级名模的广告轰炸下，就连漂亮女人都会觉得自己魅力一般。因此，如果你是女人，想找一个男人，你千万不要让你的模特儿等级的朋友陪你一起出去。男人会因此发觉不到你的真实魅力。你独自去就好。更好的办法是：你带上两个比你难看的朋友去参加舞会。",""
"9、现成偏误",""
"**现成偏误是指：我们依据现成的例子来想象世界。这当然是愚蠢的，因为外界现实中的某种东西不会因为我们更容易想到而出现得更频繁。**",""
"**你为什么宁可用一张错误的地图，也不愿没有地图**",""
"“他终生吸烟，每天3盒，却活到了100多岁。因此吸烟的危险不可能有多大。”“汉堡是安全的。我认识一个人，他住在白沙岛中部，他从不锁门，哪怕出去度假都不锁门，他家还从未失窃过。”这些话是想证明某种东西，但它们其实什么也证明不了。这么讲话的人，就是犯了现成偏误。",""
"首字母是R的德语单词要比结尾字母是R的多吗？答案是，结尾字母是R的德语单词要比首字母是R的多两倍以上。为什么这个问题大多数人都会答错呢？因为我们会更快地想起以R为首字母的单词。换个说法：它们更现成。",""
"现成偏误是指：我们依据现成的例子来想象世界。这当然是愚蠢的，因为外界现实中的某种东西不会因为我们更容易想到而出现得更频繁。",""
"由于现成偏误，我们的脑子里总有一张错误的风险卡。于是我们系统性地高估了因飞机坠毁、汽车事故或谋杀而遇难的风险。我们低估了因为糖尿病或胃癌这样不太能引起轰动的方式死亡的风险。炸弹袭击要比我们认为的少得多，抑郁症则要常见得多。壮观、华丽或大声的一切，我们都高估了它们出现的概率。而无声、无形的一切，我们都低估了它们出现的概率。因为我们的大脑更容易接受壮观、华丽或大声的东西。我们的大脑是剧本式思维的，而不是量化思维的。",""
"医生们更是常沦为现成偏误的牺牲品。他们有他们最喜欢的疗法，用它们治疗所有可能的病例。虽然有可能存在更合适的疗法，但在他们的思想里是不存在的。因此他们总是采用自己熟悉的方法。企业顾问们也好不到哪儿去。如果遇到一种新形势，他们不会双手交叉在头顶上，叹息说：“我实在不知道我能向你提供什么建议。”相反，他们会启动一个他们熟悉的顾问程序——不管它合不合适。",""
"某种东西重复出现，我们的大脑就很容易重新提取它。它并不一定是真的。纳粹领导人不就是经常重复“犹太人问题”，直到大众坚信存在一个严肃的问题吗？你只需要足够经常地重复“不明飞行物”、“生命能量”或“轮回”这些词，人们就会相信它们。",""
"现成偏误的蠕虫深深地钻在董事会的沙发椅里。这些大人物只讨论管理层呈送给他们的东西——大多是季度数据——而不讨论管理层未呈送但更重要的事情，比如如何巧妙地将竞争对手一军，如何更好地应对员工积极性的下降或客户行为的某种意外变化。我多次观察到：人们都是先使用现成的数据或配方。他们在这个基础上作决定——结果经常是灾难性的。例如：10年前人们就知道，用所谓的期权定价模型公式确定衍生金融产品的价格是行不通的。但没有别的公式。因此人们聊胜于无，宁可使用一个错误公式。“波动率”也一样。用它测量一种金融产品的风险是错误的，但它是现成的。于是现成偏误给银行造成了巨额损失。这就好像你身在一座没有地图的陌生城市里，但你口袋里有另一座城市的地图，于是你就使用了那张地图。你宁可用一张错误的地图，也不愿没有地图。",""
"弗兰克•西纳特拉曾经怎么唱来着？“噢，我的心狂跳不已，皆因你在这里。我若不在我心爱的女孩身旁，我就爱我身旁的女孩。”这就是绝对的现成偏误。应对办法：请与跟你想法不同的人合作，跟那些与你拥有截然不同经验的人合作。因为你独自战胜不了现成偏误。",""
"10、“在好转之前会先恶化”的陷阱",""
"**如果有人建议你选择一条“先经历痛苦的道路”，你应该敲响警钟**",""
"几年前我在科西嘉岛上度假时生病了。那些症状是我不熟悉的，疼痛与日俱增，最后我决定去检查一下。一位年轻的医生开始对我视触叩听，在我的肚子上按来按去，然后按肩、按膝。他一个椎骨一个椎骨地摸。我渐渐感到他不懂医术，但又不敢肯定，只好听任他折腾我。检查结束后，他掏出笔记本，说：“你需要吃抗生素。每次一粒，每日3次。在你的病情好转之前，会先恶化。”我很高兴有了一个检查结果，就拖着疲惫的双腿返回了酒店房间。",""
"疼痛果然加剧了。看来那位医生知道他在讲什么。当3天后痛苦依然不减时，我打去电话。“请将剂量提高到每日5次，还会疼一阵子的。”他说道。我按要求做了。又过了两天，我打电话给急救中心。瑞士医生查明是盲肠炎，立即给我做了手术。“见鬼，你为什么等了这么久？”术后他问我。“病情变化完全符合预测，因此我信赖那位年轻医生。”“你成了‘在好转之前会先恶化’的陷阱的受害者了。那位科西嘉的医生一窍不通，估计是个临时护理人员，旅游旺季时在所有旅游区都会遇到像他这样的人。”",""
"我们再举个例子，有一位首席执行官，他的公司营业额跌到冰点，营销人员毫无积极性，营销活动屡屡无效。绝望中他聘请来一位顾问，请这位顾问分析公司的情况，费用为每天5000欧元。顾问检查后得出这样一个结论：“你的销售部门缺乏想象力，你的品牌定位不明确，形势棘手。我可以为你纠正过来，但不可能一蹴而就。问题错综复杂，需要慢慢解决。在好转之前，营业额还会下滑。”首席执行官聘用了这位顾问。一年后营业额果然下滑了。第二年也是。顾问一再强调，公司的发展正好符合他的预测。当3年之后营业额继续不见起色时，首席执行官终于解聘了这位顾问。",""
"“在好转之前会先恶化”的陷阱是确认偏误的一种变体。使用这个花招大大有利于一个对专业一窍不通或对事情没有把握的专业人员。如果情况继续走下坡路，就证明了他的预言是正确的。如果情况意外地回升了，客户开心，专业人员则可以将好转归功于他的能力。不管怎样——他总是对的。",""
"假设你将成为一名州长，但你对如何领导这个州一窍不通。你会怎么做呢？你预言将有“艰难的几年”，要求你的同胞们“勒紧裤腰带”，你许诺等“清洗”、“除渣”、“改组”的“棘手阶段”结束后形势就会好转。而你有意不涉及：低谷会有多长、多深。",""
"宗教为这一策略的成功提供了最好的证据。据说，在天堂降临地球之前，世界必须毁灭。灾难、大洪荒、火灾、死亡——它们必然会发生。信徒们会认为情形的任何恶化都是证明了预言，而每一好转都是上天的馈赠。",""
"<font size=""2"" color=""orange"">结论：如果有人说：“在好转之前会先恶化”，你脑子里就应该敲响警钟。不过请小心：确实有那样的情形，先是再次下滑然后回升。事业的转换可能会耗费时间，会造成停发工资。一个企业的重组也需要一定的时间。但所有这些情况，人们很快就能看出措施是否有效。里程碑是明确的，是可以检测的。请你望着里程碑，而不是望着天空。</font>",""
"11、故事偏误",""
"**为什么就连真实的故事也是骗局**",""
"生活紊乱，比麻线团还乱。请你设想有一个隐形火星人，手里拿着同样隐形的笔记本走在你身旁，记下你所做、所思、所梦的一切。你的生活备忘录由“喝了咖啡，加了两块糖”、“踩了一颗钉子，诅咒世界”、“梦到自己吻了女邻居”、“预订了去马尔代夫休假，贵死了”、“耳朵里有毛，立即拔掉了”等组成。我们将这些乱七八糟的细节编成一个故事，就像将我们的生活编成一根绳，让我们可以顺着它往前走。许多人认为这根绳很有“意义”。",""
"我们也是这么对待世界史细节的。我们将它们强行编成一则没有矛盾的故事。结果如何？结果是，我们突然“理解”了为什么《凡尔赛条约》会导致第二次世界大战，或格林斯潘的宽松货币政策为何会导致雷曼兄弟公司的破产。我们理解了，为什么铁幕必须降临（冷战开始），或《哈利•波特》为什么会成为畅销书。我们叫作“理解”的东西，当时当然没有人理解过。根本没有人能够理解。“意义”是我们事后虚构的。因此故事是个值得怀疑的东西——可看样子我们不能没有故事。为什么不能？不清楚。清楚的是，在开始科学思维之前，人们先是通过故事解释世界的。神学比哲学更古老。故事偏误是指：用故事扭曲和简化现实，它们排斥不合适编进故在媒体里，故事偏误像瘟疫一样肆虐。例如：一辆汽车驶过一座桥，桥突然垮塌了。我们第二天会在报纸上读到什么？我们会读到倒霉蛋的故事，他坐在汽车里，他从哪里来，要驶去哪里。我们会获悉他的生平：生在某处、长在某处、职业是什么。如果他幸存下来，能够接受采访，我们会准确地听到当桥轰然倒塌时，他是什么感觉。荒唐的是，这些故事没有一个是重要的。因为重要的不是那个倒霉蛋，而是桥梁设计。问题具体是出在哪里？是因为材料老化吗？如果是，是哪里的材料？如果不是，是桥受损了吗？那么桥是怎么受损的？会不会是使用了一种从根本上错误的设计原理？所有这些重要问题的麻烦是：不适合将它们编进一则故事里。我们喜欢听故事，不喜欢听抽象事实。这是一种不幸，因为为了不重要的方面，重要方面被忽视了。（这同时也是一种幸运，否则就只有非小说类图书，而没有小说了。）",""
"下列故事你更容易记起哪一则呢？故事一：“国王死了，然后王后也死了。”故事二：“国王死了，随后王后伤心死去。”如果你与大多数人一样，你会更容易记住第二则故事。因为在这里两次死亡不是简单地先后发生的，而是有着情感联系的。故事一是事实报道，而故事二更有“意义”。按照信息理论，本来故事一应该更容易被记住，因为它更短。可我们的大脑并不是这样理解的。",""
"讲述一则故事的广告，比理性地罗列产品优点的广告效果更好。事实上，产品的故事只是附带物，可我们的大脑不是这样运转的。它要听故事。谷歌在2010年美国“超级碗”节目中插播的广告出色地证明了这一点。在YouTube视频分享网站上输入“谷歌巴黎之爱”就可以找到这则广告。",""
"<font size=""2"" color=""orange"">结论：从自传到世界大事——我们将一切炮制成有“意义”的故事。我们这样做是在扭曲真相——这会影响我们决定的质量。应对方法：请你将这些故事拆解开来。请你问问自己：这些故事想隐藏什么？训练方法：请你设法用无关联的眼光看看自己的生平，你会吃惊的。</font>",""
"12、事后诸葛亮偏误",""
"**你为什么应该写日记**",""
"我发现了我舅公的日记。1932年，他从伦茨堡移居巴黎，去电影界碰运气。1940年8月——在德军占领巴黎一个月之后，他在日记中写道：“这里的所有人都预料德军在年底前后又会撤走，德国军官也向我证明了此事。英国会像法国一样快速沦陷，然后我们将最终重新恢复我们的巴黎生活——虽然是作为德国的一部分。”",""
"今天，任何人翻开有关“二战”的历史书，面对的都将是一个完全不同的历史。法国被占领了4年，这似乎更符合一种战争逻辑。回顾过去，战争似乎是最可能发生的。为什么呢？因为我们是事后诸葛亮偏误（英语叫作“hindsightbias”）的受害者。",""
