"钟楼里的魔鬼","The Devil in the Belfry"
"作者：埃德加·爱伦·坡","by Edgar Allan Poe"
"现在几点了？","What o’clock is it?"
"——古谚语","—Old Saying."
"一般情况下，每个人都知道世界上最美好的地方是——或者，唉，曾经是——荷兰的维奥德沃特米提斯自治镇。然而因为它远离任何一条主干道，所在的地方有点偏僻，我的读者当中可能很少有人去过那里。为了方便那些没有去过该地的人，我很有必要对它做一番描述。的确，为了赢得公众对当地人的同情，在此，我打算讲一下最近发生在这个地方的灾难性事件，因此描述这里就更有必要了。认识我的人都毫不怀疑，我会持以严格公正的态度，无比谨慎地调查事实，坚持不懈地核对典据，竭尽所能地完成我自愿承担的义务。这些特点会使那些立志要获得历史学家称号的人脱颖而出。","Everybody knows, in a general way, that the finest place in the world is—or, alas, was—the Dutch borough of Vondervotteimittiss.Yet as it lies some distance from any of the main roads, being in a somewhat out-of-the-way situation, there are perhaps very few of my readers who have ever paid it a visit.For the benefit of those who have not, therefore, it will be only proper that I should enter into some account of it.And this is indeed the more necessary, as with the hope of enlisting public sympathy in behalf of the inhabitants, I design here to give a history of the calamitous events which have so lately occurred within its limits.No one who knows me will doubt that the duty thus self-imposed will be executed to the best of my ability, with all that rigid impartiality, all that cautious examination into facts, and diligent collation of authorities, which should ever distinguish him who aspires to the title of historian."
"在奖章、手稿和铭文的共同佐证下，我可以断定维奥德沃特米提斯自治镇从建立之初至今一直精确地保持着相同的风貌。然而，关于它建立的日期，很遗憾我只能采用那种近似精确的话语来表述，也就是数学家们有时为了套用某个数学公式不得已而采取的方法。我可以这样说，从这个城镇的历史之久远来看，这个日期不会比有据可查的任何年代更晚了。","By the united aid of medals, manuscripts, and inscriptions, I am enabled to say, positively, that the borough of Vondervotteimittiss has existed, from its origin, in precisely the same condition which it at present preserves.Of the date of this origin, however, I grieve that I can only speak with that species of indefinite definiteness which mathematicians are, at times, forced to put up with in certain algebraic formulae.The date, I may thus say, in regard to the remoteness of its antiquity, cannot be less than any assignable quantity whatsoever."
"关于维奥德沃特米提斯名字的由来，我懊恼地承认，我同样感到迷惑不解。人们对这个微妙的问题有许多不同的见解——有的犀利，有的深刻，有的却截然相反——我却不能找到一个令人满意的看法。也许格罗斯韦格的想法——几乎和克劳特普兰特的想法不谋而合——人们应该还算比较认同。这就是——维奥德沃特米提斯——维奥德，接近德语中“雷鸣”这个词的发音——沃特米提斯，接近德语“好像是闪电之前”的发音。说实话，镇议会大厅尖塔顶部电击的迹象进一步证实了这种推理。可是，我不打算在如此重大的问题上表明立场。若读者欲了解更多信息，我建议他们参考邓德古茨的《旁敲侧击先辈演讲集》。也要看看布伦德巴泽德的《词源说》中的第27页至5010页。这书是哥特体对开本，红黑字体，有导字，无密码索引；还可以参考斯图夫特朴夫手稿上的旁注和格鲁特古扎尔的点评。","Touching the derivation of the name Vondervotteimittiss, I confess myself, with sorrow, equally at fault.Among a multitude of opinions upon this delicate point—some acute, some learned, some sufficiently the reverse—I am able to select nothing which ought to be considered satisfactory.Perhaps the idea of Grogswigg—nearly coincident with that of Kroutaplenttey—is to be cautiously preferred.—It runs:—“Vondervotteimittis—Vonder, lege Donder—Votteimittis, quasi und Bleitziz—Bleitziz obsol:—pro Blitzen.”This derivative, to say the truth, is still countenanced by some traces of the electric fluid evident on the summit of the steeple of the House of the Town-Council.I do not choose, however, to commit myself on a theme of such importance, and must refer the reader desirous of information to the “Oratiunculae de Rebus Praeter-Veteris,” of Dundergutz.See, also, Blunderbuzzard “De Derivationibus,” pp. 27 to 5010, Folio, Gothic edit., Red and Black character, Catch-word and No Cypher; wherein consult, also, marginal notes in the autograph of Stuffundpuff, with the Sub-Commentaries of Gruntundguzzell."
"尽管人们对维奥德沃特米提斯自治镇建立的时间及其名字的来源尚不清楚，但是毋庸置疑，如我前面所述，它一直以我们目前发现它的样子存在着。在镇上，最年老的人也记不得它外观上有丝毫的变化。的确，话中一提到这种可能性都会被看作是一种冒犯。村庄坐落在一个完美的圆形山谷中，周长大约四分之一英里，周围全是和缓的山峦，当地人还从来不敢冒险跨过这些山峰。为此，他们有个非常充分的理由，那就是他们完全不相信山的另一边有任何东西。","Notwithstanding the obscurity which thus envelops the date of the foundation of Vondervotteimittiss, and the derivation of its name, there can be no doubt, as I said before, that it has always existed as we find it at this epoch.The oldest man in the borough can remember not the slightest difference in the appearance of any portion of it; and, indeed, the very suggestion of such a possibility is considered an insult.The site of the village is in a perfectly circular valley, about a quarter of a mile in circumference, and entirely surrounded by gentle hills, over whose summit the people have never yet ventured to pass.For this they assign the very good reason that they do not believe there is anything at all on the other side."
"六十座小房屋排成一排，延绵不断地延伸开来，环绕在山谷边缘（山谷地势平坦，全铺着平整的砖）。这些房屋，背靠群山，自然就面向了平原中心。中心与每户人家的前门相隔恰好六十码。每家房前都有一个小花园，花园里有一条环形小径，一个日晷和二十四棵卷心菜。这些房屋都如此惊人地相似，以至于人们无法把它们一一区分开来。因为年代太过久远，所以建筑风格有点古怪，但房屋那令人惊艳的美景并不会因此而逊色。房屋是用烈火烧制的黑边红砖建成，因此墙看起来就像一个巨大的棋盘。山形墙朝前。其上的檐口跟房屋其他部分一样大，搭在屋檐和大门上。窗户窄又深，内嵌着细小的窗格和很多窗框。屋顶上铺了大量翘起的长檐角瓦片。房屋的木制部分通体颜色深暗，上面有很多雕刻，但图案的样式变化很小。因为很久以来，维奥德沃特米提斯的雕刻匠们就只会雕刻两种东西——计时器和卷心菜。但是这两样东西他们雕刻得极其精致，凡落凿之处，他们都独具匠心地加以点缀。","Round the skirts of the valley (which is quite level, and paved throughout with flat tiles), extends a continuous row of sixty little houses.These, having their backs on the hills, must look, of course, to the centre of the plain, which is just sixty yards from the front door of each dwelling.Every house has a small garden before it, with a circular path, a sun-dial, and twenty-four cabbages.The buildings themselves are so precisely alike, that one can in no manner be distinguished from the other.Owing to the vast antiquity, the style of architecture is somewhat odd, but it is not for that reason the less strikingly picturesque.They are fashioned of hard-burned little bricks, red, with black ends, so that the walls look like a chess-board upon a great scale.The gables are turned to the front, and there are cornices, as big as all the rest of the house, over the eaves and over the main doors.The windows are narrow and deep, with very tiny panes and a great deal of sash.On the roof is a vast quantity of tiles with long curly ears.The woodwork, throughout, is of a dark hue and there is much carving about it, with but a trifling variety of pattern for, time out of mind, the carvers of Vondervotteimittiss have never been able to carve more than two objects—a time-piece and a cabbage.But these they do exceedingly well, and intersperse them, with singular ingenuity, wherever they find room for the chisel."
"房屋的内部与外部都如出一辙，家具摆设也都一个样式。地面铺着方砖。黑色木制桌椅腿细而弯曲，桌椅脚呈小狗爪状。又高又宽的壁炉架不仅正面雕刻着计时器和卷心菜，而且顶部正中间还摆放着一个真的计时器，“滴答滴答”地响得异常响亮；两端各有一个花盆，每个花盆里面栽着一棵卷心菜，像侍从一样站在两端。在每棵卷心菜和计时器之间还有一个大肚子的小中国人。透过他肚子上那个又大又圆的洞，人可以看见表的表盘。","The dwellings are as much alike inside as out, and the furniture is all upon one plan.The floors are of square tiles, the chairs and tables of black-looking wood with thin crooked legs and puppy feet.The mantelpieces are wide and high, and have not only time-pieces and cabbages sculptured over the front, but a real time-piece, which makes a prodigious ticking, on the top in the middle, with a flower-pot containing a cabbage standing on each extremity by way of outrider.Between each cabbage and the time-piece, again, is a little China man having a large stomach with a great round hole in it, through which is seen the dial-plate of a watch."
"壁炉又大又深，里面的柴架弯弯曲曲、异常可怖。壁炉里火势总是很旺，上面放着一口大锅，里面煮着满满一锅的泡菜和猪肉，勤劳的家庭主妇总是忙着料理它们。她是个矮胖的老太太，长着一双蓝眼睛，有着一张红扑扑的脸，戴着一顶圆锥形糖块式样的大帽子，上面饰有紫色和黄色丝带。她穿着一件亚麻羊毛混纺料子的橙色连衣裙，后面有许多褶皱，腰部的剪裁很短——从其他角度看也确实很短，衣服还不到她大腿中部。她的腿很粗，脚踝也一样。但是她穿着一双漂亮的绿长袜，把双腿都遮住了。她的鞋——用粉色皮革制成——每只都用一束黄色丝带系成卷心菜状。她左手拿着一支小而沉的荷兰手表；右手持一个勺子，搅拌着锅里的泡菜和猪肉。她的旁边站着一只胖乎乎的虎斑猫，尾巴上系着一个镀金的玩具打簧表。这是“小伙子们”搞恶作剧系上去的。","The fireplaces are large and deep, with fierce crooked-looking fire-dogs.There is constantly a rousing fire, and a huge pot over it, full of sauerkraut and pork, to which the good woman of the house is always busy in attending.She is a little fat old lady, with blue eyes and a red face, and wears a huge cap like a sugar-loaf, ornamented with purple and yellow ribbons.Her dress is of orange-colored linsey-woolsey, made very full behind and very short in the waist—and indeed very short in other respects, not reaching below the middle of her leg.This is somewhat thick, and so are her ankles, but she has a fine pair of green stockings to cover them.Her shoes—of pink leather—are fastened each with a bunch of yellow ribbons puckered up in the shape of a cabbage.In her left hand she has a little heavy Dutch watch; in her right she wields a ladle for the sauerkraut and pork.By her side there stands a fat tabby cat, with a gilt toy-repeater tied to its tail, which “the boys” have there fastened by way of a quiz."
"三个小伙子都在花园里喂猪。每个人都身高两英尺。他们头戴高翘的三角帽，上穿长及大腿的紫色马甲，下身是齐膝的鹿皮马裤，红色长筒袜，缀有银色大纽扣的大头鞋，外面套着一件紧身长外套，上面镶着珍珠母大纽扣。每个人嘴里还叼着烟斗，右手拿着一个笨重的小手表。他们吐一口烟，看一眼表，然后再吐一口烟，再看看表。猪——又肥又懒——正忙着捡食卷心菜上的落叶，不时地踢着后面的镀金打簧表。那是调皮鬼们系在它尾巴上的，为了使它看上去和猫一样漂亮。","The boys themselves are, all three of them, in the garden attending the pig.They are each two feet in height.They have three-cornered cocked hats, purple waistcoats reaching down to their thighs, buckskin knee-breeches, red stockings, heavy shoes with big silver buckles, long surtout coats with large buttons of mother-of-pearl.Each, too, has a pipe in his mouth, and a little dumpy watch in his right hand.He takes a puff and a look, and then a look and a puff.The pig—which is corpulent and lazy—is occupied now in picking up the stray leaves that fall from the cabbages, and now in giving a kick behind at the gilt repeater, which the urchins have also tied to his tail in order to make him look as handsome as the cat."
"正门门口，有一把高背扶手椅，上有皮革垫子，还有像桌子一样弯曲的椅腿和小狗爪一样的椅脚，上面坐着一个老头子，是这个房子的主人。他是一个超级胖的小老头，有着圆溜溜的大眼睛，肥肥的双下巴。他的穿着跟小伙子们很相似——我在此就不多费口舌了。只有一点不同，他的烟斗比他们的稍微大一些，吐出的烟圈也要大一些。与他们一样，他也有一块手表。不过，他把他的手表装在了他的口袋里。老实说，他有比查看手表更重要的事情要做——是什么呢，这就是我现在要讲的。他右腿放在左膝上，表情严肃地坐在那里，总是至少用其中一只眼睛紧紧盯着平原中心一样比较显眼的东西。","Right at the front door, in a high-backed leather-bottomed armed chair, with crooked legs and puppy feet like the tables, is seated the old man of the house himself.He is an exceedingly puffy little old gentleman, with big circular eyes and a huge double chin.His dress resembles that of the boys—and I need say nothing farther about it.All the difference is, that his pipe is somewhat bigger than theirs and he can make a greater smoke.Like them, he has a watch, but he carries his watch in his pocket.To say the truth, he has something of more importance than a watch to attend to—and what that is, I shall presently explain.He sits with his right leg upon his left knee, wears a grave countenance, and always keeps one of his eyes, at least, resolutely bent upon a certain remarkable object in the centre of the plain."
"这样东西位于镇议会厅的尖塔上。镇议会的议员都是一些矮小肥胖、油光满面、头脑聪明的先生们。他们长着圆圆的大眼睛和肥硕的双下巴。跟维奥德沃特米提斯自治镇的普通居民相比，他们的外衣更长，鞋扣也要更大些。我在此逗留期间，他们开了好几次特别会议，通过了以下三个重要的决定：","This object is situated in the steeple of the House of the Town Council.The Town Council are all very little, round, oily, intelligent men, with big saucer eyes and fat double chins, and have their coats much longer and their shoe-buckles much bigger than the ordinary inhabitants of Vondervotteimittiss.Since my sojourn in the borough, they have had several special meetings, and have adopted these three important resolutions:"
"“改变事物原有的正常规律是错误的。”","“That it is wrong to alter the good old course of things:”"
"“在维奥德沃特米提斯自治镇之外的地方，一切都不可容忍”——","“That there is nothing tolerable out of Vondervotteimittiss:” and—"
"“我们将固守我们的钟表和我们的卷心菜。” ","“That we will stick by our clocks and our cabbages.”"
"在议会会议厅上方是尖塔，钟楼就在尖塔里面。那里有、并且很久以前就有了村庄的骄傲和奇迹——维奥德沃特米提斯自治镇的大钟。这就是那些坐在皮革垫子扶手椅上的老头们眼睛所注视的东西。","Above the session-room of the Council is the steeple, and in the steeple is the belfry, where exists, and has existed time out of mind, the pride and wonder of the village—the great clock of the borough of Vondervotteimittiss.And this is the object to which the eyes of the old gentlemen are turned who sit in the leather-bottomed arm-chairs."
"大钟有七面——每一面占七面尖塔中的一面——因此，人们可以从各个方位、很容易地看到它。它的钟面又大又白，它的指针又沉又黑。看钟人唯一的职责就是照看它。然而，这个职务是一个完完全全的闲差——因为人们还从未听说过维奥德沃特米提斯自治镇的钟出过什么毛病。直到现在，仅仅是如此假设一下都会被看作是一种异端邪说。从有据可考的、最久远的年代开始，这口大钟就一直准时地敲响。确实，镇上其他所有的时钟和手表也和它一样按时报时。世界上还没见过一个这么恪守时间的地方。当钟锤认为是报“十二点！”的时候了，所有顺从的追随者会同时张开喉咙，就像回声一样回应着。总之，善良的镇民们喜欢他们的泡菜，但是他们引以为豪的却是钟表。","The great clock has seven faces—one in each of the seven sides of the steeple—so that it can be readily seen from all quarters.Its faces are large and white, and its hands heavy and black.There is a belfry-man whose sole duty is to attend to it; but this duty is the most perfect of sinecures—for the clock of Vondervotteimittiss was never yet known to have anything the matter with it.Until lately, the bare supposition of such a thing was considered heretical.From the remotest period of antiquity to which the archives have reference, the hours have been regularly struck by the big bell.And, indeed the case was just the same with all the other clocks and watches in the borough.Never was such a place for keeping the true time.When the large clapper thought proper to say “Twelve o’clock!” all its obedient followers opened their throats simultaneously, and responded like a very echo.In short, the good burghers were fond of their sauerkraut, but then they were proud of their clocks."
"所有有闲职的人都或多或少地受人尊重。维奥德沃特米提斯自治镇上的敲钟人拥有一份最完美的闲差，因此他是这个世界上最受尊重的人。他是这个镇上最显要的人物，连那些猪也用崇敬的神情仰视他。与镇上的其他老绅士相比，他外套的后摆要长很多——他的烟斗、他的鞋扣、他的眼睛和他的肚子也要大得多。他的下巴，已不只是两层，而是三层了。","All people who hold sinecure offices are held in more or less respect, and as the belfry-man of Vondervotteimittiss has the most perfect of sinecures, he is the most perfectly respected of any man in the world.He is the chief dignitary of the borough, and the very pigs look up to him with a sentiment of reverence.His coat-tail is very far longer—his pipe, his shoe-buckles, his eyes, and his stomach, very far bigger—than those of any other old gentleman in the village; and as to his chin, it is not only double, but triple."
"至此，我已经描绘了镇上欢快的情形，唉，如此美丽的景象竟然经历了一场颠覆！","I have thus painted the happy estate of Vondervotteimittiss: alas, that so fair a picture should ever experience a reverse!"
"很久以来，在最睿智的居民中间流传着这样一句话，“山那边不会出来什么好东西”。看来这句话真有种预言的意味。前天中午，差五分钟到十二点时，东面山脊顶上出现了一个看起来非常古怪的物体。当然，这件事引起了所有人的注意。坐在皮革垫子扶手椅上的每一个小老头都惊慌地用一只眼睛关注着这一现象，另一只眼睛仍旧盯着尖塔上的钟表。","There has been long a saying among the wisest inhabitants, that “no good can come from over the hills”; and it really seemed that the words had in them something of the spirit of prophecy.It wanted five minutes of noon, on the day before yesterday, when there appeared a very odd-looking object on the summit of the ridge of the eastward.Such an occurrence, of course, attracted universal attention, and every little old gentleman who sat in a leather-bottomed arm-chair turned one of his eyes with a stare of dismay upon the phenomenon, still keeping the other upon the clock in the steeple."
"只差三分钟就到十二点的时候，他们才弄明白，那个令人疑惑不解的古怪物原来是一个矮小的陌生年轻男子。他下山的速度极快，因此每个人很快便看清了他的模样。他确实是维奥德沃特米提斯自治镇上的人们所见过的最讲究的小人。他面部呈深黄褐色，长着一个长长的鹰钩鼻，一双豌豆眼，一张宽大的嘴巴和一副整齐洁白的牙齿。他咧嘴大笑，似乎是急于炫耀他的这口好牙。由于蓬松胡须和络腮胡子的遮掩，他脸上的其他部位就看不到了。他没戴帽子，头发用卷发纸处理得很整齐。他穿着紧身的黑色燕尾服（其中一个口袋悬着一条很长的白手帕），黑色克什米尔羊毛齐膝短裤，黑长袜，模样粗短的无带舞鞋，上面还系有一大堆蝴蝶结状的黑缎带。他一只胳膊下夹着一顶特大的三角帽，另一只胳膊下是一个几乎大他四倍的小提琴。他左手拿着一个金色鼻烟壶。当他欢呼雀跃地下山时，他边迈着大步，边不停地嗅着鼻烟，显出一副自我陶醉的样子。天啊！——这在维奥德沃特米提斯诚实的镇民来看，可真是个奇观！","By the time that it wanted only three minutes to noon, the droll object in question was perceived to be a very diminutive foreign-looking young man.He descended the hills at a great rate, so that every body had soon a good look at him.He was really the most finicky little personage that had ever been seen in Vondervotteimittiss.His countenance was of a dark snuff-color, and he had a long hooked nose, pea eyes, a wide mouth, and an excellent set of teeth, which latter he seemed anxious of displaying, as he was grinning from ear to ear.What with mustachios and whiskers, there was none of the rest of his face to be seen.His head was uncovered, and his hair neatly done up in papillotes.His dress was a tight-fitting swallow-tailed black coat (from one of whose pockets dangled a vast length of white handkerchief), black kerseymere knee-breeches, black stockings, and stumpy-looking pumps, with huge bunches of black satin ribbon for bows.Under one arm he carried a huge chapeau-de-bras, and under the other a fiddle nearly five times as big as himself.In his left hand was a gold snuff-box, from which, as he capered down the hill, cutting all manner of fantastic steps, he took snuff incessantly with an air of the greatest possible self-satisfaction.God bless me!—here was a sight for the honest burghers of Vondervotteimittiss!"
"坦率地说，尽管这个家伙咧着嘴笑，他还是表现出了一副放肆和险恶的神态。当他一蹦一跳地直奔村庄时，他那双破旧而粗短的无带舞鞋引起了人们不小的怀疑。他的白色麻布手帕从燕尾服的口袋里露出来很是显眼。那天看到他的许多人宁愿浪费一点时间，也想要窥视一下白手帕下藏着什么东西。但非常让人愤慨的是，这个无赖的花花公子，这儿一个西班牙舞步，那儿一个旋转舞步，好像根本就不晓得世界上还有要按节拍移动舞步的概念。","To speak plainly, the fellow had, in spite of his grinning, an audacious and sinister kind of face; and as he curvetted right into the village, the old stumpy appearance of his pumps excited no little suspicion; and many a burgher who beheld him that day would have given a trifle for a peep beneath the white cambric handkerchief which hung so obtrusively from the pocket of his swallow-tailed coat.But what mainly occasioned a righteous indignation was, that the scoundrelly popinjay, while he cut a fandango here, and a whirligig there, did not seem to have the remotest idea in the world of such a thing as keeping time in his steps."
