"“哦，我知道那场比赛。”萨瑟兰一边说着，一边和他握了握手。“我还记得你第一次持球触地得分所成功运用的持球跑动打法。”","“Yes, I read of the game,” Sutherland said, shaking hands.“And I remember that big run of yours for the first touchdown.”"
"格林尼治棕褐色的脸涨成了猪肝色，笨拙地给别人让了让地方。","Greenwich flushed darkly under his tanned skin and awkwardly made room for another."
"“这是马修斯——伯克利人。我们中还有一些来自东部地区漂泊的运动好手。过来，普林斯顿人！过来！这是萨瑟兰，杰克·萨瑟兰！”","“And here’s Matthews,—Berkeley man.And we’ve got some Eastern cracks knocking about, too.Come up, you Princeton men!Come up!This is Sutherland, Jack Sutherland!”"
"然后他们一哄而上，把他带回帐篷，给他拿了些干衣服，端上好几大杯红茶。","Then they fell upon him heavily, carried him into camp, and supplied him with dry clothes and numerous mugs of black tea."
"被忽视的唐纳德和戴维回屋玩起了他们每晚都玩的克里比奇牌戏。蒙塔纳·基德和警察尾随在他们之后。","Donald and Davy, overlooked, had retired to their nightly game of crib.Montana Kid followed them with the policeman."
"他从自己为数不多的衣服中抽出几件，说道：“给，换上这些干衣服。我想你也不得不和我将就着睡了。”","“Here, get into some dry togs,” he said, pulling them from out his scanty kit.“Guess you’ll have to bunk with me, too.”"
"“哎呀，我说，你这人真不错。”警察一边穿着基德的袜子，一边说道，“很抱歉我得把你带回道森，但是我希望他们不会对你过分严厉。”","“Well, I say, you’re a good ’un,” the policeman remarked as he pulled on the other man’s socks.“Sorry I’ve got to take you back to Dawson, but I only ’ope they won’t be ’ard on you.”"
"“别这么快啊。”基德古怪地微笑。“我们还没开始呢。我走的时候会往下游走，我想你可能也要一起走。”","“Not so fast.”The Kid smiled curiously.“We ain’t under way yet.When I go I’m going down river, and I guess the chances are you’ll go along.”"
"“我自己也不太清楚——”","“Not if I know myself—”"
"“跟我到外面来吧，我指给你看。”他将拇指伸过肩，指着那两个苏格兰人，说道：“这些该死的蠢人，定居在这儿的时候破了产。首先，填满你的烟斗——这烟草相当好——只管尽情享受吧。你不怎么抽嘛。”","“Come on outside, and I’ll show you, then.These damn fools,” thrusting a thumb over his shoulder at the two Scots, “played smash when they located here.Fill your pipe, first—this is pretty good plug—and enjoy yourself while you can.You haven’t many smokes before you.”"
"警察好奇地和他一起抽。唐纳德和戴维也丢下牌，和他们一起抽了起来。从米诺克来的人们注意到蒙塔纳·基德时而指指河上游，时而又指指下游，便走了过来。","The policeman went with him wonderingly, while Donald and Davy dropped their cards and followed.The Minook men noticed Montana Kid pointing now up the river, now down, and came over."
"“怎么了？”萨瑟兰问道。","“What’s up?” Sutherland demanded."
"“没什么。”基德显得漠不关心。“只不过是大麻烦要来了。看到那儿的弯曲处了吗？那里会堆积上百万吨冰块。然后会有上百万吨在上面的那些弯曲处堆积。上面的冰块最先断裂，下面的能撑上一会儿，噗！”他用手夸张地比划了一下整个岛。“上百万吨啊。”他沉思着，又添上这么一句。","“Nothing much.”Nonchalance sat well upon the Kid.“Just a case of raising hell and putting a chunk under.See that bend down there?That’s where she’ll jam millions of tons of ice.Then she’ll jam in the bends up above, millions of tons.Upper jam breaks first, lower jam holds, pouf!”He dramatically swept the island with his hand.“Millions of tons,” he added reflectively."
"戴维问道：“那些木料堆会怎样呢？”","“And what of the woodpiles?” Davy questioned."
"基德重复了比划的手势。戴维哀诉道：“这可是几个月的劳动成果啊！不能发生这种事！不，不，老弟，绝对不能。我不知道刚才是你讲了个笑话。哎，快说它是个笑话啊。”他恳求道。","The Kid repeated his sweeping gestures and Davy wailed, “The labor of months!It canna be!Na, na, lad, it canna be.I doot not it’s a jowk.Ay, say that it is,” he appealed."
"但是，基德发出刺耳的笑声，转过了身。戴维一下子瘫坐在木堆上，开始疯狂地把岸上的木材扔回去。","But when the Kid laughed harshly and turned on his heel, Davy flung himself upon the piles and began frantically to toss the cordwood back from the bank."
"“帮我一把啊，唐纳德！”他喊道，“你难道会坐视不管吗？这可是几个月来的劳动成果啊，还有回家的路费！”","“Lend a hand, Donald!” he cried.“Can ye no lend a hand?’T is the labor of months and the passage home!”"
"唐纳德拽住了他的胳膊，摇晃着他，但是戴维挣脱了。“伙计，难道你没听见吗？上百万吨，还有整个岛都会被淹没。”","Donald caught him by the arm and shook him, but he tore free.“Did ye no hear, man?Millions of tons, and the island shall be sweepit clean.”"
"“伙计，振作一点儿，”唐纳德说道，“你有点儿太过烦恼了。”","“Straighten yersel’ up, man,” said Donald.“It’s a bit fashed ye are.”"
"但是，戴维还是瘫坐在木材堆上。唐纳德高视阔步走回小木屋，扣上他还有戴维的藏着钱的腰带，走出来，来到岛的岬角。那儿地势最高，还有一棵非常高大的松树，周围的松树都不及它。","But Davy fell upon the cordwood.Donald stalked back to the cabin, buckled on his money belt and Davy’s, and went out to the point of the island where the ground was highest and where a huge pine towered above its fellows."
"小木屋前的人们听着他斧子的声响，微笑着。格林尼治从岛的另一端回来，说他们都被困住了。要穿过秘密通道是不可能的。那个患雪盲症的米诺克人开始唱歌，其他人也跟着和——","The men before the cabin heard the ringing of his axe and smiled.Greenwich returned from across the island with the word that they were penned in.It was impossible to cross the back-channel.The blind Minook man began to sing, and the rest joined in with—"
"“这是不是真的？在你们看来是真的吗？在我看来，是他在撒谎——啊，我想知道，这是不是真的呢？”","“Wonder if it’s true?Does it seem so to you?Seems to me he’s lying—Oh, I wonder if it’s true?”"
"戴维抬起头，看着他们在斜阳的光辉下跳舞，悲叹道：“这真是罪恶。我的木材都要白费了。”","“It’s ay sinfu’,” Davy moaned, lifting his head and watching them dance in the slanting rays of the sun.“And my guid wood a’ going to waste.”"
"“啊，我想知道这是不是真的。”歌声炫耀似的回应他。","“Oh, I wonder if it’s true,” was flaunted back."
"河上的喧闹声骤然停止了。一种异常的平静包围着他们。冰挣脱了河岸，在渐渐涨高的河面上越漂越高。它来了，快速而无声地漂了二十英尺。然后，如蛋糕一样的巨大冰块轻轻地触碰到河岸的顶端。岛的末端，由于地势较低，被淹没了。接着，白茫茫的洪水开始毫不费力地侵袭下游。但是，随着势头不断增强，声响也越来越大。很快，嘎吱作响的冰块使整座岛都开始摇晃、颤抖。在压力之下，几百吨重的、如蛋糕一般的巨大冰块，像豌豆一样崩裂到空中。这种冰冷的混乱状态越来越严重，人们要想让对方听见自己说的话，得朝着他的耳朵大喊才行。偶尔能在混乱之中听见从秘密通道传来的嘈杂声。一块巨大的“蛋糕”正好打到岛的岬角上，整个岛都因此震动。二十棵松树被连根拔起，在河面上旋转漂荡，浑浊的河底也被洪水掀翻上来。洪水一步步向小木屋逼近，像一把巨大的刀在削着河岸和树木。看起来洪水几乎没有碰到小木屋的角落，但是屋中的原木却像火柴似的上倾，小木屋就像个玩具房子一样向后倒塌，成了废墟。","The noise of the river ceased suddenly.A strange calm wrapped about them.The ice had ripped from the shores and was floating higher on the surface of the river, which was rising.Up it came, swift and silent, for twenty feet, till the huge cakes rubbed softly against the crest of the bank.The tail of the island, being lower, was overrun.Then, without effort, the white flood started down-stream.But the sound increased with the momentum, and soon the whole island was shaking and quivering with the shock of the grinding bergs.Under pressure, the mighty cakes, weighing hundreds of tons, were shot into the air like peas.The frigid anarchy increased its riot, and the men had to shout into one another’s ears to be heard.Occasionally the racket from the back channel could be heard above the tumult.The island shuddered with the impact of an enormous cake which drove in squarely upon its point.It ripped a score of pines out by the roots, then swinging around and over, lifted its muddy base from the bottom of the river and bore down upon the cabin, slicing the bank and trees away like a gigantic knife.It seemed barely to graze the corner of the cabin, but the cribbed logs tilted up like matches, and the structure, like a toy house, fell backward in ruin."
"“几个月的劳动成果啊！几个月的劳动成果，还有回家的路费！”戴维哀诉着，蒙塔纳·基德和警察把他从木料堆那儿拽了回来。","“The labor of months!The labor of months, and the passage home!”Davy wailed, while Montana Kid and the policeman dragged him backward from the woodpiles."
"“你还会有很多好机会能很快挣到回家的路费。”警察怒吼着，猛地扇了戴维一耳光，很快把他送到了安全的地方。","“You’ll ’ave plenty o’ hoppertunity all in good time for yer passage ’ome,” the policeman growled, clouting him alongside the head and sending him flying into safety."
"唐纳德从松树的顶端看着毁灭性的冰块把木材卷走并在下游消失。对这场灾难，冰凌洪水似乎已经满足了，于是降到了之前的水位，并开始放慢速度。嘈杂声也变小了。其他人能够听见唐纳德在高处大声喊着，让大家往下游看。正如预测的那样，小岛的弯曲处堵住了，冰块在一个巨大的障碍处堆积起来，这障碍处从一个河岸延伸到另一个河岸。河流停了下来，找不到出口的河水开始上涨。河水一直快速上涨，直至岛被淹没。人们趟着没膝的水，那些狗游向了小木屋的废墟。河水到达这个水位的时候，突然不动了，让人觉察不到涨落。","Donald, from the top of the pine, saw the devastating berg sweep away the cordwood and disappear down-stream.As though satisfied with this damage, the ice-flood quickly dropped to its old level and began to slacken its pace.The noise likewise eased down, and the others could hear Donald shouting from his eyrie to look down-stream.As forecast, the jam had come among the islands in the bend, and the ice was piling up in a great barrier which stretched from shore to shore.The river came to a standstill, and the water finding no outlet began to rise.It rushed up till the island was awash, the men splashing around up to their knees, and the dogs swimming to the ruins of the cabin.At this stage it abruptly became stationary, with no perceptible rise or fall."
"蒙塔纳·基德摇了摇头。“上面堵住了，不会再有冰块下来了。”","Montana Kid shook his head.“It’s jammed above, and no more’s coming down.”"
"萨瑟兰补充道：“不确定的是哪个堵塞口会先破裂。”","“And the gamble is, which jam will break first,” Sutherland added."
"“一点儿没错。”基德肯定地说，“如果是上面的堵塞口先破裂，我们就没机会了。一切都会被摧毁。”","“Exactly,” the Kid affirmed.“If the upper jam breaks first, we haven’t a chance.Nothing will stand before it.”"
"那些米诺克人默默地离开了，但是不一会儿《拉莫斯基赫尔》的歌声就在寂静的空中浮起，紧跟着的是《橙色和黑色》。人们在蒙塔纳·基德和警察周围围成了一个圈，一首歌一首歌地唱下去，很快就抓住了合唱中清晰的韵律。","The Minook men turned away in silence, but soon “Rumsky Ho” floated upon the quiet air, followed by “The Orange and the Black.”Room was made in the circle for Montana Kid and the policeman, and they quickly caught the ringing rhythm of the choruses as they drifted on from song to song."
"“啊，唐纳德，你不愿帮忙吗？”戴维在树下哭诉，就是刚才他的同伴爬上去的那棵树。“啊，唐纳德，伙计，你不愿帮忙吗？”他又哭诉起来，试图顺着滑溜溜的树干爬上去，却是徒劳，双手都流血了。","“Oh, Donald, will ye no lend a hand?”Davy sobbed at the foot of the tree into which his comrade had climbed.“Oh, Donald, man, will ye no lend a hand?” he sobbed again, his hands bleeding from vain attempts to scale the slippery trunk."
"然而唐纳德凝视着河流，突然声音颤抖，其中夹杂着恐惧，大声喊道：","But Donald had fixed his gaze up river, and now his voice rang out, vibrant with fear:—"
"“万能的上帝，它又来了！”","“God Almichty, here she comes!”"
"米诺克人、基德和那个警察站在及膝的冰水里，握紧了手，惊恐地提高了音调，唱着《共和国战歌》。但是，洪水逼近的咆哮声淹没了他们的歌声。","Standing knee-deep in the icy water, the Minook men, with Montana Kid and the policeman, gripped hands and raised their voices in the terrible, “Battle Hymn of the Republic.”But the words were drowned in the advancing roar."
"唐纳德看到了这样的景象——人们再也看不见东西，也无法生存。一股白浪像一面巨大的墙一样猛地向小岛扑过来。树木、狗和人们都被淹没了，好像是上帝伸手把自然的脸擦净了。唐纳德看了这么多，在那高处的位置上摇摆了片刻之后，便纵身跳进了那个冰封的地狱。","And to Donald was vouchsafed a sight such as no man may see and live.A great wall of white flung itself upon the island.Trees, dogs, men, were blotted out, as though the hand of God had wiped the face of nature clean.This much he saw, then swayed an instant longer in his lofty perch and hurtled far out into the frozen hell."
